{
  "address": "0x076c7883e154F6Cc0cA04888288b350d78cf1321",
  "abi": [
    {
      "inputs": [],
      "stateMutability": "nonpayable",
      "type": "constructor"
    },
    {
      "anonymous": false,
      "inputs": [
        {
          "indexed": false,
          "internalType": "string",
          "name": "action",
          "type": "string"
        },
        {
          "indexed": false,
          "internalType": "bool",
          "name": "pauseState",
          "type": "bool"
        }
      ],
      "name": "ActionPaused",
      "type": "event"
    },
    {
      "anonymous": false,
      "inputs": [
        {
          "indexed": false,
          "internalType": "contract CToken",
          "name": "cToken",
          "type": "address"
        },
        {
          "indexed": false,
          "internalType": "string",
          "name": "action",
          "type": "string"
        },
        {
          "indexed": false,
          "internalType": "bool",
          "name": "pauseState",
          "type": "bool"
        }
      ],
      "name": "ActionPaused",
      "type": "event"
    },
    {
      "anonymous": false,
      "inputs": [
        {
          "indexed": true,
          "internalType": "address",
          "name": "user",
          "type": "address"
        },
        {
          "indexed": false,
          "internalType": "uint256",
          "name": "oldCompAccrued",
          "type": "uint256"
        },
        {
          "indexed": false,
          "internalType": "uint256",
          "name": "newCompAccrued",
          "type": "uint256"
        }
      ],
      "name": "CompAccruedAdjusted",
      "type": "event"
    },
    {
      "anonymous": false,
      "inputs": [
        {
          "indexed": true,
          "internalType": "contract CToken",
          "name": "cToken",
          "type": "address"
        },
        {
          "indexed": false,
          "internalType": "uint256",
          "name": "newSpeed",
          "type": "uint256"
        }
      ],
      "name": "CompBorrowSpeedUpdated",
      "type": "event"
    },
    {
      "anonymous": false,
      "inputs": [
        {
          "indexed": false,
          "internalType": "address",
          "name": "recipient",
          "type": "address"
        },
        {
          "indexed": false,
          "internalType": "uint256",
          "name": "amount",
          "type": "uint256"
        }
      ],
      "name": "CompGranted",
      "type": "event"
    },
    {
      "anonymous": false,
      "inputs": [
        {
          "indexed": true,
          "internalType": "address",
          "name": "user",
          "type": "address"
        },
        {
          "indexed": false,
          "internalType": "uint256",
          "name": "oldCompReceivable",
          "type": "uint256"
        },
        {
          "indexed": false,
          "internalType": "uint256",
          "name": "newCompReceivable",
          "type": "uint256"
        }
      ],
      "name": "CompReceivableUpdated",
      "type": "event"
    },
    {
      "anonymous": false,
      "inputs": [
        {
          "indexed": true,
          "internalType": "contract CToken",
          "name": "cToken",
          "type": "address"
        },
        {
          "indexed": false,
          "internalType": "uint256",
          "name": "newSpeed",
          "type": "uint256"
        }
      ],
      "name": "CompSupplySpeedUpdated",
      "type": "event"
    },
    {
      "anonymous": false,
      "inputs": [
        {
          "indexed": true,
          "internalType": "address",
          "name": "contributor",
          "type": "address"
        },
        {
          "indexed": false,
          "internalType": "uint256",
          "name": "newSpeed",
          "type": "uint256"
        }
      ],
      "name": "ContributorCompSpeedUpdated",
      "type": "event"
    },
    {
      "anonymous": false,
      "inputs": [
        {
          "indexed": true,
          "internalType": "contract CToken",
          "name": "cToken",
          "type": "address"
        },
        {
          "indexed": true,
          "internalType": "address",
          "name": "borrower",
          "type": "address"
        },
        {
          "indexed": false,
          "internalType": "uint256",
          "name": "compDelta",
          "type": "uint256"
        },
        {
          "indexed": false,
          "internalType": "uint256",
          "name": "compBorrowIndex",
          "type": "uint256"
        }
      ],
      "name": "DistributedBorrowerComp",
      "type": "event"
    },
    {
      "anonymous": false,
      "inputs": [
        {
          "indexed": true,
          "internalType": "contract CToken",
          "name": "cToken",
          "type": "address"
        },
        {
          "indexed": true,
          "internalType": "address",
          "name": "supplier",
          "type": "address"
        },
        {
          "indexed": false,
          "internalType": "uint256",
          "name": "compDelta",
          "type": "uint256"
        },
        {
          "indexed": false,
          "internalType": "uint256",
          "name": "compSupplyIndex",
          "type": "uint256"
        }
      ],
      "name": "DistributedSupplierComp",
      "type": "event"
    },
    {
      "anonymous": false,
      "inputs": [
        {
          "indexed": false,
          "internalType": "uint256",
          "name": "error",
          "type": "uint256"
        },
        {
          "indexed": false,
          "internalType": "uint256",
          "name": "info",
          "type": "uint256"
        },
        {
          "indexed": false,
          "internalType": "uint256",
          "name": "detail",
          "type": "uint256"
        }
      ],
      "name": "Failure",
      "type": "event"
    },
    {
      "anonymous": false,
      "inputs": [
        {
          "indexed": false,
          "internalType": "contract CToken",
          "name": "cToken",
          "type": "address"
        },
        {
          "indexed": false,
          "internalType": "address",
          "name": "account",
          "type": "address"
        }
      ],
      "name": "MarketEntered",
      "type": "event"
    },
    {
      "anonymous": false,
      "inputs": [
        {
          "indexed": false,
          "internalType": "contract CToken",
          "name": "cToken",
          "type": "address"
        },
        {
          "indexed": false,
          "internalType": "address",
          "name": "account",
          "type": "address"
        }
      ],
      "name": "MarketExited",
      "type": "event"
    },
    {
      "anonymous": false,
      "inputs": [
        {
          "indexed": false,
          "internalType": "contract CToken",
          "name": "cToken",
          "type": "address"
        }
      ],
      "name": "MarketListed",
      "type": "event"
    },
    {
      "anonymous": false,
      "inputs": [
        {
          "indexed": true,
          "internalType": "contract CToken",
          "name": "cToken",
          "type": "address"
        },
        {
          "indexed": false,
          "internalType": "uint256",
          "name": "newBorrowCap",
          "type": "uint256"
        }
      ],
      "name": "NewBorrowCap",
      "type": "event"
    },
    {
      "anonymous": false,
      "inputs": [
        {
          "indexed": false,
          "internalType": "address",
          "name": "oldBorrowCapGuardian",
          "type": "address"
        },
        {
          "indexed": false,
          "internalType": "address",
          "name": "newBorrowCapGuardian",
          "type": "address"
        }
      ],
      "name": "NewBorrowCapGuardian",
      "type": "event"
    },
    {
      "anonymous": false,
      "inputs": [
        {
          "indexed": false,
          "internalType": "uint256",
          "name": "oldCloseFactorMantissa",
          "type": "uint256"
        },
        {
          "indexed": false,
          "internalType": "uint256",
          "name": "newCloseFactorMantissa",
          "type": "uint256"
        }
      ],
      "name": "NewCloseFactor",
      "type": "event"
    },
    {
      "anonymous": false,
      "inputs": [
        {
          "indexed": false,
          "internalType": "contract CToken",
          "name": "cToken",
          "type": "address"
        },
        {
          "indexed": false,
          "internalType": "uint256",
          "name": "oldCollateralFactorMantissa",
          "type": "uint256"
        },
        {
          "indexed": false,
          "internalType": "uint256",
          "name": "newCollateralFactorMantissa",
          "type": "uint256"
        }
      ],
      "name": "NewCollateralFactor",
      "type": "event"
    },
    {
      "anonymous": false,
      "inputs": [
        {
          "indexed": false,
          "internalType": "uint256",
          "name": "oldLiquidationIncentiveMantissa",
          "type": "uint256"
        },
        {
          "indexed": false,
          "internalType": "uint256",
          "name": "newLiquidationIncentiveMantissa",
          "type": "uint256"
        }
      ],
      "name": "NewLiquidationIncentive",
      "type": "event"
    },
    {
      "anonymous": false,
      "inputs": [
        {
          "indexed": false,
          "internalType": "address",
          "name": "oldPauseGuardian",
          "type": "address"
        },
        {
          "indexed": false,
          "internalType": "address",
          "name": "newPauseGuardian",
          "type": "address"
        }
      ],
      "name": "NewPauseGuardian",
      "type": "event"
    },
    {
      "anonymous": false,
      "inputs": [
        {
          "indexed": false,
          "internalType": "contract PriceOracle",
          "name": "oldPriceOracle",
          "type": "address"
        },
        {
          "indexed": false,
          "internalType": "contract PriceOracle",
          "name": "newPriceOracle",
          "type": "address"
        }
      ],
      "name": "NewPriceOracle",
      "type": "event"
    },
    {
      "anonymous": false,
      "inputs": [
        {
          "indexed": true,
          "internalType": "contract CToken",
          "name": "cToken",
          "type": "address"
        },
        {
          "indexed": false,
          "internalType": "uint256",
          "name": "newSupplyCap",
          "type": "uint256"
        }
      ],
      "name": "NewSupplyCap",
      "type": "event"
    },
    {
      "anonymous": false,
      "inputs": [
        {
          "indexed": false,
          "internalType": "address",
          "name": "oldSupplyCapGuardian",
          "type": "address"
        },
        {
          "indexed": false,
          "internalType": "address",
          "name": "newSupplyCapGuardian",
          "type": "address"
        }
      ],
      "name": "NewSupplyCapGuardian",
      "type": "event"
    },
    {
      "inputs": [
        {
          "internalType": "contract Unitroller",
          "name": "unitroller",
          "type": "address"
        }
      ],
      "name": "_become",
      "outputs": [],
      "stateMutability": "nonpayable",
      "type": "function"
    },
    {
      "inputs": [],
      "name": "_borrowGuardianPaused",
      "outputs": [
        {
          "internalType": "bool",
          "name": "",
          "type": "bool"
        }
      ],
      "stateMutability": "view",
      "type": "function"
    },
    {
      "inputs": [
        {
          "internalType": "address",
          "name": "recipient",
          "type": "address"
        },
        {
          "internalType": "uint256",
          "name": "amount",
          "type": "uint256"
        }
      ],
      "name": "_grantComp",
      "outputs": [],
      "stateMutability": "nonpayable",
      "type": "function"
    },
    {
      "inputs": [],
      "name": "_mintGuardianPaused",
      "outputs": [
        {
          "internalType": "bool",
          "name": "",
          "type": "bool"
        }
      ],
      "stateMutability": "view",
      "type": "function"
    },
    {
      "inputs": [
        {
          "internalType": "address",
          "name": "newBorrowCapGuardian",
          "type": "address"
        }
      ],
      "name": "_setBorrowCapGuardian",
      "outputs": [],
      "stateMutability": "nonpayable",
      "type": "function"
    },
    {
      "inputs": [
        {
          "internalType": "contract CToken",
          "name": "cToken",
          "type": "address"
        },
        {
          "internalType": "bool",
          "name": "state",
          "type": "bool"
        }
      ],
      "name": "_setBorrowPaused",
      "outputs": [
        {
          "internalType": "bool",
          "name": "",
          "type": "bool"
        }
      ],
      "stateMutability": "nonpayable",
      "type": "function"
    },
    {
      "inputs": [
        {
          "internalType": "uint256",
          "name": "newCloseFactorMantissa",
          "type": "uint256"
        }
      ],
      "name": "_setCloseFactor",
      "outputs": [
        {
          "internalType": "uint256",
          "name": "",
          "type": "uint256"
        }
      ],
      "stateMutability": "nonpayable",
      "type": "function"
    },
    {
      "inputs": [
        {
          "internalType": "contract CToken",
          "name": "cToken",
          "type": "address"
        },
        {
          "internalType": "uint256",
          "name": "newCollateralFactorMantissa",
          "type": "uint256"
        }
      ],
      "name": "_setCollateralFactor",
      "outputs": [
        {
          "internalType": "uint256",
          "name": "",
          "type": "uint256"
        }
      ],
      "stateMutability": "nonpayable",
      "type": "function"
    },
    {
      "inputs": [
        {
          "internalType": "contract CToken[]",
          "name": "cTokens",
          "type": "address[]"
        },
        {
          "internalType": "uint256[]",
          "name": "supplySpeeds",
          "type": "uint256[]"
        },
        {
          "internalType": "uint256[]",
          "name": "borrowSpeeds",
          "type": "uint256[]"
        }
      ],
      "name": "_setCompSpeeds",
      "outputs": [],
      "stateMutability": "nonpayable",
      "type": "function"
    },
    {
      "inputs": [
        {
          "internalType": "address",
          "name": "contributor",
          "type": "address"
        },
        {
          "internalType": "uint256",
          "name": "compSpeed",
          "type": "uint256"
        }
      ],
      "name": "_setContributorCompSpeed",
      "outputs": [],
      "stateMutability": "nonpayable",
      "type": "function"
    },
    {
      "inputs": [
        {
          "internalType": "uint256",
          "name": "newLiquidationIncentiveMantissa",
          "type": "uint256"
        }
      ],
      "name": "_setLiquidationIncentive",
      "outputs": [
        {
          "internalType": "uint256",
          "name": "",
          "type": "uint256"
        }
      ],
      "stateMutability": "nonpayable",
      "type": "function"
    },
    {
      "inputs": [
        {
          "internalType": "contract CToken[]",
          "name": "cTokens",
          "type": "address[]"
        },
        {
          "internalType": "uint256[]",
          "name": "newBorrowCaps",
          "type": "uint256[]"
        }
      ],
      "name": "_setMarketBorrowCaps",
      "outputs": [],
      "stateMutability": "nonpayable",
      "type": "function"
    },
    {
      "inputs": [
        {
          "internalType": "contract CToken[]",
          "name": "cTokens",
          "type": "address[]"
        },
        {
          "internalType": "uint256[]",
          "name": "newSupplyCaps",
          "type": "uint256[]"
        }
      ],
      "name": "_setMarketSupplyCaps",
      "outputs": [],
      "stateMutability": "nonpayable",
      "type": "function"
    },
    {
      "inputs": [
        {
          "internalType": "contract CToken",
          "name": "cToken",
          "type": "address"
        },
        {
          "internalType": "bool",
          "name": "state",
          "type": "bool"
        }
      ],
      "name": "_setMintPaused",
      "outputs": [
        {
          "internalType": "bool",
          "name": "",
          "type": "bool"
        }
      ],
      "stateMutability": "nonpayable",
      "type": "function"
    },
    {
      "inputs": [
        {
          "internalType": "address",
          "name": "newPauseGuardian",
          "type": "address"
        }
      ],
      "name": "_setPauseGuardian",
      "outputs": [
        {
          "internalType": "uint256",
          "name": "",
          "type": "uint256"
        }
      ],
      "stateMutability": "nonpayable",
      "type": "function"
    },
    {
      "inputs": [
        {
          "internalType": "contract PriceOracle",
          "name": "newOracle",
          "type": "address"
        }
      ],
      "name": "_setPriceOracle",
      "outputs": [
        {
          "internalType": "uint256",
          "name": "",
          "type": "uint256"
        }
      ],
      "stateMutability": "nonpayable",
      "type": "function"
    },
    {
      "inputs": [
        {
          "internalType": "bool",
          "name": "state",
          "type": "bool"
        }
      ],
      "name": "_setSeizePaused",
      "outputs": [
        {
          "internalType": "bool",
          "name": "",
          "type": "bool"
        }
      ],
      "stateMutability": "nonpayable",
      "type": "function"
    },
    {
      "inputs": [
        {
          "internalType": "address",
          "name": "newSupplyCapGuardian",
          "type": "address"
        }
      ],
      "name": "_setSupplyCapGuardian",
      "outputs": [],
      "stateMutability": "nonpayable",
      "type": "function"
    },
    {
      "inputs": [
        {
          "internalType": "bool",
          "name": "state",
          "type": "bool"
        }
      ],
      "name": "_setTransferPaused",
      "outputs": [
        {
          "internalType": "bool",
          "name": "",
          "type": "bool"
        }
      ],
      "stateMutability": "nonpayable",
      "type": "function"
    },
    {
      "inputs": [
        {
          "internalType": "contract CToken",
          "name": "cToken",
          "type": "address"
        }
      ],
      "name": "_supportMarket",
      "outputs": [
        {
          "internalType": "uint256",
          "name": "",
          "type": "uint256"
        }
      ],
      "stateMutability": "nonpayable",
      "type": "function"
    },
    {
      "inputs": [
        {
          "internalType": "address",
          "name": "",
          "type": "address"
        },
        {
          "internalType": "uint256",
          "name": "",
          "type": "uint256"
        }
      ],
      "name": "accountAssets",
      "outputs": [
        {
          "internalType": "contract CToken",
          "name": "",
          "type": "address"
        }
      ],
      "stateMutability": "view",
      "type": "function"
    },
    {
      "inputs": [],
      "name": "admin",
      "outputs": [
        {
          "internalType": "address",
          "name": "",
          "type": "address"
        }
      ],
      "stateMutability": "view",
      "type": "function"
    },
    {
      "inputs": [
        {
          "internalType": "uint256",
          "name": "",
          "type": "uint256"
        }
      ],
      "name": "allMarkets",
      "outputs": [
        {
          "internalType": "contract CToken",
          "name": "",
          "type": "address"
        }
      ],
      "stateMutability": "view",
      "type": "function"
    },
    {
      "inputs": [
        {
          "internalType": "address",
          "name": "cToken",
          "type": "address"
        },
        {
          "internalType": "address",
          "name": "borrower",
          "type": "address"
        },
        {
          "internalType": "uint256",
          "name": "borrowAmount",
          "type": "uint256"
        }
      ],
      "name": "borrowAllowed",
      "outputs": [
        {
          "internalType": "uint256",
          "name": "",
          "type": "uint256"
        }
      ],
      "stateMutability": "nonpayable",
      "type": "function"
    },
    {
      "inputs": [],
      "name": "borrowCapGuardian",
      "outputs": [
        {
          "internalType": "address",
          "name": "",
          "type": "address"
        }
      ],
      "stateMutability": "view",
      "type": "function"
    },
    {
      "inputs": [
        {
          "internalType": "address",
          "name": "",
          "type": "address"
        }
      ],
      "name": "borrowCaps",
      "outputs": [
        {
          "internalType": "uint256",
          "name": "",
          "type": "uint256"
        }
      ],
      "stateMutability": "view",
      "type": "function"
    },
    {
      "inputs": [
        {
          "internalType": "address",
          "name": "",
          "type": "address"
        }
      ],
      "name": "borrowGuardianPaused",
      "outputs": [
        {
          "internalType": "bool",
          "name": "",
          "type": "bool"
        }
      ],
      "stateMutability": "view",
      "type": "function"
    },
    {
      "inputs": [
        {
          "internalType": "address",
          "name": "cToken",
          "type": "address"
        },
        {
          "internalType": "address",
          "name": "borrower",
          "type": "address"
        },
        {
          "internalType": "uint256",
          "name": "borrowAmount",
          "type": "uint256"
        }
      ],
      "name": "borrowVerify",
      "outputs": [],
      "stateMutability": "nonpayable",
      "type": "function"
    },
    {
      "inputs": [
        {
          "internalType": "address",
          "name": "account",
          "type": "address"
        },
        {
          "internalType": "contract CToken",
          "name": "cToken",
          "type": "address"
        }
      ],
      "name": "checkMembership",
      "outputs": [
        {
          "internalType": "bool",
          "name": "",
          "type": "bool"
        }
      ],
      "stateMutability": "view",
      "type": "function"
    },
    {
      "inputs": [
        {
          "internalType": "address",
          "name": "holder",
          "type": "address"
        },
        {
          "internalType": "contract CToken[]",
          "name": "cTokens",
          "type": "address[]"
        }
      ],
      "name": "claimComp",
      "outputs": [],
      "stateMutability": "nonpayable",
      "type": "function"
    },
    {
      "inputs": [
        {
          "internalType": "address[]",
          "name": "holders",
          "type": "address[]"
        },
        {
          "internalType": "contract CToken[]",
          "name": "cTokens",
          "type": "address[]"
        },
        {
          "internalType": "bool",
          "name": "borrowers",
          "type": "bool"
        },
        {
          "internalType": "bool",
          "name": "suppliers",
          "type": "bool"
        }
      ],
      "name": "claimComp",
      "outputs": [],
      "stateMutability": "nonpayable",
      "type": "function"
    },
    {
      "inputs": [
        {
          "internalType": "address",
          "name": "holder",
          "type": "address"
        }
      ],
      "name": "claimComp",
      "outputs": [],
      "stateMutability": "nonpayable",
      "type": "function"
    },
    {
      "inputs": [],
      "name": "closeFactorMantissa",
      "outputs": [
        {
          "internalType": "uint256",
          "name": "",
          "type": "uint256"
        }
      ],
      "stateMutability": "view",
      "type": "function"
    },
    {
      "inputs": [
        {
          "internalType": "address",
          "name": "",
          "type": "address"
        }
      ],
      "name": "compAccrued",
      "outputs": [
        {
          "internalType": "uint256",
          "name": "",
          "type": "uint256"
        }
      ],
      "stateMutability": "view",
      "type": "function"
    },
    {
      "inputs": [
        {
          "internalType": "address",
          "name": "",
          "type": "address"
        }
      ],
      "name": "compBorrowSpeeds",
      "outputs": [
        {
          "internalType": "uint256",
          "name": "",
          "type": "uint256"
        }
      ],
      "stateMutability": "view",
      "type": "function"
    },
    {
      "inputs": [
        {
          "internalType": "address",
          "name": "",
          "type": "address"
        }
      ],
      "name": "compBorrowState",
      "outputs": [
        {
          "internalType": "uint224",
          "name": "index",
          "type": "uint224"
        },
        {
          "internalType": "uint32",
          "name": "block",
          "type": "uint32"
        }
      ],
      "stateMutability": "view",
      "type": "function"
    },
    {
      "inputs": [
        {
          "internalType": "address",
          "name": "",
          "type": "address"
        },
        {
          "internalType": "address",
          "name": "",
          "type": "address"
        }
      ],
      "name": "compBorrowerIndex",
      "outputs": [
        {
          "internalType": "uint256",
          "name": "",
          "type": "uint256"
        }
      ],
      "stateMutability": "view",
      "type": "function"
    },
    {
      "inputs": [
        {
          "internalType": "address",
          "name": "",
          "type": "address"
        }
      ],
      "name": "compContributorSpeeds",
      "outputs": [
        {
          "internalType": "uint256",
          "name": "",
          "type": "uint256"
        }
      ],
      "stateMutability": "view",
      "type": "function"
    },
    {
      "inputs": [],
      "name": "compInitialIndex",
      "outputs": [
        {
          "internalType": "uint224",
          "name": "",
          "type": "uint224"
        }
      ],
      "stateMutability": "view",
      "type": "function"
    },
    {
      "inputs": [],
      "name": "compRate",
      "outputs": [
        {
          "internalType": "uint256",
          "name": "",
          "type": "uint256"
        }
      ],
      "stateMutability": "view",
      "type": "function"
    },
    {
      "inputs": [
        {
          "internalType": "address",
          "name": "",
          "type": "address"
        }
      ],
      "name": "compReceivable",
      "outputs": [
        {
          "internalType": "uint256",
          "name": "",
          "type": "uint256"
        }
      ],
      "stateMutability": "view",
      "type": "function"
    },
    {
      "inputs": [
        {
          "internalType": "address",
          "name": "",
          "type": "address"
        }
      ],
      "name": "compSpeeds",
      "outputs": [
        {
          "internalType": "uint256",
          "name": "",
          "type": "uint256"
        }
      ],
      "stateMutability": "view",
      "type": "function"
    },
    {
      "inputs": [
        {
          "internalType": "address",
          "name": "",
          "type": "address"
        },
        {
          "internalType": "address",
          "name": "",
          "type": "address"
        }
      ],
      "name": "compSupplierIndex",
      "outputs": [
        {
          "internalType": "uint256",
          "name": "",
          "type": "uint256"
        }
      ],
      "stateMutability": "view",
      "type": "function"
    },
    {
      "inputs": [
        {
          "internalType": "address",
          "name": "",
          "type": "address"
        }
      ],
      "name": "compSupplySpeeds",
      "outputs": [
        {
          "internalType": "uint256",
          "name": "",
          "type": "uint256"
        }
      ],
      "stateMutability": "view",
      "type": "function"
    },
    {
      "inputs": [
        {
          "internalType": "address",
          "name": "",
          "type": "address"
        }
      ],
      "name": "compSupplyState",
      "outputs": [
        {
          "internalType": "uint224",
          "name": "index",
          "type": "uint224"
        },
        {
          "internalType": "uint32",
          "name": "block",
          "type": "uint32"
        }
      ],
      "stateMutability": "view",
      "type": "function"
    },
    {
      "inputs": [],
      "name": "comptrollerImplementation",
      "outputs": [
        {
          "internalType": "address",
          "name": "",
          "type": "address"
        }
      ],
      "stateMutability": "view",
      "type": "function"
    },
    {
      "inputs": [
        {
          "internalType": "address[]",
          "name": "cTokens",
          "type": "address[]"
        }
      ],
      "name": "enterMarkets",
      "outputs": [
        {
          "internalType": "uint256[]",
          "name": "",
          "type": "uint256[]"
        }
      ],
      "stateMutability": "nonpayable",
      "type": "function"
    },
    {
      "inputs": [
        {
          "internalType": "address",
          "name": "cTokenAddress",
          "type": "address"
        }
      ],
      "name": "exitMarket",
      "outputs": [
        {
          "internalType": "uint256",
          "name": "",
          "type": "uint256"
        }
      ],
      "stateMutability": "nonpayable",
      "type": "function"
    },
    {
      "inputs": [
        {
          "internalType": "address[]",
          "name": "affectedUsers",
          "type": "address[]"
        },
        {
          "internalType": "uint256[]",
          "name": "amounts",
          "type": "uint256[]"
        }
      ],
      "name": "fixBadAccruals",
      "outputs": [],
      "stateMutability": "nonpayable",
      "type": "function"
    },
    {
      "inputs": [
        {
          "internalType": "address",
          "name": "account",
          "type": "address"
        }
      ],
      "name": "getAccountLiquidity",
      "outputs": [
        {
          "internalType": "uint256",
          "name": "",
          "type": "uint256"
        },
        {
          "internalType": "uint256",
          "name": "",
          "type": "uint256"
        },
        {
          "internalType": "uint256",
          "name": "",
          "type": "uint256"
        }
      ],
      "stateMutability": "view",
      "type": "function"
    },
    {
      "inputs": [],
      "name": "getAllMarkets",
      "outputs": [
        {
          "internalType": "contract CToken[]",
          "name": "",
          "type": "address[]"
        }
      ],
      "stateMutability": "view",
      "type": "function"
    },
    {
      "inputs": [
        {
          "internalType": "address",
          "name": "account",
          "type": "address"
        }
      ],
      "name": "getAssetsIn",
      "outputs": [
        {
          "internalType": "contract CToken[]",
          "name": "",
          "type": "address[]"
        }
      ],
      "stateMutability": "view",
      "type": "function"
    },
    {
      "inputs": [],
      "name": "getBlockNumber",
      "outputs": [
        {
          "internalType": "uint256",
          "name": "",
          "type": "uint256"
        }
      ],
      "stateMutability": "view",
      "type": "function"
    },
    {
      "inputs": [],
      "name": "getCompAddress",
      "outputs": [
        {
          "internalType": "address",
          "name": "",
          "type": "address"
        }
      ],
      "stateMutability": "view",
      "type": "function"
    },
    {
      "inputs": [],
      "name": "getExternalRewardDistributorAddress",
      "outputs": [
        {
          "internalType": "address",
          "name": "",
          "type": "address"
        }
      ],
      "stateMutability": "view",
      "type": "function"
    },
    {
      "inputs": [
        {
          "internalType": "address",
          "name": "account",
          "type": "address"
        },
        {
          "internalType": "address",
          "name": "cTokenModify",
          "type": "address"
        },
        {
          "internalType": "uint256",
          "name": "redeemTokens",
          "type": "uint256"
        },
        {
          "internalType": "uint256",
          "name": "borrowAmount",
          "type": "uint256"
        }
      ],
      "name": "getHypotheticalAccountLiquidity",
      "outputs": [
        {
          "internalType": "uint256",
          "name": "",
          "type": "uint256"
        },
        {
          "internalType": "uint256",
          "name": "",
          "type": "uint256"
        },
        {
          "internalType": "uint256",
          "name": "",
          "type": "uint256"
        }
      ],
      "stateMutability": "view",
      "type": "function"
    },
    {
      "inputs": [],
      "name": "isComptroller",
      "outputs": [
        {
          "internalType": "bool",
          "name": "",
          "type": "bool"
        }
      ],
      "stateMutability": "view",
      "type": "function"
    },
    {
      "inputs": [
        {
          "internalType": "contract CToken",
          "name": "cToken",
          "type": "address"
        }
      ],
      "name": "isDeprecated",
      "outputs": [
        {
          "internalType": "bool",
          "name": "",
          "type": "bool"
        }
      ],
      "stateMutability": "view",
      "type": "function"
    },
    {
      "inputs": [
        {
          "internalType": "address",
          "name": "",
          "type": "address"
        }
      ],
      "name": "lastContributorBlock",
      "outputs": [
        {
          "internalType": "uint256",
          "name": "",
          "type": "uint256"
        }
      ],
      "stateMutability": "view",
      "type": "function"
    },
    {
      "inputs": [
        {
          "internalType": "address",
          "name": "cTokenBorrowed",
          "type": "address"
        },
        {
          "internalType": "address",
          "name": "cTokenCollateral",
          "type": "address"
        },
        {
          "internalType": "address",
          "name": "liquidator",
          "type": "address"
        },
        {
          "internalType": "address",
          "name": "borrower",
          "type": "address"
        },
        {
          "internalType": "uint256",
          "name": "repayAmount",
          "type": "uint256"
        }
      ],
      "name": "liquidateBorrowAllowed",
      "outputs": [
        {
          "internalType": "uint256",
          "name": "",
          "type": "uint256"
        }
      ],
      "stateMutability": "nonpayable",
      "type": "function"
    },
    {
      "inputs": [
        {
          "internalType": "address",
          "name": "cTokenBorrowed",
          "type": "address"
        },
        {
          "internalType": "address",
          "name": "cTokenCollateral",
          "type": "address"
        },
        {
          "internalType": "address",
          "name": "liquidator",
          "type": "address"
        },
        {
          "internalType": "address",
          "name": "borrower",
          "type": "address"
        },
        {
          "internalType": "uint256",
          "name": "actualRepayAmount",
          "type": "uint256"
        },
        {
          "internalType": "uint256",
          "name": "seizeTokens",
          "type": "uint256"
        }
      ],
      "name": "liquidateBorrowVerify",
      "outputs": [],
      "stateMutability": "nonpayable",
      "type": "function"
    },
    {
      "inputs": [
        {
          "internalType": "address",
          "name": "cTokenBorrowed",
          "type": "address"
        },
        {
          "internalType": "address",
          "name": "cTokenCollateral",
          "type": "address"
        },
        {
          "internalType": "uint256",
          "name": "actualRepayAmount",
          "type": "uint256"
        }
      ],
      "name": "liquidateCalculateSeizeTokens",
      "outputs": [
        {
          "internalType": "uint256",
          "name": "",
          "type": "uint256"
        },
        {
          "internalType": "uint256",
          "name": "",
          "type": "uint256"
        }
      ],
      "stateMutability": "view",
      "type": "function"
    },
    {
      "inputs": [],
      "name": "liquidationIncentiveMantissa",
      "outputs": [
        {
          "internalType": "uint256",
          "name": "",
          "type": "uint256"
        }
      ],
      "stateMutability": "view",
      "type": "function"
    },
    {
      "inputs": [
        {
          "internalType": "address",
          "name": "",
          "type": "address"
        }
      ],
      "name": "markets",
      "outputs": [
        {
          "internalType": "bool",
          "name": "isListed",
          "type": "bool"
        },
        {
          "internalType": "uint256",
          "name": "collateralFactorMantissa",
          "type": "uint256"
        },
        {
          "internalType": "bool",
          "name": "isComped",
          "type": "bool"
        }
      ],
      "stateMutability": "view",
      "type": "function"
    },
    {
      "inputs": [],
      "name": "maxAssets",
      "outputs": [
        {
          "internalType": "uint256",
          "name": "",
          "type": "uint256"
        }
      ],
      "stateMutability": "view",
      "type": "function"
    },
    {
      "inputs": [
        {
          "internalType": "address",
          "name": "cToken",
          "type": "address"
        },
        {
          "internalType": "address",
          "name": "minter",
          "type": "address"
        },
        {
          "internalType": "uint256",
          "name": "mintAmount",
          "type": "uint256"
        }
      ],
      "name": "mintAllowed",
      "outputs": [
        {
          "internalType": "uint256",
          "name": "",
          "type": "uint256"
        }
      ],
      "stateMutability": "nonpayable",
      "type": "function"
    },
    {
      "inputs": [
        {
          "internalType": "address",
          "name": "",
          "type": "address"
        }
      ],
      "name": "mintGuardianPaused",
      "outputs": [
        {
          "internalType": "bool",
          "name": "",
          "type": "bool"
        }
      ],
      "stateMutability": "view",
      "type": "function"
    },
    {
      "inputs": [
        {
          "internalType": "address",
          "name": "cToken",
          "type": "address"
        },
        {
          "internalType": "address",
          "name": "minter",
          "type": "address"
        },
        {
          "internalType": "uint256",
          "name": "actualMintAmount",
          "type": "uint256"
        },
        {
          "internalType": "uint256",
          "name": "mintTokens",
          "type": "uint256"
        }
      ],
      "name": "mintVerify",
      "outputs": [],
      "stateMutability": "nonpayable",
      "type": "function"
    },
    {
      "inputs": [],
      "name": "oracle",
      "outputs": [
        {
          "internalType": "contract PriceOracle",
          "name": "",
          "type": "address"
        }
      ],
      "stateMutability": "view",
      "type": "function"
    },
    {
      "inputs": [],
      "name": "pauseGuardian",
      "outputs": [
        {
          "internalType": "address",
          "name": "",
          "type": "address"
        }
      ],
      "stateMutability": "view",
      "type": "function"
    },
    {
      "inputs": [],
      "name": "pendingAdmin",
      "outputs": [
        {
          "internalType": "address",
          "name": "",
          "type": "address"
        }
      ],
      "stateMutability": "view",
      "type": "function"
    },
    {
      "inputs": [],
      "name": "pendingComptrollerImplementation",
      "outputs": [
        {
          "internalType": "address",
          "name": "",
          "type": "address"
        }
      ],
      "stateMutability": "view",
      "type": "function"
    },
    {
      "inputs": [],
      "name": "proposal65FixExecuted",
      "outputs": [
        {
          "internalType": "bool",
          "name": "",
          "type": "bool"
        }
      ],
      "stateMutability": "view",
      "type": "function"
    },
    {
      "inputs": [
        {
          "internalType": "address",
          "name": "cToken",
          "type": "address"
        },
        {
          "internalType": "address",
          "name": "redeemer",
          "type": "address"
        },
        {
          "internalType": "uint256",
          "name": "redeemTokens",
          "type": "uint256"
        }
      ],
      "name": "redeemAllowed",
      "outputs": [
        {
          "internalType": "uint256",
          "name": "",
          "type": "uint256"
        }
      ],
      "stateMutability": "nonpayable",
      "type": "function"
    },
    {
      "inputs": [
        {
          "internalType": "address",
          "name": "cToken",
          "type": "address"
        },
        {
          "internalType": "address",
          "name": "redeemer",
          "type": "address"
        },
        {
          "internalType": "uint256",
          "name": "redeemAmount",
          "type": "uint256"
        },
        {
          "internalType": "uint256",
          "name": "redeemTokens",
          "type": "uint256"
        }
      ],
      "name": "redeemVerify",
      "outputs": [],
      "stateMutability": "nonpayable",
      "type": "function"
    },
    {
      "inputs": [
        {
          "internalType": "address",
          "name": "cToken",
          "type": "address"
        },
        {
          "internalType": "address",
          "name": "payer",
          "type": "address"
        },
        {
          "internalType": "address",
          "name": "borrower",
          "type": "address"
        },
        {
          "internalType": "uint256",
          "name": "repayAmount",
          "type": "uint256"
        }
      ],
      "name": "repayBorrowAllowed",
      "outputs": [
        {
          "internalType": "uint256",
          "name": "",
          "type": "uint256"
        }
      ],
      "stateMutability": "nonpayable",
      "type": "function"
    },
    {
      "inputs": [
        {
          "internalType": "address",
          "name": "cToken",
          "type": "address"
        },
        {
          "internalType": "address",
          "name": "payer",
          "type": "address"
        },
        {
          "internalType": "address",
          "name": "borrower",
          "type": "address"
        },
        {
          "internalType": "uint256",
          "name": "actualRepayAmount",
          "type": "uint256"
        },
        {
          "internalType": "uint256",
          "name": "borrowerIndex",
          "type": "uint256"
        }
      ],
      "name": "repayBorrowVerify",
      "outputs": [],
      "stateMutability": "nonpayable",
      "type": "function"
    },
    {
      "inputs": [
        {
          "internalType": "address",
          "name": "cTokenCollateral",
          "type": "address"
        },
        {
          "internalType": "address",
          "name": "cTokenBorrowed",
          "type": "address"
        },
        {
          "internalType": "address",
          "name": "liquidator",
          "type": "address"
        },
        {
          "internalType": "address",
          "name": "borrower",
          "type": "address"
        },
        {
          "internalType": "uint256",
          "name": "seizeTokens",
          "type": "uint256"
        }
      ],
      "name": "seizeAllowed",
      "outputs": [
        {
          "internalType": "uint256",
          "name": "",
          "type": "uint256"
        }
      ],
      "stateMutability": "nonpayable",
      "type": "function"
    },
    {
      "inputs": [],
      "name": "seizeGuardianPaused",
      "outputs": [
        {
          "internalType": "bool",
          "name": "",
          "type": "bool"
        }
      ],
      "stateMutability": "view",
      "type": "function"
    },
    {
      "inputs": [
        {
          "internalType": "address",
          "name": "cTokenCollateral",
          "type": "address"
        },
        {
          "internalType": "address",
          "name": "cTokenBorrowed",
          "type": "address"
        },
        {
          "internalType": "address",
          "name": "liquidator",
          "type": "address"
        },
        {
          "internalType": "address",
          "name": "borrower",
          "type": "address"
        },
        {
          "internalType": "uint256",
          "name": "seizeTokens",
          "type": "uint256"
        }
      ],
      "name": "seizeVerify",
      "outputs": [],
      "stateMutability": "nonpayable",
      "type": "function"
    },
    {
      "inputs": [],
      "name": "supplyCapGuardian",
      "outputs": [
        {
          "internalType": "address",
          "name": "",
          "type": "address"
        }
      ],
      "stateMutability": "view",
      "type": "function"
    },
    {
      "inputs": [
        {
          "internalType": "address",
          "name": "",
          "type": "address"
        }
      ],
      "name": "supplyCaps",
      "outputs": [
        {
          "internalType": "uint256",
          "name": "",
          "type": "uint256"
        }
      ],
      "stateMutability": "view",
      "type": "function"
    },
    {
      "inputs": [
        {
          "internalType": "address",
          "name": "cToken",
          "type": "address"
        },
        {
          "internalType": "address",
          "name": "src",
          "type": "address"
        },
        {
          "internalType": "address",
          "name": "dst",
          "type": "address"
        },
        {
          "internalType": "uint256",
          "name": "transferTokens",
          "type": "uint256"
        }
      ],
      "name": "transferAllowed",
      "outputs": [
        {
          "internalType": "uint256",
          "name": "",
          "type": "uint256"
        }
      ],
      "stateMutability": "nonpayable",
      "type": "function"
    },
    {
      "inputs": [],
      "name": "transferGuardianPaused",
      "outputs": [
        {
          "internalType": "bool",
          "name": "",
          "type": "bool"
        }
      ],
      "stateMutability": "view",
      "type": "function"
    },
    {
      "inputs": [
        {
          "internalType": "address",
          "name": "cToken",
          "type": "address"
        },
        {
          "internalType": "address",
          "name": "src",
          "type": "address"
        },
        {
          "internalType": "address",
          "name": "dst",
          "type": "address"
        },
        {
          "internalType": "uint256",
          "name": "transferTokens",
          "type": "uint256"
        }
      ],
      "name": "transferVerify",
      "outputs": [],
      "stateMutability": "nonpayable",
      "type": "function"
    },
    {
      "inputs": [
        {
          "internalType": "address",
          "name": "contributor",
          "type": "address"
        }
      ],
      "name": "updateContributorRewards",
      "outputs": [],
      "stateMutability": "nonpayable",
      "type": "function"
    }
  ],
  "transactionHash": "0xc23042e3ab09d6f5f62bf028c941fc5d796e42157057d0a6c5c432dfc0a6b8fe",
  "receipt": {
    "to": null,
    "from": "0xFb59Ce8986943163F14C590755b29dB2998F2322",
    "contractAddress": "0x076c7883e154F6Cc0cA04888288b350d78cf1321",
    "transactionIndex": 14,
    "gasUsed": "5158424",
    "logsBloom": "0x00000000000000000000000000000000000000000000000000000000000000000000000000000000000000000000000000000000000000000000000000000000000000000000000000000000000000000000000000000000000000000000000000000000000000000000000000000000000000000000000000000000000000000000000000000000000000000000000000000000000000000000000000000000000000000000000000000000000000000000000000000000000000000000000000000000000000000000000000000000000000000000000000000000000000000000000000000000000000000000000000000000000000000000000000000000",
    "blockHash": "0x470411db6275e73c9dc4933980fe1649d7d7f2565e3d4ef6265380edfef31764",
    "transactionHash": "0xc23042e3ab09d6f5f62bf028c941fc5d796e42157057d0a6c5c432dfc0a6b8fe",
    "logs": [],
    "blockNumber": 2494215,
    "cumulativeGasUsed": "7579944",
    "status": 1,
    "byzantium": true
  },
  "args": [],
  "numDeployments": 2,
  "solcInputHash": "8b76c9d3dc4390cd2ac7ef58bedccd1a",
  "metadata": "{\"compiler\":{\"version\":\"0.8.10+commit.fc410830\"},\"language\":\"Solidity\",\"output\":{\"abi\":[{\"inputs\":[],\"stateMutability\":\"nonpayable\",\"type\":\"constructor\"},{\"anonymous\":false,\"inputs\":[{\"indexed\":false,\"internalType\":\"string\",\"name\":\"action\",\"type\":\"string\"},{\"indexed\":false,\"internalType\":\"bool\",\"name\":\"pauseState\",\"type\":\"bool\"}],\"name\":\"ActionPaused\",\"type\":\"event\"},{\"anonymous\":false,\"inputs\":[{\"indexed\":false,\"internalType\":\"contract CToken\",\"name\":\"cToken\",\"type\":\"address\"},{\"indexed\":false,\"internalType\":\"string\",\"name\":\"action\",\"type\":\"string\"},{\"indexed\":false,\"internalType\":\"bool\",\"name\":\"pauseState\",\"type\":\"bool\"}],\"name\":\"ActionPaused\",\"type\":\"event\"},{\"anonymous\":false,\"inputs\":[{\"indexed\":true,\"internalType\":\"address\",\"name\":\"user\",\"type\":\"address\"},{\"indexed\":false,\"internalType\":\"uint256\",\"name\":\"oldCompAccrued\",\"type\":\"uint256\"},{\"indexed\":false,\"internalType\":\"uint256\",\"name\":\"newCompAccrued\",\"type\":\"uint256\"}],\"name\":\"CompAccruedAdjusted\",\"type\":\"event\"},{\"anonymous\":false,\"inputs\":[{\"indexed\":true,\"internalType\":\"contract CToken\",\"name\":\"cToken\",\"type\":\"address\"},{\"indexed\":false,\"internalType\":\"uint256\",\"name\":\"newSpeed\",\"type\":\"uint256\"}],\"name\":\"CompBorrowSpeedUpdated\",\"type\":\"event\"},{\"anonymous\":false,\"inputs\":[{\"indexed\":false,\"internalType\":\"address\",\"name\":\"recipient\",\"type\":\"address\"},{\"indexed\":false,\"internalType\":\"uint256\",\"name\":\"amount\",\"type\":\"uint256\"}],\"name\":\"CompGranted\",\"type\":\"event\"},{\"anonymous\":false,\"inputs\":[{\"indexed\":true,\"internalType\":\"address\",\"name\":\"user\",\"type\":\"address\"},{\"indexed\":false,\"internalType\":\"uint256\",\"name\":\"oldCompReceivable\",\"type\":\"uint256\"},{\"indexed\":false,\"internalType\":\"uint256\",\"name\":\"newCompReceivable\",\"type\":\"uint256\"}],\"name\":\"CompReceivableUpdated\",\"type\":\"event\"},{\"anonymous\":false,\"inputs\":[{\"indexed\":true,\"internalType\":\"contract CToken\",\"name\":\"cToken\",\"type\":\"address\"},{\"indexed\":false,\"internalType\":\"uint256\",\"name\":\"newSpeed\",\"type\":\"uint256\"}],\"name\":\"CompSupplySpeedUpdated\",\"type\":\"event\"},{\"anonymous\":false,\"inputs\":[{\"indexed\":true,\"internalType\":\"address\",\"name\":\"contributor\",\"type\":\"address\"},{\"indexed\":false,\"internalType\":\"uint256\",\"name\":\"newSpeed\",\"type\":\"uint256\"}],\"name\":\"ContributorCompSpeedUpdated\",\"type\":\"event\"},{\"anonymous\":false,\"inputs\":[{\"indexed\":true,\"internalType\":\"contract CToken\",\"name\":\"cToken\",\"type\":\"address\"},{\"indexed\":true,\"internalType\":\"address\",\"name\":\"borrower\",\"type\":\"address\"},{\"indexed\":false,\"internalType\":\"uint256\",\"name\":\"compDelta\",\"type\":\"uint256\"},{\"indexed\":false,\"internalType\":\"uint256\",\"name\":\"compBorrowIndex\",\"type\":\"uint256\"}],\"name\":\"DistributedBorrowerComp\",\"type\":\"event\"},{\"anonymous\":false,\"inputs\":[{\"indexed\":true,\"internalType\":\"contract CToken\",\"name\":\"cToken\",\"type\":\"address\"},{\"indexed\":true,\"internalType\":\"address\",\"name\":\"supplier\",\"type\":\"address\"},{\"indexed\":false,\"internalType\":\"uint256\",\"name\":\"compDelta\",\"type\":\"uint256\"},{\"indexed\":false,\"internalType\":\"uint256\",\"name\":\"compSupplyIndex\",\"type\":\"uint256\"}],\"name\":\"DistributedSupplierComp\",\"type\":\"event\"},{\"anonymous\":false,\"inputs\":[{\"indexed\":false,\"internalType\":\"uint256\",\"name\":\"error\",\"type\":\"uint256\"},{\"indexed\":false,\"internalType\":\"uint256\",\"name\":\"info\",\"type\":\"uint256\"},{\"indexed\":false,\"internalType\":\"uint256\",\"name\":\"detail\",\"type\":\"uint256\"}],\"name\":\"Failure\",\"type\":\"event\"},{\"anonymous\":false,\"inputs\":[{\"indexed\":false,\"internalType\":\"contract CToken\",\"name\":\"cToken\",\"type\":\"address\"},{\"indexed\":false,\"internalType\":\"address\",\"name\":\"account\",\"type\":\"address\"}],\"name\":\"MarketEntered\",\"type\":\"event\"},{\"anonymous\":false,\"inputs\":[{\"indexed\":false,\"internalType\":\"contract CToken\",\"name\":\"cToken\",\"type\":\"address\"},{\"indexed\":false,\"internalType\":\"address\",\"name\":\"account\",\"type\":\"address\"}],\"name\":\"MarketExited\",\"type\":\"event\"},{\"anonymous\":false,\"inputs\":[{\"indexed\":false,\"internalType\":\"contract CToken\",\"name\":\"cToken\",\"type\":\"address\"}],\"name\":\"MarketListed\",\"type\":\"event\"},{\"anonymous\":false,\"inputs\":[{\"indexed\":true,\"internalType\":\"contract CToken\",\"name\":\"cToken\",\"type\":\"address\"},{\"indexed\":false,\"internalType\":\"uint256\",\"name\":\"newBorrowCap\",\"type\":\"uint256\"}],\"name\":\"NewBorrowCap\",\"type\":\"event\"},{\"anonymous\":false,\"inputs\":[{\"indexed\":false,\"internalType\":\"address\",\"name\":\"oldBorrowCapGuardian\",\"type\":\"address\"},{\"indexed\":false,\"internalType\":\"address\",\"name\":\"newBorrowCapGuardian\",\"type\":\"address\"}],\"name\":\"NewBorrowCapGuardian\",\"type\":\"event\"},{\"anonymous\":false,\"inputs\":[{\"indexed\":false,\"internalType\":\"uint256\",\"name\":\"oldCloseFactorMantissa\",\"type\":\"uint256\"},{\"indexed\":false,\"internalType\":\"uint256\",\"name\":\"newCloseFactorMantissa\",\"type\":\"uint256\"}],\"name\":\"NewCloseFactor\",\"type\":\"event\"},{\"anonymous\":false,\"inputs\":[{\"indexed\":false,\"internalType\":\"contract CToken\",\"name\":\"cToken\",\"type\":\"address\"},{\"indexed\":false,\"internalType\":\"uint256\",\"name\":\"oldCollateralFactorMantissa\",\"type\":\"uint256\"},{\"indexed\":false,\"internalType\":\"uint256\",\"name\":\"newCollateralFactorMantissa\",\"type\":\"uint256\"}],\"name\":\"NewCollateralFactor\",\"type\":\"event\"},{\"anonymous\":false,\"inputs\":[{\"indexed\":false,\"internalType\":\"uint256\",\"name\":\"oldLiquidationIncentiveMantissa\",\"type\":\"uint256\"},{\"indexed\":false,\"internalType\":\"uint256\",\"name\":\"newLiquidationIncentiveMantissa\",\"type\":\"uint256\"}],\"name\":\"NewLiquidationIncentive\",\"type\":\"event\"},{\"anonymous\":false,\"inputs\":[{\"indexed\":false,\"internalType\":\"address\",\"name\":\"oldPauseGuardian\",\"type\":\"address\"},{\"indexed\":false,\"internalType\":\"address\",\"name\":\"newPauseGuardian\",\"type\":\"address\"}],\"name\":\"NewPauseGuardian\",\"type\":\"event\"},{\"anonymous\":false,\"inputs\":[{\"indexed\":false,\"internalType\":\"contract PriceOracle\",\"name\":\"oldPriceOracle\",\"type\":\"address\"},{\"indexed\":false,\"internalType\":\"contract PriceOracle\",\"name\":\"newPriceOracle\",\"type\":\"address\"}],\"name\":\"NewPriceOracle\",\"type\":\"event\"},{\"anonymous\":false,\"inputs\":[{\"indexed\":true,\"internalType\":\"contract CToken\",\"name\":\"cToken\",\"type\":\"address\"},{\"indexed\":false,\"internalType\":\"uint256\",\"name\":\"newSupplyCap\",\"type\":\"uint256\"}],\"name\":\"NewSupplyCap\",\"type\":\"event\"},{\"anonymous\":false,\"inputs\":[{\"indexed\":false,\"internalType\":\"address\",\"name\":\"oldSupplyCapGuardian\",\"type\":\"address\"},{\"indexed\":false,\"internalType\":\"address\",\"name\":\"newSupplyCapGuardian\",\"type\":\"address\"}],\"name\":\"NewSupplyCapGuardian\",\"type\":\"event\"},{\"inputs\":[{\"internalType\":\"contract Unitroller\",\"name\":\"unitroller\",\"type\":\"address\"}],\"name\":\"_become\",\"outputs\":[],\"stateMutability\":\"nonpayable\",\"type\":\"function\"},{\"inputs\":[],\"name\":\"_borrowGuardianPaused\",\"outputs\":[{\"internalType\":\"bool\",\"name\":\"\",\"type\":\"bool\"}],\"stateMutability\":\"view\",\"type\":\"function\"},{\"inputs\":[{\"internalType\":\"address\",\"name\":\"recipient\",\"type\":\"address\"},{\"internalType\":\"uint256\",\"name\":\"amount\",\"type\":\"uint256\"}],\"name\":\"_grantComp\",\"outputs\":[],\"stateMutability\":\"nonpayable\",\"type\":\"function\"},{\"inputs\":[],\"name\":\"_mintGuardianPaused\",\"outputs\":[{\"internalType\":\"bool\",\"name\":\"\",\"type\":\"bool\"}],\"stateMutability\":\"view\",\"type\":\"function\"},{\"inputs\":[{\"internalType\":\"address\",\"name\":\"newBorrowCapGuardian\",\"type\":\"address\"}],\"name\":\"_setBorrowCapGuardian\",\"outputs\":[],\"stateMutability\":\"nonpayable\",\"type\":\"function\"},{\"inputs\":[{\"internalType\":\"contract CToken\",\"name\":\"cToken\",\"type\":\"address\"},{\"internalType\":\"bool\",\"name\":\"state\",\"type\":\"bool\"}],\"name\":\"_setBorrowPaused\",\"outputs\":[{\"internalType\":\"bool\",\"name\":\"\",\"type\":\"bool\"}],\"stateMutability\":\"nonpayable\",\"type\":\"function\"},{\"inputs\":[{\"internalType\":\"uint256\",\"name\":\"newCloseFactorMantissa\",\"type\":\"uint256\"}],\"name\":\"_setCloseFactor\",\"outputs\":[{\"internalType\":\"uint256\",\"name\":\"\",\"type\":\"uint256\"}],\"stateMutability\":\"nonpayable\",\"type\":\"function\"},{\"inputs\":[{\"internalType\":\"contract CToken\",\"name\":\"cToken\",\"type\":\"address\"},{\"internalType\":\"uint256\",\"name\":\"newCollateralFactorMantissa\",\"type\":\"uint256\"}],\"name\":\"_setCollateralFactor\",\"outputs\":[{\"internalType\":\"uint256\",\"name\":\"\",\"type\":\"uint256\"}],\"stateMutability\":\"nonpayable\",\"type\":\"function\"},{\"inputs\":[{\"internalType\":\"contract CToken[]\",\"name\":\"cTokens\",\"type\":\"address[]\"},{\"internalType\":\"uint256[]\",\"name\":\"supplySpeeds\",\"type\":\"uint256[]\"},{\"internalType\":\"uint256[]\",\"name\":\"borrowSpeeds\",\"type\":\"uint256[]\"}],\"name\":\"_setCompSpeeds\",\"outputs\":[],\"stateMutability\":\"nonpayable\",\"type\":\"function\"},{\"inputs\":[{\"internalType\":\"address\",\"name\":\"contributor\",\"type\":\"address\"},{\"internalType\":\"uint256\",\"name\":\"compSpeed\",\"type\":\"uint256\"}],\"name\":\"_setContributorCompSpeed\",\"outputs\":[],\"stateMutability\":\"nonpayable\",\"type\":\"function\"},{\"inputs\":[{\"internalType\":\"uint256\",\"name\":\"newLiquidationIncentiveMantissa\",\"type\":\"uint256\"}],\"name\":\"_setLiquidationIncentive\",\"outputs\":[{\"internalType\":\"uint256\",\"name\":\"\",\"type\":\"uint256\"}],\"stateMutability\":\"nonpayable\",\"type\":\"function\"},{\"inputs\":[{\"internalType\":\"contract CToken[]\",\"name\":\"cTokens\",\"type\":\"address[]\"},{\"internalType\":\"uint256[]\",\"name\":\"newBorrowCaps\",\"type\":\"uint256[]\"}],\"name\":\"_setMarketBorrowCaps\",\"outputs\":[],\"stateMutability\":\"nonpayable\",\"type\":\"function\"},{\"inputs\":[{\"internalType\":\"contract CToken[]\",\"name\":\"cTokens\",\"type\":\"address[]\"},{\"internalType\":\"uint256[]\",\"name\":\"newSupplyCaps\",\"type\":\"uint256[]\"}],\"name\":\"_setMarketSupplyCaps\",\"outputs\":[],\"stateMutability\":\"nonpayable\",\"type\":\"function\"},{\"inputs\":[{\"internalType\":\"contract CToken\",\"name\":\"cToken\",\"type\":\"address\"},{\"internalType\":\"bool\",\"name\":\"state\",\"type\":\"bool\"}],\"name\":\"_setMintPaused\",\"outputs\":[{\"internalType\":\"bool\",\"name\":\"\",\"type\":\"bool\"}],\"stateMutability\":\"nonpayable\",\"type\":\"function\"},{\"inputs\":[{\"internalType\":\"address\",\"name\":\"newPauseGuardian\",\"type\":\"address\"}],\"name\":\"_setPauseGuardian\",\"outputs\":[{\"internalType\":\"uint256\",\"name\":\"\",\"type\":\"uint256\"}],\"stateMutability\":\"nonpayable\",\"type\":\"function\"},{\"inputs\":[{\"internalType\":\"contract PriceOracle\",\"name\":\"newOracle\",\"type\":\"address\"}],\"name\":\"_setPriceOracle\",\"outputs\":[{\"internalType\":\"uint256\",\"name\":\"\",\"type\":\"uint256\"}],\"stateMutability\":\"nonpayable\",\"type\":\"function\"},{\"inputs\":[{\"internalType\":\"bool\",\"name\":\"state\",\"type\":\"bool\"}],\"name\":\"_setSeizePaused\",\"outputs\":[{\"internalType\":\"bool\",\"name\":\"\",\"type\":\"bool\"}],\"stateMutability\":\"nonpayable\",\"type\":\"function\"},{\"inputs\":[{\"internalType\":\"address\",\"name\":\"newSupplyCapGuardian\",\"type\":\"address\"}],\"name\":\"_setSupplyCapGuardian\",\"outputs\":[],\"stateMutability\":\"nonpayable\",\"type\":\"function\"},{\"inputs\":[{\"internalType\":\"bool\",\"name\":\"state\",\"type\":\"bool\"}],\"name\":\"_setTransferPaused\",\"outputs\":[{\"internalType\":\"bool\",\"name\":\"\",\"type\":\"bool\"}],\"stateMutability\":\"nonpayable\",\"type\":\"function\"},{\"inputs\":[{\"internalType\":\"contract CToken\",\"name\":\"cToken\",\"type\":\"address\"}],\"name\":\"_supportMarket\",\"outputs\":[{\"internalType\":\"uint256\",\"name\":\"\",\"type\":\"uint256\"}],\"stateMutability\":\"nonpayable\",\"type\":\"function\"},{\"inputs\":[{\"internalType\":\"address\",\"name\":\"\",\"type\":\"address\"},{\"internalType\":\"uint256\",\"name\":\"\",\"type\":\"uint256\"}],\"name\":\"accountAssets\",\"outputs\":[{\"internalType\":\"contract CToken\",\"name\":\"\",\"type\":\"address\"}],\"stateMutability\":\"view\",\"type\":\"function\"},{\"inputs\":[],\"name\":\"admin\",\"outputs\":[{\"internalType\":\"address\",\"name\":\"\",\"type\":\"address\"}],\"stateMutability\":\"view\",\"type\":\"function\"},{\"inputs\":[{\"internalType\":\"uint256\",\"name\":\"\",\"type\":\"uint256\"}],\"name\":\"allMarkets\",\"outputs\":[{\"internalType\":\"contract CToken\",\"name\":\"\",\"type\":\"address\"}],\"stateMutability\":\"view\",\"type\":\"function\"},{\"inputs\":[{\"internalType\":\"address\",\"name\":\"cToken\",\"type\":\"address\"},{\"internalType\":\"address\",\"name\":\"borrower\",\"type\":\"address\"},{\"internalType\":\"uint256\",\"name\":\"borrowAmount\",\"type\":\"uint256\"}],\"name\":\"borrowAllowed\",\"outputs\":[{\"internalType\":\"uint256\",\"name\":\"\",\"type\":\"uint256\"}],\"stateMutability\":\"nonpayable\",\"type\":\"function\"},{\"inputs\":[],\"name\":\"borrowCapGuardian\",\"outputs\":[{\"internalType\":\"address\",\"name\":\"\",\"type\":\"address\"}],\"stateMutability\":\"view\",\"type\":\"function\"},{\"inputs\":[{\"internalType\":\"address\",\"name\":\"\",\"type\":\"address\"}],\"name\":\"borrowCaps\",\"outputs\":[{\"internalType\":\"uint256\",\"name\":\"\",\"type\":\"uint256\"}],\"stateMutability\":\"view\",\"type\":\"function\"},{\"inputs\":[{\"internalType\":\"address\",\"name\":\"\",\"type\":\"address\"}],\"name\":\"borrowGuardianPaused\",\"outputs\":[{\"internalType\":\"bool\",\"name\":\"\",\"type\":\"bool\"}],\"stateMutability\":\"view\",\"type\":\"function\"},{\"inputs\":[{\"internalType\":\"address\",\"name\":\"cToken\",\"type\":\"address\"},{\"internalType\":\"address\",\"name\":\"borrower\",\"type\":\"address\"},{\"internalType\":\"uint256\",\"name\":\"borrowAmount\",\"type\":\"uint256\"}],\"name\":\"borrowVerify\",\"outputs\":[],\"stateMutability\":\"nonpayable\",\"type\":\"function\"},{\"inputs\":[{\"internalType\":\"address\",\"name\":\"account\",\"type\":\"address\"},{\"internalType\":\"contract CToken\",\"name\":\"cToken\",\"type\":\"address\"}],\"name\":\"checkMembership\",\"outputs\":[{\"internalType\":\"bool\",\"name\":\"\",\"type\":\"bool\"}],\"stateMutability\":\"view\",\"type\":\"function\"},{\"inputs\":[{\"internalType\":\"address\",\"name\":\"holder\",\"type\":\"address\"},{\"internalType\":\"contract CToken[]\",\"name\":\"cTokens\",\"type\":\"address[]\"}],\"name\":\"claimComp\",\"outputs\":[],\"stateMutability\":\"nonpayable\",\"type\":\"function\"},{\"inputs\":[{\"internalType\":\"address[]\",\"name\":\"holders\",\"type\":\"address[]\"},{\"internalType\":\"contract CToken[]\",\"name\":\"cTokens\",\"type\":\"address[]\"},{\"internalType\":\"bool\",\"name\":\"borrowers\",\"type\":\"bool\"},{\"internalType\":\"bool\",\"name\":\"suppliers\",\"type\":\"bool\"}],\"name\":\"claimComp\",\"outputs\":[],\"stateMutability\":\"nonpayable\",\"type\":\"function\"},{\"inputs\":[{\"internalType\":\"address\",\"name\":\"holder\",\"type\":\"address\"}],\"name\":\"claimComp\",\"outputs\":[],\"stateMutability\":\"nonpayable\",\"type\":\"function\"},{\"inputs\":[],\"name\":\"closeFactorMantissa\",\"outputs\":[{\"internalType\":\"uint256\",\"name\":\"\",\"type\":\"uint256\"}],\"stateMutability\":\"view\",\"type\":\"function\"},{\"inputs\":[{\"internalType\":\"address\",\"name\":\"\",\"type\":\"address\"}],\"name\":\"compAccrued\",\"outputs\":[{\"internalType\":\"uint256\",\"name\":\"\",\"type\":\"uint256\"}],\"stateMutability\":\"view\",\"type\":\"function\"},{\"inputs\":[{\"internalType\":\"address\",\"name\":\"\",\"type\":\"address\"}],\"name\":\"compBorrowSpeeds\",\"outputs\":[{\"internalType\":\"uint256\",\"name\":\"\",\"type\":\"uint256\"}],\"stateMutability\":\"view\",\"type\":\"function\"},{\"inputs\":[{\"internalType\":\"address\",\"name\":\"\",\"type\":\"address\"}],\"name\":\"compBorrowState\",\"outputs\":[{\"internalType\":\"uint224\",\"name\":\"index\",\"type\":\"uint224\"},{\"internalType\":\"uint32\",\"name\":\"block\",\"type\":\"uint32\"}],\"stateMutability\":\"view\",\"type\":\"function\"},{\"inputs\":[{\"internalType\":\"address\",\"name\":\"\",\"type\":\"address\"},{\"internalType\":\"address\",\"name\":\"\",\"type\":\"address\"}],\"name\":\"compBorrowerIndex\",\"outputs\":[{\"internalType\":\"uint256\",\"name\":\"\",\"type\":\"uint256\"}],\"stateMutability\":\"view\",\"type\":\"function\"},{\"inputs\":[{\"internalType\":\"address\",\"name\":\"\",\"type\":\"address\"}],\"name\":\"compContributorSpeeds\",\"outputs\":[{\"internalType\":\"uint256\",\"name\":\"\",\"type\":\"uint256\"}],\"stateMutability\":\"view\",\"type\":\"function\"},{\"inputs\":[],\"name\":\"compInitialIndex\",\"outputs\":[{\"internalType\":\"uint224\",\"name\":\"\",\"type\":\"uint224\"}],\"stateMutability\":\"view\",\"type\":\"function\"},{\"inputs\":[],\"name\":\"compRate\",\"outputs\":[{\"internalType\":\"uint256\",\"name\":\"\",\"type\":\"uint256\"}],\"stateMutability\":\"view\",\"type\":\"function\"},{\"inputs\":[{\"internalType\":\"address\",\"name\":\"\",\"type\":\"address\"}],\"name\":\"compReceivable\",\"outputs\":[{\"internalType\":\"uint256\",\"name\":\"\",\"type\":\"uint256\"}],\"stateMutability\":\"view\",\"type\":\"function\"},{\"inputs\":[{\"internalType\":\"address\",\"name\":\"\",\"type\":\"address\"}],\"name\":\"compSpeeds\",\"outputs\":[{\"internalType\":\"uint256\",\"name\":\"\",\"type\":\"uint256\"}],\"stateMutability\":\"view\",\"type\":\"function\"},{\"inputs\":[{\"internalType\":\"address\",\"name\":\"\",\"type\":\"address\"},{\"internalType\":\"address\",\"name\":\"\",\"type\":\"address\"}],\"name\":\"compSupplierIndex\",\"outputs\":[{\"internalType\":\"uint256\",\"name\":\"\",\"type\":\"uint256\"}],\"stateMutability\":\"view\",\"type\":\"function\"},{\"inputs\":[{\"internalType\":\"address\",\"name\":\"\",\"type\":\"address\"}],\"name\":\"compSupplySpeeds\",\"outputs\":[{\"internalType\":\"uint256\",\"name\":\"\",\"type\":\"uint256\"}],\"stateMutability\":\"view\",\"type\":\"function\"},{\"inputs\":[{\"internalType\":\"address\",\"name\":\"\",\"type\":\"address\"}],\"name\":\"compSupplyState\",\"outputs\":[{\"internalType\":\"uint224\",\"name\":\"index\",\"type\":\"uint224\"},{\"internalType\":\"uint32\",\"name\":\"block\",\"type\":\"uint32\"}],\"stateMutability\":\"view\",\"type\":\"function\"},{\"inputs\":[],\"name\":\"comptrollerImplementation\",\"outputs\":[{\"internalType\":\"address\",\"name\":\"\",\"type\":\"address\"}],\"stateMutability\":\"view\",\"type\":\"function\"},{\"inputs\":[{\"internalType\":\"address[]\",\"name\":\"cTokens\",\"type\":\"address[]\"}],\"name\":\"enterMarkets\",\"outputs\":[{\"internalType\":\"uint256[]\",\"name\":\"\",\"type\":\"uint256[]\"}],\"stateMutability\":\"nonpayable\",\"type\":\"function\"},{\"inputs\":[{\"internalType\":\"address\",\"name\":\"cTokenAddress\",\"type\":\"address\"}],\"name\":\"exitMarket\",\"outputs\":[{\"internalType\":\"uint256\",\"name\":\"\",\"type\":\"uint256\"}],\"stateMutability\":\"nonpayable\",\"type\":\"function\"},{\"inputs\":[{\"internalType\":\"address[]\",\"name\":\"affectedUsers\",\"type\":\"address[]\"},{\"internalType\":\"uint256[]\",\"name\":\"amounts\",\"type\":\"uint256[]\"}],\"name\":\"fixBadAccruals\",\"outputs\":[],\"stateMutability\":\"nonpayable\",\"type\":\"function\"},{\"inputs\":[{\"internalType\":\"address\",\"name\":\"account\",\"type\":\"address\"}],\"name\":\"getAccountLiquidity\",\"outputs\":[{\"internalType\":\"uint256\",\"name\":\"\",\"type\":\"uint256\"},{\"internalType\":\"uint256\",\"name\":\"\",\"type\":\"uint256\"},{\"internalType\":\"uint256\",\"name\":\"\",\"type\":\"uint256\"}],\"stateMutability\":\"view\",\"type\":\"function\"},{\"inputs\":[],\"name\":\"getAllMarkets\",\"outputs\":[{\"internalType\":\"contract CToken[]\",\"name\":\"\",\"type\":\"address[]\"}],\"stateMutability\":\"view\",\"type\":\"function\"},{\"inputs\":[{\"internalType\":\"address\",\"name\":\"account\",\"type\":\"address\"}],\"name\":\"getAssetsIn\",\"outputs\":[{\"internalType\":\"contract CToken[]\",\"name\":\"\",\"type\":\"address[]\"}],\"stateMutability\":\"view\",\"type\":\"function\"},{\"inputs\":[],\"name\":\"getBlockNumber\",\"outputs\":[{\"internalType\":\"uint256\",\"name\":\"\",\"type\":\"uint256\"}],\"stateMutability\":\"view\",\"type\":\"function\"},{\"inputs\":[],\"name\":\"getCompAddress\",\"outputs\":[{\"internalType\":\"address\",\"name\":\"\",\"type\":\"address\"}],\"stateMutability\":\"view\",\"type\":\"function\"},{\"inputs\":[],\"name\":\"getExternalRewardDistributorAddress\",\"outputs\":[{\"internalType\":\"address\",\"name\":\"\",\"type\":\"address\"}],\"stateMutability\":\"view\",\"type\":\"function\"},{\"inputs\":[{\"internalType\":\"address\",\"name\":\"account\",\"type\":\"address\"},{\"internalType\":\"address\",\"name\":\"cTokenModify\",\"type\":\"address\"},{\"internalType\":\"uint256\",\"name\":\"redeemTokens\",\"type\":\"uint256\"},{\"internalType\":\"uint256\",\"name\":\"borrowAmount\",\"type\":\"uint256\"}],\"name\":\"getHypotheticalAccountLiquidity\",\"outputs\":[{\"internalType\":\"uint256\",\"name\":\"\",\"type\":\"uint256\"},{\"internalType\":\"uint256\",\"name\":\"\",\"type\":\"uint256\"},{\"internalType\":\"uint256\",\"name\":\"\",\"type\":\"uint256\"}],\"stateMutability\":\"view\",\"type\":\"function\"},{\"inputs\":[],\"name\":\"isComptroller\",\"outputs\":[{\"internalType\":\"bool\",\"name\":\"\",\"type\":\"bool\"}],\"stateMutability\":\"view\",\"type\":\"function\"},{\"inputs\":[{\"internalType\":\"contract CToken\",\"name\":\"cToken\",\"type\":\"address\"}],\"name\":\"isDeprecated\",\"outputs\":[{\"internalType\":\"bool\",\"name\":\"\",\"type\":\"bool\"}],\"stateMutability\":\"view\",\"type\":\"function\"},{\"inputs\":[{\"internalType\":\"address\",\"name\":\"\",\"type\":\"address\"}],\"name\":\"lastContributorBlock\",\"outputs\":[{\"internalType\":\"uint256\",\"name\":\"\",\"type\":\"uint256\"}],\"stateMutability\":\"view\",\"type\":\"function\"},{\"inputs\":[{\"internalType\":\"address\",\"name\":\"cTokenBorrowed\",\"type\":\"address\"},{\"internalType\":\"address\",\"name\":\"cTokenCollateral\",\"type\":\"address\"},{\"internalType\":\"address\",\"name\":\"liquidator\",\"type\":\"address\"},{\"internalType\":\"address\",\"name\":\"borrower\",\"type\":\"address\"},{\"internalType\":\"uint256\",\"name\":\"repayAmount\",\"type\":\"uint256\"}],\"name\":\"liquidateBorrowAllowed\",\"outputs\":[{\"internalType\":\"uint256\",\"name\":\"\",\"type\":\"uint256\"}],\"stateMutability\":\"nonpayable\",\"type\":\"function\"},{\"inputs\":[{\"internalType\":\"address\",\"name\":\"cTokenBorrowed\",\"type\":\"address\"},{\"internalType\":\"address\",\"name\":\"cTokenCollateral\",\"type\":\"address\"},{\"internalType\":\"address\",\"name\":\"liquidator\",\"type\":\"address\"},{\"internalType\":\"address\",\"name\":\"borrower\",\"type\":\"address\"},{\"internalType\":\"uint256\",\"name\":\"actualRepayAmount\",\"type\":\"uint256\"},{\"internalType\":\"uint256\",\"name\":\"seizeTokens\",\"type\":\"uint256\"}],\"name\":\"liquidateBorrowVerify\",\"outputs\":[],\"stateMutability\":\"nonpayable\",\"type\":\"function\"},{\"inputs\":[{\"internalType\":\"address\",\"name\":\"cTokenBorrowed\",\"type\":\"address\"},{\"internalType\":\"address\",\"name\":\"cTokenCollateral\",\"type\":\"address\"},{\"internalType\":\"uint256\",\"name\":\"actualRepayAmount\",\"type\":\"uint256\"}],\"name\":\"liquidateCalculateSeizeTokens\",\"outputs\":[{\"internalType\":\"uint256\",\"name\":\"\",\"type\":\"uint256\"},{\"internalType\":\"uint256\",\"name\":\"\",\"type\":\"uint256\"}],\"stateMutability\":\"view\",\"type\":\"function\"},{\"inputs\":[],\"name\":\"liquidationIncentiveMantissa\",\"outputs\":[{\"internalType\":\"uint256\",\"name\":\"\",\"type\":\"uint256\"}],\"stateMutability\":\"view\",\"type\":\"function\"},{\"inputs\":[{\"internalType\":\"address\",\"name\":\"\",\"type\":\"address\"}],\"name\":\"markets\",\"outputs\":[{\"internalType\":\"bool\",\"name\":\"isListed\",\"type\":\"bool\"},{\"internalType\":\"uint256\",\"name\":\"collateralFactorMantissa\",\"type\":\"uint256\"},{\"internalType\":\"bool\",\"name\":\"isComped\",\"type\":\"bool\"}],\"stateMutability\":\"view\",\"type\":\"function\"},{\"inputs\":[],\"name\":\"maxAssets\",\"outputs\":[{\"internalType\":\"uint256\",\"name\":\"\",\"type\":\"uint256\"}],\"stateMutability\":\"view\",\"type\":\"function\"},{\"inputs\":[{\"internalType\":\"address\",\"name\":\"cToken\",\"type\":\"address\"},{\"internalType\":\"address\",\"name\":\"minter\",\"type\":\"address\"},{\"internalType\":\"uint256\",\"name\":\"mintAmount\",\"type\":\"uint256\"}],\"name\":\"mintAllowed\",\"outputs\":[{\"internalType\":\"uint256\",\"name\":\"\",\"type\":\"uint256\"}],\"stateMutability\":\"nonpayable\",\"type\":\"function\"},{\"inputs\":[{\"internalType\":\"address\",\"name\":\"\",\"type\":\"address\"}],\"name\":\"mintGuardianPaused\",\"outputs\":[{\"internalType\":\"bool\",\"name\":\"\",\"type\":\"bool\"}],\"stateMutability\":\"view\",\"type\":\"function\"},{\"inputs\":[{\"internalType\":\"address\",\"name\":\"cToken\",\"type\":\"address\"},{\"internalType\":\"address\",\"name\":\"minter\",\"type\":\"address\"},{\"internalType\":\"uint256\",\"name\":\"actualMintAmount\",\"type\":\"uint256\"},{\"internalType\":\"uint256\",\"name\":\"mintTokens\",\"type\":\"uint256\"}],\"name\":\"mintVerify\",\"outputs\":[],\"stateMutability\":\"nonpayable\",\"type\":\"function\"},{\"inputs\":[],\"name\":\"oracle\",\"outputs\":[{\"internalType\":\"contract PriceOracle\",\"name\":\"\",\"type\":\"address\"}],\"stateMutability\":\"view\",\"type\":\"function\"},{\"inputs\":[],\"name\":\"pauseGuardian\",\"outputs\":[{\"internalType\":\"address\",\"name\":\"\",\"type\":\"address\"}],\"stateMutability\":\"view\",\"type\":\"function\"},{\"inputs\":[],\"name\":\"pendingAdmin\",\"outputs\":[{\"internalType\":\"address\",\"name\":\"\",\"type\":\"address\"}],\"stateMutability\":\"view\",\"type\":\"function\"},{\"inputs\":[],\"name\":\"pendingComptrollerImplementation\",\"outputs\":[{\"internalType\":\"address\",\"name\":\"\",\"type\":\"address\"}],\"stateMutability\":\"view\",\"type\":\"function\"},{\"inputs\":[],\"name\":\"proposal65FixExecuted\",\"outputs\":[{\"internalType\":\"bool\",\"name\":\"\",\"type\":\"bool\"}],\"stateMutability\":\"view\",\"type\":\"function\"},{\"inputs\":[{\"internalType\":\"address\",\"name\":\"cToken\",\"type\":\"address\"},{\"internalType\":\"address\",\"name\":\"redeemer\",\"type\":\"address\"},{\"internalType\":\"uint256\",\"name\":\"redeemTokens\",\"type\":\"uint256\"}],\"name\":\"redeemAllowed\",\"outputs\":[{\"internalType\":\"uint256\",\"name\":\"\",\"type\":\"uint256\"}],\"stateMutability\":\"nonpayable\",\"type\":\"function\"},{\"inputs\":[{\"internalType\":\"address\",\"name\":\"cToken\",\"type\":\"address\"},{\"internalType\":\"address\",\"name\":\"redeemer\",\"type\":\"address\"},{\"internalType\":\"uint256\",\"name\":\"redeemAmount\",\"type\":\"uint256\"},{\"internalType\":\"uint256\",\"name\":\"redeemTokens\",\"type\":\"uint256\"}],\"name\":\"redeemVerify\",\"outputs\":[],\"stateMutability\":\"nonpayable\",\"type\":\"function\"},{\"inputs\":[{\"internalType\":\"address\",\"name\":\"cToken\",\"type\":\"address\"},{\"internalType\":\"address\",\"name\":\"payer\",\"type\":\"address\"},{\"internalType\":\"address\",\"name\":\"borrower\",\"type\":\"address\"},{\"internalType\":\"uint256\",\"name\":\"repayAmount\",\"type\":\"uint256\"}],\"name\":\"repayBorrowAllowed\",\"outputs\":[{\"internalType\":\"uint256\",\"name\":\"\",\"type\":\"uint256\"}],\"stateMutability\":\"nonpayable\",\"type\":\"function\"},{\"inputs\":[{\"internalType\":\"address\",\"name\":\"cToken\",\"type\":\"address\"},{\"internalType\":\"address\",\"name\":\"payer\",\"type\":\"address\"},{\"internalType\":\"address\",\"name\":\"borrower\",\"type\":\"address\"},{\"internalType\":\"uint256\",\"name\":\"actualRepayAmount\",\"type\":\"uint256\"},{\"internalType\":\"uint256\",\"name\":\"borrowerIndex\",\"type\":\"uint256\"}],\"name\":\"repayBorrowVerify\",\"outputs\":[],\"stateMutability\":\"nonpayable\",\"type\":\"function\"},{\"inputs\":[{\"internalType\":\"address\",\"name\":\"cTokenCollateral\",\"type\":\"address\"},{\"internalType\":\"address\",\"name\":\"cTokenBorrowed\",\"type\":\"address\"},{\"internalType\":\"address\",\"name\":\"liquidator\",\"type\":\"address\"},{\"internalType\":\"address\",\"name\":\"borrower\",\"type\":\"address\"},{\"internalType\":\"uint256\",\"name\":\"seizeTokens\",\"type\":\"uint256\"}],\"name\":\"seizeAllowed\",\"outputs\":[{\"internalType\":\"uint256\",\"name\":\"\",\"type\":\"uint256\"}],\"stateMutability\":\"nonpayable\",\"type\":\"function\"},{\"inputs\":[],\"name\":\"seizeGuardianPaused\",\"outputs\":[{\"internalType\":\"bool\",\"name\":\"\",\"type\":\"bool\"}],\"stateMutability\":\"view\",\"type\":\"function\"},{\"inputs\":[{\"internalType\":\"address\",\"name\":\"cTokenCollateral\",\"type\":\"address\"},{\"internalType\":\"address\",\"name\":\"cTokenBorrowed\",\"type\":\"address\"},{\"internalType\":\"address\",\"name\":\"liquidator\",\"type\":\"address\"},{\"internalType\":\"address\",\"name\":\"borrower\",\"type\":\"address\"},{\"internalType\":\"uint256\",\"name\":\"seizeTokens\",\"type\":\"uint256\"}],\"name\":\"seizeVerify\",\"outputs\":[],\"stateMutability\":\"nonpayable\",\"type\":\"function\"},{\"inputs\":[],\"name\":\"supplyCapGuardian\",\"outputs\":[{\"internalType\":\"address\",\"name\":\"\",\"type\":\"address\"}],\"stateMutability\":\"view\",\"type\":\"function\"},{\"inputs\":[{\"internalType\":\"address\",\"name\":\"\",\"type\":\"address\"}],\"name\":\"supplyCaps\",\"outputs\":[{\"internalType\":\"uint256\",\"name\":\"\",\"type\":\"uint256\"}],\"stateMutability\":\"view\",\"type\":\"function\"},{\"inputs\":[{\"internalType\":\"address\",\"name\":\"cToken\",\"type\":\"address\"},{\"internalType\":\"address\",\"name\":\"src\",\"type\":\"address\"},{\"internalType\":\"address\",\"name\":\"dst\",\"type\":\"address\"},{\"internalType\":\"uint256\",\"name\":\"transferTokens\",\"type\":\"uint256\"}],\"name\":\"transferAllowed\",\"outputs\":[{\"internalType\":\"uint256\",\"name\":\"\",\"type\":\"uint256\"}],\"stateMutability\":\"nonpayable\",\"type\":\"function\"},{\"inputs\":[],\"name\":\"transferGuardianPaused\",\"outputs\":[{\"internalType\":\"bool\",\"name\":\"\",\"type\":\"bool\"}],\"stateMutability\":\"view\",\"type\":\"function\"},{\"inputs\":[{\"internalType\":\"address\",\"name\":\"cToken\",\"type\":\"address\"},{\"internalType\":\"address\",\"name\":\"src\",\"type\":\"address\"},{\"internalType\":\"address\",\"name\":\"dst\",\"type\":\"address\"},{\"internalType\":\"uint256\",\"name\":\"transferTokens\",\"type\":\"uint256\"}],\"name\":\"transferVerify\",\"outputs\":[],\"stateMutability\":\"nonpayable\",\"type\":\"function\"},{\"inputs\":[{\"internalType\":\"address\",\"name\":\"contributor\",\"type\":\"address\"}],\"name\":\"updateContributorRewards\",\"outputs\":[],\"stateMutability\":\"nonpayable\",\"type\":\"function\"}],\"devdoc\":{\"author\":\"Compound\",\"kind\":\"dev\",\"methods\":{\"_grantComp(address,uint256)\":{\"details\":\"Note: If there is not enough COMP, we do not perform the transfer all.\",\"params\":{\"amount\":\"The amount of COMP to (possibly) transfer\",\"recipient\":\"The address of the recipient to transfer COMP to\"}},\"_setBorrowCapGuardian(address)\":{\"params\":{\"newBorrowCapGuardian\":\"The address of the new Borrow Cap Guardian\"}},\"_setCloseFactor(uint256)\":{\"details\":\"Admin function to set closeFactor\",\"params\":{\"newCloseFactorMantissa\":\"New close factor, scaled by 1e18\"},\"returns\":{\"_0\":\"uint 0=success, otherwise a failure\"}},\"_setCollateralFactor(address,uint256)\":{\"details\":\"Admin function to set per-market collateralFactor\",\"params\":{\"cToken\":\"The market to set the factor on\",\"newCollateralFactorMantissa\":\"The new collateral factor, scaled by 1e18\"},\"returns\":{\"_0\":\"uint 0=success, otherwise a failure. (See ErrorReporter for details)\"}},\"_setCompSpeeds(address[],uint256[],uint256[])\":{\"params\":{\"borrowSpeeds\":\"New borrow-side COMP speed for the corresponding market.\",\"cTokens\":\"The markets whose COMP speed to update.\",\"supplySpeeds\":\"New supply-side COMP speed for the corresponding market.\"}},\"_setContributorCompSpeed(address,uint256)\":{\"params\":{\"compSpeed\":\"New COMP speed for contributor\",\"contributor\":\"The contributor whose COMP speed to update\"}},\"_setLiquidationIncentive(uint256)\":{\"details\":\"Admin function to set liquidationIncentive\",\"params\":{\"newLiquidationIncentiveMantissa\":\"New liquidationIncentive scaled by 1e18\"},\"returns\":{\"_0\":\"uint 0=success, otherwise a failure. (See ErrorReporter for details)\"}},\"_setMarketBorrowCaps(address[],uint256[])\":{\"details\":\"Admin or borrowCapGuardian function to set the borrow caps. A borrow cap of 0 corresponds to unlimited borrowing.\",\"params\":{\"cTokens\":\"The addresses of the markets (tokens) to change the borrow caps for\",\"newBorrowCaps\":\"The new borrow cap values in underlying to be set. A value of 0 corresponds to unlimited borrowing.\"}},\"_setMarketSupplyCaps(address[],uint256[])\":{\"details\":\"Admin or supplyCapGuardian function to set the supply caps. A supply cap of 0 corresponds to unlimited supplying.\",\"params\":{\"cTokens\":\"The addresses of the markets (tokens) to change the supply caps for\",\"newSupplyCaps\":\"The new supply cap values in underlying to be set. A value of 0 corresponds to unlimited supplying.\"}},\"_setPauseGuardian(address)\":{\"params\":{\"newPauseGuardian\":\"The address of the new Pause Guardian\"},\"returns\":{\"_0\":\"uint 0=success, otherwise a failure. (See enum Error for details)\"}},\"_setPriceOracle(address)\":{\"details\":\"Admin function to set a new price oracle\",\"returns\":{\"_0\":\"uint 0=success, otherwise a failure (see ErrorReporter.sol for details)\"}},\"_setSupplyCapGuardian(address)\":{\"params\":{\"newSupplyCapGuardian\":\"The address of the new Supply Cap Guardian\"}},\"_supportMarket(address)\":{\"details\":\"Admin function to set isListed and add support for the market\",\"params\":{\"cToken\":\"The address of the market (token) to list\"},\"returns\":{\"_0\":\"uint 0=success, otherwise a failure. (See enum Error for details)\"}},\"borrowAllowed(address,address,uint256)\":{\"params\":{\"borrowAmount\":\"The amount of underlying the account would borrow\",\"borrower\":\"The account which would borrow the asset\",\"cToken\":\"The market to verify the borrow against\"},\"returns\":{\"_0\":\"0 if the borrow is allowed, otherwise a semi-opaque error code (See ErrorReporter.sol)\"}},\"borrowVerify(address,address,uint256)\":{\"params\":{\"borrowAmount\":\"The amount of the underlying asset requested to borrow\",\"borrower\":\"The address borrowing the underlying\",\"cToken\":\"Asset whose underlying is being borrowed\"}},\"checkMembership(address,address)\":{\"params\":{\"account\":\"The address of the account to check\",\"cToken\":\"The cToken to check\"},\"returns\":{\"_0\":\"True if the account is in the asset, otherwise false.\"}},\"claimComp(address)\":{\"params\":{\"holder\":\"The address to claim COMP for\"}},\"claimComp(address,address[])\":{\"params\":{\"cTokens\":\"The list of markets to claim COMP in\",\"holder\":\"The address to claim COMP for\"}},\"claimComp(address[],address[],bool,bool)\":{\"params\":{\"borrowers\":\"Whether or not to claim COMP earned by borrowing\",\"cTokens\":\"The list of markets to claim COMP in\",\"holders\":\"The addresses to claim COMP for\",\"suppliers\":\"Whether or not to claim COMP earned by supplying\"}},\"enterMarkets(address[])\":{\"params\":{\"cTokens\":\"The list of addresses of the cToken markets to be enabled\"},\"returns\":{\"_0\":\"Success indicator for whether each corresponding market was entered\"}},\"exitMarket(address)\":{\"details\":\"Sender must not have an outstanding borrow balance in the asset,  or be providing necessary collateral for an outstanding borrow.\",\"params\":{\"cTokenAddress\":\"The address of the asset to be removed\"},\"returns\":{\"_0\":\"Whether or not the account successfully exited the market\"}},\"getAccountLiquidity(address)\":{\"returns\":{\"_0\":\"(possible error code (semi-opaque), account liquidity in excess of collateral requirements,          account shortfall below collateral requirements)\"}},\"getAllMarkets()\":{\"details\":\"The automatic getter may be used to access an individual market.\",\"returns\":{\"_0\":\"The list of market addresses\"}},\"getAssetsIn(address)\":{\"params\":{\"account\":\"The address of the account to pull assets for\"},\"returns\":{\"_0\":\"A dynamic list with the assets the account has entered\"}},\"getCompAddress()\":{\"returns\":{\"_0\":\"The address of SONNE\"}},\"getExternalRewardDistributorAddress()\":{\"returns\":{\"_0\":\"The address of the external reward distributor\"}},\"getHypotheticalAccountLiquidity(address,address,uint256,uint256)\":{\"params\":{\"account\":\"The account to determine liquidity for\",\"borrowAmount\":\"The amount of underlying to hypothetically borrow\",\"cTokenModify\":\"The market to hypothetically redeem/borrow in\",\"redeemTokens\":\"The number of tokens to hypothetically redeem\"},\"returns\":{\"_0\":\"(possible error code (semi-opaque), hypothetical account liquidity in excess of collateral requirements,          hypothetical account shortfall below collateral requirements)\"}},\"isDeprecated(address)\":{\"details\":\"All borrows in a deprecated cToken market can be immediately liquidated\",\"params\":{\"cToken\":\"The market to check if deprecated\"}},\"liquidateBorrowAllowed(address,address,address,address,uint256)\":{\"params\":{\"borrower\":\"The address of the borrower\",\"cTokenBorrowed\":\"Asset which was borrowed by the borrower\",\"cTokenCollateral\":\"Asset which was used as collateral and will be seized\",\"liquidator\":\"The address repaying the borrow and seizing the collateral\",\"repayAmount\":\"The amount of underlying being repaid\"}},\"liquidateBorrowVerify(address,address,address,address,uint256,uint256)\":{\"params\":{\"actualRepayAmount\":\"The amount of underlying being repaid\",\"borrower\":\"The address of the borrower\",\"cTokenBorrowed\":\"Asset which was borrowed by the borrower\",\"cTokenCollateral\":\"Asset which was used as collateral and will be seized\",\"liquidator\":\"The address repaying the borrow and seizing the collateral\"}},\"liquidateCalculateSeizeTokens(address,address,uint256)\":{\"details\":\"Used in liquidation (called in cToken.liquidateBorrowFresh)\",\"params\":{\"actualRepayAmount\":\"The amount of cTokenBorrowed underlying to convert into cTokenCollateral tokens\",\"cTokenBorrowed\":\"The address of the borrowed cToken\",\"cTokenCollateral\":\"The address of the collateral cToken\"},\"returns\":{\"_0\":\"(errorCode, number of cTokenCollateral tokens to be seized in a liquidation)\"}},\"mintAllowed(address,address,uint256)\":{\"params\":{\"cToken\":\"The market to verify the mint against\",\"mintAmount\":\"The amount of underlying being supplied to the market in exchange for tokens\",\"minter\":\"The account which would get the minted tokens\"},\"returns\":{\"_0\":\"0 if the mint is allowed, otherwise a semi-opaque error code (See ErrorReporter.sol)\"}},\"mintVerify(address,address,uint256,uint256)\":{\"params\":{\"actualMintAmount\":\"The amount of the underlying asset being minted\",\"cToken\":\"Asset being minted\",\"mintTokens\":\"The number of tokens being minted\",\"minter\":\"The address minting the tokens\"}},\"redeemAllowed(address,address,uint256)\":{\"params\":{\"cToken\":\"The market to verify the redeem against\",\"redeemTokens\":\"The number of cTokens to exchange for the underlying asset in the market\",\"redeemer\":\"The account which would redeem the tokens\"},\"returns\":{\"_0\":\"0 if the redeem is allowed, otherwise a semi-opaque error code (See ErrorReporter.sol)\"}},\"redeemVerify(address,address,uint256,uint256)\":{\"params\":{\"cToken\":\"Asset being redeemed\",\"redeemAmount\":\"The amount of the underlying asset being redeemed\",\"redeemTokens\":\"The number of tokens being redeemed\",\"redeemer\":\"The address redeeming the tokens\"}},\"repayBorrowAllowed(address,address,address,uint256)\":{\"params\":{\"borrower\":\"The account which would borrowed the asset\",\"cToken\":\"The market to verify the repay against\",\"payer\":\"The account which would repay the asset\",\"repayAmount\":\"The amount of the underlying asset the account would repay\"},\"returns\":{\"_0\":\"0 if the repay is allowed, otherwise a semi-opaque error code (See ErrorReporter.sol)\"}},\"repayBorrowVerify(address,address,address,uint256,uint256)\":{\"params\":{\"actualRepayAmount\":\"The amount of underlying being repaid\",\"borrower\":\"The address of the borrower\",\"cToken\":\"Asset being repaid\",\"payer\":\"The address repaying the borrow\"}},\"seizeAllowed(address,address,address,address,uint256)\":{\"params\":{\"borrower\":\"The address of the borrower\",\"cTokenBorrowed\":\"Asset which was borrowed by the borrower\",\"cTokenCollateral\":\"Asset which was used as collateral and will be seized\",\"liquidator\":\"The address repaying the borrow and seizing the collateral\",\"seizeTokens\":\"The number of collateral tokens to seize\"}},\"seizeVerify(address,address,address,address,uint256)\":{\"params\":{\"borrower\":\"The address of the borrower\",\"cTokenBorrowed\":\"Asset which was borrowed by the borrower\",\"cTokenCollateral\":\"Asset which was used as collateral and will be seized\",\"liquidator\":\"The address repaying the borrow and seizing the collateral\",\"seizeTokens\":\"The number of collateral tokens to seize\"}},\"transferAllowed(address,address,address,uint256)\":{\"params\":{\"cToken\":\"The market to verify the transfer against\",\"dst\":\"The account which receives the tokens\",\"src\":\"The account which sources the tokens\",\"transferTokens\":\"The number of cTokens to transfer\"},\"returns\":{\"_0\":\"0 if the transfer is allowed, otherwise a semi-opaque error code (See ErrorReporter.sol)\"}},\"transferVerify(address,address,address,uint256)\":{\"params\":{\"cToken\":\"Asset being transferred\",\"dst\":\"The account which receives the tokens\",\"src\":\"The account which sources the tokens\",\"transferTokens\":\"The number of cTokens to transfer\"}},\"updateContributorRewards(address)\":{\"params\":{\"contributor\":\"The address to calculate contributor rewards for\"}}},\"title\":\"Compound's Comptroller Contract\",\"version\":1},\"userdoc\":{\"events\":{\"ActionPaused(address,string,bool)\":{\"notice\":\"Emitted when an action is paused on a market\"},\"ActionPaused(string,bool)\":{\"notice\":\"Emitted when an action is paused globally\"},\"CompAccruedAdjusted(address,uint256,uint256)\":{\"notice\":\"Emitted when COMP accrued for a user has been manually adjusted.\"},\"CompBorrowSpeedUpdated(address,uint256)\":{\"notice\":\"Emitted when a new borrow-side COMP speed is calculated for a market\"},\"CompGranted(address,uint256)\":{\"notice\":\"Emitted when COMP is granted by admin\"},\"CompReceivableUpdated(address,uint256,uint256)\":{\"notice\":\"Emitted when COMP receivable for a user has been updated.\"},\"CompSupplySpeedUpdated(address,uint256)\":{\"notice\":\"Emitted when a new supply-side COMP speed is calculated for a market\"},\"ContributorCompSpeedUpdated(address,uint256)\":{\"notice\":\"Emitted when a new COMP speed is set for a contributor\"},\"DistributedBorrowerComp(address,address,uint256,uint256)\":{\"notice\":\"Emitted when COMP is distributed to a borrower\"},\"DistributedSupplierComp(address,address,uint256,uint256)\":{\"notice\":\"Emitted when COMP is distributed to a supplier\"},\"MarketEntered(address,address)\":{\"notice\":\"Emitted when an account enters a market\"},\"MarketExited(address,address)\":{\"notice\":\"Emitted when an account exits a market\"},\"MarketListed(address)\":{\"notice\":\"Emitted when an admin supports a market\"},\"NewBorrowCap(address,uint256)\":{\"notice\":\"Emitted when borrow cap for a cToken is changed\"},\"NewBorrowCapGuardian(address,address)\":{\"notice\":\"Emitted when borrow cap guardian is changed\"},\"NewCloseFactor(uint256,uint256)\":{\"notice\":\"Emitted when close factor is changed by admin\"},\"NewCollateralFactor(address,uint256,uint256)\":{\"notice\":\"Emitted when a collateral factor is changed by admin\"},\"NewLiquidationIncentive(uint256,uint256)\":{\"notice\":\"Emitted when liquidation incentive is changed by admin\"},\"NewPauseGuardian(address,address)\":{\"notice\":\"Emitted when pause guardian is changed\"},\"NewPriceOracle(address,address)\":{\"notice\":\"Emitted when price oracle is changed\"},\"NewSupplyCap(address,uint256)\":{\"notice\":\"Emitted when supply cap for a cToken is changed\"},\"NewSupplyCapGuardian(address,address)\":{\"notice\":\"Emitted when supply cap guardian is changed\"}},\"kind\":\"user\",\"methods\":{\"_grantComp(address,uint256)\":{\"notice\":\"Transfer COMP to the recipient\"},\"_setBorrowCapGuardian(address)\":{\"notice\":\"Admin function to change the Borrow Cap Guardian\"},\"_setCloseFactor(uint256)\":{\"notice\":\"Sets the closeFactor used when liquidating borrows\"},\"_setCollateralFactor(address,uint256)\":{\"notice\":\"Sets the collateralFactor for a market\"},\"_setCompSpeeds(address[],uint256[],uint256[])\":{\"notice\":\"Set COMP borrow and supply speeds for the specified markets.\"},\"_setContributorCompSpeed(address,uint256)\":{\"notice\":\"Set COMP speed for a single contributor\"},\"_setLiquidationIncentive(uint256)\":{\"notice\":\"Sets liquidationIncentive\"},\"_setMarketBorrowCaps(address[],uint256[])\":{\"notice\":\"Set the given borrow caps for the given cToken markets. Borrowing that brings total borrows to or above borrow cap will revert.\"},\"_setMarketSupplyCaps(address[],uint256[])\":{\"notice\":\"Set the given supply caps for the given cToken markets. Supplying that brings total supply to or above supply cap will revert.\"},\"_setPauseGuardian(address)\":{\"notice\":\"Admin function to change the Pause Guardian\"},\"_setPriceOracle(address)\":{\"notice\":\"Sets a new price oracle for the comptroller\"},\"_setSupplyCapGuardian(address)\":{\"notice\":\"Admin function to change the Supply Cap Guardian\"},\"_supportMarket(address)\":{\"notice\":\"Add the market to the markets mapping and set it as listed\"},\"accountAssets(address,uint256)\":{\"notice\":\"Per-account mapping of \\\"assets you are in\\\", capped by maxAssets\"},\"admin()\":{\"notice\":\"Administrator for this contract\"},\"allMarkets(uint256)\":{\"notice\":\"A list of all markets\"},\"borrowAllowed(address,address,uint256)\":{\"notice\":\"Checks if the account should be allowed to borrow the underlying asset of the given market\"},\"borrowVerify(address,address,uint256)\":{\"notice\":\"Validates borrow and reverts on rejection. May emit logs.\"},\"checkMembership(address,address)\":{\"notice\":\"Returns whether the given account is entered in the given asset\"},\"claimComp(address)\":{\"notice\":\"Claim all the comp accrued by holder in all markets\"},\"claimComp(address,address[])\":{\"notice\":\"Claim all the comp accrued by holder in the specified markets\"},\"claimComp(address[],address[],bool,bool)\":{\"notice\":\"Claim all comp accrued by the holders\"},\"closeFactorMantissa()\":{\"notice\":\"Multiplier used to calculate the maximum repayAmount when liquidating a borrow\"},\"compAccrued(address)\":{\"notice\":\"The COMP accrued but not yet transferred to each user\"},\"compBorrowSpeeds(address)\":{\"notice\":\"The rate at which comp is distributed to the corresponding borrow market (per block)\"},\"compBorrowState(address)\":{\"notice\":\"The COMP market borrow state for each market\"},\"compBorrowerIndex(address,address)\":{\"notice\":\"The COMP borrow index for each market for each borrower as of the last time they accrued COMP\"},\"compContributorSpeeds(address)\":{\"notice\":\"The portion of COMP that each contributor receives per block\"},\"compInitialIndex()\":{\"notice\":\"The initial COMP index for a market\"},\"compRate()\":{\"notice\":\"The rate at which the flywheel distributes COMP, per block\"},\"compReceivable(address)\":{\"notice\":\"Accounting storage mapping account addresses to how much COMP they owe the protocol.\"},\"compSpeeds(address)\":{\"notice\":\"The portion of compRate that each market currently receives\"},\"compSupplierIndex(address,address)\":{\"notice\":\"The COMP borrow index for each market for each supplier as of the last time they accrued COMP\"},\"compSupplySpeeds(address)\":{\"notice\":\"The rate at which comp is distributed to the corresponding supply market (per block)\"},\"compSupplyState(address)\":{\"notice\":\"The COMP market supply state for each market\"},\"comptrollerImplementation()\":{\"notice\":\"Active brains of Unitroller\"},\"enterMarkets(address[])\":{\"notice\":\"Add assets to be included in account liquidity calculation\"},\"exitMarket(address)\":{\"notice\":\"Removes asset from sender's account liquidity calculation\"},\"fixBadAccruals(address[],uint256[])\":{\"notice\":\"Delete this function after proposal 65 is executed\"},\"getAccountLiquidity(address)\":{\"notice\":\"Determine the current account liquidity wrt collateral requirements\"},\"getAllMarkets()\":{\"notice\":\"Return all of the markets\"},\"getAssetsIn(address)\":{\"notice\":\"Returns the assets an account has entered\"},\"getCompAddress()\":{\"notice\":\"Return the address of the SONNE token\"},\"getExternalRewardDistributorAddress()\":{\"notice\":\"Return the address of the external reward distributor\"},\"getHypotheticalAccountLiquidity(address,address,uint256,uint256)\":{\"notice\":\"Determine what the account liquidity would be if the given amounts were redeemed/borrowed\"},\"isComptroller()\":{\"notice\":\"Indicator that this is a Comptroller contract (for inspection)\"},\"isDeprecated(address)\":{\"notice\":\"Returns true if the given cToken market has been deprecated\"},\"lastContributorBlock(address)\":{\"notice\":\"Last block at which a contributor's COMP rewards have been allocated\"},\"liquidateBorrowAllowed(address,address,address,address,uint256)\":{\"notice\":\"Checks if the liquidation should be allowed to occur\"},\"liquidateBorrowVerify(address,address,address,address,uint256,uint256)\":{\"notice\":\"Validates liquidateBorrow and reverts on rejection. May emit logs.\"},\"liquidateCalculateSeizeTokens(address,address,uint256)\":{\"notice\":\"Calculate number of tokens of collateral asset to seize given an underlying amount\"},\"liquidationIncentiveMantissa()\":{\"notice\":\"Multiplier representing the discount on collateral that a liquidator receives\"},\"markets(address)\":{\"notice\":\"Official mapping of cTokens -> Market metadata\"},\"maxAssets()\":{\"notice\":\"Max number of assets a single account can participate in (borrow or use as collateral)\"},\"mintAllowed(address,address,uint256)\":{\"notice\":\"Checks if the account should be allowed to mint tokens in the given market\"},\"mintVerify(address,address,uint256,uint256)\":{\"notice\":\"Validates mint and reverts on rejection. May emit logs.\"},\"oracle()\":{\"notice\":\"Oracle which gives the price of any given asset\"},\"pauseGuardian()\":{\"notice\":\"The Pause Guardian can pause certain actions as a safety mechanism.  Actions which allow users to remove their own assets cannot be paused.  Liquidation / seizing / transfer can only be paused globally, not by market.\"},\"pendingAdmin()\":{\"notice\":\"Pending administrator for this contract\"},\"pendingComptrollerImplementation()\":{\"notice\":\"Pending brains of Unitroller\"},\"proposal65FixExecuted()\":{\"notice\":\"Flag indicating whether the function to fix COMP accruals has been executed (RE: proposal 62 bug)\"},\"redeemAllowed(address,address,uint256)\":{\"notice\":\"Checks if the account should be allowed to redeem tokens in the given market\"},\"redeemVerify(address,address,uint256,uint256)\":{\"notice\":\"Validates redeem and reverts on rejection. May emit logs.\"},\"repayBorrowAllowed(address,address,address,uint256)\":{\"notice\":\"Checks if the account should be allowed to repay a borrow in the given market\"},\"repayBorrowVerify(address,address,address,uint256,uint256)\":{\"notice\":\"Validates repayBorrow and reverts on rejection. May emit logs.\"},\"seizeAllowed(address,address,address,address,uint256)\":{\"notice\":\"Checks if the seizing of assets should be allowed to occur\"},\"seizeVerify(address,address,address,address,uint256)\":{\"notice\":\"Validates seize and reverts on rejection. May emit logs.\"},\"transferAllowed(address,address,address,uint256)\":{\"notice\":\"Checks if the account should be allowed to transfer tokens in the given market\"},\"transferVerify(address,address,address,uint256)\":{\"notice\":\"Validates transfer and reverts on rejection. May emit logs.\"},\"updateContributorRewards(address)\":{\"notice\":\"Calculate additional accrued COMP for a contributor since last accrual\"}},\"version\":1}},\"settings\":{\"compilationTarget\":{\"contracts/Comptroller.sol\":\"Comptroller\"},\"evmVersion\":\"london\",\"libraries\":{},\"metadata\":{\"bytecodeHash\":\"ipfs\",\"useLiteralContent\":true},\"optimizer\":{\"enabled\":true,\"runs\":200},\"remappings\":[]},\"sources\":{\"contracts/CToken.sol\":{\"content\":\"// SPDX-License-Identifier: BSD-3-Clause\\npragma solidity ^0.8.10;\\n\\nimport \\\"./ComptrollerInterface.sol\\\";\\nimport \\\"./CTokenInterfaces.sol\\\";\\nimport \\\"./ErrorReporter.sol\\\";\\nimport \\\"./EIP20Interface.sol\\\";\\nimport \\\"./InterestRateModel.sol\\\";\\nimport \\\"./ExponentialNoError.sol\\\";\\n\\n/**\\n * @title Compound's CToken Contract\\n * @notice Abstract base for CTokens\\n * @author Compound\\n */\\nabstract contract CToken is\\n    CTokenInterface,\\n    ExponentialNoError,\\n    TokenErrorReporter\\n{\\n    /**\\n     * @notice Initialize the money market\\n     * @param comptroller_ The address of the Comptroller\\n     * @param interestRateModel_ The address of the interest rate model\\n     * @param initialExchangeRateMantissa_ The initial exchange rate, scaled by 1e18\\n     * @param name_ EIP-20 name of this token\\n     * @param symbol_ EIP-20 symbol of this token\\n     * @param decimals_ EIP-20 decimal precision of this token\\n     */\\n    function initialize(\\n        ComptrollerInterface comptroller_,\\n        InterestRateModel interestRateModel_,\\n        uint256 initialExchangeRateMantissa_,\\n        string memory name_,\\n        string memory symbol_,\\n        uint8 decimals_\\n    ) public {\\n        require(msg.sender == admin, \\\"only admin may initialize the market\\\");\\n        require(\\n            accrualBlockNumber == 0 && borrowIndex == 0,\\n            \\\"market may only be initialized once\\\"\\n        );\\n\\n        // Set initial exchange rate\\n        initialExchangeRateMantissa = initialExchangeRateMantissa_;\\n        require(\\n            initialExchangeRateMantissa > 0,\\n            \\\"initial exchange rate must be greater than zero.\\\"\\n        );\\n\\n        // Set the comptroller\\n        uint256 err = _setComptroller(comptroller_);\\n        require(err == NO_ERROR, \\\"setting comptroller failed\\\");\\n\\n        // Initialize block number and borrow index (block number mocks depend on comptroller being set)\\n        accrualBlockNumber = getBlockNumber();\\n        borrowIndex = mantissaOne;\\n\\n        // Set the interest rate model (depends on block number / borrow index)\\n        err = _setInterestRateModelFresh(interestRateModel_);\\n        require(err == NO_ERROR, \\\"setting interest rate model failed\\\");\\n\\n        name = name_;\\n        symbol = symbol_;\\n        decimals = decimals_;\\n\\n        // The counter starts true to prevent changing it from zero to non-zero (i.e. smaller cost/refund)\\n        _notEntered = true;\\n    }\\n\\n    /**\\n     * @notice Transfer `tokens` tokens from `src` to `dst` by `spender`\\n     * @dev Called by both `transfer` and `transferFrom` internally\\n     * @param spender The address of the account performing the transfer\\n     * @param src The address of the source account\\n     * @param dst The address of the destination account\\n     * @param tokens The number of tokens to transfer\\n     * @return 0 if the transfer succeeded, else revert\\n     */\\n    function transferTokens(\\n        address spender,\\n        address src,\\n        address dst,\\n        uint256 tokens\\n    ) internal returns (uint256) {\\n        /* Fail if transfer not allowed */\\n        uint256 allowed = comptroller.transferAllowed(\\n            address(this),\\n            src,\\n            dst,\\n            tokens\\n        );\\n        if (allowed != 0) {\\n            revert TransferComptrollerRejection(allowed);\\n        }\\n\\n        /* Do not allow self-transfers */\\n        if (src == dst) {\\n            revert TransferNotAllowed();\\n        }\\n\\n        /* Get the allowance, infinite for the account owner */\\n        uint256 startingAllowance = 0;\\n        if (spender == src) {\\n            startingAllowance = type(uint256).max;\\n        } else {\\n            startingAllowance = transferAllowances[src][spender];\\n        }\\n\\n        /* Do the calculations, checking for {under,over}flow */\\n        uint256 allowanceNew = startingAllowance - tokens;\\n        uint256 srcTokensNew = accountTokens[src] - tokens;\\n        uint256 dstTokensNew = accountTokens[dst] + tokens;\\n\\n        /////////////////////////\\n        // EFFECTS & INTERACTIONS\\n        // (No safe failures beyond this point)\\n\\n        accountTokens[src] = srcTokensNew;\\n        accountTokens[dst] = dstTokensNew;\\n\\n        /* Eat some of the allowance (if necessary) */\\n        if (startingAllowance != type(uint256).max) {\\n            transferAllowances[src][spender] = allowanceNew;\\n        }\\n\\n        /* We emit a Transfer event */\\n        emit Transfer(src, dst, tokens);\\n\\n        // unused function\\n        // comptroller.transferVerify(address(this), src, dst, tokens);\\n\\n        return NO_ERROR;\\n    }\\n\\n    /**\\n     * @notice Transfer `amount` tokens from `msg.sender` to `dst`\\n     * @param dst The address of the destination account\\n     * @param amount The number of tokens to transfer\\n     * @return Whether or not the transfer succeeded\\n     */\\n    function transfer(address dst, uint256 amount)\\n        external\\n        override\\n        nonReentrant\\n        returns (bool)\\n    {\\n        return transferTokens(msg.sender, msg.sender, dst, amount) == NO_ERROR;\\n    }\\n\\n    /**\\n     * @notice Transfer `amount` tokens from `src` to `dst`\\n     * @param src The address of the source account\\n     * @param dst The address of the destination account\\n     * @param amount The number of tokens to transfer\\n     * @return Whether or not the transfer succeeded\\n     */\\n    function transferFrom(\\n        address src,\\n        address dst,\\n        uint256 amount\\n    ) external override nonReentrant returns (bool) {\\n        return transferTokens(msg.sender, src, dst, amount) == NO_ERROR;\\n    }\\n\\n    /**\\n     * @notice Approve `spender` to transfer up to `amount` from `src`\\n     * @dev This will overwrite the approval amount for `spender`\\n     *  and is subject to issues noted [here](https://eips.ethereum.org/EIPS/eip-20#approve)\\n     * @param spender The address of the account which may transfer tokens\\n     * @param amount The number of tokens that are approved (uint256.max means infinite)\\n     * @return Whether or not the approval succeeded\\n     */\\n    function approve(address spender, uint256 amount)\\n        external\\n        override\\n        returns (bool)\\n    {\\n        address src = msg.sender;\\n        transferAllowances[src][spender] = amount;\\n        emit Approval(src, spender, amount);\\n        return true;\\n    }\\n\\n    /**\\n     * @notice Get the current allowance from `owner` for `spender`\\n     * @param owner The address of the account which owns the tokens to be spent\\n     * @param spender The address of the account which may transfer tokens\\n     * @return The number of tokens allowed to be spent (-1 means infinite)\\n     */\\n    function allowance(address owner, address spender)\\n        external\\n        view\\n        override\\n        returns (uint256)\\n    {\\n        return transferAllowances[owner][spender];\\n    }\\n\\n    /**\\n     * @notice Get the token balance of the `owner`\\n     * @param owner The address of the account to query\\n     * @return The number of tokens owned by `owner`\\n     */\\n    function balanceOf(address owner) external view override returns (uint256) {\\n        return accountTokens[owner];\\n    }\\n\\n    /**\\n     * @notice Get the underlying balance of the `owner`\\n     * @dev This also accrues interest in a transaction\\n     * @param owner The address of the account to query\\n     * @return The amount of underlying owned by `owner`\\n     */\\n    function balanceOfUnderlying(address owner)\\n        external\\n        override\\n        returns (uint256)\\n    {\\n        Exp memory exchangeRate = Exp({mantissa: exchangeRateCurrent()});\\n        return mul_ScalarTruncate(exchangeRate, accountTokens[owner]);\\n    }\\n\\n    /**\\n     * @notice Get a snapshot of the account's balances, and the cached exchange rate\\n     * @dev This is used by comptroller to more efficiently perform liquidity checks.\\n     * @param account Address of the account to snapshot\\n     * @return (possible error, token balance, borrow balance, exchange rate mantissa)\\n     */\\n    function getAccountSnapshot(address account)\\n        external\\n        view\\n        override\\n        returns (\\n            uint256,\\n            uint256,\\n            uint256,\\n            uint256\\n        )\\n    {\\n        return (\\n            NO_ERROR,\\n            accountTokens[account],\\n            borrowBalanceStoredInternal(account),\\n            exchangeRateStoredInternal()\\n        );\\n    }\\n\\n    /**\\n     * @dev Function to simply retrieve block number\\n     *  This exists mainly for inheriting test contracts to stub this result.\\n     */\\n    function getBlockNumber() internal view virtual returns (uint256) {\\n        return block.timestamp;\\n    }\\n\\n    /**\\n     * @notice Returns the current per-block borrow interest rate for this cToken\\n     * @return The borrow interest rate per block, scaled by 1e18\\n     */\\n    function borrowRatePerBlock() external view override returns (uint256) {\\n        return\\n            interestRateModel.getBorrowRate(\\n                getCashPrior(),\\n                totalBorrows,\\n                totalReserves\\n            );\\n    }\\n\\n    /**\\n     * @notice Returns the current per-block supply interest rate for this cToken\\n     * @return The supply interest rate per block, scaled by 1e18\\n     */\\n    function supplyRatePerBlock() external view override returns (uint256) {\\n        return\\n            interestRateModel.getSupplyRate(\\n                getCashPrior(),\\n                totalBorrows,\\n                totalReserves,\\n                reserveFactorMantissa\\n            );\\n    }\\n\\n    /**\\n     * @notice Returns the current total borrows plus accrued interest\\n     * @return The total borrows with interest\\n     */\\n    function totalBorrowsCurrent()\\n        external\\n        override\\n        nonReentrant\\n        returns (uint256)\\n    {\\n        accrueInterest();\\n        return totalBorrows;\\n    }\\n\\n    /**\\n     * @notice Accrue interest to updated borrowIndex and then calculate account's borrow balance using the updated borrowIndex\\n     * @param account The address whose balance should be calculated after updating borrowIndex\\n     * @return The calculated balance\\n     */\\n    function borrowBalanceCurrent(address account)\\n        external\\n        override\\n        nonReentrant\\n        returns (uint256)\\n    {\\n        accrueInterest();\\n        return borrowBalanceStored(account);\\n    }\\n\\n    /**\\n     * @notice Return the borrow balance of account based on stored data\\n     * @param account The address whose balance should be calculated\\n     * @return The calculated balance\\n     */\\n    function borrowBalanceStored(address account)\\n        public\\n        view\\n        override\\n        returns (uint256)\\n    {\\n        return borrowBalanceStoredInternal(account);\\n    }\\n\\n    /**\\n     * @notice Return the borrow balance of account based on stored data\\n     * @param account The address whose balance should be calculated\\n     * @return (error code, the calculated balance or 0 if error code is non-zero)\\n     */\\n    function borrowBalanceStoredInternal(address account)\\n        internal\\n        view\\n        returns (uint256)\\n    {\\n        /* Get borrowBalance and borrowIndex */\\n        BorrowSnapshot storage borrowSnapshot = accountBorrows[account];\\n\\n        /* If borrowBalance = 0 then borrowIndex is likely also 0.\\n         * Rather than failing the calculation with a division by 0, we immediately return 0 in this case.\\n         */\\n        if (borrowSnapshot.principal == 0) {\\n            return 0;\\n        }\\n\\n        /* Calculate new borrow balance using the interest index:\\n         *  recentBorrowBalance = borrower.borrowBalance * market.borrowIndex / borrower.borrowIndex\\n         */\\n        uint256 principalTimesIndex = borrowSnapshot.principal * borrowIndex;\\n        return principalTimesIndex / borrowSnapshot.interestIndex;\\n    }\\n\\n    /**\\n     * @notice Accrue interest then return the up-to-date exchange rate\\n     * @return Calculated exchange rate scaled by 1e18\\n     */\\n    function exchangeRateCurrent()\\n        public\\n        override\\n        nonReentrant\\n        returns (uint256)\\n    {\\n        accrueInterest();\\n        return exchangeRateStored();\\n    }\\n\\n    /**\\n     * @notice Calculates the exchange rate from the underlying to the CToken\\n     * @dev This function does not accrue interest before calculating the exchange rate\\n     * @return Calculated exchange rate scaled by 1e18\\n     */\\n    function exchangeRateStored() public view override returns (uint256) {\\n        return exchangeRateStoredInternal();\\n    }\\n\\n    /**\\n     * @notice Calculates the exchange rate from the underlying to the CToken\\n     * @dev This function does not accrue interest before calculating the exchange rate\\n     * @return calculated exchange rate scaled by 1e18\\n     */\\n    function exchangeRateStoredInternal()\\n        internal\\n        view\\n        virtual\\n        returns (uint256)\\n    {\\n        uint256 _totalSupply = totalSupply;\\n        if (_totalSupply == 0) {\\n            /*\\n             * If there are no tokens minted:\\n             *  exchangeRate = initialExchangeRate\\n             */\\n            return initialExchangeRateMantissa;\\n        } else {\\n            /*\\n             * Otherwise:\\n             *  exchangeRate = (totalCash + totalBorrows - totalReserves) / totalSupply\\n             */\\n            uint256 totalCash = getCashPrior();\\n            uint256 cashPlusBorrowsMinusReserves = totalCash +\\n                totalBorrows -\\n                totalReserves;\\n            uint256 exchangeRate = (cashPlusBorrowsMinusReserves * expScale) /\\n                _totalSupply;\\n\\n            return exchangeRate;\\n        }\\n    }\\n\\n    /**\\n     * @notice Get cash balance of this cToken in the underlying asset\\n     * @return The quantity of underlying asset owned by this contract\\n     */\\n    function getCash() external view override returns (uint256) {\\n        return getCashPrior();\\n    }\\n\\n    /**\\n     * @notice Applies accrued interest to total borrows and reserves\\n     * @dev This calculates interest accrued from the last checkpointed block\\n     *   up to the current block and writes new checkpoint to storage.\\n     */\\n    function accrueInterest() public virtual override returns (uint256) {\\n        /* Remember the initial block number */\\n        uint256 currentBlockNumber = getBlockNumber();\\n        uint256 accrualBlockNumberPrior = accrualBlockNumber;\\n\\n        /* Short-circuit accumulating 0 interest */\\n        if (accrualBlockNumberPrior == currentBlockNumber) {\\n            return NO_ERROR;\\n        }\\n\\n        /* Read the previous values out of storage */\\n        uint256 cashPrior = getCashPrior();\\n        uint256 borrowsPrior = totalBorrows;\\n        uint256 reservesPrior = totalReserves;\\n        uint256 borrowIndexPrior = borrowIndex;\\n\\n        /* Calculate the current borrow interest rate */\\n        uint256 borrowRateMantissa = interestRateModel.getBorrowRate(\\n            cashPrior,\\n            borrowsPrior,\\n            reservesPrior\\n        );\\n        require(\\n            borrowRateMantissa <= borrowRateMaxMantissa,\\n            \\\"borrow rate is absurdly high\\\"\\n        );\\n\\n        /* Calculate the number of blocks elapsed since the last accrual */\\n        uint256 blockDelta = currentBlockNumber - accrualBlockNumberPrior;\\n\\n        /*\\n         * Calculate the interest accumulated into borrows and reserves and the new index:\\n         *  simpleInterestFactor = borrowRate * blockDelta\\n         *  interestAccumulated = simpleInterestFactor * totalBorrows\\n         *  totalBorrowsNew = interestAccumulated + totalBorrows\\n         *  totalReservesNew = interestAccumulated * reserveFactor + totalReserves\\n         *  borrowIndexNew = simpleInterestFactor * borrowIndex + borrowIndex\\n         */\\n\\n        Exp memory simpleInterestFactor = mul_(\\n            Exp({mantissa: borrowRateMantissa}),\\n            blockDelta\\n        );\\n        uint256 interestAccumulated = mul_ScalarTruncate(\\n            simpleInterestFactor,\\n            borrowsPrior\\n        );\\n        uint256 totalBorrowsNew = interestAccumulated + borrowsPrior;\\n        uint256 totalReservesNew = mul_ScalarTruncateAddUInt(\\n            Exp({mantissa: reserveFactorMantissa}),\\n            interestAccumulated,\\n            reservesPrior\\n        );\\n        uint256 borrowIndexNew = mul_ScalarTruncateAddUInt(\\n            simpleInterestFactor,\\n            borrowIndexPrior,\\n            borrowIndexPrior\\n        );\\n\\n        /////////////////////////\\n        // EFFECTS & INTERACTIONS\\n        // (No safe failures beyond this point)\\n\\n        /* We write the previously calculated values into storage */\\n        accrualBlockNumber = currentBlockNumber;\\n        borrowIndex = borrowIndexNew;\\n        totalBorrows = totalBorrowsNew;\\n        totalReserves = totalReservesNew;\\n\\n        /* We emit an AccrueInterest event */\\n        emit AccrueInterest(\\n            cashPrior,\\n            interestAccumulated,\\n            borrowIndexNew,\\n            totalBorrowsNew\\n        );\\n\\n        return NO_ERROR;\\n    }\\n\\n    /**\\n     * @notice Sender supplies assets into the market and receives cTokens in exchange\\n     * @dev Accrues interest whether or not the operation succeeds, unless reverted\\n     * @param mintAmount The amount of the underlying asset to supply\\n     */\\n    function mintInternal(uint256 mintAmount) internal nonReentrant {\\n        accrueInterest();\\n        // mintFresh emits the actual Mint event if successful and logs on errors, so we don't need to\\n        mintFresh(msg.sender, mintAmount);\\n    }\\n\\n    /**\\n     * @notice User supplies assets into the market and receives cTokens in exchange\\n     * @dev Assumes interest has already been accrued up to the current block\\n     * @param minter The address of the account which is supplying the assets\\n     * @param mintAmount The amount of the underlying asset to supply\\n     */\\n    function mintFresh(address minter, uint256 mintAmount) internal {\\n        /* Fail if mint not allowed */\\n        uint256 allowed = comptroller.mintAllowed(\\n            address(this),\\n            minter,\\n            mintAmount\\n        );\\n        if (allowed != 0) {\\n            revert MintComptrollerRejection(allowed);\\n        }\\n\\n        /* Verify market's block number equals current block number */\\n        if (accrualBlockNumber != getBlockNumber()) {\\n            revert MintFreshnessCheck();\\n        }\\n\\n        Exp memory exchangeRate = Exp({mantissa: exchangeRateStoredInternal()});\\n\\n        /////////////////////////\\n        // EFFECTS & INTERACTIONS\\n        // (No safe failures beyond this point)\\n\\n        /*\\n         *  We call `doTransferIn` for the minter and the mintAmount.\\n         *  Note: The cToken must handle variations between ERC-20 and ETH underlying.\\n         *  `doTransferIn` reverts if anything goes wrong, since we can't be sure if\\n         *  side-effects occurred. The function returns the amount actually transferred,\\n         *  in case of a fee. On success, the cToken holds an additional `actualMintAmount`\\n         *  of cash.\\n         */\\n        uint256 actualMintAmount = doTransferIn(minter, mintAmount);\\n\\n        /*\\n         * We get the current exchange rate and calculate the number of cTokens to be minted:\\n         *  mintTokens = actualMintAmount / exchangeRate\\n         */\\n\\n        uint256 mintTokens = div_(actualMintAmount, exchangeRate);\\n\\n        /*\\n         * We calculate the new total supply of cTokens and minter token balance, checking for overflow:\\n         *  totalSupplyNew = totalSupply + mintTokens\\n         *  accountTokensNew = accountTokens[minter] + mintTokens\\n         * And write them into storage\\n         */\\n        totalSupply = totalSupply + mintTokens;\\n        accountTokens[minter] = accountTokens[minter] + mintTokens;\\n\\n        /* We emit a Mint event, and a Transfer event */\\n        emit Mint(minter, actualMintAmount, mintTokens);\\n        emit Transfer(address(this), minter, mintTokens);\\n\\n        /* We call the defense hook */\\n        comptroller.mintVerify(address(this), minter, actualMintAmount, mintTokens);\\n    }\\n\\n    /**\\n     * @notice Sender redeems cTokens in exchange for the underlying asset\\n     * @dev Accrues interest whether or not the operation succeeds, unless reverted\\n     * @param redeemTokens The number of cTokens to redeem into underlying\\n     */\\n    function redeemInternal(uint256 redeemTokens) internal nonReentrant {\\n        accrueInterest();\\n        // redeemFresh emits redeem-specific logs on errors, so we don't need to\\n        redeemFresh(payable(msg.sender), redeemTokens, 0);\\n    }\\n\\n    /**\\n     * @notice Sender redeems cTokens in exchange for a specified amount of underlying asset\\n     * @dev Accrues interest whether or not the operation succeeds, unless reverted\\n     * @param redeemAmount The amount of underlying to receive from redeeming cTokens\\n     */\\n    function redeemUnderlyingInternal(uint256 redeemAmount)\\n        internal\\n        nonReentrant\\n    {\\n        accrueInterest();\\n        // redeemFresh emits redeem-specific logs on errors, so we don't need to\\n        redeemFresh(payable(msg.sender), 0, redeemAmount);\\n    }\\n\\n    /**\\n     * @notice User redeems cTokens in exchange for the underlying asset\\n     * @dev Assumes interest has already been accrued up to the current block\\n     * @param redeemer The address of the account which is redeeming the tokens\\n     * @param redeemTokensIn The number of cTokens to redeem into underlying (only one of redeemTokensIn or redeemAmountIn may be non-zero)\\n     * @param redeemAmountIn The number of underlying tokens to receive from redeeming cTokens (only one of redeemTokensIn or redeemAmountIn may be non-zero)\\n     */\\n    function redeemFresh(\\n        address payable redeemer,\\n        uint256 redeemTokensIn,\\n        uint256 redeemAmountIn\\n    ) internal {\\n        require(\\n            redeemTokensIn == 0 || redeemAmountIn == 0,\\n            \\\"one of redeemTokensIn or redeemAmountIn must be zero\\\"\\n        );\\n\\n        /* exchangeRate = invoke Exchange Rate Stored() */\\n        Exp memory exchangeRate = Exp({mantissa: exchangeRateStoredInternal()});\\n\\n        uint256 redeemTokens;\\n        uint256 redeemAmount;\\n        /* If redeemTokensIn > 0: */\\n        if (redeemTokensIn > 0) {\\n            /*\\n             * We calculate the exchange rate and the amount of underlying to be redeemed:\\n             *  redeemTokens = redeemTokensIn\\n             *  redeemAmount = redeemTokensIn x exchangeRateCurrent\\n             */\\n            redeemTokens = redeemTokensIn;\\n            redeemAmount = mul_ScalarTruncate(exchangeRate, redeemTokensIn);\\n        } else {\\n            /*\\n             * We get the current exchange rate and calculate the amount to be redeemed:\\n             *  redeemTokens = redeemAmountIn / exchangeRate\\n             *  redeemAmount = redeemAmountIn\\n             */\\n            redeemTokens = div_(redeemAmountIn, exchangeRate);\\n            redeemAmount = redeemAmountIn;\\n        }\\n\\n        /* Fail if redeem not allowed */\\n        uint256 allowed = comptroller.redeemAllowed(\\n            address(this),\\n            redeemer,\\n            redeemTokens\\n        );\\n        if (allowed != 0) {\\n            revert RedeemComptrollerRejection(allowed);\\n        }\\n\\n        /* Verify market's block number equals current block number */\\n        if (accrualBlockNumber != getBlockNumber()) {\\n            revert RedeemFreshnessCheck();\\n        }\\n\\n        /* Fail gracefully if protocol has insufficient cash */\\n        if (getCashPrior() < redeemAmount) {\\n            revert RedeemTransferOutNotPossible();\\n        }\\n\\n        /////////////////////////\\n        // EFFECTS & INTERACTIONS\\n        // (No safe failures beyond this point)\\n\\n        /*\\n         * We write the previously calculated values into storage.\\n         *  Note: Avoid token reentrancy attacks by writing reduced supply before external transfer.\\n         */\\n        totalSupply = totalSupply - redeemTokens;\\n        accountTokens[redeemer] = accountTokens[redeemer] - redeemTokens;\\n\\n        /*\\n         * We invoke doTransferOut for the redeemer and the redeemAmount.\\n         *  Note: The cToken must handle variations between ERC-20 and ETH underlying.\\n         *  On success, the cToken has redeemAmount less of cash.\\n         *  doTransferOut reverts if anything goes wrong, since we can't be sure if side effects occurred.\\n         */\\n        doTransferOut(redeemer, redeemAmount);\\n\\n        /* We emit a Transfer event, and a Redeem event */\\n        emit Transfer(redeemer, address(this), redeemTokens);\\n        emit Redeem(redeemer, redeemAmount, redeemTokens);\\n\\n        /* We call the defense hook */\\n        comptroller.redeemVerify(\\n            address(this),\\n            redeemer,\\n            redeemAmount,\\n            redeemTokens\\n        );\\n    }\\n\\n    /**\\n     * @notice Sender borrows assets from the protocol to their own address\\n     * @param borrowAmount The amount of the underlying asset to borrow\\n     */\\n    function borrowInternal(uint256 borrowAmount) internal nonReentrant {\\n        accrueInterest();\\n        // borrowFresh emits borrow-specific logs on errors, so we don't need to\\n        borrowFresh(payable(msg.sender), borrowAmount);\\n    }\\n\\n    /**\\n     * @notice Users borrow assets from the protocol to their own address\\n     * @param borrowAmount The amount of the underlying asset to borrow\\n     */\\n    function borrowFresh(address payable borrower, uint256 borrowAmount)\\n        internal\\n    {\\n        /* Fail if borrow not allowed */\\n        uint256 allowed = comptroller.borrowAllowed(\\n            address(this),\\n            borrower,\\n            borrowAmount\\n        );\\n        if (allowed != 0) {\\n            revert BorrowComptrollerRejection(allowed);\\n        }\\n\\n        /* Verify market's block number equals current block number */\\n        if (accrualBlockNumber != getBlockNumber()) {\\n            revert BorrowFreshnessCheck();\\n        }\\n\\n        /* Fail gracefully if protocol has insufficient underlying cash */\\n        if (getCashPrior() < borrowAmount) {\\n            revert BorrowCashNotAvailable();\\n        }\\n\\n        /*\\n         * We calculate the new borrower and total borrow balances, failing on overflow:\\n         *  accountBorrowNew = accountBorrow + borrowAmount\\n         *  totalBorrowsNew = totalBorrows + borrowAmount\\n         */\\n        uint256 accountBorrowsPrev = borrowBalanceStoredInternal(borrower);\\n        uint256 accountBorrowsNew = accountBorrowsPrev + borrowAmount;\\n        uint256 totalBorrowsNew = totalBorrows + borrowAmount;\\n\\n        /////////////////////////\\n        // EFFECTS & INTERACTIONS\\n        // (No safe failures beyond this point)\\n\\n        /*\\n         * We write the previously calculated values into storage.\\n         *  Note: Avoid token reentrancy attacks by writing increased borrow before external transfer.\\n        `*/\\n        accountBorrows[borrower].principal = accountBorrowsNew;\\n        accountBorrows[borrower].interestIndex = borrowIndex;\\n        totalBorrows = totalBorrowsNew;\\n\\n        /*\\n         * We invoke doTransferOut for the borrower and the borrowAmount.\\n         *  Note: The cToken must handle variations between ERC-20 and ETH underlying.\\n         *  On success, the cToken borrowAmount less of cash.\\n         *  doTransferOut reverts if anything goes wrong, since we can't be sure if side effects occurred.\\n         */\\n        doTransferOut(borrower, borrowAmount);\\n\\n        /* We emit a Borrow event */\\n        emit Borrow(borrower, borrowAmount, accountBorrowsNew, totalBorrowsNew);\\n    }\\n\\n    /**\\n     * @notice Sender repays their own borrow\\n     * @param repayAmount The amount to repay, or -1 for the full outstanding amount\\n     */\\n    function repayBorrowInternal(uint256 repayAmount) internal nonReentrant {\\n        accrueInterest();\\n        // repayBorrowFresh emits repay-borrow-specific logs on errors, so we don't need to\\n        repayBorrowFresh(msg.sender, msg.sender, repayAmount);\\n    }\\n\\n    /**\\n     * @notice Sender repays a borrow belonging to borrower\\n     * @param borrower the account with the debt being payed off\\n     * @param repayAmount The amount to repay, or -1 for the full outstanding amount\\n     */\\n    function repayBorrowBehalfInternal(address borrower, uint256 repayAmount)\\n        internal\\n        nonReentrant\\n    {\\n        accrueInterest();\\n        // repayBorrowFresh emits repay-borrow-specific logs on errors, so we don't need to\\n        repayBorrowFresh(msg.sender, borrower, repayAmount);\\n    }\\n\\n    /**\\n     * @notice Borrows are repaid by another user (possibly the borrower).\\n     * @param payer the account paying off the borrow\\n     * @param borrower the account with the debt being payed off\\n     * @param repayAmount the amount of underlying tokens being returned, or -1 for the full outstanding amount\\n     * @return (uint) the actual repayment amount.\\n     */\\n    function repayBorrowFresh(\\n        address payer,\\n        address borrower,\\n        uint256 repayAmount\\n    ) internal returns (uint256) {\\n        /* Fail if repayBorrow not allowed */\\n        uint256 allowed = comptroller.repayBorrowAllowed(\\n            address(this),\\n            payer,\\n            borrower,\\n            repayAmount\\n        );\\n        if (allowed != 0) {\\n            revert RepayBorrowComptrollerRejection(allowed);\\n        }\\n\\n        /* Verify market's block number equals current block number */\\n        if (accrualBlockNumber != getBlockNumber()) {\\n            revert RepayBorrowFreshnessCheck();\\n        }\\n\\n        /* We fetch the amount the borrower owes, with accumulated interest */\\n        uint256 accountBorrowsPrev = borrowBalanceStoredInternal(borrower);\\n\\n        /* If repayAmount == -1, repayAmount = accountBorrows */\\n        uint256 repayAmountFinal = repayAmount == type(uint256).max\\n            ? accountBorrowsPrev\\n            : repayAmount;\\n\\n        /////////////////////////\\n        // EFFECTS & INTERACTIONS\\n        // (No safe failures beyond this point)\\n\\n        /*\\n         * We call doTransferIn for the payer and the repayAmount\\n         *  Note: The cToken must handle variations between ERC-20 and ETH underlying.\\n         *  On success, the cToken holds an additional repayAmount of cash.\\n         *  doTransferIn reverts if anything goes wrong, since we can't be sure if side effects occurred.\\n         *   it returns the amount actually transferred, in case of a fee.\\n         */\\n        uint256 actualRepayAmount = doTransferIn(payer, repayAmountFinal);\\n\\n        /*\\n         * We calculate the new borrower and total borrow balances, failing on underflow:\\n         *  accountBorrowsNew = accountBorrows - actualRepayAmount\\n         *  totalBorrowsNew = totalBorrows - actualRepayAmount\\n         */\\n        uint256 accountBorrowsNew = accountBorrowsPrev - actualRepayAmount;\\n        uint256 totalBorrowsNew = totalBorrows - actualRepayAmount;\\n\\n        /* We write the previously calculated values into storage */\\n        accountBorrows[borrower].principal = accountBorrowsNew;\\n        accountBorrows[borrower].interestIndex = borrowIndex;\\n        totalBorrows = totalBorrowsNew;\\n\\n        /* We emit a RepayBorrow event */\\n        emit RepayBorrow(\\n            payer,\\n            borrower,\\n            actualRepayAmount,\\n            accountBorrowsNew,\\n            totalBorrowsNew\\n        );\\n\\n        return actualRepayAmount;\\n    }\\n\\n    /**\\n     * @notice The sender liquidates the borrowers collateral.\\n     *  The collateral seized is transferred to the liquidator.\\n     * @param borrower The borrower of this cToken to be liquidated\\n     * @param cTokenCollateral The market in which to seize collateral from the borrower\\n     * @param repayAmount The amount of the underlying borrowed asset to repay\\n     */\\n    function liquidateBorrowInternal(\\n        address borrower,\\n        uint256 repayAmount,\\n        CTokenInterface cTokenCollateral\\n    ) internal nonReentrant {\\n        accrueInterest();\\n\\n        uint256 error = cTokenCollateral.accrueInterest();\\n        if (error != NO_ERROR) {\\n            // accrueInterest emits logs on errors, but we still want to log the fact that an attempted liquidation failed\\n            revert LiquidateAccrueCollateralInterestFailed(error);\\n        }\\n\\n        // liquidateBorrowFresh emits borrow-specific logs on errors, so we don't need to\\n        liquidateBorrowFresh(\\n            msg.sender,\\n            borrower,\\n            repayAmount,\\n            cTokenCollateral\\n        );\\n    }\\n\\n    /**\\n     * @notice The liquidator liquidates the borrowers collateral.\\n     *  The collateral seized is transferred to the liquidator.\\n     * @param borrower The borrower of this cToken to be liquidated\\n     * @param liquidator The address repaying the borrow and seizing collateral\\n     * @param cTokenCollateral The market in which to seize collateral from the borrower\\n     * @param repayAmount The amount of the underlying borrowed asset to repay\\n     */\\n    function liquidateBorrowFresh(\\n        address liquidator,\\n        address borrower,\\n        uint256 repayAmount,\\n        CTokenInterface cTokenCollateral\\n    ) internal {\\n        /* Fail if liquidate not allowed */\\n        uint256 allowed = comptroller.liquidateBorrowAllowed(\\n            address(this),\\n            address(cTokenCollateral),\\n            liquidator,\\n            borrower,\\n            repayAmount\\n        );\\n        if (allowed != 0) {\\n            revert LiquidateComptrollerRejection(allowed);\\n        }\\n\\n        /* Verify market's block number equals current block number */\\n        if (accrualBlockNumber != getBlockNumber()) {\\n            revert LiquidateFreshnessCheck();\\n        }\\n\\n        /* Verify cTokenCollateral market's block number equals current block number */\\n        if (cTokenCollateral.accrualBlockNumber() != getBlockNumber()) {\\n            revert LiquidateCollateralFreshnessCheck();\\n        }\\n\\n        /* Fail if borrower = liquidator */\\n        if (borrower == liquidator) {\\n            revert LiquidateLiquidatorIsBorrower();\\n        }\\n\\n        /* Fail if repayAmount = 0 */\\n        if (repayAmount == 0) {\\n            revert LiquidateCloseAmountIsZero();\\n        }\\n\\n        /* Fail if repayAmount = -1 */\\n        if (repayAmount == type(uint256).max) {\\n            revert LiquidateCloseAmountIsUintMax();\\n        }\\n\\n        /* Fail if repayBorrow fails */\\n        uint256 actualRepayAmount = repayBorrowFresh(\\n            liquidator,\\n            borrower,\\n            repayAmount\\n        );\\n\\n        /////////////////////////\\n        // EFFECTS & INTERACTIONS\\n        // (No safe failures beyond this point)\\n\\n        /* We calculate the number of collateral tokens that will be seized */\\n        (uint256 amountSeizeError, uint256 seizeTokens) = comptroller\\n            .liquidateCalculateSeizeTokens(\\n                address(this),\\n                address(cTokenCollateral),\\n                actualRepayAmount\\n            );\\n        require(\\n            amountSeizeError == NO_ERROR,\\n            \\\"LIQUIDATE_COMPTROLLER_CALCULATE_AMOUNT_SEIZE_FAILED\\\"\\n        );\\n\\n        /* Revert if borrower collateral token balance < seizeTokens */\\n        require(\\n            cTokenCollateral.balanceOf(borrower) >= seizeTokens,\\n            \\\"LIQUIDATE_SEIZE_TOO_MUCH\\\"\\n        );\\n\\n        // If this is also the collateral, run seizeInternal to avoid re-entrancy, otherwise make an external call\\n        if (address(cTokenCollateral) == address(this)) {\\n            seizeInternal(address(this), liquidator, borrower, seizeTokens);\\n        } else {\\n            require(\\n                cTokenCollateral.seize(liquidator, borrower, seizeTokens) ==\\n                    NO_ERROR,\\n                \\\"token seizure failed\\\"\\n            );\\n        }\\n\\n        /* We emit a LiquidateBorrow event */\\n        emit LiquidateBorrow(\\n            liquidator,\\n            borrower,\\n            actualRepayAmount,\\n            address(cTokenCollateral),\\n            seizeTokens\\n        );\\n    }\\n\\n    /**\\n     * @notice Transfers collateral tokens (this market) to the liquidator.\\n     * @dev Will fail unless called by another cToken during the process of liquidation.\\n     *  Its absolutely critical to use msg.sender as the borrowed cToken and not a parameter.\\n     * @param liquidator The account receiving seized collateral\\n     * @param borrower The account having collateral seized\\n     * @param seizeTokens The number of cTokens to seize\\n     * @return uint 0=success, otherwise a failure (see ErrorReporter.sol for details)\\n     */\\n    function seize(\\n        address liquidator,\\n        address borrower,\\n        uint256 seizeTokens\\n    ) external override nonReentrant returns (uint256) {\\n        seizeInternal(msg.sender, liquidator, borrower, seizeTokens);\\n\\n        return NO_ERROR;\\n    }\\n\\n    /**\\n     * @notice Transfers collateral tokens (this market) to the liquidator.\\n     * @dev Called only during an in-kind liquidation, or by liquidateBorrow during the liquidation of another CToken.\\n     *  Its absolutely critical to use msg.sender as the seizer cToken and not a parameter.\\n     * @param seizerToken The contract seizing the collateral (i.e. borrowed cToken)\\n     * @param liquidator The account receiving seized collateral\\n     * @param borrower The account having collateral seized\\n     * @param seizeTokens The number of cTokens to seize\\n     */\\n    function seizeInternal(\\n        address seizerToken,\\n        address liquidator,\\n        address borrower,\\n        uint256 seizeTokens\\n    ) internal {\\n        /* Fail if seize not allowed */\\n        uint256 allowed = comptroller.seizeAllowed(\\n            address(this),\\n            seizerToken,\\n            liquidator,\\n            borrower,\\n            seizeTokens\\n        );\\n        if (allowed != 0) {\\n            revert LiquidateSeizeComptrollerRejection(allowed);\\n        }\\n\\n        /* Fail if borrower = liquidator */\\n        if (borrower == liquidator) {\\n            revert LiquidateSeizeLiquidatorIsBorrower();\\n        }\\n\\n        /*\\n         * We calculate the new borrower and liquidator token balances, failing on underflow/overflow:\\n         *  borrowerTokensNew = accountTokens[borrower] - seizeTokens\\n         *  liquidatorTokensNew = accountTokens[liquidator] + seizeTokens\\n         */\\n        uint256 protocolSeizeTokens = mul_(\\n            seizeTokens,\\n            Exp({mantissa: protocolSeizeShareMantissa})\\n        );\\n        uint256 liquidatorSeizeTokens = seizeTokens - protocolSeizeTokens;\\n        Exp memory exchangeRate = Exp({mantissa: exchangeRateStoredInternal()});\\n        uint256 protocolSeizeAmount = mul_ScalarTruncate(\\n            exchangeRate,\\n            protocolSeizeTokens\\n        );\\n        uint256 totalReservesNew = totalReserves + protocolSeizeAmount;\\n\\n        /////////////////////////\\n        // EFFECTS & INTERACTIONS\\n        // (No safe failures beyond this point)\\n\\n        /* We write the calculated values into storage */\\n        totalReserves = totalReservesNew;\\n        totalSupply = totalSupply - protocolSeizeTokens;\\n        accountTokens[borrower] = accountTokens[borrower] - seizeTokens;\\n        accountTokens[liquidator] =\\n            accountTokens[liquidator] +\\n            liquidatorSeizeTokens;\\n\\n        /* Emit a Transfer event */\\n        emit Transfer(borrower, liquidator, liquidatorSeizeTokens);\\n        emit Transfer(borrower, address(this), protocolSeizeTokens);\\n        emit ReservesAdded(\\n            address(this),\\n            protocolSeizeAmount,\\n            totalReservesNew\\n        );\\n    }\\n\\n    /*** Admin Functions ***/\\n\\n    /**\\n     * @notice Begins transfer of admin rights. The newPendingAdmin must call `_acceptAdmin` to finalize the transfer.\\n     * @dev Admin function to begin change of admin. The newPendingAdmin must call `_acceptAdmin` to finalize the transfer.\\n     * @param newPendingAdmin New pending admin.\\n     * @return uint 0=success, otherwise a failure (see ErrorReporter.sol for details)\\n     */\\n    function _setPendingAdmin(address payable newPendingAdmin)\\n        external\\n        override\\n        returns (uint256)\\n    {\\n        // Check caller = admin\\n        if (msg.sender != admin) {\\n            revert SetPendingAdminOwnerCheck();\\n        }\\n\\n        // Save current value, if any, for inclusion in log\\n        address oldPendingAdmin = pendingAdmin;\\n\\n        // Store pendingAdmin with value newPendingAdmin\\n        pendingAdmin = newPendingAdmin;\\n\\n        // Emit NewPendingAdmin(oldPendingAdmin, newPendingAdmin)\\n        emit NewPendingAdmin(oldPendingAdmin, newPendingAdmin);\\n\\n        return NO_ERROR;\\n    }\\n\\n    /**\\n     * @notice Accepts transfer of admin rights. msg.sender must be pendingAdmin\\n     * @dev Admin function for pending admin to accept role and update admin\\n     * @return uint 0=success, otherwise a failure (see ErrorReporter.sol for details)\\n     */\\n    function _acceptAdmin() external override returns (uint256) {\\n        // Check caller is pendingAdmin and pendingAdmin \\u2260 address(0)\\n        if (msg.sender != pendingAdmin || msg.sender == address(0)) {\\n            revert AcceptAdminPendingAdminCheck();\\n        }\\n\\n        // Save current values for inclusion in log\\n        address oldAdmin = admin;\\n        address oldPendingAdmin = pendingAdmin;\\n\\n        // Store admin with value pendingAdmin\\n        admin = pendingAdmin;\\n\\n        // Clear the pending value\\n        pendingAdmin = payable(address(0));\\n\\n        emit NewAdmin(oldAdmin, admin);\\n        emit NewPendingAdmin(oldPendingAdmin, pendingAdmin);\\n\\n        return NO_ERROR;\\n    }\\n\\n    /**\\n     * @notice Sets a new comptroller for the market\\n     * @dev Admin function to set a new comptroller\\n     * @return uint 0=success, otherwise a failure (see ErrorReporter.sol for details)\\n     */\\n    function _setComptroller(ComptrollerInterface newComptroller)\\n        public\\n        override\\n        returns (uint256)\\n    {\\n        // Check caller is admin\\n        if (msg.sender != admin) {\\n            revert SetComptrollerOwnerCheck();\\n        }\\n\\n        ComptrollerInterface oldComptroller = comptroller;\\n        // Ensure invoke comptroller.isComptroller() returns true\\n        require(newComptroller.isComptroller(), \\\"marker method returned false\\\");\\n\\n        // Set market's comptroller to newComptroller\\n        comptroller = newComptroller;\\n\\n        // Emit NewComptroller(oldComptroller, newComptroller)\\n        emit NewComptroller(oldComptroller, newComptroller);\\n\\n        return NO_ERROR;\\n    }\\n\\n    /**\\n     * @notice accrues interest and sets a new reserve factor for the protocol using _setReserveFactorFresh\\n     * @dev Admin function to accrue interest and set a new reserve factor\\n     * @return uint 0=success, otherwise a failure (see ErrorReporter.sol for details)\\n     */\\n    function _setReserveFactor(uint256 newReserveFactorMantissa)\\n        external\\n        override\\n        nonReentrant\\n        returns (uint256)\\n    {\\n        accrueInterest();\\n        // _setReserveFactorFresh emits reserve-factor-specific logs on errors, so we don't need to.\\n        return _setReserveFactorFresh(newReserveFactorMantissa);\\n    }\\n\\n    /**\\n     * @notice Sets a new reserve factor for the protocol (*requires fresh interest accrual)\\n     * @dev Admin function to set a new reserve factor\\n     * @return uint 0=success, otherwise a failure (see ErrorReporter.sol for details)\\n     */\\n    function _setReserveFactorFresh(uint256 newReserveFactorMantissa)\\n        internal\\n        returns (uint256)\\n    {\\n        // Check caller is admin\\n        if (msg.sender != admin) {\\n            revert SetReserveFactorAdminCheck();\\n        }\\n\\n        // Verify market's block number equals current block number\\n        if (accrualBlockNumber != getBlockNumber()) {\\n            revert SetReserveFactorFreshCheck();\\n        }\\n\\n        // Check newReserveFactor \\u2264 maxReserveFactor\\n        if (newReserveFactorMantissa > reserveFactorMaxMantissa) {\\n            revert SetReserveFactorBoundsCheck();\\n        }\\n\\n        uint256 oldReserveFactorMantissa = reserveFactorMantissa;\\n        reserveFactorMantissa = newReserveFactorMantissa;\\n\\n        emit NewReserveFactor(\\n            oldReserveFactorMantissa,\\n            newReserveFactorMantissa\\n        );\\n\\n        return NO_ERROR;\\n    }\\n\\n    /**\\n     * @notice Accrues interest and reduces reserves by transferring from msg.sender\\n     * @param addAmount Amount of addition to reserves\\n     * @return uint 0=success, otherwise a failure (see ErrorReporter.sol for details)\\n     */\\n    function _addReservesInternal(uint256 addAmount)\\n        internal\\n        nonReentrant\\n        returns (uint256)\\n    {\\n        accrueInterest();\\n\\n        // _addReservesFresh emits reserve-addition-specific logs on errors, so we don't need to.\\n        _addReservesFresh(addAmount);\\n        return NO_ERROR;\\n    }\\n\\n    /**\\n     * @notice Add reserves by transferring from caller\\n     * @dev Requires fresh interest accrual\\n     * @param addAmount Amount of addition to reserves\\n     * @return (uint, uint) An error code (0=success, otherwise a failure (see ErrorReporter.sol for details)) and the actual amount added, net token fees\\n     */\\n    function _addReservesFresh(uint256 addAmount)\\n        internal\\n        returns (uint256, uint256)\\n    {\\n        // totalReserves + actualAddAmount\\n        uint256 totalReservesNew;\\n        uint256 actualAddAmount;\\n\\n        // We fail gracefully unless market's block number equals current block number\\n        if (accrualBlockNumber != getBlockNumber()) {\\n            revert AddReservesFactorFreshCheck(actualAddAmount);\\n        }\\n\\n        /////////////////////////\\n        // EFFECTS & INTERACTIONS\\n        // (No safe failures beyond this point)\\n\\n        /*\\n         * We call doTransferIn for the caller and the addAmount\\n         *  Note: The cToken must handle variations between ERC-20 and ETH underlying.\\n         *  On success, the cToken holds an additional addAmount of cash.\\n         *  doTransferIn reverts if anything goes wrong, since we can't be sure if side effects occurred.\\n         *  it returns the amount actually transferred, in case of a fee.\\n         */\\n\\n        actualAddAmount = doTransferIn(msg.sender, addAmount);\\n\\n        totalReservesNew = totalReserves + actualAddAmount;\\n\\n        // Store reserves[n+1] = reserves[n] + actualAddAmount\\n        totalReserves = totalReservesNew;\\n\\n        /* Emit NewReserves(admin, actualAddAmount, reserves[n+1]) */\\n        emit ReservesAdded(msg.sender, actualAddAmount, totalReservesNew);\\n\\n        /* Return (NO_ERROR, actualAddAmount) */\\n        return (NO_ERROR, actualAddAmount);\\n    }\\n\\n    /**\\n     * @notice Accrues interest and reduces reserves by transferring to admin\\n     * @param reduceAmount Amount of reduction to reserves\\n     * @return uint 0=success, otherwise a failure (see ErrorReporter.sol for details)\\n     */\\n    function _reduceReserves(uint256 reduceAmount)\\n        external\\n        override\\n        nonReentrant\\n        returns (uint256)\\n    {\\n        accrueInterest();\\n        // _reduceReservesFresh emits reserve-reduction-specific logs on errors, so we don't need to.\\n        return _reduceReservesFresh(reduceAmount);\\n    }\\n\\n    /**\\n     * @notice Reduces reserves by transferring to admin\\n     * @dev Requires fresh interest accrual\\n     * @param reduceAmount Amount of reduction to reserves\\n     * @return uint 0=success, otherwise a failure (see ErrorReporter.sol for details)\\n     */\\n    function _reduceReservesFresh(uint256 reduceAmount)\\n        internal\\n        returns (uint256)\\n    {\\n        // totalReserves - reduceAmount\\n        uint256 totalReservesNew;\\n\\n        // Check caller is admin\\n        if (msg.sender != admin) {\\n            revert ReduceReservesAdminCheck();\\n        }\\n\\n        // We fail gracefully unless market's block number equals current block number\\n        if (accrualBlockNumber != getBlockNumber()) {\\n            revert ReduceReservesFreshCheck();\\n        }\\n\\n        // Fail gracefully if protocol has insufficient underlying cash\\n        if (getCashPrior() < reduceAmount) {\\n            revert ReduceReservesCashNotAvailable();\\n        }\\n\\n        // Check reduceAmount \\u2264 reserves[n] (totalReserves)\\n        if (reduceAmount > totalReserves) {\\n            revert ReduceReservesCashValidation();\\n        }\\n\\n        /////////////////////////\\n        // EFFECTS & INTERACTIONS\\n        // (No safe failures beyond this point)\\n\\n        totalReservesNew = totalReserves - reduceAmount;\\n\\n        // Store reserves[n+1] = reserves[n] - reduceAmount\\n        totalReserves = totalReservesNew;\\n\\n        // doTransferOut reverts if anything goes wrong, since we can't be sure if side effects occurred.\\n        doTransferOut(admin, reduceAmount);\\n\\n        emit ReservesReduced(admin, reduceAmount, totalReservesNew);\\n\\n        return NO_ERROR;\\n    }\\n\\n    /**\\n     * @notice accrues interest and updates the interest rate model using _setInterestRateModelFresh\\n     * @dev Admin function to accrue interest and update the interest rate model\\n     * @param newInterestRateModel the new interest rate model to use\\n     * @return uint 0=success, otherwise a failure (see ErrorReporter.sol for details)\\n     */\\n    function _setInterestRateModel(InterestRateModel newInterestRateModel)\\n        public\\n        override\\n        returns (uint256)\\n    {\\n        accrueInterest();\\n        // _setInterestRateModelFresh emits interest-rate-model-update-specific logs on errors, so we don't need to.\\n        return _setInterestRateModelFresh(newInterestRateModel);\\n    }\\n\\n    /**\\n     * @notice updates the interest rate model (*requires fresh interest accrual)\\n     * @dev Admin function to update the interest rate model\\n     * @param newInterestRateModel the new interest rate model to use\\n     * @return uint 0=success, otherwise a failure (see ErrorReporter.sol for details)\\n     */\\n    function _setInterestRateModelFresh(InterestRateModel newInterestRateModel)\\n        internal\\n        returns (uint256)\\n    {\\n        // Used to store old model for use in the event that is emitted on success\\n        InterestRateModel oldInterestRateModel;\\n\\n        // Check caller is admin\\n        if (msg.sender != admin) {\\n            revert SetInterestRateModelOwnerCheck();\\n        }\\n\\n        // We fail gracefully unless market's block number equals current block number\\n        if (accrualBlockNumber != getBlockNumber()) {\\n            revert SetInterestRateModelFreshCheck();\\n        }\\n\\n        // Track the market's current interest rate model\\n        oldInterestRateModel = interestRateModel;\\n\\n        // Ensure invoke newInterestRateModel.isInterestRateModel() returns true\\n        require(\\n            newInterestRateModel.isInterestRateModel(),\\n            \\\"marker method returned false\\\"\\n        );\\n\\n        // Set the interest rate model to newInterestRateModel\\n        interestRateModel = newInterestRateModel;\\n\\n        // Emit NewMarketInterestRateModel(oldInterestRateModel, newInterestRateModel)\\n        emit NewMarketInterestRateModel(\\n            oldInterestRateModel,\\n            newInterestRateModel\\n        );\\n\\n        return NO_ERROR;\\n    }\\n\\n    /*** Safe Token ***/\\n\\n    /**\\n     * @notice Gets balance of this contract in terms of the underlying\\n     * @dev This excludes the value of the current message, if any\\n     * @return The quantity of underlying owned by this contract\\n     */\\n    function getCashPrior() internal view virtual returns (uint256);\\n\\n    /**\\n     * @dev Performs a transfer in, reverting upon failure. Returns the amount actually transferred to the protocol, in case of a fee.\\n     *  This may revert due to insufficient balance or insufficient allowance.\\n     */\\n    function doTransferIn(address from, uint256 amount)\\n        internal\\n        virtual\\n        returns (uint256);\\n\\n    /**\\n     * @dev Performs a transfer out, ideally returning an explanatory error code upon failure rather than reverting.\\n     *  If caller has not called checked protocol's balance, may revert due to insufficient cash held in the contract.\\n     *  If caller has checked protocol's balance, and verified it is >= amount, this should not revert in normal conditions.\\n     */\\n    function doTransferOut(address payable to, uint256 amount) internal virtual;\\n\\n    /*** Reentrancy Guard ***/\\n\\n    /**\\n     * @dev Prevents a contract from calling itself, directly or indirectly.\\n     */\\n    modifier nonReentrant() {\\n        require(_notEntered, \\\"re-entered\\\");\\n        _notEntered = false;\\n        _;\\n        _notEntered = true; // get a gas-refund post-Istanbul\\n    }\\n}\\n\",\"keccak256\":\"0x7199ac1e928d62f95183aa2bdb91599b73a1f6b971eb384e782372fe2f4360d4\",\"license\":\"BSD-3-Clause\"},\"contracts/CTokenInterfaces.sol\":{\"content\":\"// SPDX-License-Identifier: BSD-3-Clause\\npragma solidity ^0.8.10;\\n\\nimport \\\"./ComptrollerInterface.sol\\\";\\nimport \\\"./InterestRateModel.sol\\\";\\nimport \\\"./EIP20NonStandardInterface.sol\\\";\\nimport \\\"./ErrorReporter.sol\\\";\\n\\ncontract CTokenStorage {\\n    /**\\n     * @dev Guard variable for re-entrancy checks\\n     */\\n    bool internal _notEntered;\\n\\n    /**\\n     * @notice EIP-20 token name for this token\\n     */\\n    string public name;\\n\\n    /**\\n     * @notice EIP-20 token symbol for this token\\n     */\\n    string public symbol;\\n\\n    /**\\n     * @notice EIP-20 token decimals for this token\\n     */\\n    uint8 public decimals;\\n\\n    // Maximum borrow rate that can ever be applied (.00004% / block)\\n    uint internal constant borrowRateMaxMantissa = 0.00004e16;\\n\\n    // Maximum fraction of interest that can be set aside for reserves\\n    uint internal constant reserveFactorMaxMantissa = 1e18;\\n\\n    /**\\n     * @notice Administrator for this contract\\n     */\\n    address payable public admin;\\n\\n    /**\\n     * @notice Pending administrator for this contract\\n     */\\n    address payable public pendingAdmin;\\n\\n    /**\\n     * @notice Contract which oversees inter-cToken operations\\n     */\\n    ComptrollerInterface public comptroller;\\n\\n    /**\\n     * @notice Model which tells what the current interest rate should be\\n     */\\n    InterestRateModel public interestRateModel;\\n\\n    // Initial exchange rate used when minting the first CTokens (used when totalSupply = 0)\\n    uint internal initialExchangeRateMantissa;\\n\\n    /**\\n     * @notice Fraction of interest currently set aside for reserves\\n     */\\n    uint public reserveFactorMantissa;\\n\\n    /**\\n     * @notice Block number that interest was last accrued at\\n     */\\n    uint public accrualBlockNumber;\\n\\n    /**\\n     * @notice Accumulator of the total earned interest rate since the opening of the market\\n     */\\n    uint public borrowIndex;\\n\\n    /**\\n     * @notice Total amount of outstanding borrows of the underlying in this market\\n     */\\n    uint public totalBorrows;\\n\\n    /**\\n     * @notice Total amount of reserves of the underlying held in this market\\n     */\\n    uint public totalReserves;\\n\\n    /**\\n     * @notice Total number of tokens in circulation\\n     */\\n    uint public totalSupply;\\n\\n    // Official record of token balances for each account\\n    mapping (address => uint) internal accountTokens;\\n\\n    // Approved token transfer amounts on behalf of others\\n    mapping (address => mapping (address => uint)) internal transferAllowances;\\n\\n    /**\\n     * @notice Container for borrow balance information\\n     * @member principal Total balance (with accrued interest), after applying the most recent balance-changing action\\n     * @member interestIndex Global borrowIndex as of the most recent balance-changing action\\n     */\\n    struct BorrowSnapshot {\\n        uint principal;\\n        uint interestIndex;\\n    }\\n\\n    // Mapping of account addresses to outstanding borrow balances\\n    mapping(address => BorrowSnapshot) internal accountBorrows;\\n\\n    /**\\n     * @notice Share of seized collateral that is added to reserves\\n     */\\n    uint public constant protocolSeizeShareMantissa = 2.8e16; //2.8%\\n}\\n\\nabstract contract CTokenInterface is CTokenStorage {\\n    /**\\n     * @notice Indicator that this is a CToken contract (for inspection)\\n     */\\n    bool public constant isCToken = true;\\n\\n\\n    /*** Market Events ***/\\n\\n    /**\\n     * @notice Event emitted when interest is accrued\\n     */\\n    event AccrueInterest(uint cashPrior, uint interestAccumulated, uint borrowIndex, uint totalBorrows);\\n\\n    /**\\n     * @notice Event emitted when tokens are minted\\n     */\\n    event Mint(address minter, uint mintAmount, uint mintTokens);\\n\\n    /**\\n     * @notice Event emitted when tokens are redeemed\\n     */\\n    event Redeem(address redeemer, uint redeemAmount, uint redeemTokens);\\n\\n    /**\\n     * @notice Event emitted when underlying is borrowed\\n     */\\n    event Borrow(address borrower, uint borrowAmount, uint accountBorrows, uint totalBorrows);\\n\\n    /**\\n     * @notice Event emitted when a borrow is repaid\\n     */\\n    event RepayBorrow(address payer, address borrower, uint repayAmount, uint accountBorrows, uint totalBorrows);\\n\\n    /**\\n     * @notice Event emitted when a borrow is liquidated\\n     */\\n    event LiquidateBorrow(address liquidator, address borrower, uint repayAmount, address cTokenCollateral, uint seizeTokens);\\n\\n\\n    /*** Admin Events ***/\\n\\n    /**\\n     * @notice Event emitted when pendingAdmin is changed\\n     */\\n    event NewPendingAdmin(address oldPendingAdmin, address newPendingAdmin);\\n\\n    /**\\n     * @notice Event emitted when pendingAdmin is accepted, which means admin is updated\\n     */\\n    event NewAdmin(address oldAdmin, address newAdmin);\\n\\n    /**\\n     * @notice Event emitted when comptroller is changed\\n     */\\n    event NewComptroller(ComptrollerInterface oldComptroller, ComptrollerInterface newComptroller);\\n\\n    /**\\n     * @notice Event emitted when interestRateModel is changed\\n     */\\n    event NewMarketInterestRateModel(InterestRateModel oldInterestRateModel, InterestRateModel newInterestRateModel);\\n\\n    /**\\n     * @notice Event emitted when the reserve factor is changed\\n     */\\n    event NewReserveFactor(uint oldReserveFactorMantissa, uint newReserveFactorMantissa);\\n\\n    /**\\n     * @notice Event emitted when the reserves are added\\n     */\\n    event ReservesAdded(address benefactor, uint addAmount, uint newTotalReserves);\\n\\n    /**\\n     * @notice Event emitted when the reserves are reduced\\n     */\\n    event ReservesReduced(address admin, uint reduceAmount, uint newTotalReserves);\\n\\n    /**\\n     * @notice EIP20 Transfer event\\n     */\\n    event Transfer(address indexed from, address indexed to, uint amount);\\n\\n    /**\\n     * @notice EIP20 Approval event\\n     */\\n    event Approval(address indexed owner, address indexed spender, uint amount);\\n\\n\\n    /*** User Interface ***/\\n\\n    function transfer(address dst, uint amount) virtual external returns (bool);\\n    function transferFrom(address src, address dst, uint amount) virtual external returns (bool);\\n    function approve(address spender, uint amount) virtual external returns (bool);\\n    function allowance(address owner, address spender) virtual external view returns (uint);\\n    function balanceOf(address owner) virtual external view returns (uint);\\n    function balanceOfUnderlying(address owner) virtual external returns (uint);\\n    function getAccountSnapshot(address account) virtual external view returns (uint, uint, uint, uint);\\n    function borrowRatePerBlock() virtual external view returns (uint);\\n    function supplyRatePerBlock() virtual external view returns (uint);\\n    function totalBorrowsCurrent() virtual external returns (uint);\\n    function borrowBalanceCurrent(address account) virtual external returns (uint);\\n    function borrowBalanceStored(address account) virtual external view returns (uint);\\n    function exchangeRateCurrent() virtual external returns (uint);\\n    function exchangeRateStored() virtual external view returns (uint);\\n    function getCash() virtual external view returns (uint);\\n    function accrueInterest() virtual external returns (uint);\\n    function seize(address liquidator, address borrower, uint seizeTokens) virtual external returns (uint);\\n\\n\\n    /*** Admin Functions ***/\\n\\n    function _setPendingAdmin(address payable newPendingAdmin) virtual external returns (uint);\\n    function _acceptAdmin() virtual external returns (uint);\\n    function _setComptroller(ComptrollerInterface newComptroller) virtual external returns (uint);\\n    function _setReserveFactor(uint newReserveFactorMantissa) virtual external returns (uint);\\n    function _reduceReserves(uint reduceAmount) virtual external returns (uint);\\n    function _setInterestRateModel(InterestRateModel newInterestRateModel) virtual external returns (uint);\\n}\\n\\ncontract CErc20Storage {\\n    /**\\n     * @notice Underlying asset for this CToken\\n     */\\n    address public underlying;\\n}\\n\\nabstract contract CErc20Interface is CErc20Storage {\\n\\n    /*** User Interface ***/\\n\\n    function mint(uint mintAmount) virtual external returns (uint);\\n    function redeem(uint redeemTokens) virtual external returns (uint);\\n    function redeemUnderlying(uint redeemAmount) virtual external returns (uint);\\n    function borrow(uint borrowAmount) virtual external returns (uint);\\n    function repayBorrow(uint repayAmount) virtual external returns (uint);\\n    function repayBorrowBehalf(address borrower, uint repayAmount) virtual external returns (uint);\\n    function liquidateBorrow(address borrower, uint repayAmount, CTokenInterface cTokenCollateral) virtual external returns (uint);\\n    function sweepToken(EIP20NonStandardInterface token) virtual external;\\n\\n\\n    /*** Admin Functions ***/\\n\\n    function _addReserves(uint addAmount) virtual external returns (uint);\\n}\\n\\ncontract CDelegationStorage {\\n    /**\\n     * @notice Implementation address for this contract\\n     */\\n    address public implementation;\\n}\\n\\nabstract contract CDelegatorInterface is CDelegationStorage {\\n    /**\\n     * @notice Emitted when implementation is changed\\n     */\\n    event NewImplementation(address oldImplementation, address newImplementation);\\n\\n    /**\\n     * @notice Called by the admin to update the implementation of the delegator\\n     * @param implementation_ The address of the new implementation for delegation\\n     * @param allowResign Flag to indicate whether to call _resignImplementation on the old implementation\\n     * @param becomeImplementationData The encoded bytes data to be passed to _becomeImplementation\\n     */\\n    function _setImplementation(address implementation_, bool allowResign, bytes memory becomeImplementationData) virtual external;\\n}\\n\\nabstract contract CDelegateInterface is CDelegationStorage {\\n    /**\\n     * @notice Called by the delegator on a delegate to initialize it for duty\\n     * @dev Should revert if any issues arise which make it unfit for delegation\\n     * @param data The encoded bytes data for any initialization\\n     */\\n    function _becomeImplementation(bytes memory data) virtual external;\\n\\n    /**\\n     * @notice Called by the delegator on a delegate to forfeit its responsibility\\n     */\\n    function _resignImplementation() virtual external;\\n}\\n\",\"keccak256\":\"0xedc230407e26410afef1dd9d18fe5a7fba65b3b07b4a49739c6c36fc884bb384\",\"license\":\"BSD-3-Clause\"},\"contracts/Comptroller.sol\":{\"content\":\"// SPDX-License-Identifier: BSD-3-Clause\\npragma solidity ^0.8.10;\\n\\nimport \\\"./CToken.sol\\\";\\nimport \\\"./ErrorReporter.sol\\\";\\nimport \\\"./PriceOracle.sol\\\";\\nimport \\\"./ComptrollerInterface.sol\\\";\\nimport \\\"./ComptrollerStorage.sol\\\";\\nimport \\\"./Unitroller.sol\\\";\\nimport \\\"./Governance/Comp.sol\\\";\\n\\n/**\\n * @title Compound's Comptroller Contract\\n * @author Compound\\n */\\ncontract Comptroller is\\n    ComptrollerV8Storage,\\n    ComptrollerInterface,\\n    ComptrollerErrorReporter,\\n    ExponentialNoError\\n{\\n    /// @notice Emitted when an admin supports a market\\n    event MarketListed(CToken cToken);\\n\\n    /// @notice Emitted when an account enters a market\\n    event MarketEntered(CToken cToken, address account);\\n\\n    /// @notice Emitted when an account exits a market\\n    event MarketExited(CToken cToken, address account);\\n\\n    /// @notice Emitted when close factor is changed by admin\\n    event NewCloseFactor(\\n        uint256 oldCloseFactorMantissa,\\n        uint256 newCloseFactorMantissa\\n    );\\n\\n    /// @notice Emitted when a collateral factor is changed by admin\\n    event NewCollateralFactor(\\n        CToken cToken,\\n        uint256 oldCollateralFactorMantissa,\\n        uint256 newCollateralFactorMantissa\\n    );\\n\\n    /// @notice Emitted when liquidation incentive is changed by admin\\n    event NewLiquidationIncentive(\\n        uint256 oldLiquidationIncentiveMantissa,\\n        uint256 newLiquidationIncentiveMantissa\\n    );\\n\\n    /// @notice Emitted when price oracle is changed\\n    event NewPriceOracle(\\n        PriceOracle oldPriceOracle,\\n        PriceOracle newPriceOracle\\n    );\\n\\n    /// @notice Emitted when pause guardian is changed\\n    event NewPauseGuardian(address oldPauseGuardian, address newPauseGuardian);\\n\\n    /// @notice Emitted when an action is paused globally\\n    event ActionPaused(string action, bool pauseState);\\n\\n    /// @notice Emitted when an action is paused on a market\\n    event ActionPaused(CToken cToken, string action, bool pauseState);\\n\\n    /// @notice Emitted when a new borrow-side COMP speed is calculated for a market\\n    event CompBorrowSpeedUpdated(CToken indexed cToken, uint256 newSpeed);\\n\\n    /// @notice Emitted when a new supply-side COMP speed is calculated for a market\\n    event CompSupplySpeedUpdated(CToken indexed cToken, uint256 newSpeed);\\n\\n    /// @notice Emitted when a new COMP speed is set for a contributor\\n    event ContributorCompSpeedUpdated(\\n        address indexed contributor,\\n        uint256 newSpeed\\n    );\\n\\n    /// @notice Emitted when COMP is distributed to a supplier\\n    event DistributedSupplierComp(\\n        CToken indexed cToken,\\n        address indexed supplier,\\n        uint256 compDelta,\\n        uint256 compSupplyIndex\\n    );\\n\\n    /// @notice Emitted when COMP is distributed to a borrower\\n    event DistributedBorrowerComp(\\n        CToken indexed cToken,\\n        address indexed borrower,\\n        uint256 compDelta,\\n        uint256 compBorrowIndex\\n    );\\n\\n    /// @notice Emitted when borrow cap for a cToken is changed\\n    event NewBorrowCap(CToken indexed cToken, uint256 newBorrowCap);\\n\\n    /// @notice Emitted when supply cap for a cToken is changed\\n    event NewSupplyCap(CToken indexed cToken, uint256 newSupplyCap);\\n\\n    /// @notice Emitted when borrow cap guardian is changed\\n    event NewBorrowCapGuardian(\\n        address oldBorrowCapGuardian,\\n        address newBorrowCapGuardian\\n    );\\n\\n    /// @notice Emitted when supply cap guardian is changed\\n    event NewSupplyCapGuardian(\\n        address oldSupplyCapGuardian,\\n        address newSupplyCapGuardian\\n    );\\n\\n    /// @notice Emitted when COMP is granted by admin\\n    event CompGranted(address recipient, uint256 amount);\\n\\n    /// @notice Emitted when COMP accrued for a user has been manually adjusted.\\n    event CompAccruedAdjusted(\\n        address indexed user,\\n        uint256 oldCompAccrued,\\n        uint256 newCompAccrued\\n    );\\n\\n    /// @notice Emitted when COMP receivable for a user has been updated.\\n    event CompReceivableUpdated(\\n        address indexed user,\\n        uint256 oldCompReceivable,\\n        uint256 newCompReceivable\\n    );\\n\\n    /// @notice The initial COMP index for a market\\n    uint224 public constant compInitialIndex = 1e36;\\n\\n    // closeFactorMantissa must be strictly greater than this value\\n    uint256 internal constant closeFactorMinMantissa = 0.05e18; // 0.05\\n\\n    // closeFactorMantissa must not exceed this value\\n    uint256 internal constant closeFactorMaxMantissa = 0.9e18; // 0.9\\n\\n    // No collateralFactorMantissa may exceed this value\\n    uint256 internal constant collateralFactorMaxMantissa = 0.9e18; // 0.9\\n\\n    constructor() {\\n        admin = msg.sender;\\n    }\\n\\n    /*** Assets You Are In ***/\\n\\n    /**\\n     * @notice Returns the assets an account has entered\\n     * @param account The address of the account to pull assets for\\n     * @return A dynamic list with the assets the account has entered\\n     */\\n    function getAssetsIn(\\n        address account\\n    ) external view returns (CToken[] memory) {\\n        CToken[] memory assetsIn = accountAssets[account];\\n\\n        return assetsIn;\\n    }\\n\\n    /**\\n     * @notice Returns whether the given account is entered in the given asset\\n     * @param account The address of the account to check\\n     * @param cToken The cToken to check\\n     * @return True if the account is in the asset, otherwise false.\\n     */\\n    function checkMembership(\\n        address account,\\n        CToken cToken\\n    ) external view returns (bool) {\\n        return markets[address(cToken)].accountMembership[account];\\n    }\\n\\n    /**\\n     * @notice Add assets to be included in account liquidity calculation\\n     * @param cTokens The list of addresses of the cToken markets to be enabled\\n     * @return Success indicator for whether each corresponding market was entered\\n     */\\n    function enterMarkets(\\n        address[] memory cTokens\\n    ) public override returns (uint256[] memory) {\\n        uint256 len = cTokens.length;\\n\\n        uint256[] memory results = new uint256[](len);\\n        for (uint256 i = 0; i < len; i++) {\\n            CToken cToken = CToken(cTokens[i]);\\n\\n            results[i] = uint256(addToMarketInternal(cToken, msg.sender));\\n        }\\n\\n        return results;\\n    }\\n\\n    /**\\n     * @notice Add the market to the borrower's \\\"assets in\\\" for liquidity calculations\\n     * @param cToken The market to enter\\n     * @param borrower The address of the account to modify\\n     * @return Success indicator for whether the market was entered\\n     */\\n    function addToMarketInternal(\\n        CToken cToken,\\n        address borrower\\n    ) internal returns (Error) {\\n        Market storage marketToJoin = markets[address(cToken)];\\n\\n        if (!marketToJoin.isListed) {\\n            // market is not listed, cannot join\\n            return Error.MARKET_NOT_LISTED;\\n        }\\n\\n        if (marketToJoin.accountMembership[borrower] == true) {\\n            // already joined\\n            return Error.NO_ERROR;\\n        }\\n\\n        // survived the gauntlet, add to list\\n        // NOTE: we store these somewhat redundantly as a significant optimization\\n        //  this avoids having to iterate through the list for the most common use cases\\n        //  that is, only when we need to perform liquidity checks\\n        //  and not whenever we want to check if an account is in a particular market\\n        marketToJoin.accountMembership[borrower] = true;\\n        accountAssets[borrower].push(cToken);\\n\\n        emit MarketEntered(cToken, borrower);\\n\\n        return Error.NO_ERROR;\\n    }\\n\\n    /**\\n     * @notice Removes asset from sender's account liquidity calculation\\n     * @dev Sender must not have an outstanding borrow balance in the asset,\\n     *  or be providing necessary collateral for an outstanding borrow.\\n     * @param cTokenAddress The address of the asset to be removed\\n     * @return Whether or not the account successfully exited the market\\n     */\\n    function exitMarket(\\n        address cTokenAddress\\n    ) external override returns (uint256) {\\n        CToken cToken = CToken(cTokenAddress);\\n        /* Get sender tokensHeld and amountOwed underlying from the cToken */\\n        (uint256 oErr, uint256 tokensHeld, uint256 amountOwed, ) = cToken\\n            .getAccountSnapshot(msg.sender);\\n        require(oErr == 0, \\\"exitMarket: getAccountSnapshot failed\\\"); // semi-opaque error code\\n\\n        /* Fail if the sender has a borrow balance */\\n        if (amountOwed != 0) {\\n            return\\n                fail(\\n                    Error.NONZERO_BORROW_BALANCE,\\n                    FailureInfo.EXIT_MARKET_BALANCE_OWED\\n                );\\n        }\\n\\n        /* Fail if the sender is not permitted to redeem all of their tokens */\\n        uint256 allowed = redeemAllowedInternal(\\n            cTokenAddress,\\n            msg.sender,\\n            tokensHeld\\n        );\\n        if (allowed != 0) {\\n            return\\n                failOpaque(\\n                    Error.REJECTION,\\n                    FailureInfo.EXIT_MARKET_REJECTION,\\n                    allowed\\n                );\\n        }\\n\\n        Market storage marketToExit = markets[address(cToken)];\\n\\n        /* Return true if the sender is not already \\u2018in\\u2019 the market */\\n        if (!marketToExit.accountMembership[msg.sender]) {\\n            return uint256(Error.NO_ERROR);\\n        }\\n\\n        /* Set cToken account membership to false */\\n        delete marketToExit.accountMembership[msg.sender];\\n\\n        /* Delete cToken from the account\\u2019s list of assets */\\n        // load into memory for faster iteration\\n        CToken[] memory userAssetList = accountAssets[msg.sender];\\n        uint256 len = userAssetList.length;\\n        uint256 assetIndex = len;\\n        for (uint256 i = 0; i < len; i++) {\\n            if (userAssetList[i] == cToken) {\\n                assetIndex = i;\\n                break;\\n            }\\n        }\\n\\n        // We *must* have found the asset in the list or our redundant data structure is broken\\n        assert(assetIndex < len);\\n\\n        // copy last item in list to location of item to be removed, reduce length by 1\\n        CToken[] storage storedList = accountAssets[msg.sender];\\n        storedList[assetIndex] = storedList[storedList.length - 1];\\n        storedList.pop();\\n\\n        emit MarketExited(cToken, msg.sender);\\n\\n        return uint256(Error.NO_ERROR);\\n    }\\n\\n    /*** Policy Hooks ***/\\n\\n    /**\\n     * @notice Checks if the account should be allowed to mint tokens in the given market\\n     * @param cToken The market to verify the mint against\\n     * @param minter The account which would get the minted tokens\\n     * @param mintAmount The amount of underlying being supplied to the market in exchange for tokens\\n     * @return 0 if the mint is allowed, otherwise a semi-opaque error code (See ErrorReporter.sol)\\n     */\\n    function mintAllowed(\\n        address cToken,\\n        address minter,\\n        uint256 mintAmount\\n    ) external override returns (uint256) {\\n        // Pausing is a very serious situation - we revert to sound the alarms\\n        require(!mintGuardianPaused[cToken], \\\"mint is paused\\\");\\n\\n        // Shh - currently unused\\n        minter;\\n        mintAmount;\\n\\n        if (!markets[cToken].isListed) {\\n            return uint256(Error.MARKET_NOT_LISTED);\\n        }\\n\\n        // Keep the flywheel moving\\n        updateCompSupplyIndex(cToken);\\n        distributeSupplierComp(cToken, minter);\\n\\n        return uint256(Error.NO_ERROR);\\n    }\\n\\n    /**\\n     * @notice Validates mint and reverts on rejection. May emit logs.\\n     * @param cToken Asset being minted\\n     * @param minter The address minting the tokens\\n     * @param actualMintAmount The amount of the underlying asset being minted\\n     * @param mintTokens The number of tokens being minted\\n     */\\n    function mintVerify(\\n        address cToken,\\n        address minter,\\n        uint256 actualMintAmount,\\n        uint256 mintTokens\\n    ) external override {\\n        // Shh - currently unused\\n        cToken;\\n        minter;\\n        actualMintAmount;\\n        mintTokens;\\n\\n        uint256 supplyCap = supplyCaps[cToken];\\n        // Supply cap of 0 corresponds to unlimited borrowing\\n        if (supplyCap != 0) {\\n            uint256 totalSupply = CToken(cToken).totalSupply();\\n            Exp memory exchangeRate = Exp({\\n                mantissa: CToken(cToken).exchangeRateStored()\\n            });\\n            uint256 totalAmount = mul_ScalarTruncate(exchangeRate, totalSupply);\\n            require(totalAmount <= supplyCap, \\\"market supply cap reached\\\");\\n        }\\n    }\\n\\n    /**\\n     * @notice Checks if the account should be allowed to redeem tokens in the given market\\n     * @param cToken The market to verify the redeem against\\n     * @param redeemer The account which would redeem the tokens\\n     * @param redeemTokens The number of cTokens to exchange for the underlying asset in the market\\n     * @return 0 if the redeem is allowed, otherwise a semi-opaque error code (See ErrorReporter.sol)\\n     */\\n    function redeemAllowed(\\n        address cToken,\\n        address redeemer,\\n        uint256 redeemTokens\\n    ) external override returns (uint256) {\\n        uint256 allowed = redeemAllowedInternal(cToken, redeemer, redeemTokens);\\n        if (allowed != uint256(Error.NO_ERROR)) {\\n            return allowed;\\n        }\\n\\n        // Keep the flywheel moving\\n        updateCompSupplyIndex(cToken);\\n        distributeSupplierComp(cToken, redeemer);\\n\\n        return uint256(Error.NO_ERROR);\\n    }\\n\\n    function redeemAllowedInternal(\\n        address cToken,\\n        address redeemer,\\n        uint256 redeemTokens\\n    ) internal view returns (uint256) {\\n        if (!markets[cToken].isListed) {\\n            return uint256(Error.MARKET_NOT_LISTED);\\n        }\\n\\n        /* If the redeemer is not 'in' the market, then we can bypass the liquidity check */\\n        if (!markets[cToken].accountMembership[redeemer]) {\\n            return uint256(Error.NO_ERROR);\\n        }\\n\\n        /* Otherwise, perform a hypothetical liquidity check to guard against shortfall */\\n        (\\n            Error err,\\n            ,\\n            uint256 shortfall\\n        ) = getHypotheticalAccountLiquidityInternal(\\n                redeemer,\\n                CToken(cToken),\\n                redeemTokens,\\n                0\\n            );\\n        if (err != Error.NO_ERROR) {\\n            return uint256(err);\\n        }\\n        if (shortfall > 0) {\\n            return uint256(Error.INSUFFICIENT_LIQUIDITY);\\n        }\\n\\n        return uint256(Error.NO_ERROR);\\n    }\\n\\n    /**\\n     * @notice Validates redeem and reverts on rejection. May emit logs.\\n     * @param cToken Asset being redeemed\\n     * @param redeemer The address redeeming the tokens\\n     * @param redeemAmount The amount of the underlying asset being redeemed\\n     * @param redeemTokens The number of tokens being redeemed\\n     */\\n    function redeemVerify(\\n        address cToken,\\n        address redeemer,\\n        uint256 redeemAmount,\\n        uint256 redeemTokens\\n    ) external override {\\n        // Shh - currently unused\\n        cToken;\\n        redeemer;\\n\\n        // Require tokens is zero or amount is also zero\\n        if (redeemTokens == 0 && redeemAmount > 0) {\\n            revert(\\\"redeemTokens zero\\\");\\n        }\\n    }\\n\\n    /**\\n     * @notice Checks if the account should be allowed to borrow the underlying asset of the given market\\n     * @param cToken The market to verify the borrow against\\n     * @param borrower The account which would borrow the asset\\n     * @param borrowAmount The amount of underlying the account would borrow\\n     * @return 0 if the borrow is allowed, otherwise a semi-opaque error code (See ErrorReporter.sol)\\n     */\\n    function borrowAllowed(\\n        address cToken,\\n        address borrower,\\n        uint256 borrowAmount\\n    ) external override returns (uint256) {\\n        // Pausing is a very serious situation - we revert to sound the alarms\\n        require(!borrowGuardianPaused[cToken], \\\"borrow is paused\\\");\\n\\n        if (!markets[cToken].isListed) {\\n            return uint256(Error.MARKET_NOT_LISTED);\\n        }\\n\\n        if (!markets[cToken].accountMembership[borrower]) {\\n            // only cTokens may call borrowAllowed if borrower not in market\\n            require(msg.sender == cToken, \\\"sender must be cToken\\\");\\n\\n            // attempt to add borrower to the market\\n            Error err = addToMarketInternal(CToken(msg.sender), borrower);\\n            if (err != Error.NO_ERROR) {\\n                return uint256(err);\\n            }\\n\\n            // it should be impossible to break the important invariant\\n            assert(markets[cToken].accountMembership[borrower]);\\n        }\\n\\n        if (oracle.getUnderlyingPrice(CToken(cToken)) == 0) {\\n            return uint256(Error.PRICE_ERROR);\\n        }\\n\\n        uint256 borrowCap = borrowCaps[cToken];\\n        // Borrow cap of 0 corresponds to unlimited borrowing\\n        if (borrowCap != 0) {\\n            uint256 totalBorrows = CToken(cToken).totalBorrows();\\n            uint256 nextTotalBorrows = add_(totalBorrows, borrowAmount);\\n            require(nextTotalBorrows < borrowCap, \\\"market borrow cap reached\\\");\\n        }\\n\\n        (\\n            Error err,\\n            ,\\n            uint256 shortfall\\n        ) = getHypotheticalAccountLiquidityInternal(\\n                borrower,\\n                CToken(cToken),\\n                0,\\n                borrowAmount\\n            );\\n        if (err != Error.NO_ERROR) {\\n            return uint256(err);\\n        }\\n        if (shortfall > 0) {\\n            return uint256(Error.INSUFFICIENT_LIQUIDITY);\\n        }\\n\\n        // Keep the flywheel moving\\n        Exp memory borrowIndex = Exp({mantissa: CToken(cToken).borrowIndex()});\\n        updateCompBorrowIndex(cToken, borrowIndex);\\n        distributeBorrowerComp(cToken, borrower, borrowIndex);\\n\\n        return uint256(Error.NO_ERROR);\\n    }\\n\\n    /**\\n     * @notice Validates borrow and reverts on rejection. May emit logs.\\n     * @param cToken Asset whose underlying is being borrowed\\n     * @param borrower The address borrowing the underlying\\n     * @param borrowAmount The amount of the underlying asset requested to borrow\\n     */\\n    function borrowVerify(\\n        address cToken,\\n        address borrower,\\n        uint256 borrowAmount\\n    ) external override {\\n        // Shh - currently unused\\n        cToken;\\n        borrower;\\n        borrowAmount;\\n\\n        // Shh - we don't ever want this hook to be marked pure\\n        if (false) {\\n            maxAssets = maxAssets;\\n        }\\n    }\\n\\n    /**\\n     * @notice Checks if the account should be allowed to repay a borrow in the given market\\n     * @param cToken The market to verify the repay against\\n     * @param payer The account which would repay the asset\\n     * @param borrower The account which would borrowed the asset\\n     * @param repayAmount The amount of the underlying asset the account would repay\\n     * @return 0 if the repay is allowed, otherwise a semi-opaque error code (See ErrorReporter.sol)\\n     */\\n    function repayBorrowAllowed(\\n        address cToken,\\n        address payer,\\n        address borrower,\\n        uint256 repayAmount\\n    ) external override returns (uint256) {\\n        // Shh - currently unused\\n        payer;\\n        borrower;\\n        repayAmount;\\n\\n        if (!markets[cToken].isListed) {\\n            return uint256(Error.MARKET_NOT_LISTED);\\n        }\\n\\n        // Keep the flywheel moving\\n        Exp memory borrowIndex = Exp({mantissa: CToken(cToken).borrowIndex()});\\n        updateCompBorrowIndex(cToken, borrowIndex);\\n        distributeBorrowerComp(cToken, borrower, borrowIndex);\\n\\n        return uint256(Error.NO_ERROR);\\n    }\\n\\n    /**\\n     * @notice Validates repayBorrow and reverts on rejection. May emit logs.\\n     * @param cToken Asset being repaid\\n     * @param payer The address repaying the borrow\\n     * @param borrower The address of the borrower\\n     * @param actualRepayAmount The amount of underlying being repaid\\n     */\\n    function repayBorrowVerify(\\n        address cToken,\\n        address payer,\\n        address borrower,\\n        uint256 actualRepayAmount,\\n        uint256 borrowerIndex\\n    ) external override {\\n        // Shh - currently unused\\n        cToken;\\n        payer;\\n        borrower;\\n        actualRepayAmount;\\n        borrowerIndex;\\n\\n        // Shh - we don't ever want this hook to be marked pure\\n        if (false) {\\n            maxAssets = maxAssets;\\n        }\\n    }\\n\\n    /**\\n     * @notice Checks if the liquidation should be allowed to occur\\n     * @param cTokenBorrowed Asset which was borrowed by the borrower\\n     * @param cTokenCollateral Asset which was used as collateral and will be seized\\n     * @param liquidator The address repaying the borrow and seizing the collateral\\n     * @param borrower The address of the borrower\\n     * @param repayAmount The amount of underlying being repaid\\n     */\\n    function liquidateBorrowAllowed(\\n        address cTokenBorrowed,\\n        address cTokenCollateral,\\n        address liquidator,\\n        address borrower,\\n        uint256 repayAmount\\n    ) external override returns (uint256) {\\n        // Shh - currently unused\\n        liquidator;\\n\\n        if (\\n            !markets[cTokenBorrowed].isListed ||\\n            !markets[cTokenCollateral].isListed\\n        ) {\\n            return uint256(Error.MARKET_NOT_LISTED);\\n        }\\n\\n        uint256 borrowBalance = CToken(cTokenBorrowed).borrowBalanceStored(\\n            borrower\\n        );\\n\\n        /* allow accounts to be liquidated if the market is deprecated */\\n        if (isDeprecated(CToken(cTokenBorrowed))) {\\n            require(\\n                borrowBalance >= repayAmount,\\n                \\\"Can not repay more than the total borrow\\\"\\n            );\\n        } else {\\n            /* The borrower must have shortfall in order to be liquidatable */\\n            (Error err, , uint256 shortfall) = getAccountLiquidityInternal(\\n                borrower\\n            );\\n            if (err != Error.NO_ERROR) {\\n                return uint256(err);\\n            }\\n\\n            if (shortfall == 0) {\\n                return uint256(Error.INSUFFICIENT_SHORTFALL);\\n            }\\n\\n            /* The liquidator may not repay more than what is allowed by the closeFactor */\\n            uint256 maxClose = mul_ScalarTruncate(\\n                Exp({mantissa: closeFactorMantissa}),\\n                borrowBalance\\n            );\\n            if (repayAmount > maxClose) {\\n                return uint256(Error.TOO_MUCH_REPAY);\\n            }\\n        }\\n        return uint256(Error.NO_ERROR);\\n    }\\n\\n    /**\\n     * @notice Validates liquidateBorrow and reverts on rejection. May emit logs.\\n     * @param cTokenBorrowed Asset which was borrowed by the borrower\\n     * @param cTokenCollateral Asset which was used as collateral and will be seized\\n     * @param liquidator The address repaying the borrow and seizing the collateral\\n     * @param borrower The address of the borrower\\n     * @param actualRepayAmount The amount of underlying being repaid\\n     */\\n    function liquidateBorrowVerify(\\n        address cTokenBorrowed,\\n        address cTokenCollateral,\\n        address liquidator,\\n        address borrower,\\n        uint256 actualRepayAmount,\\n        uint256 seizeTokens\\n    ) external override {\\n        // Shh - currently unused\\n        cTokenBorrowed;\\n        cTokenCollateral;\\n        liquidator;\\n        borrower;\\n        actualRepayAmount;\\n        seizeTokens;\\n\\n        // Shh - we don't ever want this hook to be marked pure\\n        if (false) {\\n            maxAssets = maxAssets;\\n        }\\n    }\\n\\n    /**\\n     * @notice Checks if the seizing of assets should be allowed to occur\\n     * @param cTokenCollateral Asset which was used as collateral and will be seized\\n     * @param cTokenBorrowed Asset which was borrowed by the borrower\\n     * @param liquidator The address repaying the borrow and seizing the collateral\\n     * @param borrower The address of the borrower\\n     * @param seizeTokens The number of collateral tokens to seize\\n     */\\n    function seizeAllowed(\\n        address cTokenCollateral,\\n        address cTokenBorrowed,\\n        address liquidator,\\n        address borrower,\\n        uint256 seizeTokens\\n    ) external override returns (uint256) {\\n        // Pausing is a very serious situation - we revert to sound the alarms\\n        require(!seizeGuardianPaused, \\\"seize is paused\\\");\\n\\n        // Shh - currently unused\\n        seizeTokens;\\n\\n        if (\\n            !markets[cTokenCollateral].isListed ||\\n            !markets[cTokenBorrowed].isListed\\n        ) {\\n            return uint256(Error.MARKET_NOT_LISTED);\\n        }\\n\\n        if (\\n            CToken(cTokenCollateral).comptroller() !=\\n            CToken(cTokenBorrowed).comptroller()\\n        ) {\\n            return uint256(Error.COMPTROLLER_MISMATCH);\\n        }\\n\\n        // Keep the flywheel moving\\n        updateCompSupplyIndex(cTokenCollateral);\\n        distributeSupplierComp(cTokenCollateral, borrower);\\n        distributeSupplierComp(cTokenCollateral, liquidator);\\n\\n        return uint256(Error.NO_ERROR);\\n    }\\n\\n    /**\\n     * @notice Validates seize and reverts on rejection. May emit logs.\\n     * @param cTokenCollateral Asset which was used as collateral and will be seized\\n     * @param cTokenBorrowed Asset which was borrowed by the borrower\\n     * @param liquidator The address repaying the borrow and seizing the collateral\\n     * @param borrower The address of the borrower\\n     * @param seizeTokens The number of collateral tokens to seize\\n     */\\n    function seizeVerify(\\n        address cTokenCollateral,\\n        address cTokenBorrowed,\\n        address liquidator,\\n        address borrower,\\n        uint256 seizeTokens\\n    ) external override {\\n        // Shh - currently unused\\n        cTokenCollateral;\\n        cTokenBorrowed;\\n        liquidator;\\n        borrower;\\n        seizeTokens;\\n\\n        // Shh - we don't ever want this hook to be marked pure\\n        if (false) {\\n            maxAssets = maxAssets;\\n        }\\n    }\\n\\n    /**\\n     * @notice Checks if the account should be allowed to transfer tokens in the given market\\n     * @param cToken The market to verify the transfer against\\n     * @param src The account which sources the tokens\\n     * @param dst The account which receives the tokens\\n     * @param transferTokens The number of cTokens to transfer\\n     * @return 0 if the transfer is allowed, otherwise a semi-opaque error code (See ErrorReporter.sol)\\n     */\\n    function transferAllowed(\\n        address cToken,\\n        address src,\\n        address dst,\\n        uint256 transferTokens\\n    ) external override returns (uint256) {\\n        // Pausing is a very serious situation - we revert to sound the alarms\\n        require(!transferGuardianPaused, \\\"transfer is paused\\\");\\n\\n        // Currently the only consideration is whether or not\\n        //  the src is allowed to redeem this many tokens\\n        uint256 allowed = redeemAllowedInternal(cToken, src, transferTokens);\\n        if (allowed != uint256(Error.NO_ERROR)) {\\n            return allowed;\\n        }\\n\\n        // Keep the flywheel moving\\n        updateCompSupplyIndex(cToken);\\n        distributeSupplierComp(cToken, src);\\n        distributeSupplierComp(cToken, dst);\\n\\n        return uint256(Error.NO_ERROR);\\n    }\\n\\n    /**\\n     * @notice Validates transfer and reverts on rejection. May emit logs.\\n     * @param cToken Asset being transferred\\n     * @param src The account which sources the tokens\\n     * @param dst The account which receives the tokens\\n     * @param transferTokens The number of cTokens to transfer\\n     */\\n    function transferVerify(\\n        address cToken,\\n        address src,\\n        address dst,\\n        uint256 transferTokens\\n    ) external override {\\n        // Shh - currently unused\\n        cToken;\\n        src;\\n        dst;\\n        transferTokens;\\n\\n        // Shh - we don't ever want this hook to be marked pure\\n        if (false) {\\n            maxAssets = maxAssets;\\n        }\\n    }\\n\\n    /*** Liquidity/Liquidation Calculations ***/\\n\\n    /**\\n     * @dev Local vars for avoiding stack-depth limits in calculating account liquidity.\\n     *  Note that `cTokenBalance` is the number of cTokens the account owns in the market,\\n     *  whereas `borrowBalance` is the amount of underlying that the account has borrowed.\\n     */\\n    struct AccountLiquidityLocalVars {\\n        uint256 sumCollateral;\\n        uint256 sumBorrowPlusEffects;\\n        uint256 cTokenBalance;\\n        uint256 borrowBalance;\\n        uint256 exchangeRateMantissa;\\n        uint256 oraclePriceMantissa;\\n        Exp collateralFactor;\\n        Exp exchangeRate;\\n        Exp oraclePrice;\\n        Exp tokensToDenom;\\n    }\\n\\n    /**\\n     * @notice Determine the current account liquidity wrt collateral requirements\\n     * @return (possible error code (semi-opaque),\\n                account liquidity in excess of collateral requirements,\\n     *          account shortfall below collateral requirements)\\n     */\\n    function getAccountLiquidity(\\n        address account\\n    ) public view returns (uint256, uint256, uint256) {\\n        (\\n            Error err,\\n            uint256 liquidity,\\n            uint256 shortfall\\n        ) = getHypotheticalAccountLiquidityInternal(\\n                account,\\n                CToken(address(0)),\\n                0,\\n                0\\n            );\\n\\n        return (uint256(err), liquidity, shortfall);\\n    }\\n\\n    /**\\n     * @notice Determine the current account liquidity wrt collateral requirements\\n     * @return (possible error code,\\n                account liquidity in excess of collateral requirements,\\n     *          account shortfall below collateral requirements)\\n     */\\n    function getAccountLiquidityInternal(\\n        address account\\n    ) internal view returns (Error, uint256, uint256) {\\n        return\\n            getHypotheticalAccountLiquidityInternal(\\n                account,\\n                CToken(address(0)),\\n                0,\\n                0\\n            );\\n    }\\n\\n    /**\\n     * @notice Determine what the account liquidity would be if the given amounts were redeemed/borrowed\\n     * @param cTokenModify The market to hypothetically redeem/borrow in\\n     * @param account The account to determine liquidity for\\n     * @param redeemTokens The number of tokens to hypothetically redeem\\n     * @param borrowAmount The amount of underlying to hypothetically borrow\\n     * @return (possible error code (semi-opaque),\\n                hypothetical account liquidity in excess of collateral requirements,\\n     *          hypothetical account shortfall below collateral requirements)\\n     */\\n    function getHypotheticalAccountLiquidity(\\n        address account,\\n        address cTokenModify,\\n        uint256 redeemTokens,\\n        uint256 borrowAmount\\n    ) public view returns (uint256, uint256, uint256) {\\n        (\\n            Error err,\\n            uint256 liquidity,\\n            uint256 shortfall\\n        ) = getHypotheticalAccountLiquidityInternal(\\n                account,\\n                CToken(cTokenModify),\\n                redeemTokens,\\n                borrowAmount\\n            );\\n        return (uint256(err), liquidity, shortfall);\\n    }\\n\\n    /**\\n     * @notice Determine what the account liquidity would be if the given amounts were redeemed/borrowed\\n     * @param cTokenModify The market to hypothetically redeem/borrow in\\n     * @param account The account to determine liquidity for\\n     * @param redeemTokens The number of tokens to hypothetically redeem\\n     * @param borrowAmount The amount of underlying to hypothetically borrow\\n     * @dev Note that we calculate the exchangeRateStored for each collateral cToken using stored data,\\n     *  without calculating accumulated interest.\\n     * @return (possible error code,\\n                hypothetical account liquidity in excess of collateral requirements,\\n     *          hypothetical account shortfall below collateral requirements)\\n     */\\n    function getHypotheticalAccountLiquidityInternal(\\n        address account,\\n        CToken cTokenModify,\\n        uint256 redeemTokens,\\n        uint256 borrowAmount\\n    ) internal view returns (Error, uint256, uint256) {\\n        AccountLiquidityLocalVars memory vars; // Holds all our calculation results\\n        uint256 oErr;\\n\\n        // For each asset the account is in\\n        CToken[] memory assets = accountAssets[account];\\n        for (uint256 i = 0; i < assets.length; i++) {\\n            CToken asset = assets[i];\\n\\n            // Read the balances and exchange rate from the cToken\\n            (\\n                oErr,\\n                vars.cTokenBalance,\\n                vars.borrowBalance,\\n                vars.exchangeRateMantissa\\n            ) = asset.getAccountSnapshot(account);\\n            if (oErr != 0) {\\n                // semi-opaque error code, we assume NO_ERROR == 0 is invariant between upgrades\\n                return (Error.SNAPSHOT_ERROR, 0, 0);\\n            }\\n            vars.collateralFactor = Exp({\\n                mantissa: markets[address(asset)].collateralFactorMantissa\\n            });\\n            vars.exchangeRate = Exp({mantissa: vars.exchangeRateMantissa});\\n\\n            // Get the normalized price of the asset\\n            vars.oraclePriceMantissa = oracle.getUnderlyingPrice(asset);\\n            if (vars.oraclePriceMantissa == 0) {\\n                return (Error.PRICE_ERROR, 0, 0);\\n            }\\n            vars.oraclePrice = Exp({mantissa: vars.oraclePriceMantissa});\\n\\n            // Pre-compute a conversion factor from tokens -> ether (normalized price value)\\n            vars.tokensToDenom = mul_(\\n                mul_(vars.collateralFactor, vars.exchangeRate),\\n                vars.oraclePrice\\n            );\\n\\n            // sumCollateral += tokensToDenom * cTokenBalance\\n            vars.sumCollateral = mul_ScalarTruncateAddUInt(\\n                vars.tokensToDenom,\\n                vars.cTokenBalance,\\n                vars.sumCollateral\\n            );\\n\\n            // sumBorrowPlusEffects += oraclePrice * borrowBalance\\n            vars.sumBorrowPlusEffects = mul_ScalarTruncateAddUInt(\\n                vars.oraclePrice,\\n                vars.borrowBalance,\\n                vars.sumBorrowPlusEffects\\n            );\\n\\n            // Calculate effects of interacting with cTokenModify\\n            if (asset == cTokenModify) {\\n                // redeem effect\\n                // sumBorrowPlusEffects += tokensToDenom * redeemTokens\\n                vars.sumBorrowPlusEffects = mul_ScalarTruncateAddUInt(\\n                    vars.tokensToDenom,\\n                    redeemTokens,\\n                    vars.sumBorrowPlusEffects\\n                );\\n\\n                // borrow effect\\n                // sumBorrowPlusEffects += oraclePrice * borrowAmount\\n                vars.sumBorrowPlusEffects = mul_ScalarTruncateAddUInt(\\n                    vars.oraclePrice,\\n                    borrowAmount,\\n                    vars.sumBorrowPlusEffects\\n                );\\n            }\\n        }\\n\\n        // These are safe, as the underflow condition is checked first\\n        if (vars.sumCollateral > vars.sumBorrowPlusEffects) {\\n            return (\\n                Error.NO_ERROR,\\n                vars.sumCollateral - vars.sumBorrowPlusEffects,\\n                0\\n            );\\n        } else {\\n            return (\\n                Error.NO_ERROR,\\n                0,\\n                vars.sumBorrowPlusEffects - vars.sumCollateral\\n            );\\n        }\\n    }\\n\\n    /**\\n     * @notice Calculate number of tokens of collateral asset to seize given an underlying amount\\n     * @dev Used in liquidation (called in cToken.liquidateBorrowFresh)\\n     * @param cTokenBorrowed The address of the borrowed cToken\\n     * @param cTokenCollateral The address of the collateral cToken\\n     * @param actualRepayAmount The amount of cTokenBorrowed underlying to convert into cTokenCollateral tokens\\n     * @return (errorCode, number of cTokenCollateral tokens to be seized in a liquidation)\\n     */\\n    function liquidateCalculateSeizeTokens(\\n        address cTokenBorrowed,\\n        address cTokenCollateral,\\n        uint256 actualRepayAmount\\n    ) external view override returns (uint256, uint256) {\\n        /* Read oracle prices for borrowed and collateral markets */\\n        uint256 priceBorrowedMantissa = oracle.getUnderlyingPrice(\\n            CToken(cTokenBorrowed)\\n        );\\n        uint256 priceCollateralMantissa = oracle.getUnderlyingPrice(\\n            CToken(cTokenCollateral)\\n        );\\n        if (priceBorrowedMantissa == 0 || priceCollateralMantissa == 0) {\\n            return (uint256(Error.PRICE_ERROR), 0);\\n        }\\n\\n        /*\\n         * Get the exchange rate and calculate the number of collateral tokens to seize:\\n         *  seizeAmount = actualRepayAmount * liquidationIncentive * priceBorrowed / priceCollateral\\n         *  seizeTokens = seizeAmount / exchangeRate\\n         *   = actualRepayAmount * (liquidationIncentive * priceBorrowed) / (priceCollateral * exchangeRate)\\n         */\\n        uint256 exchangeRateMantissa = CToken(cTokenCollateral)\\n            .exchangeRateStored(); // Note: reverts on error\\n        uint256 seizeTokens;\\n        Exp memory numerator;\\n        Exp memory denominator;\\n        Exp memory ratio;\\n\\n        numerator = mul_(\\n            Exp({mantissa: liquidationIncentiveMantissa}),\\n            Exp({mantissa: priceBorrowedMantissa})\\n        );\\n        denominator = mul_(\\n            Exp({mantissa: priceCollateralMantissa}),\\n            Exp({mantissa: exchangeRateMantissa})\\n        );\\n        ratio = div_(numerator, denominator);\\n\\n        seizeTokens = mul_ScalarTruncate(ratio, actualRepayAmount);\\n\\n        return (uint256(Error.NO_ERROR), seizeTokens);\\n    }\\n\\n    /*** Admin Functions ***/\\n\\n    /**\\n     * @notice Sets a new price oracle for the comptroller\\n     * @dev Admin function to set a new price oracle\\n     * @return uint 0=success, otherwise a failure (see ErrorReporter.sol for details)\\n     */\\n    function _setPriceOracle(PriceOracle newOracle) public returns (uint256) {\\n        // Check caller is admin\\n        if (msg.sender != admin) {\\n            return\\n                fail(\\n                    Error.UNAUTHORIZED,\\n                    FailureInfo.SET_PRICE_ORACLE_OWNER_CHECK\\n                );\\n        }\\n\\n        // Track the old oracle for the comptroller\\n        PriceOracle oldOracle = oracle;\\n\\n        // Set comptroller's oracle to newOracle\\n        oracle = newOracle;\\n\\n        // Emit NewPriceOracle(oldOracle, newOracle)\\n        emit NewPriceOracle(oldOracle, newOracle);\\n\\n        return uint256(Error.NO_ERROR);\\n    }\\n\\n    /**\\n     * @notice Sets the closeFactor used when liquidating borrows\\n     * @dev Admin function to set closeFactor\\n     * @param newCloseFactorMantissa New close factor, scaled by 1e18\\n     * @return uint 0=success, otherwise a failure\\n     */\\n    function _setCloseFactor(\\n        uint256 newCloseFactorMantissa\\n    ) external returns (uint256) {\\n        // Check caller is admin\\n        require(msg.sender == admin, \\\"only admin can set close factor\\\");\\n\\n        uint256 oldCloseFactorMantissa = closeFactorMantissa;\\n        closeFactorMantissa = newCloseFactorMantissa;\\n        emit NewCloseFactor(oldCloseFactorMantissa, closeFactorMantissa);\\n\\n        return uint256(Error.NO_ERROR);\\n    }\\n\\n    /**\\n     * @notice Sets the collateralFactor for a market\\n     * @dev Admin function to set per-market collateralFactor\\n     * @param cToken The market to set the factor on\\n     * @param newCollateralFactorMantissa The new collateral factor, scaled by 1e18\\n     * @return uint 0=success, otherwise a failure. (See ErrorReporter for details)\\n     */\\n    function _setCollateralFactor(\\n        CToken cToken,\\n        uint256 newCollateralFactorMantissa\\n    ) external returns (uint256) {\\n        // Check caller is admin\\n        if (msg.sender != admin) {\\n            return\\n                fail(\\n                    Error.UNAUTHORIZED,\\n                    FailureInfo.SET_COLLATERAL_FACTOR_OWNER_CHECK\\n                );\\n        }\\n\\n        // Verify market is listed\\n        Market storage market = markets[address(cToken)];\\n        if (!market.isListed) {\\n            return\\n                fail(\\n                    Error.MARKET_NOT_LISTED,\\n                    FailureInfo.SET_COLLATERAL_FACTOR_NO_EXISTS\\n                );\\n        }\\n\\n        Exp memory newCollateralFactorExp = Exp({\\n            mantissa: newCollateralFactorMantissa\\n        });\\n\\n        // Check collateral factor <= 0.9\\n        Exp memory highLimit = Exp({mantissa: collateralFactorMaxMantissa});\\n        if (lessThanExp(highLimit, newCollateralFactorExp)) {\\n            return\\n                fail(\\n                    Error.INVALID_COLLATERAL_FACTOR,\\n                    FailureInfo.SET_COLLATERAL_FACTOR_VALIDATION\\n                );\\n        }\\n\\n        // If collateral factor != 0, fail if price == 0\\n        if (\\n            newCollateralFactorMantissa != 0 &&\\n            oracle.getUnderlyingPrice(cToken) == 0\\n        ) {\\n            return\\n                fail(\\n                    Error.PRICE_ERROR,\\n                    FailureInfo.SET_COLLATERAL_FACTOR_WITHOUT_PRICE\\n                );\\n        }\\n\\n        // Set market's collateral factor to new collateral factor, remember old value\\n        uint256 oldCollateralFactorMantissa = market.collateralFactorMantissa;\\n        market.collateralFactorMantissa = newCollateralFactorMantissa;\\n\\n        // Emit event with asset, old collateral factor, and new collateral factor\\n        emit NewCollateralFactor(\\n            cToken,\\n            oldCollateralFactorMantissa,\\n            newCollateralFactorMantissa\\n        );\\n\\n        return uint256(Error.NO_ERROR);\\n    }\\n\\n    /**\\n     * @notice Sets liquidationIncentive\\n     * @dev Admin function to set liquidationIncentive\\n     * @param newLiquidationIncentiveMantissa New liquidationIncentive scaled by 1e18\\n     * @return uint 0=success, otherwise a failure. (See ErrorReporter for details)\\n     */\\n    function _setLiquidationIncentive(\\n        uint256 newLiquidationIncentiveMantissa\\n    ) external returns (uint256) {\\n        // Check caller is admin\\n        if (msg.sender != admin) {\\n            return\\n                fail(\\n                    Error.UNAUTHORIZED,\\n                    FailureInfo.SET_LIQUIDATION_INCENTIVE_OWNER_CHECK\\n                );\\n        }\\n\\n        // Save current value for use in log\\n        uint256 oldLiquidationIncentiveMantissa = liquidationIncentiveMantissa;\\n\\n        // Set liquidation incentive to new incentive\\n        liquidationIncentiveMantissa = newLiquidationIncentiveMantissa;\\n\\n        // Emit event with old incentive, new incentive\\n        emit NewLiquidationIncentive(\\n            oldLiquidationIncentiveMantissa,\\n            newLiquidationIncentiveMantissa\\n        );\\n\\n        return uint256(Error.NO_ERROR);\\n    }\\n\\n    /**\\n     * @notice Add the market to the markets mapping and set it as listed\\n     * @dev Admin function to set isListed and add support for the market\\n     * @param cToken The address of the market (token) to list\\n     * @return uint 0=success, otherwise a failure. (See enum Error for details)\\n     */\\n    function _supportMarket(CToken cToken) external returns (uint256) {\\n        if (msg.sender != admin) {\\n            return\\n                fail(\\n                    Error.UNAUTHORIZED,\\n                    FailureInfo.SUPPORT_MARKET_OWNER_CHECK\\n                );\\n        }\\n\\n        if (markets[address(cToken)].isListed) {\\n            return\\n                fail(\\n                    Error.MARKET_ALREADY_LISTED,\\n                    FailureInfo.SUPPORT_MARKET_EXISTS\\n                );\\n        }\\n\\n        cToken.isCToken(); // Sanity check to make sure its really a CToken\\n\\n        // Note that isComped is not in active use anymore\\n        Market storage newMarket = markets[address(cToken)];\\n        newMarket.isListed = true;\\n        newMarket.isComped = false;\\n        newMarket.collateralFactorMantissa = 0;\\n\\n        _addMarketInternal(address(cToken));\\n        _initializeMarket(address(cToken));\\n\\n        emit MarketListed(cToken);\\n\\n        return uint256(Error.NO_ERROR);\\n    }\\n\\n    function _addMarketInternal(address cToken) internal {\\n        for (uint256 i = 0; i < allMarkets.length; i++) {\\n            require(allMarkets[i] != CToken(cToken), \\\"market already added\\\");\\n        }\\n        allMarkets.push(CToken(cToken));\\n    }\\n\\n    function _initializeMarket(address cToken) internal {\\n        uint32 blockNumber = safe32(\\n            getBlockNumber(),\\n            \\\"block number exceeds 32 bits\\\"\\n        );\\n\\n        CompMarketState storage supplyState = compSupplyState[cToken];\\n        CompMarketState storage borrowState = compBorrowState[cToken];\\n\\n        /*\\n         * Update market state indices\\n         */\\n        if (supplyState.index == 0) {\\n            // Initialize supply state index with default value\\n            supplyState.index = compInitialIndex;\\n        }\\n\\n        if (borrowState.index == 0) {\\n            // Initialize borrow state index with default value\\n            borrowState.index = compInitialIndex;\\n        }\\n\\n        /*\\n         * Update market state block numbers\\n         */\\n        supplyState.block = borrowState.block = blockNumber;\\n    }\\n\\n    /**\\n     * @notice Set the given borrow caps for the given cToken markets. Borrowing that brings total borrows to or above borrow cap will revert.\\n     * @dev Admin or borrowCapGuardian function to set the borrow caps. A borrow cap of 0 corresponds to unlimited borrowing.\\n     * @param cTokens The addresses of the markets (tokens) to change the borrow caps for\\n     * @param newBorrowCaps The new borrow cap values in underlying to be set. A value of 0 corresponds to unlimited borrowing.\\n     */\\n    function _setMarketBorrowCaps(\\n        CToken[] calldata cTokens,\\n        uint256[] calldata newBorrowCaps\\n    ) external {\\n        require(\\n            msg.sender == admin || msg.sender == borrowCapGuardian,\\n            \\\"only admin or borrow cap guardian can set borrow caps\\\"\\n        );\\n\\n        uint256 numMarkets = cTokens.length;\\n        uint256 numBorrowCaps = newBorrowCaps.length;\\n\\n        require(\\n            numMarkets != 0 && numMarkets == numBorrowCaps,\\n            \\\"invalid input\\\"\\n        );\\n\\n        for (uint256 i = 0; i < numMarkets; i++) {\\n            borrowCaps[address(cTokens[i])] = newBorrowCaps[i];\\n            emit NewBorrowCap(cTokens[i], newBorrowCaps[i]);\\n        }\\n    }\\n\\n    /**\\n     * @notice Set the given supply caps for the given cToken markets. Supplying that brings total supply to or above supply cap will revert.\\n     * @dev Admin or supplyCapGuardian function to set the supply caps. A supply cap of 0 corresponds to unlimited supplying.\\n     * @param cTokens The addresses of the markets (tokens) to change the supply caps for\\n     * @param newSupplyCaps The new supply cap values in underlying to be set. A value of 0 corresponds to unlimited supplying.\\n     */\\n    function _setMarketSupplyCaps(\\n        CToken[] calldata cTokens,\\n        uint256[] calldata newSupplyCaps\\n    ) external {\\n        require(\\n            msg.sender == admin || msg.sender == supplyCapGuardian,\\n            \\\"only admin or supply cap guardian can set supply caps\\\"\\n        );\\n\\n        uint256 numMarkets = cTokens.length;\\n        uint256 numSupplyCaps = newSupplyCaps.length;\\n\\n        require(\\n            numMarkets != 0 && numMarkets == numSupplyCaps,\\n            \\\"invalid input\\\"\\n        );\\n\\n        for (uint256 i = 0; i < numMarkets; i++) {\\n            supplyCaps[address(cTokens[i])] = newSupplyCaps[i];\\n            emit NewSupplyCap(cTokens[i], newSupplyCaps[i]);\\n        }\\n    }\\n\\n    /**\\n     * @notice Admin function to change the Borrow Cap Guardian\\n     * @param newBorrowCapGuardian The address of the new Borrow Cap Guardian\\n     */\\n    function _setBorrowCapGuardian(address newBorrowCapGuardian) external {\\n        require(msg.sender == admin, \\\"only admin can set borrow cap guardian\\\");\\n\\n        // Save current value for inclusion in log\\n        address oldBorrowCapGuardian = borrowCapGuardian;\\n\\n        // Store borrowCapGuardian with value newBorrowCapGuardian\\n        borrowCapGuardian = newBorrowCapGuardian;\\n\\n        // Emit NewBorrowCapGuardian(OldBorrowCapGuardian, NewBorrowCapGuardian)\\n        emit NewBorrowCapGuardian(oldBorrowCapGuardian, newBorrowCapGuardian);\\n    }\\n\\n    /**\\n     * @notice Admin function to change the Supply Cap Guardian\\n     * @param newSupplyCapGuardian The address of the new Supply Cap Guardian\\n     */\\n    function _setSupplyCapGuardian(address newSupplyCapGuardian) external {\\n        require(msg.sender == admin, \\\"only admin can set supply cap guardian\\\");\\n\\n        // Save current value for inclusion in log\\n        address oldSupplyCapGuardian = supplyCapGuardian;\\n\\n        // Store supplyCapGuardian with value newSupplyCapGuardian\\n        supplyCapGuardian = newSupplyCapGuardian;\\n\\n        // Emit NewSupplyCapGuardian(OldSupplyCapGuardian, NewSupplyCapGuardian)\\n        emit NewSupplyCapGuardian(oldSupplyCapGuardian, newSupplyCapGuardian);\\n    }\\n\\n    /**\\n     * @notice Admin function to change the Pause Guardian\\n     * @param newPauseGuardian The address of the new Pause Guardian\\n     * @return uint 0=success, otherwise a failure. (See enum Error for details)\\n     */\\n    function _setPauseGuardian(\\n        address newPauseGuardian\\n    ) public returns (uint256) {\\n        if (msg.sender != admin) {\\n            return\\n                fail(\\n                    Error.UNAUTHORIZED,\\n                    FailureInfo.SET_PAUSE_GUARDIAN_OWNER_CHECK\\n                );\\n        }\\n\\n        // Save current value for inclusion in log\\n        address oldPauseGuardian = pauseGuardian;\\n\\n        // Store pauseGuardian with value newPauseGuardian\\n        pauseGuardian = newPauseGuardian;\\n\\n        // Emit NewPauseGuardian(OldPauseGuardian, NewPauseGuardian)\\n        emit NewPauseGuardian(oldPauseGuardian, pauseGuardian);\\n\\n        return uint256(Error.NO_ERROR);\\n    }\\n\\n    function _setMintPaused(CToken cToken, bool state) public returns (bool) {\\n        require(\\n            markets[address(cToken)].isListed,\\n            \\\"cannot pause a market that is not listed\\\"\\n        );\\n        require(\\n            msg.sender == pauseGuardian || msg.sender == admin,\\n            \\\"only pause guardian and admin can pause\\\"\\n        );\\n        require(msg.sender == admin || state == true, \\\"only admin can unpause\\\");\\n\\n        mintGuardianPaused[address(cToken)] = state;\\n        emit ActionPaused(cToken, \\\"Mint\\\", state);\\n        return state;\\n    }\\n\\n    function _setBorrowPaused(CToken cToken, bool state) public returns (bool) {\\n        require(\\n            markets[address(cToken)].isListed,\\n            \\\"cannot pause a market that is not listed\\\"\\n        );\\n        require(\\n            msg.sender == pauseGuardian || msg.sender == admin,\\n            \\\"only pause guardian and admin can pause\\\"\\n        );\\n        require(msg.sender == admin || state == true, \\\"only admin can unpause\\\");\\n\\n        borrowGuardianPaused[address(cToken)] = state;\\n        emit ActionPaused(cToken, \\\"Borrow\\\", state);\\n        return state;\\n    }\\n\\n    function _setTransferPaused(bool state) public returns (bool) {\\n        require(\\n            msg.sender == pauseGuardian || msg.sender == admin,\\n            \\\"only pause guardian and admin can pause\\\"\\n        );\\n        require(msg.sender == admin || state == true, \\\"only admin can unpause\\\");\\n\\n        transferGuardianPaused = state;\\n        emit ActionPaused(\\\"Transfer\\\", state);\\n        return state;\\n    }\\n\\n    function _setSeizePaused(bool state) public returns (bool) {\\n        require(\\n            msg.sender == pauseGuardian || msg.sender == admin,\\n            \\\"only pause guardian and admin can pause\\\"\\n        );\\n        require(msg.sender == admin || state == true, \\\"only admin can unpause\\\");\\n\\n        seizeGuardianPaused = state;\\n        emit ActionPaused(\\\"Seize\\\", state);\\n        return state;\\n    }\\n\\n    function _become(Unitroller unitroller) public {\\n        require(\\n            msg.sender == unitroller.admin(),\\n            \\\"only unitroller admin can change brains\\\"\\n        );\\n        require(\\n            unitroller._acceptImplementation() == 0,\\n            \\\"change not authorized\\\"\\n        );\\n    }\\n\\n    /// @notice Delete this function after proposal 65 is executed\\n    function fixBadAccruals(\\n        address[] calldata affectedUsers,\\n        uint256[] calldata amounts\\n    ) external {\\n        require(msg.sender == admin, \\\"Only admin can call this function\\\"); // Only the timelock can call this function\\n        require(\\n            !proposal65FixExecuted,\\n            \\\"Already executed this one-off function\\\"\\n        ); // Require that this function is only called once\\n        require(affectedUsers.length == amounts.length, \\\"Invalid input\\\");\\n\\n        // Loop variables\\n        address user;\\n        uint256 currentAccrual;\\n        uint256 amountToSubtract;\\n        uint256 newAccrual;\\n\\n        // Iterate through all affected users\\n        for (uint256 i = 0; i < affectedUsers.length; ++i) {\\n            user = affectedUsers[i];\\n            currentAccrual = compAccrued[user];\\n\\n            amountToSubtract = amounts[i];\\n\\n            // The case where the user has claimed and received an incorrect amount of COMP.\\n            // The user has less currently accrued than the amount they incorrectly received.\\n            if (amountToSubtract > currentAccrual) {\\n                // Amount of COMP the user owes the protocol\\n                uint256 accountReceivable = amountToSubtract - currentAccrual; // Underflow safe since amountToSubtract > currentAccrual\\n\\n                uint256 oldReceivable = compReceivable[user];\\n                uint256 newReceivable = add_(oldReceivable, accountReceivable);\\n\\n                // Accounting: record the COMP debt for the user\\n                compReceivable[user] = newReceivable;\\n\\n                emit CompReceivableUpdated(user, oldReceivable, newReceivable);\\n\\n                amountToSubtract = currentAccrual;\\n            }\\n\\n            if (amountToSubtract > 0) {\\n                // Subtract the bad accrual amount from what they have accrued.\\n                // Users will keep whatever they have correctly accrued.\\n                compAccrued[user] = newAccrual = sub_(\\n                    currentAccrual,\\n                    amountToSubtract\\n                );\\n\\n                emit CompAccruedAdjusted(user, currentAccrual, newAccrual);\\n            }\\n        }\\n\\n        proposal65FixExecuted = true; // Makes it so that this function cannot be called again\\n    }\\n\\n    /**\\n     * @notice Checks caller is admin, or this contract is becoming the new implementation\\n     */\\n    function adminOrInitializing() internal view returns (bool) {\\n        return msg.sender == admin || msg.sender == comptrollerImplementation;\\n    }\\n\\n    /*** Comp Distribution ***/\\n\\n    /**\\n     * @notice Set COMP speed for a single market\\n     * @param cToken The market whose COMP speed to update\\n     * @param supplySpeed New supply-side COMP speed for market\\n     * @param borrowSpeed New borrow-side COMP speed for market\\n     */\\n    function setCompSpeedInternal(\\n        CToken cToken,\\n        uint256 supplySpeed,\\n        uint256 borrowSpeed\\n    ) internal {\\n        Market storage market = markets[address(cToken)];\\n        require(market.isListed, \\\"comp market is not listed\\\");\\n\\n        if (compSupplySpeeds[address(cToken)] != supplySpeed) {\\n            // Supply speed updated so let's update supply state to ensure that\\n            //  1. COMP accrued properly for the old speed, and\\n            //  2. COMP accrued at the new speed starts after this block.\\n            updateCompSupplyIndex(address(cToken));\\n\\n            // Update speed and emit event\\n            compSupplySpeeds[address(cToken)] = supplySpeed;\\n            emit CompSupplySpeedUpdated(cToken, supplySpeed);\\n        }\\n\\n        if (compBorrowSpeeds[address(cToken)] != borrowSpeed) {\\n            // Borrow speed updated so let's update borrow state to ensure that\\n            //  1. COMP accrued properly for the old speed, and\\n            //  2. COMP accrued at the new speed starts after this block.\\n            Exp memory borrowIndex = Exp({mantissa: cToken.borrowIndex()});\\n            updateCompBorrowIndex(address(cToken), borrowIndex);\\n\\n            // Update speed and emit event\\n            compBorrowSpeeds[address(cToken)] = borrowSpeed;\\n            emit CompBorrowSpeedUpdated(cToken, borrowSpeed);\\n        }\\n    }\\n\\n    /**\\n     * @notice Accrue COMP to the market by updating the supply index\\n     * @param cToken The market whose supply index to update\\n     * @dev Index is a cumulative sum of the COMP per cToken accrued.\\n     */\\n    function updateCompSupplyIndex(address cToken) internal {\\n        CompMarketState storage supplyState = compSupplyState[cToken];\\n        uint256 supplySpeed = compSupplySpeeds[cToken];\\n        uint32 blockNumber = safe32(\\n            getBlockNumber(),\\n            \\\"block number exceeds 32 bits\\\"\\n        );\\n        uint256 deltaBlocks = sub_(\\n            uint256(blockNumber),\\n            uint256(supplyState.block)\\n        );\\n        if (deltaBlocks > 0 && supplySpeed > 0) {\\n            uint256 supplyTokens = CToken(cToken).totalSupply();\\n            uint256 compAccrued = mul_(deltaBlocks, supplySpeed);\\n            Double memory ratio = supplyTokens > 0\\n                ? fraction(compAccrued, supplyTokens)\\n                : Double({mantissa: 0});\\n            supplyState.index = safe224(\\n                add_(Double({mantissa: supplyState.index}), ratio).mantissa,\\n                \\\"new index exceeds 224 bits\\\"\\n            );\\n            supplyState.block = blockNumber;\\n        } else if (deltaBlocks > 0) {\\n            supplyState.block = blockNumber;\\n        }\\n\\n        (bool success, ) = getExternalRewardDistributorAddress().call(\\n            abi.encodeWithSignature(\\\"notifySupplyIndex(address)\\\", cToken)\\n        );\\n    }\\n\\n    /**\\n     * @notice Accrue COMP to the market by updating the borrow index\\n     * @param cToken The market whose borrow index to update\\n     * @dev Index is a cumulative sum of the COMP per cToken accrued.\\n     */\\n    function updateCompBorrowIndex(\\n        address cToken,\\n        Exp memory marketBorrowIndex\\n    ) internal {\\n        CompMarketState storage borrowState = compBorrowState[cToken];\\n        uint256 borrowSpeed = compBorrowSpeeds[cToken];\\n        uint32 blockNumber = safe32(\\n            getBlockNumber(),\\n            \\\"block number exceeds 32 bits\\\"\\n        );\\n        uint256 deltaBlocks = sub_(\\n            uint256(blockNumber),\\n            uint256(borrowState.block)\\n        );\\n        if (deltaBlocks > 0 && borrowSpeed > 0) {\\n            uint256 borrowAmount = div_(\\n                CToken(cToken).totalBorrows(),\\n                marketBorrowIndex\\n            );\\n            uint256 compAccrued = mul_(deltaBlocks, borrowSpeed);\\n            Double memory ratio = borrowAmount > 0\\n                ? fraction(compAccrued, borrowAmount)\\n                : Double({mantissa: 0});\\n            borrowState.index = safe224(\\n                add_(Double({mantissa: borrowState.index}), ratio).mantissa,\\n                \\\"new index exceeds 224 bits\\\"\\n            );\\n            borrowState.block = blockNumber;\\n        } else if (deltaBlocks > 0) {\\n            borrowState.block = blockNumber;\\n        }\\n\\n        (bool success, ) = getExternalRewardDistributorAddress().call(\\n            abi.encodeWithSignature(\\\"notifyBorrowIndex(address)\\\", cToken)\\n        );\\n    }\\n\\n    /**\\n     * @notice Calculate COMP accrued by a supplier and possibly transfer it to them\\n     * @param cToken The market in which the supplier is interacting\\n     * @param supplier The address of the supplier to distribute COMP to\\n     */\\n    function distributeSupplierComp(address cToken, address supplier) internal {\\n        // TODO: Don't distribute supplier COMP if the user is not in the supplier market.\\n        // This check should be as gas efficient as possible as distributeSupplierComp is called in many places.\\n        // - We really don't want to call an external contract as that's quite expensive.\\n\\n        CompMarketState storage supplyState = compSupplyState[cToken];\\n        uint256 supplyIndex = supplyState.index;\\n        uint256 supplierIndex = compSupplierIndex[cToken][supplier];\\n\\n        // Update supplier's index to the current index since we are distributing accrued COMP\\n        compSupplierIndex[cToken][supplier] = supplyIndex;\\n\\n        if (supplierIndex == 0 && supplyIndex >= compInitialIndex) {\\n            // Covers the case where users supplied tokens before the market's supply state index was set.\\n            // Rewards the user with COMP accrued from the start of when supplier rewards were first\\n            // set for the market.\\n            supplierIndex = compInitialIndex;\\n        }\\n\\n        // Calculate change in the cumulative sum of the COMP per cToken accrued\\n        Double memory deltaIndex = Double({\\n            mantissa: sub_(supplyIndex, supplierIndex)\\n        });\\n\\n        uint256 supplierTokens = CToken(cToken).balanceOf(supplier);\\n\\n        // Calculate COMP accrued: cTokenAmount * accruedPerCToken\\n        uint256 supplierDelta = mul_(supplierTokens, deltaIndex);\\n\\n        uint256 supplierAccrued = add_(compAccrued[supplier], supplierDelta);\\n        compAccrued[supplier] = supplierAccrued;\\n\\n        emit DistributedSupplierComp(\\n            CToken(cToken),\\n            supplier,\\n            supplierDelta,\\n            supplyIndex\\n        );\\n\\n        (bool success, ) = getExternalRewardDistributorAddress().call(\\n            abi.encodeWithSignature(\\n                \\\"notifySupplier(address,address)\\\",\\n                cToken,\\n                supplier\\n            )\\n        );\\n    }\\n\\n    /**\\n     * @notice Calculate COMP accrued by a borrower and possibly transfer it to them\\n     * @dev Borrowers will not begin to accrue until after the first interaction with the protocol.\\n     * @param cToken The market in which the borrower is interacting\\n     * @param borrower The address of the borrower to distribute COMP to\\n     */\\n    function distributeBorrowerComp(\\n        address cToken,\\n        address borrower,\\n        Exp memory marketBorrowIndex\\n    ) internal {\\n        // TODO: Don't distribute supplier COMP if the user is not in the borrower market.\\n        // This check should be as gas efficient as possible as distributeBorrowerComp is called in many places.\\n        // - We really don't want to call an external contract as that's quite expensive.\\n\\n        CompMarketState storage borrowState = compBorrowState[cToken];\\n        uint256 borrowIndex = borrowState.index;\\n        uint256 borrowerIndex = compBorrowerIndex[cToken][borrower];\\n\\n        // Update borrowers's index to the current index since we are distributing accrued COMP\\n        compBorrowerIndex[cToken][borrower] = borrowIndex;\\n\\n        if (borrowerIndex == 0 && borrowIndex >= compInitialIndex) {\\n            // Covers the case where users borrowed tokens before the market's borrow state index was set.\\n            // Rewards the user with COMP accrued from the start of when borrower rewards were first\\n            // set for the market.\\n            borrowerIndex = compInitialIndex;\\n        }\\n\\n        // Calculate change in the cumulative sum of the COMP per borrowed unit accrued\\n        Double memory deltaIndex = Double({\\n            mantissa: sub_(borrowIndex, borrowerIndex)\\n        });\\n\\n        uint256 borrowerAmount = div_(\\n            CToken(cToken).borrowBalanceStored(borrower),\\n            marketBorrowIndex\\n        );\\n\\n        // Calculate COMP accrued: cTokenAmount * accruedPerBorrowedUnit\\n        uint256 borrowerDelta = mul_(borrowerAmount, deltaIndex);\\n\\n        uint256 borrowerAccrued = add_(compAccrued[borrower], borrowerDelta);\\n        compAccrued[borrower] = borrowerAccrued;\\n\\n        emit DistributedBorrowerComp(\\n            CToken(cToken),\\n            borrower,\\n            borrowerDelta,\\n            borrowIndex\\n        );\\n\\n        (bool success, ) = getExternalRewardDistributorAddress().call(\\n            abi.encodeWithSignature(\\n                \\\"notifyBorrower(address,address)\\\",\\n                cToken,\\n                borrower\\n            )\\n        );\\n    }\\n\\n    /**\\n     * @notice Calculate additional accrued COMP for a contributor since last accrual\\n     * @param contributor The address to calculate contributor rewards for\\n     */\\n    function updateContributorRewards(address contributor) public {\\n        uint256 compSpeed = compContributorSpeeds[contributor];\\n        uint256 blockNumber = getBlockNumber();\\n        uint256 deltaBlocks = sub_(\\n            blockNumber,\\n            lastContributorBlock[contributor]\\n        );\\n        if (deltaBlocks > 0 && compSpeed > 0) {\\n            uint256 newAccrued = mul_(deltaBlocks, compSpeed);\\n            uint256 contributorAccrued = add_(\\n                compAccrued[contributor],\\n                newAccrued\\n            );\\n\\n            compAccrued[contributor] = contributorAccrued;\\n            lastContributorBlock[contributor] = blockNumber;\\n        }\\n    }\\n\\n    /**\\n     * @notice Claim all the comp accrued by holder in all markets\\n     * @param holder The address to claim COMP for\\n     */\\n    function claimComp(address holder) public {\\n        return claimComp(holder, allMarkets);\\n    }\\n\\n    /**\\n     * @notice Claim all the comp accrued by holder in the specified markets\\n     * @param holder The address to claim COMP for\\n     * @param cTokens The list of markets to claim COMP in\\n     */\\n    function claimComp(address holder, CToken[] memory cTokens) public {\\n        address[] memory holders = new address[](1);\\n        holders[0] = holder;\\n        claimComp(holders, cTokens, true, true);\\n    }\\n\\n    /**\\n     * @notice Claim all comp accrued by the holders\\n     * @param holders The addresses to claim COMP for\\n     * @param cTokens The list of markets to claim COMP in\\n     * @param borrowers Whether or not to claim COMP earned by borrowing\\n     * @param suppliers Whether or not to claim COMP earned by supplying\\n     */\\n    function claimComp(\\n        address[] memory holders,\\n        CToken[] memory cTokens,\\n        bool borrowers,\\n        bool suppliers\\n    ) public {\\n        for (uint256 i = 0; i < cTokens.length; i++) {\\n            CToken cToken = cTokens[i];\\n            require(markets[address(cToken)].isListed, \\\"market must be listed\\\");\\n            if (borrowers == true) {\\n                Exp memory borrowIndex = Exp({mantissa: cToken.borrowIndex()});\\n                updateCompBorrowIndex(address(cToken), borrowIndex);\\n                for (uint256 j = 0; j < holders.length; j++) {\\n                    distributeBorrowerComp(\\n                        address(cToken),\\n                        holders[j],\\n                        borrowIndex\\n                    );\\n                }\\n            }\\n            if (suppliers == true) {\\n                updateCompSupplyIndex(address(cToken));\\n                for (uint256 j = 0; j < holders.length; j++) {\\n                    distributeSupplierComp(address(cToken), holders[j]);\\n                }\\n            }\\n        }\\n        for (uint256 j = 0; j < holders.length; j++) {\\n            compAccrued[holders[j]] = grantCompInternal(\\n                holders[j],\\n                compAccrued[holders[j]]\\n            );\\n        }\\n\\n        (bool success, ) = getExternalRewardDistributorAddress().call(\\n            abi.encodeWithSignature(\\\"claim(address[])\\\", holders)\\n        );\\n    }\\n\\n    /**\\n     * @notice Transfer COMP to the user\\n     * @dev Note: If there is not enough COMP, we do not perform the transfer all.\\n     * @param user The address of the user to transfer COMP to\\n     * @param amount The amount of COMP to (possibly) transfer\\n     * @return The amount of COMP which was NOT transferred to the user\\n     */\\n    function grantCompInternal(\\n        address user,\\n        uint256 amount\\n    ) internal returns (uint256) {\\n        Comp comp = Comp(getCompAddress());\\n        uint256 compRemaining = comp.balanceOf(address(this));\\n        if (amount > 0 && amount <= compRemaining) {\\n            comp.transfer(user, amount);\\n            return 0;\\n        }\\n        return amount;\\n    }\\n\\n    /*** Comp Distribution Admin ***/\\n\\n    /**\\n     * @notice Transfer COMP to the recipient\\n     * @dev Note: If there is not enough COMP, we do not perform the transfer all.\\n     * @param recipient The address of the recipient to transfer COMP to\\n     * @param amount The amount of COMP to (possibly) transfer\\n     */\\n    function _grantComp(address recipient, uint256 amount) public {\\n        require(adminOrInitializing(), \\\"only admin can grant comp\\\");\\n        uint256 amountLeft = grantCompInternal(recipient, amount);\\n        require(amountLeft == 0, \\\"insufficient comp for grant\\\");\\n        emit CompGranted(recipient, amount);\\n    }\\n\\n    /**\\n     * @notice Set COMP borrow and supply speeds for the specified markets.\\n     * @param cTokens The markets whose COMP speed to update.\\n     * @param supplySpeeds New supply-side COMP speed for the corresponding market.\\n     * @param borrowSpeeds New borrow-side COMP speed for the corresponding market.\\n     */\\n    function _setCompSpeeds(\\n        CToken[] memory cTokens,\\n        uint256[] memory supplySpeeds,\\n        uint256[] memory borrowSpeeds\\n    ) public {\\n        require(adminOrInitializing(), \\\"only admin can set comp speed\\\");\\n\\n        uint256 numTokens = cTokens.length;\\n        require(\\n            numTokens == supplySpeeds.length &&\\n                numTokens == borrowSpeeds.length,\\n            \\\"Comptroller::_setCompSpeeds invalid input\\\"\\n        );\\n\\n        for (uint256 i = 0; i < numTokens; ++i) {\\n            setCompSpeedInternal(cTokens[i], supplySpeeds[i], borrowSpeeds[i]);\\n        }\\n    }\\n\\n    /**\\n     * @notice Set COMP speed for a single contributor\\n     * @param contributor The contributor whose COMP speed to update\\n     * @param compSpeed New COMP speed for contributor\\n     */\\n    function _setContributorCompSpeed(\\n        address contributor,\\n        uint256 compSpeed\\n    ) public {\\n        require(adminOrInitializing(), \\\"only admin can set comp speed\\\");\\n\\n        // note that COMP speed could be set to 0 to halt liquidity rewards for a contributor\\n        updateContributorRewards(contributor);\\n        if (compSpeed == 0) {\\n            // release storage\\n            delete lastContributorBlock[contributor];\\n        } else {\\n            lastContributorBlock[contributor] = getBlockNumber();\\n        }\\n        compContributorSpeeds[contributor] = compSpeed;\\n\\n        emit ContributorCompSpeedUpdated(contributor, compSpeed);\\n    }\\n\\n    /**\\n     * @notice Return all of the markets\\n     * @dev The automatic getter may be used to access an individual market.\\n     * @return The list of market addresses\\n     */\\n    function getAllMarkets() public view returns (CToken[] memory) {\\n        return allMarkets;\\n    }\\n\\n    /**\\n     * @notice Returns true if the given cToken market has been deprecated\\n     * @dev All borrows in a deprecated cToken market can be immediately liquidated\\n     * @param cToken The market to check if deprecated\\n     */\\n    function isDeprecated(CToken cToken) public view returns (bool) {\\n        return\\n            markets[address(cToken)].collateralFactorMantissa == 0 &&\\n            borrowGuardianPaused[address(cToken)] == true &&\\n            cToken.reserveFactorMantissa() == 1e18;\\n    }\\n\\n    function getBlockNumber() public view virtual returns (uint256) {\\n        return block.timestamp;\\n    }\\n\\n    /**\\n     * @notice Return the address of the SONNE token\\n     * @return The address of SONNE\\n     */\\n    function getCompAddress() public view virtual returns (address) {\\n        return 0x22a2488fE295047Ba13BD8cCCdBC8361DBD8cf7c;\\n    }\\n\\n    /**\\n     * @notice Return the address of the external reward distributor\\n     * @return The address of the external reward distributor\\n     */\\n    function getExternalRewardDistributorAddress()\\n        public\\n        view\\n        virtual\\n        returns (address)\\n    {\\n        return 0xd86C8d4279CCaFbec840c782BcC50D201f277419;\\n    }\\n}\\n\",\"keccak256\":\"0xb411da4c4d2b8545051246edd79cfb574820ccbe580b4c7bc603a43fc456a7c6\",\"license\":\"BSD-3-Clause\"},\"contracts/ComptrollerInterface.sol\":{\"content\":\"// SPDX-License-Identifier: BSD-3-Clause\\npragma solidity ^0.8.10;\\n\\nabstract contract ComptrollerInterface {\\n    /// @notice Indicator that this is a Comptroller contract (for inspection)\\n    bool public constant isComptroller = true;\\n\\n    /*** Assets You Are In ***/\\n\\n    function enterMarkets(address[] calldata cTokens) virtual external returns (uint[] memory);\\n    function exitMarket(address cToken) virtual external returns (uint);\\n\\n    /*** Policy Hooks ***/\\n\\n    function mintAllowed(address cToken, address minter, uint mintAmount) virtual external returns (uint);\\n    function mintVerify(address cToken, address minter, uint mintAmount, uint mintTokens) virtual external;\\n\\n    function redeemAllowed(address cToken, address redeemer, uint redeemTokens) virtual external returns (uint);\\n    function redeemVerify(address cToken, address redeemer, uint redeemAmount, uint redeemTokens) virtual external;\\n\\n    function borrowAllowed(address cToken, address borrower, uint borrowAmount) virtual external returns (uint);\\n    function borrowVerify(address cToken, address borrower, uint borrowAmount) virtual external;\\n\\n    function repayBorrowAllowed(\\n        address cToken,\\n        address payer,\\n        address borrower,\\n        uint repayAmount) virtual external returns (uint);\\n    function repayBorrowVerify(\\n        address cToken,\\n        address payer,\\n        address borrower,\\n        uint repayAmount,\\n        uint borrowerIndex) virtual external;\\n\\n    function liquidateBorrowAllowed(\\n        address cTokenBorrowed,\\n        address cTokenCollateral,\\n        address liquidator,\\n        address borrower,\\n        uint repayAmount) virtual external returns (uint);\\n    function liquidateBorrowVerify(\\n        address cTokenBorrowed,\\n        address cTokenCollateral,\\n        address liquidator,\\n        address borrower,\\n        uint repayAmount,\\n        uint seizeTokens) virtual external;\\n\\n    function seizeAllowed(\\n        address cTokenCollateral,\\n        address cTokenBorrowed,\\n        address liquidator,\\n        address borrower,\\n        uint seizeTokens) virtual external returns (uint);\\n    function seizeVerify(\\n        address cTokenCollateral,\\n        address cTokenBorrowed,\\n        address liquidator,\\n        address borrower,\\n        uint seizeTokens) virtual external;\\n\\n    function transferAllowed(address cToken, address src, address dst, uint transferTokens) virtual external returns (uint);\\n    function transferVerify(address cToken, address src, address dst, uint transferTokens) virtual external;\\n\\n    /*** Liquidity/Liquidation Calculations ***/\\n\\n    function liquidateCalculateSeizeTokens(\\n        address cTokenBorrowed,\\n        address cTokenCollateral,\\n        uint repayAmount) virtual external view returns (uint, uint);\\n}\\n\",\"keccak256\":\"0x4111ff0414696caca696cf36ecf3add15133933b51ba57c56cfb08989c82d44f\",\"license\":\"BSD-3-Clause\"},\"contracts/ComptrollerStorage.sol\":{\"content\":\"// SPDX-License-Identifier: BSD-3-Clause\\npragma solidity ^0.8.10;\\n\\nimport \\\"./CToken.sol\\\";\\nimport \\\"./PriceOracle.sol\\\";\\n\\ncontract UnitrollerAdminStorage {\\n    /**\\n     * @notice Administrator for this contract\\n     */\\n    address public admin;\\n\\n    /**\\n     * @notice Pending administrator for this contract\\n     */\\n    address public pendingAdmin;\\n\\n    /**\\n     * @notice Active brains of Unitroller\\n     */\\n    address public comptrollerImplementation;\\n\\n    /**\\n     * @notice Pending brains of Unitroller\\n     */\\n    address public pendingComptrollerImplementation;\\n}\\n\\ncontract ComptrollerV1Storage is UnitrollerAdminStorage {\\n    /**\\n     * @notice Oracle which gives the price of any given asset\\n     */\\n    PriceOracle public oracle;\\n\\n    /**\\n     * @notice Multiplier used to calculate the maximum repayAmount when liquidating a borrow\\n     */\\n    uint256 public closeFactorMantissa;\\n\\n    /**\\n     * @notice Multiplier representing the discount on collateral that a liquidator receives\\n     */\\n    uint256 public liquidationIncentiveMantissa;\\n\\n    /**\\n     * @notice Max number of assets a single account can participate in (borrow or use as collateral)\\n     */\\n    uint256 public maxAssets;\\n\\n    /**\\n     * @notice Per-account mapping of \\\"assets you are in\\\", capped by maxAssets\\n     */\\n    mapping(address => CToken[]) public accountAssets;\\n}\\n\\ncontract ComptrollerV2Storage is ComptrollerV1Storage {\\n    struct Market {\\n        // Whether or not this market is listed\\n        bool isListed;\\n        //  Multiplier representing the most one can borrow against their collateral in this market.\\n        //  For instance, 0.9 to allow borrowing 90% of collateral value.\\n        //  Must be between 0 and 1, and stored as a mantissa.\\n        uint256 collateralFactorMantissa;\\n        // Per-market mapping of \\\"accounts in this asset\\\"\\n        mapping(address => bool) accountMembership;\\n        // Whether or not this market receives COMP\\n        bool isComped;\\n    }\\n\\n    /**\\n     * @notice Official mapping of cTokens -> Market metadata\\n     * @dev Used e.g. to determine if a market is supported\\n     */\\n    mapping(address => Market) public markets;\\n\\n    /**\\n     * @notice The Pause Guardian can pause certain actions as a safety mechanism.\\n     *  Actions which allow users to remove their own assets cannot be paused.\\n     *  Liquidation / seizing / transfer can only be paused globally, not by market.\\n     */\\n    address public pauseGuardian;\\n    bool public _mintGuardianPaused;\\n    bool public _borrowGuardianPaused;\\n    bool public transferGuardianPaused;\\n    bool public seizeGuardianPaused;\\n    mapping(address => bool) public mintGuardianPaused;\\n    mapping(address => bool) public borrowGuardianPaused;\\n}\\n\\ncontract ComptrollerV3Storage is ComptrollerV2Storage {\\n    struct CompMarketState {\\n        // The market's last updated compBorrowIndex or compSupplyIndex\\n        uint224 index;\\n        // The block number the index was last updated at\\n        uint32 block;\\n    }\\n\\n    /// @notice A list of all markets\\n    CToken[] public allMarkets;\\n\\n    /// @notice The rate at which the flywheel distributes COMP, per block\\n    uint256 public compRate;\\n\\n    /// @notice The portion of compRate that each market currently receives\\n    mapping(address => uint256) public compSpeeds;\\n\\n    /// @notice The COMP market supply state for each market\\n    mapping(address => CompMarketState) public compSupplyState;\\n\\n    /// @notice The COMP market borrow state for each market\\n    mapping(address => CompMarketState) public compBorrowState;\\n\\n    /// @notice The COMP borrow index for each market for each supplier as of the last time they accrued COMP\\n    mapping(address => mapping(address => uint256)) public compSupplierIndex;\\n\\n    /// @notice The COMP borrow index for each market for each borrower as of the last time they accrued COMP\\n    mapping(address => mapping(address => uint256)) public compBorrowerIndex;\\n\\n    /// @notice The COMP accrued but not yet transferred to each user\\n    mapping(address => uint256) public compAccrued;\\n}\\n\\ncontract ComptrollerV4Storage is ComptrollerV3Storage {\\n    // @notice The borrowCapGuardian can set borrowCaps to any number for any market. Lowering the borrow cap could disable borrowing on the given market.\\n    address public borrowCapGuardian;\\n\\n    // @notice Borrow caps enforced by borrowAllowed for each cToken address. Defaults to zero which corresponds to unlimited borrowing.\\n    mapping(address => uint256) public borrowCaps;\\n}\\n\\ncontract ComptrollerV5Storage is ComptrollerV4Storage {\\n    /// @notice The portion of COMP that each contributor receives per block\\n    mapping(address => uint256) public compContributorSpeeds;\\n\\n    /// @notice Last block at which a contributor's COMP rewards have been allocated\\n    mapping(address => uint256) public lastContributorBlock;\\n}\\n\\ncontract ComptrollerV6Storage is ComptrollerV5Storage {\\n    /// @notice The rate at which comp is distributed to the corresponding borrow market (per block)\\n    mapping(address => uint256) public compBorrowSpeeds;\\n\\n    /// @notice The rate at which comp is distributed to the corresponding supply market (per block)\\n    mapping(address => uint256) public compSupplySpeeds;\\n}\\n\\ncontract ComptrollerV7Storage is ComptrollerV6Storage {\\n    /// @notice Flag indicating whether the function to fix COMP accruals has been executed (RE: proposal 62 bug)\\n    bool public proposal65FixExecuted;\\n\\n    /// @notice Accounting storage mapping account addresses to how much COMP they owe the protocol.\\n    mapping(address => uint256) public compReceivable;\\n}\\n\\ncontract ComptrollerV8Storage is ComptrollerV7Storage {\\n    // @notice The supplyCapGuardian can set supplyCaps to any number for any market. Lowering the supply cap could disable supplying on the given market.\\n    address public supplyCapGuardian;\\n\\n    // @notice Supply caps enforced by supplyAllowed for each cToken address. Defaults to zero which corresponds to unlimited supplying.\\n    mapping(address => uint256) public supplyCaps;\\n}\\n\",\"keccak256\":\"0xc95f5176831f750bf41f8c20e013c8ee56d000a64bac4b4af3a86aad26468368\",\"license\":\"BSD-3-Clause\"},\"contracts/EIP20Interface.sol\":{\"content\":\"// SPDX-License-Identifier: BSD-3-Clause\\npragma solidity ^0.8.10;\\n\\n/**\\n * @title ERC 20 Token Standard Interface\\n *  https://eips.ethereum.org/EIPS/eip-20\\n */\\ninterface EIP20Interface {\\n    function name() external view returns (string memory);\\n    function symbol() external view returns (string memory);\\n    function decimals() external view returns (uint8);\\n\\n    /**\\n      * @notice Get the total number of tokens in circulation\\n      * @return The supply of tokens\\n      */\\n    function totalSupply() external view returns (uint256);\\n\\n    /**\\n     * @notice Gets the balance of the specified address\\n     * @param owner The address from which the balance will be retrieved\\n     * @return balance The balance\\n     */\\n    function balanceOf(address owner) external view returns (uint256 balance);\\n\\n    /**\\n      * @notice Transfer `amount` tokens from `msg.sender` to `dst`\\n      * @param dst The address of the destination account\\n      * @param amount The number of tokens to transfer\\n      * @return success Whether or not the transfer succeeded\\n      */\\n    function transfer(address dst, uint256 amount) external returns (bool success);\\n\\n    /**\\n      * @notice Transfer `amount` tokens from `src` to `dst`\\n      * @param src The address of the source account\\n      * @param dst The address of the destination account\\n      * @param amount The number of tokens to transfer\\n      * @return success Whether or not the transfer succeeded\\n      */\\n    function transferFrom(address src, address dst, uint256 amount) external returns (bool success);\\n\\n    /**\\n      * @notice Approve `spender` to transfer up to `amount` from `src`\\n      * @dev This will overwrite the approval amount for `spender`\\n      *  and is subject to issues noted [here](https://eips.ethereum.org/EIPS/eip-20#approve)\\n      * @param spender The address of the account which may transfer tokens\\n      * @param amount The number of tokens that are approved (-1 means infinite)\\n      * @return success Whether or not the approval succeeded\\n      */\\n    function approve(address spender, uint256 amount) external returns (bool success);\\n\\n    /**\\n      * @notice Get the current allowance from `owner` for `spender`\\n      * @param owner The address of the account which owns the tokens to be spent\\n      * @param spender The address of the account which may transfer tokens\\n      * @return remaining The number of tokens allowed to be spent (-1 means infinite)\\n      */\\n    function allowance(address owner, address spender) external view returns (uint256 remaining);\\n\\n    event Transfer(address indexed from, address indexed to, uint256 amount);\\n    event Approval(address indexed owner, address indexed spender, uint256 amount);\\n}\\n\",\"keccak256\":\"0xf44fc7783d4a0060119f0096a122c3f305c7a03da75aa21408393d8d7a2e649b\",\"license\":\"BSD-3-Clause\"},\"contracts/EIP20NonStandardInterface.sol\":{\"content\":\"// SPDX-License-Identifier: BSD-3-Clause\\npragma solidity ^0.8.10;\\n\\n/**\\n * @title EIP20NonStandardInterface\\n * @dev Version of ERC20 with no return values for `transfer` and `transferFrom`\\n *  See https://medium.com/coinmonks/missing-return-value-bug-at-least-130-tokens-affected-d67bf08521ca\\n */\\ninterface EIP20NonStandardInterface {\\n\\n    /**\\n     * @notice Get the total number of tokens in circulation\\n     * @return The supply of tokens\\n     */\\n    function totalSupply() external view returns (uint256);\\n\\n    /**\\n     * @notice Gets the balance of the specified address\\n     * @param owner The address from which the balance will be retrieved\\n     * @return balance The balance\\n     */\\n    function balanceOf(address owner) external view returns (uint256 balance);\\n\\n    ///\\n    /// !!!!!!!!!!!!!!\\n    /// !!! NOTICE !!! `transfer` does not return a value, in violation of the ERC-20 specification\\n    /// !!!!!!!!!!!!!!\\n    ///\\n\\n    /**\\n      * @notice Transfer `amount` tokens from `msg.sender` to `dst`\\n      * @param dst The address of the destination account\\n      * @param amount The number of tokens to transfer\\n      */\\n    function transfer(address dst, uint256 amount) external;\\n\\n    ///\\n    /// !!!!!!!!!!!!!!\\n    /// !!! NOTICE !!! `transferFrom` does not return a value, in violation of the ERC-20 specification\\n    /// !!!!!!!!!!!!!!\\n    ///\\n\\n    /**\\n      * @notice Transfer `amount` tokens from `src` to `dst`\\n      * @param src The address of the source account\\n      * @param dst The address of the destination account\\n      * @param amount The number of tokens to transfer\\n      */\\n    function transferFrom(address src, address dst, uint256 amount) external;\\n\\n    /**\\n      * @notice Approve `spender` to transfer up to `amount` from `src`\\n      * @dev This will overwrite the approval amount for `spender`\\n      *  and is subject to issues noted [here](https://eips.ethereum.org/EIPS/eip-20#approve)\\n      * @param spender The address of the account which may transfer tokens\\n      * @param amount The number of tokens that are approved\\n      * @return success Whether or not the approval succeeded\\n      */\\n    function approve(address spender, uint256 amount) external returns (bool success);\\n\\n    /**\\n      * @notice Get the current allowance from `owner` for `spender`\\n      * @param owner The address of the account which owns the tokens to be spent\\n      * @param spender The address of the account which may transfer tokens\\n      * @return remaining The number of tokens allowed to be spent\\n      */\\n    function allowance(address owner, address spender) external view returns (uint256 remaining);\\n\\n    event Transfer(address indexed from, address indexed to, uint256 amount);\\n    event Approval(address indexed owner, address indexed spender, uint256 amount);\\n}\\n\",\"keccak256\":\"0x5ce25bb36a4ec9490617567a24b55bc813e943bcd4411e060afffe122bea0416\",\"license\":\"BSD-3-Clause\"},\"contracts/ErrorReporter.sol\":{\"content\":\"// SPDX-License-Identifier: BSD-3-Clause\\npragma solidity ^0.8.10;\\n\\ncontract ComptrollerErrorReporter {\\n    enum Error {\\n        NO_ERROR,\\n        UNAUTHORIZED,\\n        COMPTROLLER_MISMATCH,\\n        INSUFFICIENT_SHORTFALL,\\n        INSUFFICIENT_LIQUIDITY,\\n        INVALID_CLOSE_FACTOR,\\n        INVALID_COLLATERAL_FACTOR,\\n        INVALID_LIQUIDATION_INCENTIVE,\\n        MARKET_NOT_ENTERED, // no longer possible\\n        MARKET_NOT_LISTED,\\n        MARKET_ALREADY_LISTED,\\n        MATH_ERROR,\\n        NONZERO_BORROW_BALANCE,\\n        PRICE_ERROR,\\n        REJECTION,\\n        SNAPSHOT_ERROR,\\n        TOO_MANY_ASSETS,\\n        TOO_MUCH_REPAY\\n    }\\n\\n    enum FailureInfo {\\n        ACCEPT_ADMIN_PENDING_ADMIN_CHECK,\\n        ACCEPT_PENDING_IMPLEMENTATION_ADDRESS_CHECK,\\n        EXIT_MARKET_BALANCE_OWED,\\n        EXIT_MARKET_REJECTION,\\n        SET_CLOSE_FACTOR_OWNER_CHECK,\\n        SET_CLOSE_FACTOR_VALIDATION,\\n        SET_COLLATERAL_FACTOR_OWNER_CHECK,\\n        SET_COLLATERAL_FACTOR_NO_EXISTS,\\n        SET_COLLATERAL_FACTOR_VALIDATION,\\n        SET_COLLATERAL_FACTOR_WITHOUT_PRICE,\\n        SET_IMPLEMENTATION_OWNER_CHECK,\\n        SET_LIQUIDATION_INCENTIVE_OWNER_CHECK,\\n        SET_LIQUIDATION_INCENTIVE_VALIDATION,\\n        SET_MAX_ASSETS_OWNER_CHECK,\\n        SET_PENDING_ADMIN_OWNER_CHECK,\\n        SET_PENDING_IMPLEMENTATION_OWNER_CHECK,\\n        SET_PRICE_ORACLE_OWNER_CHECK,\\n        SUPPORT_MARKET_EXISTS,\\n        SUPPORT_MARKET_OWNER_CHECK,\\n        SET_PAUSE_GUARDIAN_OWNER_CHECK\\n    }\\n\\n    /**\\n      * @dev `error` corresponds to enum Error; `info` corresponds to enum FailureInfo, and `detail` is an arbitrary\\n      * contract-specific code that enables us to report opaque error codes from upgradeable contracts.\\n      **/\\n    event Failure(uint error, uint info, uint detail);\\n\\n    /**\\n      * @dev use this when reporting a known error from the money market or a non-upgradeable collaborator\\n      */\\n    function fail(Error err, FailureInfo info) internal returns (uint) {\\n        emit Failure(uint(err), uint(info), 0);\\n\\n        return uint(err);\\n    }\\n\\n    /**\\n      * @dev use this when reporting an opaque error from an upgradeable collaborator contract\\n      */\\n    function failOpaque(Error err, FailureInfo info, uint opaqueError) internal returns (uint) {\\n        emit Failure(uint(err), uint(info), opaqueError);\\n\\n        return uint(err);\\n    }\\n}\\n\\ncontract TokenErrorReporter {\\n    uint public constant NO_ERROR = 0; // support legacy return codes\\n\\n    error TransferComptrollerRejection(uint256 errorCode);\\n    error TransferNotAllowed();\\n    error TransferNotEnough();\\n    error TransferTooMuch();\\n\\n    error MintComptrollerRejection(uint256 errorCode);\\n    error MintFreshnessCheck();\\n\\n    error RedeemComptrollerRejection(uint256 errorCode);\\n    error RedeemFreshnessCheck();\\n    error RedeemTransferOutNotPossible();\\n\\n    error BorrowComptrollerRejection(uint256 errorCode);\\n    error BorrowFreshnessCheck();\\n    error BorrowCashNotAvailable();\\n\\n    error RepayBorrowComptrollerRejection(uint256 errorCode);\\n    error RepayBorrowFreshnessCheck();\\n\\n    error LiquidateComptrollerRejection(uint256 errorCode);\\n    error LiquidateFreshnessCheck();\\n    error LiquidateCollateralFreshnessCheck();\\n    error LiquidateAccrueBorrowInterestFailed(uint256 errorCode);\\n    error LiquidateAccrueCollateralInterestFailed(uint256 errorCode);\\n    error LiquidateLiquidatorIsBorrower();\\n    error LiquidateCloseAmountIsZero();\\n    error LiquidateCloseAmountIsUintMax();\\n    error LiquidateRepayBorrowFreshFailed(uint256 errorCode);\\n\\n    error LiquidateSeizeComptrollerRejection(uint256 errorCode);\\n    error LiquidateSeizeLiquidatorIsBorrower();\\n\\n    error AcceptAdminPendingAdminCheck();\\n\\n    error SetComptrollerOwnerCheck();\\n    error SetPendingAdminOwnerCheck();\\n\\n    error SetReserveFactorAdminCheck();\\n    error SetReserveFactorFreshCheck();\\n    error SetReserveFactorBoundsCheck();\\n\\n    error AddReservesFactorFreshCheck(uint256 actualAddAmount);\\n\\n    error ReduceReservesAdminCheck();\\n    error ReduceReservesFreshCheck();\\n    error ReduceReservesCashNotAvailable();\\n    error ReduceReservesCashValidation();\\n\\n    error SetInterestRateModelOwnerCheck();\\n    error SetInterestRateModelFreshCheck();\\n}\\n\",\"keccak256\":\"0xc565694807fce4d9eb218b77d2e7eb7665e0d6950cbfa9edd1e3c09e417b809c\",\"license\":\"BSD-3-Clause\"},\"contracts/ExponentialNoError.sol\":{\"content\":\"// SPDX-License-Identifier: BSD-3-Clause\\npragma solidity ^0.8.10;\\n\\n/**\\n * @title Exponential module for storing fixed-precision decimals\\n * @author Compound\\n * @notice Exp is a struct which stores decimals with a fixed precision of 18 decimal places.\\n *         Thus, if we wanted to store the 5.1, mantissa would store 5.1e18. That is:\\n *         `Exp({mantissa: 5100000000000000000})`.\\n */\\ncontract ExponentialNoError {\\n    uint constant expScale = 1e18;\\n    uint constant doubleScale = 1e36;\\n    uint constant halfExpScale = expScale/2;\\n    uint constant mantissaOne = expScale;\\n\\n    struct Exp {\\n        uint mantissa;\\n    }\\n\\n    struct Double {\\n        uint mantissa;\\n    }\\n\\n    /**\\n     * @dev Truncates the given exp to a whole number value.\\n     *      For example, truncate(Exp{mantissa: 15 * expScale}) = 15\\n     */\\n    function truncate(Exp memory exp) pure internal returns (uint) {\\n        // Note: We are not using careful math here as we're performing a division that cannot fail\\n        return exp.mantissa / expScale;\\n    }\\n\\n    /**\\n     * @dev Multiply an Exp by a scalar, then truncate to return an unsigned integer.\\n     */\\n    function mul_ScalarTruncate(Exp memory a, uint scalar) pure internal returns (uint) {\\n        Exp memory product = mul_(a, scalar);\\n        return truncate(product);\\n    }\\n\\n    /**\\n     * @dev Multiply an Exp by a scalar, truncate, then add an to an unsigned integer, returning an unsigned integer.\\n     */\\n    function mul_ScalarTruncateAddUInt(Exp memory a, uint scalar, uint addend) pure internal returns (uint) {\\n        Exp memory product = mul_(a, scalar);\\n        return add_(truncate(product), addend);\\n    }\\n\\n    /**\\n     * @dev Checks if first Exp is less than second Exp.\\n     */\\n    function lessThanExp(Exp memory left, Exp memory right) pure internal returns (bool) {\\n        return left.mantissa < right.mantissa;\\n    }\\n\\n    /**\\n     * @dev Checks if left Exp <= right Exp.\\n     */\\n    function lessThanOrEqualExp(Exp memory left, Exp memory right) pure internal returns (bool) {\\n        return left.mantissa <= right.mantissa;\\n    }\\n\\n    /**\\n     * @dev Checks if left Exp > right Exp.\\n     */\\n    function greaterThanExp(Exp memory left, Exp memory right) pure internal returns (bool) {\\n        return left.mantissa > right.mantissa;\\n    }\\n\\n    /**\\n     * @dev returns true if Exp is exactly zero\\n     */\\n    function isZeroExp(Exp memory value) pure internal returns (bool) {\\n        return value.mantissa == 0;\\n    }\\n\\n    function safe224(uint n, string memory errorMessage) pure internal returns (uint224) {\\n        require(n < 2**224, errorMessage);\\n        return uint224(n);\\n    }\\n\\n    function safe32(uint n, string memory errorMessage) pure internal returns (uint32) {\\n        require(n < 2**32, errorMessage);\\n        return uint32(n);\\n    }\\n\\n    function add_(Exp memory a, Exp memory b) pure internal returns (Exp memory) {\\n        return Exp({mantissa: add_(a.mantissa, b.mantissa)});\\n    }\\n\\n    function add_(Double memory a, Double memory b) pure internal returns (Double memory) {\\n        return Double({mantissa: add_(a.mantissa, b.mantissa)});\\n    }\\n\\n    function add_(uint a, uint b) pure internal returns (uint) {\\n        return a + b;\\n    }\\n\\n    function sub_(Exp memory a, Exp memory b) pure internal returns (Exp memory) {\\n        return Exp({mantissa: sub_(a.mantissa, b.mantissa)});\\n    }\\n\\n    function sub_(Double memory a, Double memory b) pure internal returns (Double memory) {\\n        return Double({mantissa: sub_(a.mantissa, b.mantissa)});\\n    }\\n\\n    function sub_(uint a, uint b) pure internal returns (uint) {\\n        return a - b;\\n    }\\n\\n    function mul_(Exp memory a, Exp memory b) pure internal returns (Exp memory) {\\n        return Exp({mantissa: mul_(a.mantissa, b.mantissa) / expScale});\\n    }\\n\\n    function mul_(Exp memory a, uint b) pure internal returns (Exp memory) {\\n        return Exp({mantissa: mul_(a.mantissa, b)});\\n    }\\n\\n    function mul_(uint a, Exp memory b) pure internal returns (uint) {\\n        return mul_(a, b.mantissa) / expScale;\\n    }\\n\\n    function mul_(Double memory a, Double memory b) pure internal returns (Double memory) {\\n        return Double({mantissa: mul_(a.mantissa, b.mantissa) / doubleScale});\\n    }\\n\\n    function mul_(Double memory a, uint b) pure internal returns (Double memory) {\\n        return Double({mantissa: mul_(a.mantissa, b)});\\n    }\\n\\n    function mul_(uint a, Double memory b) pure internal returns (uint) {\\n        return mul_(a, b.mantissa) / doubleScale;\\n    }\\n\\n    function mul_(uint a, uint b) pure internal returns (uint) {\\n        return a * b;\\n    }\\n\\n    function div_(Exp memory a, Exp memory b) pure internal returns (Exp memory) {\\n        return Exp({mantissa: div_(mul_(a.mantissa, expScale), b.mantissa)});\\n    }\\n\\n    function div_(Exp memory a, uint b) pure internal returns (Exp memory) {\\n        return Exp({mantissa: div_(a.mantissa, b)});\\n    }\\n\\n    function div_(uint a, Exp memory b) pure internal returns (uint) {\\n        return div_(mul_(a, expScale), b.mantissa);\\n    }\\n\\n    function div_(Double memory a, Double memory b) pure internal returns (Double memory) {\\n        return Double({mantissa: div_(mul_(a.mantissa, doubleScale), b.mantissa)});\\n    }\\n\\n    function div_(Double memory a, uint b) pure internal returns (Double memory) {\\n        return Double({mantissa: div_(a.mantissa, b)});\\n    }\\n\\n    function div_(uint a, Double memory b) pure internal returns (uint) {\\n        return div_(mul_(a, doubleScale), b.mantissa);\\n    }\\n\\n    function div_(uint a, uint b) pure internal returns (uint) {\\n        return a / b;\\n    }\\n\\n    function fraction(uint a, uint b) pure internal returns (Double memory) {\\n        return Double({mantissa: div_(mul_(a, doubleScale), b)});\\n    }\\n}\\n\",\"keccak256\":\"0x3a05062282ef8cbf6ec372abc73387ac8105a7eb0ea0f38069ebfd0f434ff98b\",\"license\":\"BSD-3-Clause\"},\"contracts/Governance/Comp.sol\":{\"content\":\"// SPDX-License-Identifier: BSD-3-Clause\\npragma solidity ^0.8.10;\\n\\ncontract Comp {\\n    /// @notice EIP-20 token name for this token\\n    string public constant name = \\\"Compound\\\";\\n\\n    /// @notice EIP-20 token symbol for this token\\n    string public constant symbol = \\\"COMP\\\";\\n\\n    /// @notice EIP-20 token decimals for this token\\n    uint8 public constant decimals = 18;\\n\\n    /// @notice Total number of tokens in circulation\\n    uint256 public constant totalSupply = 10000000e18; // 10 million Comp\\n\\n    /// @notice Allowance amounts on behalf of others\\n    mapping(address => mapping(address => uint96)) internal allowances;\\n\\n    /// @notice Official record of token balances for each account\\n    mapping(address => uint96) internal balances;\\n\\n    /// @notice A record of each accounts delegate\\n    mapping(address => address) public delegates;\\n\\n    /// @notice A checkpoint for marking number of votes from a given block\\n    struct Checkpoint {\\n        uint32 fromBlock;\\n        uint96 votes;\\n    }\\n\\n    /// @notice A record of votes checkpoints for each account, by index\\n    mapping(address => mapping(uint32 => Checkpoint)) public checkpoints;\\n\\n    /// @notice The number of checkpoints for each account\\n    mapping(address => uint32) public numCheckpoints;\\n\\n    /// @notice The EIP-712 typehash for the contract's domain\\n    bytes32 public constant DOMAIN_TYPEHASH =\\n        keccak256(\\n            \\\"EIP712Domain(string name,uint256 chainId,address verifyingContract)\\\"\\n        );\\n\\n    /// @notice The EIP-712 typehash for the delegation struct used by the contract\\n    bytes32 public constant DELEGATION_TYPEHASH =\\n        keccak256(\\\"Delegation(address delegatee,uint256 nonce,uint256 expiry)\\\");\\n\\n    /// @notice A record of states for signing / validating signatures\\n    mapping(address => uint256) public nonces;\\n\\n    /// @notice An event thats emitted when an account changes its delegate\\n    event DelegateChanged(\\n        address indexed delegator,\\n        address indexed fromDelegate,\\n        address indexed toDelegate\\n    );\\n\\n    /// @notice An event thats emitted when a delegate account's vote balance changes\\n    event DelegateVotesChanged(\\n        address indexed delegate,\\n        uint256 previousBalance,\\n        uint256 newBalance\\n    );\\n\\n    /// @notice The standard EIP-20 transfer event\\n    event Transfer(address indexed from, address indexed to, uint256 amount);\\n\\n    /// @notice The standard EIP-20 approval event\\n    event Approval(\\n        address indexed owner,\\n        address indexed spender,\\n        uint256 amount\\n    );\\n\\n    /**\\n     * @notice Construct a new Comp token\\n     * @param account The initial account to grant all the tokens\\n     */\\n    constructor(address account) public {\\n        balances[account] = uint96(totalSupply);\\n        emit Transfer(address(0), account, totalSupply);\\n    }\\n\\n    /**\\n     * @notice Get the number of tokens `spender` is approved to spend on behalf of `account`\\n     * @param account The address of the account holding the funds\\n     * @param spender The address of the account spending the funds\\n     * @return The number of tokens approved\\n     */\\n    function allowance(address account, address spender)\\n        external\\n        view\\n        returns (uint256)\\n    {\\n        return allowances[account][spender];\\n    }\\n\\n    /**\\n     * @notice Approve `spender` to transfer up to `amount` from `src`\\n     * @dev This will overwrite the approval amount for `spender`\\n     *  and is subject to issues noted [here](https://eips.ethereum.org/EIPS/eip-20#approve)\\n     * @param spender The address of the account which may transfer tokens\\n     * @param rawAmount The number of tokens that are approved (2^256-1 means infinite)\\n     * @return Whether or not the approval succeeded\\n     */\\n    function approve(address spender, uint256 rawAmount)\\n        external\\n        returns (bool)\\n    {\\n        uint96 amount;\\n        if (rawAmount == type(uint256).max) {\\n            amount = type(uint96).max;\\n        } else {\\n            amount = safe96(rawAmount, \\\"Comp::approve: amount exceeds 96 bits\\\");\\n        }\\n\\n        allowances[msg.sender][spender] = amount;\\n\\n        emit Approval(msg.sender, spender, amount);\\n        return true;\\n    }\\n\\n    /**\\n     * @notice Get the number of tokens held by the `account`\\n     * @param account The address of the account to get the balance of\\n     * @return The number of tokens held\\n     */\\n    function balanceOf(address account) external view returns (uint256) {\\n        return balances[account];\\n    }\\n\\n    /**\\n     * @notice Transfer `amount` tokens from `msg.sender` to `dst`\\n     * @param dst The address of the destination account\\n     * @param rawAmount The number of tokens to transfer\\n     * @return Whether or not the transfer succeeded\\n     */\\n    function transfer(address dst, uint256 rawAmount) external returns (bool) {\\n        uint96 amount = safe96(\\n            rawAmount,\\n            \\\"Comp::transfer: amount exceeds 96 bits\\\"\\n        );\\n        _transferTokens(msg.sender, dst, amount);\\n        return true;\\n    }\\n\\n    /**\\n     * @notice Transfer `amount` tokens from `src` to `dst`\\n     * @param src The address of the source account\\n     * @param dst The address of the destination account\\n     * @param rawAmount The number of tokens to transfer\\n     * @return Whether or not the transfer succeeded\\n     */\\n    function transferFrom(\\n        address src,\\n        address dst,\\n        uint256 rawAmount\\n    ) external returns (bool) {\\n        address spender = msg.sender;\\n        uint96 spenderAllowance = allowances[src][spender];\\n        uint96 amount = safe96(\\n            rawAmount,\\n            \\\"Comp::approve: amount exceeds 96 bits\\\"\\n        );\\n\\n        if (spender != src && spenderAllowance != type(uint96).max) {\\n            uint96 newAllowance = sub96(\\n                spenderAllowance,\\n                amount,\\n                \\\"Comp::transferFrom: transfer amount exceeds spender allowance\\\"\\n            );\\n            allowances[src][spender] = newAllowance;\\n\\n            emit Approval(src, spender, newAllowance);\\n        }\\n\\n        _transferTokens(src, dst, amount);\\n        return true;\\n    }\\n\\n    /**\\n     * @notice Delegate votes from `msg.sender` to `delegatee`\\n     * @param delegatee The address to delegate votes to\\n     */\\n    function delegate(address delegatee) public {\\n        return _delegate(msg.sender, delegatee);\\n    }\\n\\n    /**\\n     * @notice Delegates votes from signatory to `delegatee`\\n     * @param delegatee The address to delegate votes to\\n     * @param nonce The contract state required to match the signature\\n     * @param expiry The time at which to expire the signature\\n     * @param v The recovery byte of the signature\\n     * @param r Half of the ECDSA signature pair\\n     * @param s Half of the ECDSA signature pair\\n     */\\n    function delegateBySig(\\n        address delegatee,\\n        uint256 nonce,\\n        uint256 expiry,\\n        uint8 v,\\n        bytes32 r,\\n        bytes32 s\\n    ) public {\\n        bytes32 domainSeparator = keccak256(\\n            abi.encode(\\n                DOMAIN_TYPEHASH,\\n                keccak256(bytes(name)),\\n                getChainId(),\\n                address(this)\\n            )\\n        );\\n        bytes32 structHash = keccak256(\\n            abi.encode(DELEGATION_TYPEHASH, delegatee, nonce, expiry)\\n        );\\n        bytes32 digest = keccak256(\\n            abi.encodePacked(\\\"\\\\x19\\\\x01\\\", domainSeparator, structHash)\\n        );\\n        address signatory = ecrecover(digest, v, r, s);\\n        require(\\n            signatory != address(0),\\n            \\\"Comp::delegateBySig: invalid signature\\\"\\n        );\\n        require(\\n            nonce == nonces[signatory]++,\\n            \\\"Comp::delegateBySig: invalid nonce\\\"\\n        );\\n        require(\\n            block.timestamp <= expiry,\\n            \\\"Comp::delegateBySig: signature expired\\\"\\n        );\\n        return _delegate(signatory, delegatee);\\n    }\\n\\n    /**\\n     * @notice Gets the current votes balance for `account`\\n     * @param account The address to get votes balance\\n     * @return The number of current votes for `account`\\n     */\\n    function getCurrentVotes(address account) external view returns (uint96) {\\n        uint32 nCheckpoints = numCheckpoints[account];\\n        return\\n            nCheckpoints > 0 ? checkpoints[account][nCheckpoints - 1].votes : 0;\\n    }\\n\\n    /**\\n     * @notice Determine the prior number of votes for an account as of a block number\\n     * @dev Block number must be a finalized block or else this function will revert to prevent misinformation.\\n     * @param account The address of the account to check\\n     * @param blockNumber The block number to get the vote balance at\\n     * @return The number of votes the account had as of the given block\\n     */\\n    function getPriorVotes(address account, uint256 blockNumber)\\n        public\\n        view\\n        returns (uint96)\\n    {\\n        require(\\n            blockNumber < block.number,\\n            \\\"Comp::getPriorVotes: not yet determined\\\"\\n        );\\n\\n        uint32 nCheckpoints = numCheckpoints[account];\\n        if (nCheckpoints == 0) {\\n            return 0;\\n        }\\n\\n        // First check most recent balance\\n        if (checkpoints[account][nCheckpoints - 1].fromBlock <= blockNumber) {\\n            return checkpoints[account][nCheckpoints - 1].votes;\\n        }\\n\\n        // Next check implicit zero balance\\n        if (checkpoints[account][0].fromBlock > blockNumber) {\\n            return 0;\\n        }\\n\\n        uint32 lower = 0;\\n        uint32 upper = nCheckpoints - 1;\\n        while (upper > lower) {\\n            uint32 center = upper - (upper - lower) / 2; // ceil, avoiding overflow\\n            Checkpoint memory cp = checkpoints[account][center];\\n            if (cp.fromBlock == blockNumber) {\\n                return cp.votes;\\n            } else if (cp.fromBlock < blockNumber) {\\n                lower = center;\\n            } else {\\n                upper = center - 1;\\n            }\\n        }\\n        return checkpoints[account][lower].votes;\\n    }\\n\\n    function _delegate(address delegator, address delegatee) internal {\\n        address currentDelegate = delegates[delegator];\\n        uint96 delegatorBalance = balances[delegator];\\n        delegates[delegator] = delegatee;\\n\\n        emit DelegateChanged(delegator, currentDelegate, delegatee);\\n\\n        _moveDelegates(currentDelegate, delegatee, delegatorBalance);\\n    }\\n\\n    function _transferTokens(\\n        address src,\\n        address dst,\\n        uint96 amount\\n    ) internal {\\n        require(\\n            src != address(0),\\n            \\\"Comp::_transferTokens: cannot transfer from the zero address\\\"\\n        );\\n        require(\\n            dst != address(0),\\n            \\\"Comp::_transferTokens: cannot transfer to the zero address\\\"\\n        );\\n\\n        balances[src] = sub96(\\n            balances[src],\\n            amount,\\n            \\\"Comp::_transferTokens: transfer amount exceeds balance\\\"\\n        );\\n        balances[dst] = add96(\\n            balances[dst],\\n            amount,\\n            \\\"Comp::_transferTokens: transfer amount overflows\\\"\\n        );\\n        emit Transfer(src, dst, amount);\\n\\n        _moveDelegates(delegates[src], delegates[dst], amount);\\n    }\\n\\n    function _moveDelegates(\\n        address srcRep,\\n        address dstRep,\\n        uint96 amount\\n    ) internal {\\n        if (srcRep != dstRep && amount > 0) {\\n            if (srcRep != address(0)) {\\n                uint32 srcRepNum = numCheckpoints[srcRep];\\n                uint96 srcRepOld = srcRepNum > 0\\n                    ? checkpoints[srcRep][srcRepNum - 1].votes\\n                    : 0;\\n                uint96 srcRepNew = sub96(\\n                    srcRepOld,\\n                    amount,\\n                    \\\"Comp::_moveVotes: vote amount underflows\\\"\\n                );\\n                _writeCheckpoint(srcRep, srcRepNum, srcRepOld, srcRepNew);\\n            }\\n\\n            if (dstRep != address(0)) {\\n                uint32 dstRepNum = numCheckpoints[dstRep];\\n                uint96 dstRepOld = dstRepNum > 0\\n                    ? checkpoints[dstRep][dstRepNum - 1].votes\\n                    : 0;\\n                uint96 dstRepNew = add96(\\n                    dstRepOld,\\n                    amount,\\n                    \\\"Comp::_moveVotes: vote amount overflows\\\"\\n                );\\n                _writeCheckpoint(dstRep, dstRepNum, dstRepOld, dstRepNew);\\n            }\\n        }\\n    }\\n\\n    function _writeCheckpoint(\\n        address delegatee,\\n        uint32 nCheckpoints,\\n        uint96 oldVotes,\\n        uint96 newVotes\\n    ) internal {\\n        uint32 blockNumber = safe32(\\n            block.number,\\n            \\\"Comp::_writeCheckpoint: block number exceeds 32 bits\\\"\\n        );\\n\\n        if (\\n            nCheckpoints > 0 &&\\n            checkpoints[delegatee][nCheckpoints - 1].fromBlock == blockNumber\\n        ) {\\n            checkpoints[delegatee][nCheckpoints - 1].votes = newVotes;\\n        } else {\\n            checkpoints[delegatee][nCheckpoints] = Checkpoint(\\n                blockNumber,\\n                newVotes\\n            );\\n            numCheckpoints[delegatee] = nCheckpoints + 1;\\n        }\\n\\n        emit DelegateVotesChanged(delegatee, oldVotes, newVotes);\\n    }\\n\\n    function safe32(uint256 n, string memory errorMessage)\\n        internal\\n        pure\\n        returns (uint32)\\n    {\\n        require(n < 2**32, errorMessage);\\n        return uint32(n);\\n    }\\n\\n    function safe96(uint256 n, string memory errorMessage)\\n        internal\\n        pure\\n        returns (uint96)\\n    {\\n        require(n < 2**96, errorMessage);\\n        return uint96(n);\\n    }\\n\\n    function add96(\\n        uint96 a,\\n        uint96 b,\\n        string memory errorMessage\\n    ) internal pure returns (uint96) {\\n        uint96 c = a + b;\\n        require(c >= a, errorMessage);\\n        return c;\\n    }\\n\\n    function sub96(\\n        uint96 a,\\n        uint96 b,\\n        string memory errorMessage\\n    ) internal pure returns (uint96) {\\n        require(b <= a, errorMessage);\\n        return a - b;\\n    }\\n\\n    function getChainId() internal view returns (uint256) {\\n        uint256 chainId;\\n        assembly {\\n            chainId := chainid()\\n        }\\n        return chainId;\\n    }\\n}\\n\",\"keccak256\":\"0x24e773bf73ec45b6c0dc192d35944731fc2b92a6567af8b51569b525b24fd4b0\",\"license\":\"BSD-3-Clause\"},\"contracts/InterestRateModel.sol\":{\"content\":\"// SPDX-License-Identifier: BSD-3-Clause\\npragma solidity ^0.8.10;\\n\\n/**\\n  * @title Compound's InterestRateModel Interface\\n  * @author Compound\\n  */\\nabstract contract InterestRateModel {\\n    /// @notice Indicator that this is an InterestRateModel contract (for inspection)\\n    bool public constant isInterestRateModel = true;\\n\\n    /**\\n      * @notice Calculates the current borrow interest rate per block\\n      * @param cash The total amount of cash the market has\\n      * @param borrows The total amount of borrows the market has outstanding\\n      * @param reserves The total amount of reserves the market has\\n      * @return The borrow rate per block (as a percentage, and scaled by 1e18)\\n      */\\n    function getBorrowRate(uint cash, uint borrows, uint reserves) virtual external view returns (uint);\\n\\n    /**\\n      * @notice Calculates the current supply interest rate per block\\n      * @param cash The total amount of cash the market has\\n      * @param borrows The total amount of borrows the market has outstanding\\n      * @param reserves The total amount of reserves the market has\\n      * @param reserveFactorMantissa The current reserve factor the market has\\n      * @return The supply rate per block (as a percentage, and scaled by 1e18)\\n      */\\n    function getSupplyRate(uint cash, uint borrows, uint reserves, uint reserveFactorMantissa) virtual external view returns (uint);\\n}\\n\",\"keccak256\":\"0x470821c8ff2120381ead6f54dba5c7b4fc0209682062bde51ea20291176aa0be\",\"license\":\"BSD-3-Clause\"},\"contracts/PriceOracle.sol\":{\"content\":\"// SPDX-License-Identifier: BSD-3-Clause\\npragma solidity ^0.8.10;\\n\\nimport \\\"./CToken.sol\\\";\\n\\nabstract contract PriceOracle {\\n    /// @notice Indicator that this is a PriceOracle contract (for inspection)\\n    bool public constant isPriceOracle = true;\\n\\n    /**\\n      * @notice Get the underlying price of a cToken asset\\n      * @param cToken The cToken to get the underlying price of\\n      * @return The underlying asset price mantissa (scaled by 1e18).\\n      *  Zero means the price is unavailable.\\n      */\\n    function getUnderlyingPrice(CToken cToken) virtual external view returns (uint);\\n}\\n\",\"keccak256\":\"0x3bdb44d513360f19ba6e93960fbf37184cd7952492ab0ee4a91f514b3f2ea923\",\"license\":\"BSD-3-Clause\"},\"contracts/Unitroller.sol\":{\"content\":\"// SPDX-License-Identifier: BSD-3-Clause\\npragma solidity ^0.8.10;\\n\\nimport \\\"./ErrorReporter.sol\\\";\\nimport \\\"./ComptrollerStorage.sol\\\";\\n/**\\n * @title ComptrollerCore\\n * @dev Storage for the comptroller is at this address, while execution is delegated to the `comptrollerImplementation`.\\n * CTokens should reference this contract as their comptroller.\\n */\\ncontract Unitroller is UnitrollerAdminStorage, ComptrollerErrorReporter {\\n\\n    /**\\n      * @notice Emitted when pendingComptrollerImplementation is changed\\n      */\\n    event NewPendingImplementation(address oldPendingImplementation, address newPendingImplementation);\\n\\n    /**\\n      * @notice Emitted when pendingComptrollerImplementation is accepted, which means comptroller implementation is updated\\n      */\\n    event NewImplementation(address oldImplementation, address newImplementation);\\n\\n    /**\\n      * @notice Emitted when pendingAdmin is changed\\n      */\\n    event NewPendingAdmin(address oldPendingAdmin, address newPendingAdmin);\\n\\n    /**\\n      * @notice Emitted when pendingAdmin is accepted, which means admin is updated\\n      */\\n    event NewAdmin(address oldAdmin, address newAdmin);\\n\\n    constructor() public {\\n        // Set admin to caller\\n        admin = msg.sender;\\n    }\\n\\n    /*** Admin Functions ***/\\n    function _setPendingImplementation(address newPendingImplementation) public returns (uint) {\\n\\n        if (msg.sender != admin) {\\n            return fail(Error.UNAUTHORIZED, FailureInfo.SET_PENDING_IMPLEMENTATION_OWNER_CHECK);\\n        }\\n\\n        address oldPendingImplementation = pendingComptrollerImplementation;\\n\\n        pendingComptrollerImplementation = newPendingImplementation;\\n\\n        emit NewPendingImplementation(oldPendingImplementation, pendingComptrollerImplementation);\\n\\n        return uint(Error.NO_ERROR);\\n    }\\n\\n    /**\\n    * @notice Accepts new implementation of comptroller. msg.sender must be pendingImplementation\\n    * @dev Admin function for new implementation to accept it's role as implementation\\n    * @return uint 0=success, otherwise a failure (see ErrorReporter.sol for details)\\n    */\\n    function _acceptImplementation() public returns (uint) {\\n        // Check caller is pendingImplementation and pendingImplementation \\u2260 address(0)\\n        if (msg.sender != pendingComptrollerImplementation || pendingComptrollerImplementation == address(0)) {\\n            return fail(Error.UNAUTHORIZED, FailureInfo.ACCEPT_PENDING_IMPLEMENTATION_ADDRESS_CHECK);\\n        }\\n\\n        // Save current values for inclusion in log\\n        address oldImplementation = comptrollerImplementation;\\n        address oldPendingImplementation = pendingComptrollerImplementation;\\n\\n        comptrollerImplementation = pendingComptrollerImplementation;\\n\\n        pendingComptrollerImplementation = address(0);\\n\\n        emit NewImplementation(oldImplementation, comptrollerImplementation);\\n        emit NewPendingImplementation(oldPendingImplementation, pendingComptrollerImplementation);\\n\\n        return uint(Error.NO_ERROR);\\n    }\\n\\n\\n    /**\\n      * @notice Begins transfer of admin rights. The newPendingAdmin must call `_acceptAdmin` to finalize the transfer.\\n      * @dev Admin function to begin change of admin. The newPendingAdmin must call `_acceptAdmin` to finalize the transfer.\\n      * @param newPendingAdmin New pending admin.\\n      * @return uint 0=success, otherwise a failure (see ErrorReporter.sol for details)\\n      */\\n    function _setPendingAdmin(address newPendingAdmin) public returns (uint) {\\n        // Check caller = admin\\n        if (msg.sender != admin) {\\n            return fail(Error.UNAUTHORIZED, FailureInfo.SET_PENDING_ADMIN_OWNER_CHECK);\\n        }\\n\\n        // Save current value, if any, for inclusion in log\\n        address oldPendingAdmin = pendingAdmin;\\n\\n        // Store pendingAdmin with value newPendingAdmin\\n        pendingAdmin = newPendingAdmin;\\n\\n        // Emit NewPendingAdmin(oldPendingAdmin, newPendingAdmin)\\n        emit NewPendingAdmin(oldPendingAdmin, newPendingAdmin);\\n\\n        return uint(Error.NO_ERROR);\\n    }\\n\\n    /**\\n      * @notice Accepts transfer of admin rights. msg.sender must be pendingAdmin\\n      * @dev Admin function for pending admin to accept role and update admin\\n      * @return uint 0=success, otherwise a failure (see ErrorReporter.sol for details)\\n      */\\n    function _acceptAdmin() public returns (uint) {\\n        // Check caller is pendingAdmin and pendingAdmin \\u2260 address(0)\\n        if (msg.sender != pendingAdmin || msg.sender == address(0)) {\\n            return fail(Error.UNAUTHORIZED, FailureInfo.ACCEPT_ADMIN_PENDING_ADMIN_CHECK);\\n        }\\n\\n        // Save current values for inclusion in log\\n        address oldAdmin = admin;\\n        address oldPendingAdmin = pendingAdmin;\\n\\n        // Store admin with value pendingAdmin\\n        admin = pendingAdmin;\\n\\n        // Clear the pending value\\n        pendingAdmin = address(0);\\n\\n        emit NewAdmin(oldAdmin, admin);\\n        emit NewPendingAdmin(oldPendingAdmin, pendingAdmin);\\n\\n        return uint(Error.NO_ERROR);\\n    }\\n\\n    /**\\n     * @dev Delegates execution to an implementation contract.\\n     * It returns to the external caller whatever the implementation returns\\n     * or forwards reverts.\\n     */\\n    fallback() payable external {\\n        // delegate all other functions to current implementation\\n        (bool success, ) = comptrollerImplementation.delegatecall(msg.data);\\n\\n        assembly {\\n              let free_mem_ptr := mload(0x40)\\n              returndatacopy(free_mem_ptr, 0, returndatasize())\\n\\n              switch success\\n              case 0 { revert(free_mem_ptr, returndatasize()) }\\n              default { return(free_mem_ptr, returndatasize()) }\\n        }\\n    }\\n}\\n\",\"keccak256\":\"0xe8f57584490697b95ab1be9860432e219d1c960dad74e228abe6c06b8d9b61da\",\"license\":\"BSD-3-Clause\"}},\"version\":1}",
  "bytecode": "0x608060405234801561001057600080fd5b50600080546001600160a01b03191633179055615bf180620000336000396000f3fe608060405234801561001057600080fd5b50600436106104c15760003560e01c80636d35bf9111610278578063b0772d0b1161015c578063dce15449116100ce578063e9af029211610092578063e9af029214610cae578063eabe7d9114610cc1578063ede4edd014610cd4578063f00a7a9214610ce7578063f4a433c014610cf4578063f851a44014610d1457600080fd5b8063dce1544914610c58578063dcfbc0c714610c6b578063e4028eee14610c7e578063e6653f3d14610c91578063e875544614610ca557600080fd5b8063c299823811610120578063c299823814610b9f578063c488847b14610bbf578063ca0af04314610be7578063cc7ebdc414610c12578063d02f735114610c32578063da3d454c14610c4557600080fd5b8063b0772d0b14610b26578063b21be7fd14610b2e578063bb82aa5e14610b59578063bdcdc25814610b6c578063bea6b8b814610b7f57600080fd5b806394543c15116101f5578063a7f0e231116101b9578063a7f0e23114610a96578063a8b4394814610ac3578063a979f0c514610ad6578063aa90075414610ae9578063abfceffc14610af2578063ac0b0bb714610b1257600080fd5b806394543c1514610a2d57806394b2294b14610a40578063986ab83814610a495780639d1b5a0a14610a69578063a76b3fda14610a8357600080fd5b806387f763031161023c57806387f763031461093a5780638c57804e1461094e5780638e8f294b146109865780638ebf6364146109d9578063929fe9a1146109ec57600080fd5b80636d35bf91146108c3578063731f0c2b146108d1578063741b2525146108f45780637dc0d1d01461090757806385b7beb81461091a57600080fd5b806342cbb15c116103aa578063598ee1cb1161031c578063607ef6c1116102e0578063607ef6c1146107eb5780636810dfa6146107fe5780636a56947e146108115780636aa875b5146108245780636b79c38d146108445780636d154ea5146108a057600080fd5b8063598ee1cb1461078c5780635c7786051461079f5780635ec88c79146107b25780635f5af1aa146107c55780635fc7e71e146107d857600080fd5b80634ef4c3e11161036e5780634ef4c3e11461071a5780634fd42e171461072d57806351a485e41461074057806351dff9891461075357806352d84d1e1461076657806355ee1fe11461077957600080fd5b806342cbb15c146106a757806347ef3b3b146106ad5780634a584432146106c35780634ada90af146106e35780634e79238f146106ec57600080fd5b806324008a6211610443578063317b0b7711610407578063317b0b771461063457806338b8f4c314610647578063391957d71461065a5780633bcf7ec11461066d5780633c94786f1461068057806341c728b91461069457600080fd5b806324008a62146105d557806324a3d622146105e857806326782247146105fb57806327efe3cb1461060e5780632d70db781461062157600080fd5b80631c3db2e01161048a5780631c3db2e0146105675780631d504dc61461057a5780631d7b33d71461058d5780631ededc91146105ad57806321af4569146105c257600080fd5b80627e3dd2146104c657806302c3bcbb146104e35780630c689dc31461051157806316b95e8f1461053f57806318c882a514610554575b600080fd5b6104ce600181565b60405190151581526020015b60405180910390f35b6105036104f13660046151df565b601e6020526000908152604090205481565b6040519081526020016104da565b73d86c8d4279ccafbec840c782bcc50d201f2774195b6040516001600160a01b0390911681526020016104da565b61055261054d366004615248565b610d27565b005b6104ce6105623660046152c2565b610fd0565b6105526105753660046153da565b611109565b6105526105883660046151df565b61116c565b61050361059b3660046151df565b600f6020526000908152604090205481565b6105526105bb36600461542a565b5050505050565b601554610527906001600160a01b031681565b6105036105e3366004615485565b6112ea565b600a54610527906001600160a01b031681565b600154610527906001600160a01b031681565b61055261061c3660046154d6565b6113a8565b6104ce61062f366004615502565b61149f565b61050361064236600461551f565b61158f565b6105526106553660046151df565b611636565b6105526106683660046151df565b6116fe565b6104ce61067b3660046152c2565b6117ba565b600a546104ce90600160a01b900460ff1681565b6105526106a2366004615538565b6118e4565b42610503565b6105526106bb36600461557e565b505050505050565b6105036106d13660046151df565b60166020526000908152604090205481565b61050360065481565b6106ff6106fa366004615538565b611a44565b604080519384526020840192909252908201526060016104da565b6105036107283660046155ec565b611a84565b61050361073b36600461551f565b611b25565b61055261074e366004615248565b611b82565b610552610761366004615538565b611d60565b61052761077436600461551f565b611db5565b6105036107873660046151df565b611ddf565b61055261079a3660046154d6565b611e51565b6105526107ad3660046155ec565b505050565b6106ff6107c03660046151df565b611f45565b6105036107d33660046151df565b611f80565b6105036107e636600461562d565b611ff1565b6105526107f9366004615248565b6121c0565b61055261080c366004615691565b612395565b61055261081f366004615485565b6126c3565b6105036108323660046151df565b601a6020526000908152604090205481565b61087c6108523660046151df565b6010602052600090815260409020546001600160e01b03811690600160e01b900463ffffffff1682565b604080516001600160e01b03909316835263ffffffff9091166020830152016104da565b6104ce6108ae3660046151df565b600c6020526000908152604090205460ff1681565b6105526105bb36600461562d565b6104ce6108df3660046151df565b600b6020526000908152604090205460ff1681565b6105526109023660046151df565b6126c8565b600454610527906001600160a01b031681565b6105036109283660046151df565b601c6020526000908152604090205481565b600a546104ce90600160b01b900460ff1681565b61087c61095c3660046151df565b6011602052600090815260409020546001600160e01b03811690600160e01b900463ffffffff1682565b6109ba6109943660046151df565b60096020526000908152604090208054600182015460039092015460ff91821692911683565b60408051931515845260208401929092521515908201526060016104da565b6104ce6109e7366004615502565b612774565b6104ce6109fa36600461571a565b6001600160a01b038082166000908152600960209081526040808320938616835260029093019052205460ff1692915050565b6104ce610a3b3660046151df565b61285b565b61050360075481565b610503610a573660046151df565b60176020526000908152604090205481565b7322a2488fe295047ba13bd8cccdbc8361dbd8cf7c610527565b610503610a913660046151df565b61291a565b610aab6a0c097ce7bc90715b34b9f160241b81565b6040516001600160e01b0390911681526020016104da565b610552610ad13660046157a3565b612a4c565b601d54610527906001600160a01b031681565b610503600e5481565b610b05610b003660046151df565b612b81565b6040516104da919061582b565b600a546104ce90600160b81b900460ff1681565b610b05612bf7565b610503610b3c36600461571a565b601260209081526000928352604080842090915290825290205481565b600254610527906001600160a01b031681565b610503610b7a366004615485565b612c59565b610503610b8d3660046151df565b60186020526000908152604090205481565b610bb2610bad366004615878565b612ce4565b6040516104da91906158ad565b610bd2610bcd3660046155ec565b612dac565b604080519283526020830191909152016104da565b610503610bf536600461571a565b601360209081526000928352604080842090915290825290205481565b610503610c203660046151df565b60146020526000908152604090205481565b610503610c4036600461562d565b612fca565b610503610c533660046155ec565b613171565b610527610c663660046154d6565b613541565b600354610527906001600160a01b031681565b610503610c8c3660046154d6565b613579565b600a546104ce90600160a81b900460ff1681565b61050360055481565b610552610cbc3660046151df565b61370b565b610503610ccf3660046155ec565b61376f565b610503610ce23660046151df565b6137aa565b601b546104ce9060ff1681565b610503610d023660046151df565b60196020526000908152604090205481565b600054610527906001600160a01b031681565b6000546001600160a01b03163314610d905760405162461bcd60e51b815260206004820152602160248201527f4f6e6c792061646d696e2063616e2063616c6c20746869732066756e6374696f6044820152603760f91b60648201526084015b60405180910390fd5b601b5460ff1615610df25760405162461bcd60e51b815260206004820152602660248201527f416c72656164792065786563757465642074686973206f6e652d6f66662066756044820152653731ba34b7b760d11b6064820152608401610d87565b828114610e315760405162461bcd60e51b815260206004820152600d60248201526c125b9d985b1a59081a5b9c1d5d609a1b6044820152606401610d87565b60008060008060005b87811015610fb857888882818110610e5457610e546158e5565b9050602002016020810190610e6991906151df565b6001600160a01b0381166000908152601460205260409020549095509350868682818110610e9957610e996158e5565b90506020020135925083831115610f3d576000610eb68585615911565b6001600160a01b0387166000908152601c6020526040812054919250610edc8284613afb565b6001600160a01b0389166000818152601c6020908152604091829020849055815186815290810184905292935090917f17fea09d9a7ca41b2f9f9118f18f44848a62e9c70d55dd4385131eb2cf1b7e47910160405180910390a28695505050505b8215610fa857610f4d8484613b07565b6001600160a01b038616600081815260146020908152604091829020849055815188815290810184905292945090917f4a5c134e28b537a76546993ea37f3b60d9190476df7356d3842aa40902e20f04910160405180910390a25b610fb181615928565b9050610e3a565b5050601b805460ff1916600117905550505050505050565b6001600160a01b03821660009081526009602052604081205460ff166110085760405162461bcd60e51b8152600401610d8790615943565b600a546001600160a01b031633148061102b57506000546001600160a01b031633145b6110475760405162461bcd60e51b8152600401610d879061598b565b6000546001600160a01b031633148061106257506001821515145b61107e5760405162461bcd60e51b8152600401610d87906159d2565b6001600160a01b0383166000818152600c6020908152604091829020805460ff19168615159081179091558251938452606091840182905260069184019190915265426f72726f7760d01b6080840152908201527f71aec636243f9709bb0007ae15e9afb8150ab01716d75fd7573be5cc096e03b09060a0015b60405180910390a150805b92915050565b60408051600180825281830190925260009160208083019080368337019050509050828160008151811061113f5761113f6158e5565b60200260200101906001600160a01b031690816001600160a01b0316815250506107ad8183600180612395565b806001600160a01b031663f851a4406040518163ffffffff1660e01b8152600401602060405180830381865afa1580156111aa573d6000803e3d6000fd5b505050506040513d601f19601f820116820180604052508101906111ce9190615a02565b6001600160a01b0316336001600160a01b03161461123e5760405162461bcd60e51b815260206004820152602760248201527f6f6e6c7920756e6974726f6c6c65722061646d696e2063616e206368616e676560448201526620627261696e7360c81b6064820152608401610d87565b806001600160a01b031663c1e803346040518163ffffffff1660e01b81526004016020604051808303816000875af115801561127e573d6000803e3d6000fd5b505050506040513d601f19601f820116820180604052508101906112a29190615a1f565b156112e75760405162461bcd60e51b815260206004820152601560248201527418da185b99d9481b9bdd08185d5d1a1bdc9a5e9959605a1b6044820152606401610d87565b50565b6001600160a01b03841660009081526009602052604081205460ff16611312575060096113a0565b60006040518060200160405280876001600160a01b031663aa5af0fd6040518163ffffffff1660e01b8152600401602060405180830381865afa15801561135d573d6000803e3d6000fd5b505050506040513d601f19601f820116820180604052508101906113819190615a1f565b9052905061138f8682613b13565b61139a868583613db2565b60009150505b949350505050565b6113b0613fe0565b6113fc5760405162461bcd60e51b815260206004820152601960248201527f6f6e6c792061646d696e2063616e206772616e7420636f6d70000000000000006044820152606401610d87565b60006114088383614009565b905080156114585760405162461bcd60e51b815260206004820152601b60248201527f696e73756666696369656e7420636f6d7020666f72206772616e7400000000006044820152606401610d87565b604080516001600160a01b0385168152602081018490527f98b2f82a3a07f223a0be64b3d0f47711c64dccd1feafb94aa28156b38cd9695c910160405180910390a1505050565b600a546000906001600160a01b03163314806114c557506000546001600160a01b031633145b6114e15760405162461bcd60e51b8152600401610d879061598b565b6000546001600160a01b03163314806114fc57506001821515145b6115185760405162461bcd60e51b8152600401610d87906159d2565b600a8054831515600160b81b0260ff60b81b199091161790556040517fef159d9a32b2472e32b098f954f3ce62d232939f1c207070b584df1814de2de0906115839084906040808252600590820152645365697a6560d81b6060820152901515602082015260800190565b60405180910390a15090565b600080546001600160a01b031633146115ea5760405162461bcd60e51b815260206004820152601f60248201527f6f6e6c792061646d696e2063616e2073657420636c6f736520666163746f72006044820152606401610d87565b600580549083905560408051828152602081018590527f3b9670cf975d26958e754b57098eaa2ac914d8d2a31b83257997b9f346110fd991015b60405180910390a160005b9392505050565b6000546001600160a01b0316331461169f5760405162461bcd60e51b815260206004820152602660248201527f6f6e6c792061646d696e2063616e2073657420737570706c792063617020677560448201526530b93234b0b760d11b6064820152608401610d87565b601d80546001600160a01b038381166001600160a01b03198316179092556040519116907fb0d3622c24ac9bd967d8f37a25808b3e668fe7ed4f3075bbe82842d3e287c044906116f29083908590615a4e565b60405180910390a15050565b6000546001600160a01b031633146117675760405162461bcd60e51b815260206004820152602660248201527f6f6e6c792061646d696e2063616e2073657420626f72726f772063617020677560448201526530b93234b0b760d11b6064820152608401610d87565b601580546001600160a01b038381166001600160a01b03198316179092556040519116907feda98690e518e9a05f8ec6837663e188211b2da8f4906648b323f2c1d4434e29906116f29083908590615a4e565b6001600160a01b03821660009081526009602052604081205460ff166117f25760405162461bcd60e51b8152600401610d8790615943565b600a546001600160a01b031633148061181557506000546001600160a01b031633145b6118315760405162461bcd60e51b8152600401610d879061598b565b6000546001600160a01b031633148061184c57506001821515145b6118685760405162461bcd60e51b8152600401610d87906159d2565b6001600160a01b0383166000818152600b6020908152604091829020805460ff19168615159081179091558251938452606091840182905260049184019190915263135a5b9d60e21b6080840152908201527f71aec636243f9709bb0007ae15e9afb8150ab01716d75fd7573be5cc096e03b09060a0016110f8565b6001600160a01b0384166000908152601e602052604090205480156105bb576000856001600160a01b03166318160ddd6040518163ffffffff1660e01b8152600401602060405180830381865afa158015611943573d6000803e3d6000fd5b505050506040513d601f19601f820116820180604052508101906119679190615a1f565b905060006040518060200160405280886001600160a01b031663182df0f56040518163ffffffff1660e01b8152600401602060405180830381865afa1580156119b4573d6000803e3d6000fd5b505050506040513d601f19601f820116820180604052508101906119d89190615a1f565b9052905060006119e8828461412e565b905083811115611a3a5760405162461bcd60e51b815260206004820152601960248201527f6d61726b657420737570706c79206361702072656163686564000000000000006044820152606401610d87565b5050505050505050565b600080600080600080611a598a8a8a8a614146565b925092509250826011811115611a7157611a71615a38565b95509093509150505b9450945094915050565b6001600160a01b0383166000908152600b602052604081205460ff1615611ade5760405162461bcd60e51b815260206004820152600e60248201526d1b5a5b9d081a5cc81c185d5cd95960921b6044820152606401610d87565b6001600160a01b03841660009081526009602052604090205460ff16611b085760095b905061162f565b611b1184614474565b611b1b8484614698565b6000949350505050565b600080546001600160a01b03163314611b44576111036001600b6148e4565b600680549083905560408051828152602081018590527faeba5a6c40a8ac138134bff1aaa65debf25971188a58804bad717f82f0ec13169101611624565b6000546001600160a01b0316331480611ba55750601d546001600160a01b031633145b611c0f5760405162461bcd60e51b815260206004820152603560248201527f6f6e6c792061646d696e206f7220737570706c792063617020677561726469616044820152746e2063616e2073657420737570706c79206361707360581b6064820152608401610d87565b82818115801590611c1f57508082145b611c5b5760405162461bcd60e51b815260206004820152600d60248201526c1a5b9d985b1a59081a5b9c1d5d609a1b6044820152606401610d87565b60005b82811015611d5757848482818110611c7857611c786158e5565b90506020020135601e6000898985818110611c9557611c956158e5565b9050602002016020810190611caa91906151df565b6001600160a01b03168152602081019190915260400160002055868682818110611cd657611cd66158e5565b9050602002016020810190611ceb91906151df565b6001600160a01b03167f9e0ad9cee10bdf36b7fbd38910c0bdff0f275ace679b45b922381c2723d676f8868684818110611d2757611d276158e5565b90506020020135604051611d3d91815260200190565b60405180910390a280611d4f81615928565b915050611c5e565b50505050505050565b80158015611d6e5750600082115b15611daf5760405162461bcd60e51b815260206004820152601160248201527072656465656d546f6b656e73207a65726f60781b6044820152606401610d87565b50505050565b600d8181548110611dc557600080fd5b6000918252602090912001546001600160a01b0316905081565b600080546001600160a01b03163314611dfe57611103600160106148e4565b600480546001600160a01b038481166001600160a01b03198316179092556040519116907fd52b2b9b7e9ee655fcb95d2e5b9e0c9f69e7ef2b8e9d2d0ea78402d576d22e22906116249083908690615a4e565b611e59613fe0565b611ea55760405162461bcd60e51b815260206004820152601d60248201527f6f6e6c792061646d696e2063616e2073657420636f6d702073706565640000006044820152606401610d87565b611eae826126c8565b80611ed1576001600160a01b038216600090815260186020526040812055611eec565b426001600160a01b0383166000908152601860205260409020555b6001600160a01b03821660008181526017602052604090819020839055517f386537fa92edc3319af95f1f904dcf1900021e4f3f4e08169a577a09076e66b390611f399084815260200190565b60405180910390a25050565b600080600080600080611f5c876000806000614146565b925092509250826011811115611f7457611f74615a38565b97919650945092505050565b600080546001600160a01b03163314611f9f57611103600160136148e4565b600a80546001600160a01b038481166001600160a01b0319831681179093556040519116917f0613b6ee6a04f0d09f390e4d9318894b9f6ac7fd83897cd8d18896ba579c401e91611624918491615a4e565b6001600160a01b03851660009081526009602052604081205460ff16158061203257506001600160a01b03851660009081526009602052604090205460ff16155b156120415760095b90506121b7565b6040516395dd919360e01b81526001600160a01b038481166004830152600091908816906395dd919390602401602060405180830381865afa15801561208b573d6000803e3d6000fd5b505050506040513d601f19601f820116820180604052508101906120af9190615a1f565b90506120ba8761285b565b1561212557828110156121205760405162461bcd60e51b815260206004820152602860248201527f43616e206e6f74207265706179206d6f7265207468616e2074686520746f74616044820152676c20626f72726f7760c01b6064820152608401610d87565b6121b1565b6000806121318661495d565b9193509091506000905082601181111561214d5761214d615a38565b1461216e5781601181111561216457612164615a38565b93505050506121b7565b8061217a576003612164565b600061219660405180602001604052806005548152508561412e565b9050808611156121ad5760119450505050506121b7565b5050505b60009150505b95945050505050565b6000546001600160a01b03163314806121e357506015546001600160a01b031633145b61224d5760405162461bcd60e51b815260206004820152603560248201527f6f6e6c792061646d696e206f7220626f72726f772063617020677561726469616044820152746e2063616e2073657420626f72726f77206361707360581b6064820152608401610d87565b8281811580159061225d57508082145b6122995760405162461bcd60e51b815260206004820152600d60248201526c1a5b9d985b1a59081a5b9c1d5d609a1b6044820152606401610d87565b60005b82811015611d57578484828181106122b6576122b66158e5565b90506020020135601660008989858181106122d3576122d36158e5565b90506020020160208101906122e891906151df565b6001600160a01b03168152602081019190915260400160002055868682818110612314576123146158e5565b905060200201602081019061232991906151df565b6001600160a01b03167f6f1951b2aad10f3fc81b86d91105b413a5b3f847a34bbc5ce1904201b14438f6868684818110612365576123656158e5565b9050602002013560405161237b91815260200190565b60405180910390a28061238d81615928565b91505061229c565b60005b835181101561255c5760008482815181106123b5576123b56158e5565b6020908102919091018101516001600160a01b0381166000908152600990925260409091205490915060ff166124255760405162461bcd60e51b81526020600482015260156024820152741b585c9ad95d081b5d5cdd081899481b1a5cdd1959605a1b6044820152606401610d87565b600184151514156124f25760006040518060200160405280836001600160a01b031663aa5af0fd6040518163ffffffff1660e01b8152600401602060405180830381865afa15801561247b573d6000803e3d6000fd5b505050506040513d601f19601f8201168201806040525081019061249f9190615a1f565b905290506124ad8282613b13565b60005b87518110156124ef576124dd838983815181106124cf576124cf6158e5565b602002602001015184613db2565b806124e781615928565b9150506124b0565b50505b600183151514156125495761250681614474565b60005b86518110156125475761253582888381518110612528576125286158e5565b6020026020010151614698565b8061253f81615928565b915050612509565b505b508061255481615928565b915050612398565b5060005b845181101561261f576125ca85828151811061257e5761257e6158e5565b60200260200101516014600088858151811061259c5761259c6158e5565b60200260200101516001600160a01b03166001600160a01b0316815260200190815260200160002054614009565b601460008784815181106125e0576125e06158e5565b60200260200101516001600160a01b03166001600160a01b0316815260200190815260200160002081905550808061261790615928565b915050612560565b50600073d86c8d4279ccafbec840c782bcc50d201f2774196001600160a01b031685604051602401612651919061582b565b60408051601f198184030181529181526020820180516001600160e01b031663318d9e5d60e01b179052516126869190615a94565b6000604051808303816000865af19150503d8060008114611a3a576040519150601f19603f3d011682016040523d82523d6000602084013e611a3a565b611daf565b6001600160a01b0381166000908152601760209081526040808320546018909252822054909142916126fb908390613b07565b905060008111801561270d5750600083115b15611daf57600061271e828561497d565b6001600160a01b038616600090815260146020526040812054919250906127459083613afb565b6001600160a01b0387166000908152601460209081526040808320939093556018905220849055505050505050565b600a546000906001600160a01b031633148061279a57506000546001600160a01b031633145b6127b65760405162461bcd60e51b8152600401610d879061598b565b6000546001600160a01b03163314806127d157506001821515145b6127ed5760405162461bcd60e51b8152600401610d87906159d2565b600a8054831515600160b01b0260ff60b01b199091161790556040517fef159d9a32b2472e32b098f954f3ce62d232939f1c207070b584df1814de2de0906115839084906040808252600890820152672a3930b739b332b960c11b6060820152901515602082015260800190565b6001600160a01b0381166000908152600960205260408120600101541580156128a157506001600160a01b0382166000908152600c602052604090205460ff1615156001145b80156111035750816001600160a01b031663173b99046040518163ffffffff1660e01b8152600401602060405180830381865afa1580156128e6573d6000803e3d6000fd5b505050506040513d601f19601f8201168201806040525081019061290a9190615a1f565b670de0b6b3a76400001492915050565b600080546001600160a01b0316331461293957611103600160126148e4565b6001600160a01b03821660009081526009602052604090205460ff161561296657611103600a60116148e4565b816001600160a01b031663fe9c44ae6040518163ffffffff1660e01b8152600401602060405180830381865afa1580156129a4573d6000803e3d6000fd5b505050506040513d601f19601f820116820180604052508101906129c89190615ab0565b506001600160a01b03821660009081526009602052604081208054600160ff1991821681178355600383018054909216909155810191909155612a0a83614989565b612a1383614a72565b6040516001600160a01b03841681527fcf583bb0c569eb967f806b11601c4cb93c10310485c67add5f8362c2f212321f90602001611624565b612a54613fe0565b612aa05760405162461bcd60e51b815260206004820152601d60248201527f6f6e6c792061646d696e2063616e2073657420636f6d702073706565640000006044820152606401610d87565b8251825181148015612ab25750815181145b612b105760405162461bcd60e51b815260206004820152602960248201527f436f6d7074726f6c6c65723a3a5f736574436f6d7053706565647320696e76616044820152681b1a59081a5b9c1d5d60ba1b6064820152608401610d87565b60005b818110156105bb57612b71858281518110612b3057612b306158e5565b6020026020010151858381518110612b4a57612b4a6158e5565b6020026020010151858481518110612b6457612b646158e5565b6020026020010151614b2e565b612b7a81615928565b9050612b13565b6001600160a01b0381166000908152600860209081526040808320805482518185028101850190935280835260609493830182828015612bea57602002820191906000526020600020905b81546001600160a01b03168152600190910190602001808311612bcc575b5093979650505050505050565b6060600d805480602002602001604051908101604052809291908181526020018280548015612c4f57602002820191906000526020600020905b81546001600160a01b03168152600190910190602001808311612c31575b5050505050905090565b600a54600090600160b01b900460ff1615612cab5760405162461bcd60e51b81526020600482015260126024820152711d1c985b9cd9995c881a5cc81c185d5cd95960721b6044820152606401610d87565b6000612cb8868685614d0d565b90508015612cc75790506113a0565b612cd086614474565b612cda8686614698565b61139a8685614698565b805160609060008167ffffffffffffffff811115612d0457612d046152fb565b604051908082528060200260200182016040528015612d2d578160200160208202803683370190505b50905060005b82811015612da4576000858281518110612d4f57612d4f6158e5565b60200260200101519050612d638133614dc5565b6011811115612d7457612d74615a38565b838381518110612d8657612d866158e5565b60209081029190910101525080612d9c81615928565b915050612d33565b509392505050565b6004805460405163fc57d4df60e01b81526001600160a01b03868116938201939093526000928392839291169063fc57d4df90602401602060405180830381865afa158015612dff573d6000803e3d6000fd5b505050506040513d601f19601f82011682018060405250810190612e239190615a1f565b6004805460405163fc57d4df60e01b81526001600160a01b038981169382019390935292935060009291169063fc57d4df90602401602060405180830381865afa158015612e75573d6000803e3d6000fd5b505050506040513d601f19601f82011682018060405250810190612e999190615a1f565b9050811580612ea6575080155b15612eba57600d6000935093505050612fc2565b6000866001600160a01b031663182df0f56040518163ffffffff1660e01b8152600401602060405180830381865afa158015612efa573d6000803e3d6000fd5b505050506040513d601f19601f82011682018060405250810190612f1e9190615a1f565b90506000612f386040518060200160405280600081525090565b604080516020808201835260008083528351808301855290815283518083018552600654815284519283019094528882529192612f7491614ebc565b9250612f9c604051806020016040528088815250604051806020016040528088815250614ebc565b9150612fa88383614f04565b9050612fb4818b61412e565b600099509750505050505050505b935093915050565b600a54600090600160b81b900460ff16156130195760405162461bcd60e51b815260206004820152600f60248201526e1cd95a5e99481a5cc81c185d5cd959608a1b6044820152606401610d87565b6001600160a01b03861660009081526009602052604090205460ff16158061305a57506001600160a01b03851660009081526009602052604090205460ff16155b1561306657600961203a565b846001600160a01b0316635fe3b5676040518163ffffffff1660e01b8152600401602060405180830381865afa1580156130a4573d6000803e3d6000fd5b505050506040513d601f19601f820116820180604052508101906130c89190615a02565b6001600160a01b0316866001600160a01b0316635fe3b5676040518163ffffffff1660e01b8152600401602060405180830381865afa15801561310f573d6000803e3d6000fd5b505050506040513d601f19601f820116820180604052508101906131339190615a02565b6001600160a01b03161461314857600261203a565b61315186614474565b61315b8684614698565b6131658685614698565b60009695505050505050565b6001600160a01b0383166000908152600c602052604081205460ff16156131cd5760405162461bcd60e51b815260206004820152601060248201526f189bdc9c9bddc81a5cc81c185d5cd95960821b6044820152606401610d87565b6001600160a01b03841660009081526009602052604090205460ff166131f4576009611b01565b6001600160a01b038085166000908152600960209081526040808320938716835260029093019052205460ff166132f157336001600160a01b038516146132755760405162461bcd60e51b815260206004820152601560248201527439b2b73232b91036bab9ba1031329031aa37b5b2b760591b6044820152606401610d87565b60006132813385614dc5565b9050600081601181111561329757613297615a38565b146132b6578060118111156132ae576132ae615a38565b91505061162f565b6001600160a01b038086166000908152600960209081526040808320938816835260029093019052205460ff166132ef576132ef615acd565b505b6004805460405163fc57d4df60e01b81526001600160a01b038781169382019390935291169063fc57d4df90602401602060405180830381865afa15801561333d573d6000803e3d6000fd5b505050506040513d601f19601f820116820180604052508101906133619190615a1f565b61336c57600d611b01565b6001600160a01b0384166000908152601660205260409020548015613451576000856001600160a01b03166347bd37186040518163ffffffff1660e01b8152600401602060405180830381865afa1580156133cb573d6000803e3d6000fd5b505050506040513d601f19601f820116820180604052508101906133ef9190615a1f565b905060006133fd8286613afb565b905082811061344e5760405162461bcd60e51b815260206004820152601960248201527f6d61726b657420626f72726f77206361702072656163686564000000000000006044820152606401610d87565b50505b6000806134618688600088614146565b9193509091506000905082601181111561347d5761347d615a38565b1461349e5781601181111561349457613494615a38565b935050505061162f565b80156134ab576004613494565b60006040518060200160405280896001600160a01b031663aa5af0fd6040518163ffffffff1660e01b8152600401602060405180830381865afa1580156134f6573d6000803e3d6000fd5b505050506040513d601f19601f8201168201806040525081019061351a9190615a1f565b905290506135288882613b13565b613533888883613db2565b600098975050505050505050565b6008602052816000526040600020818154811061355d57600080fd5b6000918252602090912001546001600160a01b03169150829050565b600080546001600160a01b0316331461359f57613598600160066148e4565b9050611103565b6001600160a01b0383166000908152600960205260409020805460ff166135d4576135cc600960076148e4565b915050611103565b60408051602080820183528582528251908101909252670c7d713b49da000082529061360281835190511090565b1561361d57613613600660086148e4565b9350505050611103565b841580159061369957506004805460405163fc57d4df60e01b81526001600160a01b038981169382019390935291169063fc57d4df90602401602060405180830381865afa158015613673573d6000803e3d6000fd5b505050506040513d601f19601f820116820180604052508101906136979190615a1f565b155b156136aa57613613600d60096148e4565b60018301805490869055604080516001600160a01b0389168152602081018390529081018790527f70483e6592cd5182d45ac970e05bc62cdcc90e9d8ef2c2dbe686cf383bcd7fc59060600160405180910390a16000979650505050505050565b6112e781600d80548060200260200160405190810160405280929190818152602001828054801561376557602002820191906000526020600020905b81546001600160a01b03168152600190910190602001808311613747575b5050505050611109565b60008061377d858585614d0d565b9050801561378c57905061162f565b61379585614474565b61379f8585614698565b600095945050505050565b6040516361bfb47160e11b815233600482015260009082908290819081906001600160a01b0385169063c37f68e290602401608060405180830381865afa1580156137f9573d6000803e3d6000fd5b505050506040513d601f19601f8201168201806040525081019061381d9190615ae3565b50925092509250826000146138825760405162461bcd60e51b815260206004820152602560248201527f657869744d61726b65743a206765744163636f756e74536e617073686f742066604482015264185a5b195960da1b6064820152608401610d87565b801561389e57613894600c60026148e4565b9695505050505050565b60006138ab873385614d0d565b905080156138cb576138c0600e600383614f3e565b979650505050505050565b6001600160a01b0385166000908152600960209081526040808320338452600281019092529091205460ff1661390957600098975050505050505050565b3360009081526002820160209081526040808320805460ff19169055600882528083208054825181850281018501909352808352919290919083018282801561397b57602002820191906000526020600020905b81546001600160a01b0316815260019091019060200180831161395d575b5050835193945083925060009150505b828110156139e057896001600160a01b03168482815181106139af576139af6158e5565b60200260200101516001600160a01b031614156139ce578091506139e0565b806139d881615928565b91505061398b565b508181106139f0576139f0615acd565b33600090815260086020526040902080548190613a0f90600190615911565b81548110613a1f57613a1f6158e5565b9060005260206000200160009054906101000a90046001600160a01b0316818381548110613a4f57613a4f6158e5565b9060005260206000200160006101000a8154816001600160a01b0302191690836001600160a01b0316021790555080805480613a8d57613a8d615b19565b600082815260209020810160001990810180546001600160a01b03191690550190556040517fe699a64c18b07ac5b7301aa273f36a2287239eb9501d81950672794afba29a0d90613ae1908c903390615a4e565b60405180910390a160009c9b505050505050505050505050565b600061162f8284615b2f565b600061162f8284615911565b6001600160a01b038216600090815260116020908152604080832060199092528220549091613b78425b6040518060400160405280601c81526020017f626c6f636b206e756d6265722065786365656473203332206269747300000000815250614fb6565b8354909150600090613b9a9063ffffffff80851691600160e01b900416613b07565b9050600081118015613bac5750600083115b15613cdb576000613c1e876001600160a01b03166347bd37186040518163ffffffff1660e01b8152600401602060405180830381865afa158015613bf4573d6000803e3d6000fd5b505050506040513d601f19601f82011682018060405250810190613c189190615a1f565b87614fe6565b90506000613c2c838661497d565b90506000808311613c4c5760405180602001604052806000815250613c56565b613c568284615004565b604080516020810190915288546001600160e01b03168152909150613cb990613c7f908361503f565b5160408051808201909152601a81527f6e657720696e6465782065786365656473203232342062697473000000000000602082015261506b565b6001600160e01b0316600160e01b63ffffffff87160217875550613cfd915050565b8015613cfd5783546001600160e01b0316600160e01b63ffffffff8416021784555b600073d86c8d4279ccafbec840c782bcc50d201f2774196040516001600160a01b038981166024830152919091169060440160408051601f198184030181529181526020820180516001600160e01b0316635ce65fe960e01b17905251613d649190615a94565b6000604051808303816000865af19150503d8060008114613da1576040519150601f19603f3d011682016040523d82523d6000602084013e613da6565b606091505b50505050505050505050565b6001600160a01b03838116600090815260116020908152604080832080546013845282852095881685529490925290912080546001600160e01b0390931690819055909180158015613e1257506a0c097ce7bc90715b34b9f160241b8210155b15613e2857506a0c097ce7bc90715b34b9f160241b5b60006040518060200160405280613e3f8585613b07565b90526040516395dd919360e01b81526001600160a01b038881166004830152919250600091613e9291908a16906395dd919390602401602060405180830381865afa158015613bf4573d6000803e3d6000fd5b90506000613ea08284615092565b6001600160a01b03891660009081526014602052604081205491925090613ec79083613afb565b6001600160a01b038a811660008181526014602090815260409182902085905581518781529081018b90529394509092918d16917f1fc3ecc087d8d2d15e23d0032af5a47059c3892d003d8e139fdcb6bb327c99a6910160405180910390a3600073d86c8d4279ccafbec840c782bcc50d201f2774196001600160a01b03168b8b604051602401613f59929190615a4e565b60408051601f198184030181529181526020820180516001600160e01b03166375c7940360e11b17905251613f8e9190615a94565b6000604051808303816000865af19150503d8060008114613fcb576040519150601f19603f3d011682016040523d82523d6000602084013e613fd0565b606091505b5050505050505050505050505050565b600080546001600160a01b031633148061400457506002546001600160a01b031633145b905090565b6000807322a2488fe295047ba13bd8cccdbc8361dbd8cf7c6040516370a0823160e01b81523060048201529091506000906001600160a01b038316906370a0823190602401602060405180830381865afa15801561406b573d6000803e3d6000fd5b505050506040513d601f19601f8201168201806040525081019061408f9190615a1f565b90506000841180156140a15750808411155b156141255760405163a9059cbb60e01b81526001600160a01b0386811660048301526024820186905283169063a9059cbb906044016020604051808303816000875af11580156140f5573d6000803e3d6000fd5b505050506040513d601f19601f820116820180604052508101906141199190615ab0565b50600092505050611103565b50919392505050565b60008061413b84846150bb565b90506113a0816150e3565b6000806000614153615128565b6001600160a01b0388166000908152600860209081526040808320805482518185028101850190935280835284938301828280156141ba57602002820191906000526020600020905b81546001600160a01b0316815260019091019060200180831161419c575b5050505050905060005b815181101561441e5760008282815181106141e1576141e16158e5565b60209081029190910101516040516361bfb47160e11b81526001600160a01b038e811660048301529192509082169063c37f68e290602401608060405180830381865afa158015614236573d6000803e3d6000fd5b505050506040513d601f19601f8201168201806040525081019061425a9190615ae3565b6080890152606088015260408701529350831561428657600f6000809750975097505050505050611a7a565b60408051602080820183526001600160a01b0384811660008181526009845285902060010154845260c08a01939093528351808301855260808a0151815260e08a015260048054855163fc57d4df60e01b815291820194909452935192169263fc57d4df92602480830193928290030181865afa15801561430b573d6000803e3d6000fd5b505050506040513d601f19601f8201168201806040525081019061432f9190615a1f565b60a0860181905261434f57600d6000809750975097505050505050611a7a565b604080516020810190915260a0860151815261010086015260c085015160e08601516143899161437e91614ebc565b866101000151614ebc565b6101208601819052604086015186516143a39291906150fb565b8552610100850151606086015160208701516143c09291906150fb565b60208601526001600160a01b03818116908c16141561440b576143ed8561012001518b87602001516150fb565b60208601819052610100860151614405918b906150fb565b60208601525b508061441681615928565b9150506141c4565b5060208301518351111561444f576020830151835160009161443f91615911565b6000955095509550505050611a7a565b600080846000015185602001516144669190615911565b955095509550505050611a7a565b6001600160a01b0381166000908152601060209081526040808320601a90925282205490916144a242613b3d565b83549091506000906144c49063ffffffff80851691600160e01b900416613b07565b90506000811180156144d65750600083115b156145c2576000856001600160a01b03166318160ddd6040518163ffffffff1660e01b8152600401602060405180830381865afa15801561451b573d6000803e3d6000fd5b505050506040513d601f19601f8201168201806040525081019061453f9190615a1f565b9050600061454d838661497d565b9050600080831161456d5760405180602001604052806000815250614577565b6145778284615004565b604080516020810190915288546001600160e01b031681529091506145a090613c7f908361503f565b6001600160e01b0316600160e01b63ffffffff871602178755506145e4915050565b80156145e45783546001600160e01b0316600160e01b63ffffffff8416021784555b600073d86c8d4279ccafbec840c782bcc50d201f2774196040516001600160a01b038881166024830152919091169060440160408051601f198184030181529181526020820180516001600160e01b031663743597df60e11b1790525161464b9190615a94565b6000604051808303816000865af19150503d8060008114614688576040519150601f19603f3d011682016040523d82523d6000602084013e61468d565b606091505b505050505050505050565b6001600160a01b03828116600090815260106020908152604080832080546012845282852095871685529490925290912080546001600160e01b03909316908190559091801580156146f857506a0c097ce7bc90715b34b9f160241b8210155b1561470e57506a0c097ce7bc90715b34b9f160241b5b600060405180602001604052806147258585613b07565b90526040516370a0823160e01b81526001600160a01b0387811660048301529192506000918816906370a0823190602401602060405180830381865afa158015614773573d6000803e3d6000fd5b505050506040513d601f19601f820116820180604052508101906147979190615a1f565b905060006147a58284615092565b6001600160a01b038816600090815260146020526040812054919250906147cc9083613afb565b6001600160a01b0389811660008181526014602090815260409182902085905581518781529081018b90529394509092918c16917f2caecd17d02f56fa897705dcc740da2d237c373f70686f4e0d9bd3bf0400ea7a910160405180910390a3600073d86c8d4279ccafbec840c782bcc50d201f2774196001600160a01b03168a8a60405160240161485e929190615a4e565b60408051601f198184030181529181526020820180516001600160e01b0316631169274f60e21b179052516148939190615a94565b6000604051808303816000865af19150503d80600081146148d0576040519150601f19603f3d011682016040523d82523d6000602084013e6148d5565b606091505b50505050505050505050505050565b60007f45b96fe442630264581b197e84bbada861235052c5a1aadfff9ea4e40a969aa083601181111561491957614919615a38565b83601381111561492b5761492b615a38565b60408051928352602083019190915260009082015260600160405180910390a182601181111561162f5761162f615a38565b6000806000614970846000806000614146565b9250925092509193909250565b600061162f8284615b47565b60005b600d54811015614a1f57816001600160a01b0316600d82815481106149b3576149b36158e5565b6000918252602090912001546001600160a01b03161415614a0d5760405162461bcd60e51b81526020600482015260146024820152731b585c9ad95d08185b1c9958591e48185919195960621b6044820152606401610d87565b80614a1781615928565b91505061498c565b50600d80546001810182556000919091527fd7b6990105719101dabeb77144f2a3385c8033acd3af97e9423a695e81ad1eb50180546001600160a01b0319166001600160a01b0392909216919091179055565b6000614a7d42613b3d565b6001600160a01b03831660009081526010602090815260408083206011909252909120815492935090916001600160e01b0316614ad35781546001600160e01b0319166a0c097ce7bc90715b34b9f160241b1782555b80546001600160e01b0316614b015780546001600160e01b0319166a0c097ce7bc90715b34b9f160241b1781555b805463ffffffff909316600160e01b026001600160e01b0393841681179091558154909216909117905550565b6001600160a01b0383166000908152600960205260409020805460ff16614b975760405162461bcd60e51b815260206004820152601960248201527f636f6d70206d61726b6574206973206e6f74206c6973746564000000000000006044820152606401610d87565b6001600160a01b0384166000908152601a60205260409020548314614c1557614bbf84614474565b6001600160a01b0384166000818152601a602052604090819020859055517fdeafccd0c0b768b2529f7dcbbe58e155d6023059150b7490ed4535cc3744b92d90614c0c9086815260200190565b60405180910390a25b6001600160a01b0384166000908152601960205260409020548214611daf5760006040518060200160405280866001600160a01b031663aa5af0fd6040518163ffffffff1660e01b8152600401602060405180830381865afa158015614c7f573d6000803e3d6000fd5b505050506040513d601f19601f82011682018060405250810190614ca39190615a1f565b90529050614cb18582613b13565b6001600160a01b03851660008181526019602052604090819020859055517f20af8e791cc98f74b2d7a391c80980ca8e5aebf3d4060bf581997b6acae2e53790614cfe9086815260200190565b60405180910390a25050505050565b6001600160a01b03831660009081526009602052604081205460ff16614d34576009611b01565b6001600160a01b038085166000908152600960209081526040808320938716835260029093019052205460ff16614d6c576000611b01565b600080614d7c8587866000614146565b91935090915060009050826011811115614d9857614d98615a38565b14614db857816011811115614daf57614daf615a38565b9250505061162f565b8015613165576004614daf565b6001600160a01b0382166000908152600960205260408120805460ff16614df0576009915050611103565b6001600160a01b038316600090815260028201602052604090205460ff16151560011415614e22576000915050611103565b6001600160a01b03838116600090815260028301602090815260408083208054600160ff19909116811790915560088352818420805491820181558452919092200180546001600160a01b03191692871692909217909155517f3ab23ab0d51cccc0c3085aec51f99228625aa1a922b3a8ca89a26b0f2027a1a590614eaa9086908690615a4e565b60405180910390a15060009392505050565b6040805160208101909152600081526040518060200160405280670de0b6b3a7640000614ef18660000151866000015161497d565b614efb9190615b66565b90529392505050565b6040805160208101909152600081526040518060200160405280614efb614f378660000151670de0b6b3a764000061497d565b855161511c565b60007f45b96fe442630264581b197e84bbada861235052c5a1aadfff9ea4e40a969aa0846011811115614f7357614f73615a38565b846013811115614f8557614f85615a38565b604080519283526020830191909152810184905260600160405180910390a18360118111156113a0576113a0615a38565b6000816401000000008410614fde5760405162461bcd60e51b8152600401610d879190615b88565b509192915050565b600061162f614ffd84670de0b6b3a764000061497d565b835161511c565b6040805160208101909152600081526040518060200160405280614efb615039866a0c097ce7bc90715b34b9f160241b61497d565b8561511c565b6040805160208101909152600081526040518060200160405280614efb85600001518560000151613afb565b600081600160e01b8410614fde5760405162461bcd60e51b8152600401610d879190615b88565b60006a0c097ce7bc90715b34b9f160241b6150b184846000015161497d565b61162f9190615b66565b6040805160208101909152600081526040518060200160405280614efb85600001518561497d565b805160009061110390670de0b6b3a764000090615b66565b60008061510885856150bb565b90506121b7615116826150e3565b84613afb565b600061162f8284615b66565b6040518061014001604052806000815260200160008152602001600081526020016000815260200160008152602001600081526020016151746040518060200160405280600081525090565b815260200161518f6040518060200160405280600081525090565b81526020016151aa6040518060200160405280600081525090565b81526020016151c56040518060200160405280600081525090565b905290565b6001600160a01b03811681146112e757600080fd5b6000602082840312156151f157600080fd5b813561162f816151ca565b60008083601f84011261520e57600080fd5b50813567ffffffffffffffff81111561522657600080fd5b6020830191508360208260051b850101111561524157600080fd5b9250929050565b6000806000806040858703121561525e57600080fd5b843567ffffffffffffffff8082111561527657600080fd5b615282888389016151fc565b9096509450602087013591508082111561529b57600080fd5b506152a8878288016151fc565b95989497509550505050565b80151581146112e757600080fd5b600080604083850312156152d557600080fd5b82356152e0816151ca565b915060208301356152f0816152b4565b809150509250929050565b634e487b7160e01b600052604160045260246000fd5b604051601f8201601f1916810167ffffffffffffffff8111828210171561533a5761533a6152fb565b604052919050565b600067ffffffffffffffff82111561535c5761535c6152fb565b5060051b60200190565b600082601f83011261537757600080fd5b8135602061538c61538783615342565b615311565b82815260059290921b840181019181810190868411156153ab57600080fd5b8286015b848110156153cf5780356153c2816151ca565b83529183019183016153af565b509695505050505050565b600080604083850312156153ed57600080fd5b82356153f8816151ca565b9150602083013567ffffffffffffffff81111561541457600080fd5b61542085828601615366565b9150509250929050565b600080600080600060a0868803121561544257600080fd5b853561544d816151ca565b9450602086013561545d816151ca565b9350604086013561546d816151ca565b94979396509394606081013594506080013592915050565b6000806000806080858703121561549b57600080fd5b84356154a6816151ca565b935060208501356154b6816151ca565b925060408501356154c6816151ca565b9396929550929360600135925050565b600080604083850312156154e957600080fd5b82356154f4816151ca565b946020939093013593505050565b60006020828403121561551457600080fd5b813561162f816152b4565b60006020828403121561553157600080fd5b5035919050565b6000806000806080858703121561554e57600080fd5b8435615559816151ca565b93506020850135615569816151ca565b93969395505050506040820135916060013590565b60008060008060008060c0878903121561559757600080fd5b86356155a2816151ca565b955060208701356155b2816151ca565b945060408701356155c2816151ca565b935060608701356155d2816151ca565b9598949750929560808101359460a0909101359350915050565b60008060006060848603121561560157600080fd5b833561560c816151ca565b9250602084013561561c816151ca565b929592945050506040919091013590565b600080600080600060a0868803121561564557600080fd5b8535615650816151ca565b94506020860135615660816151ca565b93506040860135615670816151ca565b92506060860135615680816151ca565b949793965091946080013592915050565b600080600080608085870312156156a757600080fd5b843567ffffffffffffffff808211156156bf57600080fd5b6156cb88838901615366565b955060208701359150808211156156e157600080fd5b506156ee87828801615366565b93505060408501356156ff816152b4565b9150606085013561570f816152b4565b939692955090935050565b6000806040838503121561572d57600080fd5b8235615738816151ca565b915060208301356152f0816151ca565b600082601f83011261575957600080fd5b8135602061576961538783615342565b82815260059290921b8401810191818101908684111561578857600080fd5b8286015b848110156153cf578035835291830191830161578c565b6000806000606084860312156157b857600080fd5b833567ffffffffffffffff808211156157d057600080fd5b6157dc87838801615366565b945060208601359150808211156157f257600080fd5b6157fe87838801615748565b9350604086013591508082111561581457600080fd5b5061582186828701615748565b9150509250925092565b6020808252825182820181905260009190848201906040850190845b8181101561586c5783516001600160a01b031683529284019291840191600101615847565b50909695505050505050565b60006020828403121561588a57600080fd5b813567ffffffffffffffff8111156158a157600080fd5b6113a084828501615366565b6020808252825182820181905260009190848201906040850190845b8181101561586c578351835292840192918401916001016158c9565b634e487b7160e01b600052603260045260246000fd5b634e487b7160e01b600052601160045260246000fd5b600082821015615923576159236158fb565b500390565b600060001982141561593c5761593c6158fb565b5060010190565b60208082526028908201527f63616e6e6f742070617573652061206d61726b65742074686174206973206e6f6040820152671d081b1a5cdd195960c21b606082015260800190565b60208082526027908201527f6f6e6c7920706175736520677561726469616e20616e642061646d696e2063616040820152666e20706175736560c81b606082015260800190565b6020808252601690820152756f6e6c792061646d696e2063616e20756e706175736560501b604082015260600190565b600060208284031215615a1457600080fd5b815161162f816151ca565b600060208284031215615a3157600080fd5b5051919050565b634e487b7160e01b600052602160045260246000fd5b6001600160a01b0392831681529116602082015260400190565b60005b83811015615a83578181015183820152602001615a6b565b83811115611daf5750506000910152565b60008251615aa6818460208701615a68565b9190910192915050565b600060208284031215615ac257600080fd5b815161162f816152b4565b634e487b7160e01b600052600160045260246000fd5b60008060008060808587031215615af957600080fd5b505082516020840151604085015160609095015191969095509092509050565b634e487b7160e01b600052603160045260246000fd5b60008219821115615b4257615b426158fb565b500190565b6000816000190483118215151615615b6157615b616158fb565b500290565b600082615b8357634e487b7160e01b600052601260045260246000fd5b500490565b6020815260008251806020840152615ba7816040850160208701615a68565b601f01601f1916919091016040019291505056fea2646970667358221220dc266738e9dceb737f600ebf213b05007f92ddb4bf0a0f58a19368ed2827271264736f6c634300080a0033",
  "deployedBytecode": "0x608060405234801561001057600080fd5b50600436106104c15760003560e01c80636d35bf9111610278578063b0772d0b1161015c578063dce15449116100ce578063e9af029211610092578063e9af029214610cae578063eabe7d9114610cc1578063ede4edd014610cd4578063f00a7a9214610ce7578063f4a433c014610cf4578063f851a44014610d1457600080fd5b8063dce1544914610c58578063dcfbc0c714610c6b578063e4028eee14610c7e578063e6653f3d14610c91578063e875544614610ca557600080fd5b8063c299823811610120578063c299823814610b9f578063c488847b14610bbf578063ca0af04314610be7578063cc7ebdc414610c12578063d02f735114610c32578063da3d454c14610c4557600080fd5b8063b0772d0b14610b26578063b21be7fd14610b2e578063bb82aa5e14610b59578063bdcdc25814610b6c578063bea6b8b814610b7f57600080fd5b806394543c15116101f5578063a7f0e231116101b9578063a7f0e23114610a96578063a8b4394814610ac3578063a979f0c514610ad6578063aa90075414610ae9578063abfceffc14610af2578063ac0b0bb714610b1257600080fd5b806394543c1514610a2d57806394b2294b14610a40578063986ab83814610a495780639d1b5a0a14610a69578063a76b3fda14610a8357600080fd5b806387f763031161023c57806387f763031461093a5780638c57804e1461094e5780638e8f294b146109865780638ebf6364146109d9578063929fe9a1146109ec57600080fd5b80636d35bf91146108c3578063731f0c2b146108d1578063741b2525146108f45780637dc0d1d01461090757806385b7beb81461091a57600080fd5b806342cbb15c116103aa578063598ee1cb1161031c578063607ef6c1116102e0578063607ef6c1146107eb5780636810dfa6146107fe5780636a56947e146108115780636aa875b5146108245780636b79c38d146108445780636d154ea5146108a057600080fd5b8063598ee1cb1461078c5780635c7786051461079f5780635ec88c79146107b25780635f5af1aa146107c55780635fc7e71e146107d857600080fd5b80634ef4c3e11161036e5780634ef4c3e11461071a5780634fd42e171461072d57806351a485e41461074057806351dff9891461075357806352d84d1e1461076657806355ee1fe11461077957600080fd5b806342cbb15c146106a757806347ef3b3b146106ad5780634a584432146106c35780634ada90af146106e35780634e79238f146106ec57600080fd5b806324008a6211610443578063317b0b7711610407578063317b0b771461063457806338b8f4c314610647578063391957d71461065a5780633bcf7ec11461066d5780633c94786f1461068057806341c728b91461069457600080fd5b806324008a62146105d557806324a3d622146105e857806326782247146105fb57806327efe3cb1461060e5780632d70db781461062157600080fd5b80631c3db2e01161048a5780631c3db2e0146105675780631d504dc61461057a5780631d7b33d71461058d5780631ededc91146105ad57806321af4569146105c257600080fd5b80627e3dd2146104c657806302c3bcbb146104e35780630c689dc31461051157806316b95e8f1461053f57806318c882a514610554575b600080fd5b6104ce600181565b60405190151581526020015b60405180910390f35b6105036104f13660046151df565b601e6020526000908152604090205481565b6040519081526020016104da565b73d86c8d4279ccafbec840c782bcc50d201f2774195b6040516001600160a01b0390911681526020016104da565b61055261054d366004615248565b610d27565b005b6104ce6105623660046152c2565b610fd0565b6105526105753660046153da565b611109565b6105526105883660046151df565b61116c565b61050361059b3660046151df565b600f6020526000908152604090205481565b6105526105bb36600461542a565b5050505050565b601554610527906001600160a01b031681565b6105036105e3366004615485565b6112ea565b600a54610527906001600160a01b031681565b600154610527906001600160a01b031681565b61055261061c3660046154d6565b6113a8565b6104ce61062f366004615502565b61149f565b61050361064236600461551f565b61158f565b6105526106553660046151df565b611636565b6105526106683660046151df565b6116fe565b6104ce61067b3660046152c2565b6117ba565b600a546104ce90600160a01b900460ff1681565b6105526106a2366004615538565b6118e4565b42610503565b6105526106bb36600461557e565b505050505050565b6105036106d13660046151df565b60166020526000908152604090205481565b61050360065481565b6106ff6106fa366004615538565b611a44565b604080519384526020840192909252908201526060016104da565b6105036107283660046155ec565b611a84565b61050361073b36600461551f565b611b25565b61055261074e366004615248565b611b82565b610552610761366004615538565b611d60565b61052761077436600461551f565b611db5565b6105036107873660046151df565b611ddf565b61055261079a3660046154d6565b611e51565b6105526107ad3660046155ec565b505050565b6106ff6107c03660046151df565b611f45565b6105036107d33660046151df565b611f80565b6105036107e636600461562d565b611ff1565b6105526107f9366004615248565b6121c0565b61055261080c366004615691565b612395565b61055261081f366004615485565b6126c3565b6105036108323660046151df565b601a6020526000908152604090205481565b61087c6108523660046151df565b6010602052600090815260409020546001600160e01b03811690600160e01b900463ffffffff1682565b604080516001600160e01b03909316835263ffffffff9091166020830152016104da565b6104ce6108ae3660046151df565b600c6020526000908152604090205460ff1681565b6105526105bb36600461562d565b6104ce6108df3660046151df565b600b6020526000908152604090205460ff1681565b6105526109023660046151df565b6126c8565b600454610527906001600160a01b031681565b6105036109283660046151df565b601c6020526000908152604090205481565b600a546104ce90600160b01b900460ff1681565b61087c61095c3660046151df565b6011602052600090815260409020546001600160e01b03811690600160e01b900463ffffffff1682565b6109ba6109943660046151df565b60096020526000908152604090208054600182015460039092015460ff91821692911683565b60408051931515845260208401929092521515908201526060016104da565b6104ce6109e7366004615502565b612774565b6104ce6109fa36600461571a565b6001600160a01b038082166000908152600960209081526040808320938616835260029093019052205460ff1692915050565b6104ce610a3b3660046151df565b61285b565b61050360075481565b610503610a573660046151df565b60176020526000908152604090205481565b7322a2488fe295047ba13bd8cccdbc8361dbd8cf7c610527565b610503610a913660046151df565b61291a565b610aab6a0c097ce7bc90715b34b9f160241b81565b6040516001600160e01b0390911681526020016104da565b610552610ad13660046157a3565b612a4c565b601d54610527906001600160a01b031681565b610503600e5481565b610b05610b003660046151df565b612b81565b6040516104da919061582b565b600a546104ce90600160b81b900460ff1681565b610b05612bf7565b610503610b3c36600461571a565b601260209081526000928352604080842090915290825290205481565b600254610527906001600160a01b031681565b610503610b7a366004615485565b612c59565b610503610b8d3660046151df565b60186020526000908152604090205481565b610bb2610bad366004615878565b612ce4565b6040516104da91906158ad565b610bd2610bcd3660046155ec565b612dac565b604080519283526020830191909152016104da565b610503610bf536600461571a565b601360209081526000928352604080842090915290825290205481565b610503610c203660046151df565b60146020526000908152604090205481565b610503610c4036600461562d565b612fca565b610503610c533660046155ec565b613171565b610527610c663660046154d6565b613541565b600354610527906001600160a01b031681565b610503610c8c3660046154d6565b613579565b600a546104ce90600160a81b900460ff1681565b61050360055481565b610552610cbc3660046151df565b61370b565b610503610ccf3660046155ec565b61376f565b610503610ce23660046151df565b6137aa565b601b546104ce9060ff1681565b610503610d023660046151df565b60196020526000908152604090205481565b600054610527906001600160a01b031681565b6000546001600160a01b03163314610d905760405162461bcd60e51b815260206004820152602160248201527f4f6e6c792061646d696e2063616e2063616c6c20746869732066756e6374696f6044820152603760f91b60648201526084015b60405180910390fd5b601b5460ff1615610df25760405162461bcd60e51b815260206004820152602660248201527f416c72656164792065786563757465642074686973206f6e652d6f66662066756044820152653731ba34b7b760d11b6064820152608401610d87565b828114610e315760405162461bcd60e51b815260206004820152600d60248201526c125b9d985b1a59081a5b9c1d5d609a1b6044820152606401610d87565b60008060008060005b87811015610fb857888882818110610e5457610e546158e5565b9050602002016020810190610e6991906151df565b6001600160a01b0381166000908152601460205260409020549095509350868682818110610e9957610e996158e5565b90506020020135925083831115610f3d576000610eb68585615911565b6001600160a01b0387166000908152601c6020526040812054919250610edc8284613afb565b6001600160a01b0389166000818152601c6020908152604091829020849055815186815290810184905292935090917f17fea09d9a7ca41b2f9f9118f18f44848a62e9c70d55dd4385131eb2cf1b7e47910160405180910390a28695505050505b8215610fa857610f4d8484613b07565b6001600160a01b038616600081815260146020908152604091829020849055815188815290810184905292945090917f4a5c134e28b537a76546993ea37f3b60d9190476df7356d3842aa40902e20f04910160405180910390a25b610fb181615928565b9050610e3a565b5050601b805460ff1916600117905550505050505050565b6001600160a01b03821660009081526009602052604081205460ff166110085760405162461bcd60e51b8152600401610d8790615943565b600a546001600160a01b031633148061102b57506000546001600160a01b031633145b6110475760405162461bcd60e51b8152600401610d879061598b565b6000546001600160a01b031633148061106257506001821515145b61107e5760405162461bcd60e51b8152600401610d87906159d2565b6001600160a01b0383166000818152600c6020908152604091829020805460ff19168615159081179091558251938452606091840182905260069184019190915265426f72726f7760d01b6080840152908201527f71aec636243f9709bb0007ae15e9afb8150ab01716d75fd7573be5cc096e03b09060a0015b60405180910390a150805b92915050565b60408051600180825281830190925260009160208083019080368337019050509050828160008151811061113f5761113f6158e5565b60200260200101906001600160a01b031690816001600160a01b0316815250506107ad8183600180612395565b806001600160a01b031663f851a4406040518163ffffffff1660e01b8152600401602060405180830381865afa1580156111aa573d6000803e3d6000fd5b505050506040513d601f19601f820116820180604052508101906111ce9190615a02565b6001600160a01b0316336001600160a01b03161461123e5760405162461bcd60e51b815260206004820152602760248201527f6f6e6c7920756e6974726f6c6c65722061646d696e2063616e206368616e676560448201526620627261696e7360c81b6064820152608401610d87565b806001600160a01b031663c1e803346040518163ffffffff1660e01b81526004016020604051808303816000875af115801561127e573d6000803e3d6000fd5b505050506040513d601f19601f820116820180604052508101906112a29190615a1f565b156112e75760405162461bcd60e51b815260206004820152601560248201527418da185b99d9481b9bdd08185d5d1a1bdc9a5e9959605a1b6044820152606401610d87565b50565b6001600160a01b03841660009081526009602052604081205460ff16611312575060096113a0565b60006040518060200160405280876001600160a01b031663aa5af0fd6040518163ffffffff1660e01b8152600401602060405180830381865afa15801561135d573d6000803e3d6000fd5b505050506040513d601f19601f820116820180604052508101906113819190615a1f565b9052905061138f8682613b13565b61139a868583613db2565b60009150505b949350505050565b6113b0613fe0565b6113fc5760405162461bcd60e51b815260206004820152601960248201527f6f6e6c792061646d696e2063616e206772616e7420636f6d70000000000000006044820152606401610d87565b60006114088383614009565b905080156114585760405162461bcd60e51b815260206004820152601b60248201527f696e73756666696369656e7420636f6d7020666f72206772616e7400000000006044820152606401610d87565b604080516001600160a01b0385168152602081018490527f98b2f82a3a07f223a0be64b3d0f47711c64dccd1feafb94aa28156b38cd9695c910160405180910390a1505050565b600a546000906001600160a01b03163314806114c557506000546001600160a01b031633145b6114e15760405162461bcd60e51b8152600401610d879061598b565b6000546001600160a01b03163314806114fc57506001821515145b6115185760405162461bcd60e51b8152600401610d87906159d2565b600a8054831515600160b81b0260ff60b81b199091161790556040517fef159d9a32b2472e32b098f954f3ce62d232939f1c207070b584df1814de2de0906115839084906040808252600590820152645365697a6560d81b6060820152901515602082015260800190565b60405180910390a15090565b600080546001600160a01b031633146115ea5760405162461bcd60e51b815260206004820152601f60248201527f6f6e6c792061646d696e2063616e2073657420636c6f736520666163746f72006044820152606401610d87565b600580549083905560408051828152602081018590527f3b9670cf975d26958e754b57098eaa2ac914d8d2a31b83257997b9f346110fd991015b60405180910390a160005b9392505050565b6000546001600160a01b0316331461169f5760405162461bcd60e51b815260206004820152602660248201527f6f6e6c792061646d696e2063616e2073657420737570706c792063617020677560448201526530b93234b0b760d11b6064820152608401610d87565b601d80546001600160a01b038381166001600160a01b03198316179092556040519116907fb0d3622c24ac9bd967d8f37a25808b3e668fe7ed4f3075bbe82842d3e287c044906116f29083908590615a4e565b60405180910390a15050565b6000546001600160a01b031633146117675760405162461bcd60e51b815260206004820152602660248201527f6f6e6c792061646d696e2063616e2073657420626f72726f772063617020677560448201526530b93234b0b760d11b6064820152608401610d87565b601580546001600160a01b038381166001600160a01b03198316179092556040519116907feda98690e518e9a05f8ec6837663e188211b2da8f4906648b323f2c1d4434e29906116f29083908590615a4e565b6001600160a01b03821660009081526009602052604081205460ff166117f25760405162461bcd60e51b8152600401610d8790615943565b600a546001600160a01b031633148061181557506000546001600160a01b031633145b6118315760405162461bcd60e51b8152600401610d879061598b565b6000546001600160a01b031633148061184c57506001821515145b6118685760405162461bcd60e51b8152600401610d87906159d2565b6001600160a01b0383166000818152600b6020908152604091829020805460ff19168615159081179091558251938452606091840182905260049184019190915263135a5b9d60e21b6080840152908201527f71aec636243f9709bb0007ae15e9afb8150ab01716d75fd7573be5cc096e03b09060a0016110f8565b6001600160a01b0384166000908152601e602052604090205480156105bb576000856001600160a01b03166318160ddd6040518163ffffffff1660e01b8152600401602060405180830381865afa158015611943573d6000803e3d6000fd5b505050506040513d601f19601f820116820180604052508101906119679190615a1f565b905060006040518060200160405280886001600160a01b031663182df0f56040518163ffffffff1660e01b8152600401602060405180830381865afa1580156119b4573d6000803e3d6000fd5b505050506040513d601f19601f820116820180604052508101906119d89190615a1f565b9052905060006119e8828461412e565b905083811115611a3a5760405162461bcd60e51b815260206004820152601960248201527f6d61726b657420737570706c79206361702072656163686564000000000000006044820152606401610d87565b5050505050505050565b600080600080600080611a598a8a8a8a614146565b925092509250826011811115611a7157611a71615a38565b95509093509150505b9450945094915050565b6001600160a01b0383166000908152600b602052604081205460ff1615611ade5760405162461bcd60e51b815260206004820152600e60248201526d1b5a5b9d081a5cc81c185d5cd95960921b6044820152606401610d87565b6001600160a01b03841660009081526009602052604090205460ff16611b085760095b905061162f565b611b1184614474565b611b1b8484614698565b6000949350505050565b600080546001600160a01b03163314611b44576111036001600b6148e4565b600680549083905560408051828152602081018590527faeba5a6c40a8ac138134bff1aaa65debf25971188a58804bad717f82f0ec13169101611624565b6000546001600160a01b0316331480611ba55750601d546001600160a01b031633145b611c0f5760405162461bcd60e51b815260206004820152603560248201527f6f6e6c792061646d696e206f7220737570706c792063617020677561726469616044820152746e2063616e2073657420737570706c79206361707360581b6064820152608401610d87565b82818115801590611c1f57508082145b611c5b5760405162461bcd60e51b815260206004820152600d60248201526c1a5b9d985b1a59081a5b9c1d5d609a1b6044820152606401610d87565b60005b82811015611d5757848482818110611c7857611c786158e5565b90506020020135601e6000898985818110611c9557611c956158e5565b9050602002016020810190611caa91906151df565b6001600160a01b03168152602081019190915260400160002055868682818110611cd657611cd66158e5565b9050602002016020810190611ceb91906151df565b6001600160a01b03167f9e0ad9cee10bdf36b7fbd38910c0bdff0f275ace679b45b922381c2723d676f8868684818110611d2757611d276158e5565b90506020020135604051611d3d91815260200190565b60405180910390a280611d4f81615928565b915050611c5e565b50505050505050565b80158015611d6e5750600082115b15611daf5760405162461bcd60e51b815260206004820152601160248201527072656465656d546f6b656e73207a65726f60781b6044820152606401610d87565b50505050565b600d8181548110611dc557600080fd5b6000918252602090912001546001600160a01b0316905081565b600080546001600160a01b03163314611dfe57611103600160106148e4565b600480546001600160a01b038481166001600160a01b03198316179092556040519116907fd52b2b9b7e9ee655fcb95d2e5b9e0c9f69e7ef2b8e9d2d0ea78402d576d22e22906116249083908690615a4e565b611e59613fe0565b611ea55760405162461bcd60e51b815260206004820152601d60248201527f6f6e6c792061646d696e2063616e2073657420636f6d702073706565640000006044820152606401610d87565b611eae826126c8565b80611ed1576001600160a01b038216600090815260186020526040812055611eec565b426001600160a01b0383166000908152601860205260409020555b6001600160a01b03821660008181526017602052604090819020839055517f386537fa92edc3319af95f1f904dcf1900021e4f3f4e08169a577a09076e66b390611f399084815260200190565b60405180910390a25050565b600080600080600080611f5c876000806000614146565b925092509250826011811115611f7457611f74615a38565b97919650945092505050565b600080546001600160a01b03163314611f9f57611103600160136148e4565b600a80546001600160a01b038481166001600160a01b0319831681179093556040519116917f0613b6ee6a04f0d09f390e4d9318894b9f6ac7fd83897cd8d18896ba579c401e91611624918491615a4e565b6001600160a01b03851660009081526009602052604081205460ff16158061203257506001600160a01b03851660009081526009602052604090205460ff16155b156120415760095b90506121b7565b6040516395dd919360e01b81526001600160a01b038481166004830152600091908816906395dd919390602401602060405180830381865afa15801561208b573d6000803e3d6000fd5b505050506040513d601f19601f820116820180604052508101906120af9190615a1f565b90506120ba8761285b565b1561212557828110156121205760405162461bcd60e51b815260206004820152602860248201527f43616e206e6f74207265706179206d6f7265207468616e2074686520746f74616044820152676c20626f72726f7760c01b6064820152608401610d87565b6121b1565b6000806121318661495d565b9193509091506000905082601181111561214d5761214d615a38565b1461216e5781601181111561216457612164615a38565b93505050506121b7565b8061217a576003612164565b600061219660405180602001604052806005548152508561412e565b9050808611156121ad5760119450505050506121b7565b5050505b60009150505b95945050505050565b6000546001600160a01b03163314806121e357506015546001600160a01b031633145b61224d5760405162461bcd60e51b815260206004820152603560248201527f6f6e6c792061646d696e206f7220626f72726f772063617020677561726469616044820152746e2063616e2073657420626f72726f77206361707360581b6064820152608401610d87565b8281811580159061225d57508082145b6122995760405162461bcd60e51b815260206004820152600d60248201526c1a5b9d985b1a59081a5b9c1d5d609a1b6044820152606401610d87565b60005b82811015611d57578484828181106122b6576122b66158e5565b90506020020135601660008989858181106122d3576122d36158e5565b90506020020160208101906122e891906151df565b6001600160a01b03168152602081019190915260400160002055868682818110612314576123146158e5565b905060200201602081019061232991906151df565b6001600160a01b03167f6f1951b2aad10f3fc81b86d91105b413a5b3f847a34bbc5ce1904201b14438f6868684818110612365576123656158e5565b9050602002013560405161237b91815260200190565b60405180910390a28061238d81615928565b91505061229c565b60005b835181101561255c5760008482815181106123b5576123b56158e5565b6020908102919091018101516001600160a01b0381166000908152600990925260409091205490915060ff166124255760405162461bcd60e51b81526020600482015260156024820152741b585c9ad95d081b5d5cdd081899481b1a5cdd1959605a1b6044820152606401610d87565b600184151514156124f25760006040518060200160405280836001600160a01b031663aa5af0fd6040518163ffffffff1660e01b8152600401602060405180830381865afa15801561247b573d6000803e3d6000fd5b505050506040513d601f19601f8201168201806040525081019061249f9190615a1f565b905290506124ad8282613b13565b60005b87518110156124ef576124dd838983815181106124cf576124cf6158e5565b602002602001015184613db2565b806124e781615928565b9150506124b0565b50505b600183151514156125495761250681614474565b60005b86518110156125475761253582888381518110612528576125286158e5565b6020026020010151614698565b8061253f81615928565b915050612509565b505b508061255481615928565b915050612398565b5060005b845181101561261f576125ca85828151811061257e5761257e6158e5565b60200260200101516014600088858151811061259c5761259c6158e5565b60200260200101516001600160a01b03166001600160a01b0316815260200190815260200160002054614009565b601460008784815181106125e0576125e06158e5565b60200260200101516001600160a01b03166001600160a01b0316815260200190815260200160002081905550808061261790615928565b915050612560565b50600073d86c8d4279ccafbec840c782bcc50d201f2774196001600160a01b031685604051602401612651919061582b565b60408051601f198184030181529181526020820180516001600160e01b031663318d9e5d60e01b179052516126869190615a94565b6000604051808303816000865af19150503d8060008114611a3a576040519150601f19603f3d011682016040523d82523d6000602084013e611a3a565b611daf565b6001600160a01b0381166000908152601760209081526040808320546018909252822054909142916126fb908390613b07565b905060008111801561270d5750600083115b15611daf57600061271e828561497d565b6001600160a01b038616600090815260146020526040812054919250906127459083613afb565b6001600160a01b0387166000908152601460209081526040808320939093556018905220849055505050505050565b600a546000906001600160a01b031633148061279a57506000546001600160a01b031633145b6127b65760405162461bcd60e51b8152600401610d879061598b565b6000546001600160a01b03163314806127d157506001821515145b6127ed5760405162461bcd60e51b8152600401610d87906159d2565b600a8054831515600160b01b0260ff60b01b199091161790556040517fef159d9a32b2472e32b098f954f3ce62d232939f1c207070b584df1814de2de0906115839084906040808252600890820152672a3930b739b332b960c11b6060820152901515602082015260800190565b6001600160a01b0381166000908152600960205260408120600101541580156128a157506001600160a01b0382166000908152600c602052604090205460ff1615156001145b80156111035750816001600160a01b031663173b99046040518163ffffffff1660e01b8152600401602060405180830381865afa1580156128e6573d6000803e3d6000fd5b505050506040513d601f19601f8201168201806040525081019061290a9190615a1f565b670de0b6b3a76400001492915050565b600080546001600160a01b0316331461293957611103600160126148e4565b6001600160a01b03821660009081526009602052604090205460ff161561296657611103600a60116148e4565b816001600160a01b031663fe9c44ae6040518163ffffffff1660e01b8152600401602060405180830381865afa1580156129a4573d6000803e3d6000fd5b505050506040513d601f19601f820116820180604052508101906129c89190615ab0565b506001600160a01b03821660009081526009602052604081208054600160ff1991821681178355600383018054909216909155810191909155612a0a83614989565b612a1383614a72565b6040516001600160a01b03841681527fcf583bb0c569eb967f806b11601c4cb93c10310485c67add5f8362c2f212321f90602001611624565b612a54613fe0565b612aa05760405162461bcd60e51b815260206004820152601d60248201527f6f6e6c792061646d696e2063616e2073657420636f6d702073706565640000006044820152606401610d87565b8251825181148015612ab25750815181145b612b105760405162461bcd60e51b815260206004820152602960248201527f436f6d7074726f6c6c65723a3a5f736574436f6d7053706565647320696e76616044820152681b1a59081a5b9c1d5d60ba1b6064820152608401610d87565b60005b818110156105bb57612b71858281518110612b3057612b306158e5565b6020026020010151858381518110612b4a57612b4a6158e5565b6020026020010151858481518110612b6457612b646158e5565b6020026020010151614b2e565b612b7a81615928565b9050612b13565b6001600160a01b0381166000908152600860209081526040808320805482518185028101850190935280835260609493830182828015612bea57602002820191906000526020600020905b81546001600160a01b03168152600190910190602001808311612bcc575b5093979650505050505050565b6060600d805480602002602001604051908101604052809291908181526020018280548015612c4f57602002820191906000526020600020905b81546001600160a01b03168152600190910190602001808311612c31575b5050505050905090565b600a54600090600160b01b900460ff1615612cab5760405162461bcd60e51b81526020600482015260126024820152711d1c985b9cd9995c881a5cc81c185d5cd95960721b6044820152606401610d87565b6000612cb8868685614d0d565b90508015612cc75790506113a0565b612cd086614474565b612cda8686614698565b61139a8685614698565b805160609060008167ffffffffffffffff811115612d0457612d046152fb565b604051908082528060200260200182016040528015612d2d578160200160208202803683370190505b50905060005b82811015612da4576000858281518110612d4f57612d4f6158e5565b60200260200101519050612d638133614dc5565b6011811115612d7457612d74615a38565b838381518110612d8657612d866158e5565b60209081029190910101525080612d9c81615928565b915050612d33565b509392505050565b6004805460405163fc57d4df60e01b81526001600160a01b03868116938201939093526000928392839291169063fc57d4df90602401602060405180830381865afa158015612dff573d6000803e3d6000fd5b505050506040513d601f19601f82011682018060405250810190612e239190615a1f565b6004805460405163fc57d4df60e01b81526001600160a01b038981169382019390935292935060009291169063fc57d4df90602401602060405180830381865afa158015612e75573d6000803e3d6000fd5b505050506040513d601f19601f82011682018060405250810190612e999190615a1f565b9050811580612ea6575080155b15612eba57600d6000935093505050612fc2565b6000866001600160a01b031663182df0f56040518163ffffffff1660e01b8152600401602060405180830381865afa158015612efa573d6000803e3d6000fd5b505050506040513d601f19601f82011682018060405250810190612f1e9190615a1f565b90506000612f386040518060200160405280600081525090565b604080516020808201835260008083528351808301855290815283518083018552600654815284519283019094528882529192612f7491614ebc565b9250612f9c604051806020016040528088815250604051806020016040528088815250614ebc565b9150612fa88383614f04565b9050612fb4818b61412e565b600099509750505050505050505b935093915050565b600a54600090600160b81b900460ff16156130195760405162461bcd60e51b815260206004820152600f60248201526e1cd95a5e99481a5cc81c185d5cd959608a1b6044820152606401610d87565b6001600160a01b03861660009081526009602052604090205460ff16158061305a57506001600160a01b03851660009081526009602052604090205460ff16155b1561306657600961203a565b846001600160a01b0316635fe3b5676040518163ffffffff1660e01b8152600401602060405180830381865afa1580156130a4573d6000803e3d6000fd5b505050506040513d601f19601f820116820180604052508101906130c89190615a02565b6001600160a01b0316866001600160a01b0316635fe3b5676040518163ffffffff1660e01b8152600401602060405180830381865afa15801561310f573d6000803e3d6000fd5b505050506040513d601f19601f820116820180604052508101906131339190615a02565b6001600160a01b03161461314857600261203a565b61315186614474565b61315b8684614698565b6131658685614698565b60009695505050505050565b6001600160a01b0383166000908152600c602052604081205460ff16156131cd5760405162461bcd60e51b815260206004820152601060248201526f189bdc9c9bddc81a5cc81c185d5cd95960821b6044820152606401610d87565b6001600160a01b03841660009081526009602052604090205460ff166131f4576009611b01565b6001600160a01b038085166000908152600960209081526040808320938716835260029093019052205460ff166132f157336001600160a01b038516146132755760405162461bcd60e51b815260206004820152601560248201527439b2b73232b91036bab9ba1031329031aa37b5b2b760591b6044820152606401610d87565b60006132813385614dc5565b9050600081601181111561329757613297615a38565b146132b6578060118111156132ae576132ae615a38565b91505061162f565b6001600160a01b038086166000908152600960209081526040808320938816835260029093019052205460ff166132ef576132ef615acd565b505b6004805460405163fc57d4df60e01b81526001600160a01b038781169382019390935291169063fc57d4df90602401602060405180830381865afa15801561333d573d6000803e3d6000fd5b505050506040513d601f19601f820116820180604052508101906133619190615a1f565b61336c57600d611b01565b6001600160a01b0384166000908152601660205260409020548015613451576000856001600160a01b03166347bd37186040518163ffffffff1660e01b8152600401602060405180830381865afa1580156133cb573d6000803e3d6000fd5b505050506040513d601f19601f820116820180604052508101906133ef9190615a1f565b905060006133fd8286613afb565b905082811061344e5760405162461bcd60e51b815260206004820152601960248201527f6d61726b657420626f72726f77206361702072656163686564000000000000006044820152606401610d87565b50505b6000806134618688600088614146565b9193509091506000905082601181111561347d5761347d615a38565b1461349e5781601181111561349457613494615a38565b935050505061162f565b80156134ab576004613494565b60006040518060200160405280896001600160a01b031663aa5af0fd6040518163ffffffff1660e01b8152600401602060405180830381865afa1580156134f6573d6000803e3d6000fd5b505050506040513d601f19601f8201168201806040525081019061351a9190615a1f565b905290506135288882613b13565b613533888883613db2565b600098975050505050505050565b6008602052816000526040600020818154811061355d57600080fd5b6000918252602090912001546001600160a01b03169150829050565b600080546001600160a01b0316331461359f57613598600160066148e4565b9050611103565b6001600160a01b0383166000908152600960205260409020805460ff166135d4576135cc600960076148e4565b915050611103565b60408051602080820183528582528251908101909252670c7d713b49da000082529061360281835190511090565b1561361d57613613600660086148e4565b9350505050611103565b841580159061369957506004805460405163fc57d4df60e01b81526001600160a01b038981169382019390935291169063fc57d4df90602401602060405180830381865afa158015613673573d6000803e3d6000fd5b505050506040513d601f19601f820116820180604052508101906136979190615a1f565b155b156136aa57613613600d60096148e4565b60018301805490869055604080516001600160a01b0389168152602081018390529081018790527f70483e6592cd5182d45ac970e05bc62cdcc90e9d8ef2c2dbe686cf383bcd7fc59060600160405180910390a16000979650505050505050565b6112e781600d80548060200260200160405190810160405280929190818152602001828054801561376557602002820191906000526020600020905b81546001600160a01b03168152600190910190602001808311613747575b5050505050611109565b60008061377d858585614d0d565b9050801561378c57905061162f565b61379585614474565b61379f8585614698565b600095945050505050565b6040516361bfb47160e11b815233600482015260009082908290819081906001600160a01b0385169063c37f68e290602401608060405180830381865afa1580156137f9573d6000803e3d6000fd5b505050506040513d601f19601f8201168201806040525081019061381d9190615ae3565b50925092509250826000146138825760405162461bcd60e51b815260206004820152602560248201527f657869744d61726b65743a206765744163636f756e74536e617073686f742066604482015264185a5b195960da1b6064820152608401610d87565b801561389e57613894600c60026148e4565b9695505050505050565b60006138ab873385614d0d565b905080156138cb576138c0600e600383614f3e565b979650505050505050565b6001600160a01b0385166000908152600960209081526040808320338452600281019092529091205460ff1661390957600098975050505050505050565b3360009081526002820160209081526040808320805460ff19169055600882528083208054825181850281018501909352808352919290919083018282801561397b57602002820191906000526020600020905b81546001600160a01b0316815260019091019060200180831161395d575b5050835193945083925060009150505b828110156139e057896001600160a01b03168482815181106139af576139af6158e5565b60200260200101516001600160a01b031614156139ce578091506139e0565b806139d881615928565b91505061398b565b508181106139f0576139f0615acd565b33600090815260086020526040902080548190613a0f90600190615911565b81548110613a1f57613a1f6158e5565b9060005260206000200160009054906101000a90046001600160a01b0316818381548110613a4f57613a4f6158e5565b9060005260206000200160006101000a8154816001600160a01b0302191690836001600160a01b0316021790555080805480613a8d57613a8d615b19565b600082815260209020810160001990810180546001600160a01b03191690550190556040517fe699a64c18b07ac5b7301aa273f36a2287239eb9501d81950672794afba29a0d90613ae1908c903390615a4e565b60405180910390a160009c9b505050505050505050505050565b600061162f8284615b2f565b600061162f8284615911565b6001600160a01b038216600090815260116020908152604080832060199092528220549091613b78425b6040518060400160405280601c81526020017f626c6f636b206e756d6265722065786365656473203332206269747300000000815250614fb6565b8354909150600090613b9a9063ffffffff80851691600160e01b900416613b07565b9050600081118015613bac5750600083115b15613cdb576000613c1e876001600160a01b03166347bd37186040518163ffffffff1660e01b8152600401602060405180830381865afa158015613bf4573d6000803e3d6000fd5b505050506040513d601f19601f82011682018060405250810190613c189190615a1f565b87614fe6565b90506000613c2c838661497d565b90506000808311613c4c5760405180602001604052806000815250613c56565b613c568284615004565b604080516020810190915288546001600160e01b03168152909150613cb990613c7f908361503f565b5160408051808201909152601a81527f6e657720696e6465782065786365656473203232342062697473000000000000602082015261506b565b6001600160e01b0316600160e01b63ffffffff87160217875550613cfd915050565b8015613cfd5783546001600160e01b0316600160e01b63ffffffff8416021784555b600073d86c8d4279ccafbec840c782bcc50d201f2774196040516001600160a01b038981166024830152919091169060440160408051601f198184030181529181526020820180516001600160e01b0316635ce65fe960e01b17905251613d649190615a94565b6000604051808303816000865af19150503d8060008114613da1576040519150601f19603f3d011682016040523d82523d6000602084013e613da6565b606091505b50505050505050505050565b6001600160a01b03838116600090815260116020908152604080832080546013845282852095881685529490925290912080546001600160e01b0390931690819055909180158015613e1257506a0c097ce7bc90715b34b9f160241b8210155b15613e2857506a0c097ce7bc90715b34b9f160241b5b60006040518060200160405280613e3f8585613b07565b90526040516395dd919360e01b81526001600160a01b038881166004830152919250600091613e9291908a16906395dd919390602401602060405180830381865afa158015613bf4573d6000803e3d6000fd5b90506000613ea08284615092565b6001600160a01b03891660009081526014602052604081205491925090613ec79083613afb565b6001600160a01b038a811660008181526014602090815260409182902085905581518781529081018b90529394509092918d16917f1fc3ecc087d8d2d15e23d0032af5a47059c3892d003d8e139fdcb6bb327c99a6910160405180910390a3600073d86c8d4279ccafbec840c782bcc50d201f2774196001600160a01b03168b8b604051602401613f59929190615a4e565b60408051601f198184030181529181526020820180516001600160e01b03166375c7940360e11b17905251613f8e9190615a94565b6000604051808303816000865af19150503d8060008114613fcb576040519150601f19603f3d011682016040523d82523d6000602084013e613fd0565b606091505b5050505050505050505050505050565b600080546001600160a01b031633148061400457506002546001600160a01b031633145b905090565b6000807322a2488fe295047ba13bd8cccdbc8361dbd8cf7c6040516370a0823160e01b81523060048201529091506000906001600160a01b038316906370a0823190602401602060405180830381865afa15801561406b573d6000803e3d6000fd5b505050506040513d601f19601f8201168201806040525081019061408f9190615a1f565b90506000841180156140a15750808411155b156141255760405163a9059cbb60e01b81526001600160a01b0386811660048301526024820186905283169063a9059cbb906044016020604051808303816000875af11580156140f5573d6000803e3d6000fd5b505050506040513d601f19601f820116820180604052508101906141199190615ab0565b50600092505050611103565b50919392505050565b60008061413b84846150bb565b90506113a0816150e3565b6000806000614153615128565b6001600160a01b0388166000908152600860209081526040808320805482518185028101850190935280835284938301828280156141ba57602002820191906000526020600020905b81546001600160a01b0316815260019091019060200180831161419c575b5050505050905060005b815181101561441e5760008282815181106141e1576141e16158e5565b60209081029190910101516040516361bfb47160e11b81526001600160a01b038e811660048301529192509082169063c37f68e290602401608060405180830381865afa158015614236573d6000803e3d6000fd5b505050506040513d601f19601f8201168201806040525081019061425a9190615ae3565b6080890152606088015260408701529350831561428657600f6000809750975097505050505050611a7a565b60408051602080820183526001600160a01b0384811660008181526009845285902060010154845260c08a01939093528351808301855260808a0151815260e08a015260048054855163fc57d4df60e01b815291820194909452935192169263fc57d4df92602480830193928290030181865afa15801561430b573d6000803e3d6000fd5b505050506040513d601f19601f8201168201806040525081019061432f9190615a1f565b60a0860181905261434f57600d6000809750975097505050505050611a7a565b604080516020810190915260a0860151815261010086015260c085015160e08601516143899161437e91614ebc565b866101000151614ebc565b6101208601819052604086015186516143a39291906150fb565b8552610100850151606086015160208701516143c09291906150fb565b60208601526001600160a01b03818116908c16141561440b576143ed8561012001518b87602001516150fb565b60208601819052610100860151614405918b906150fb565b60208601525b508061441681615928565b9150506141c4565b5060208301518351111561444f576020830151835160009161443f91615911565b6000955095509550505050611a7a565b600080846000015185602001516144669190615911565b955095509550505050611a7a565b6001600160a01b0381166000908152601060209081526040808320601a90925282205490916144a242613b3d565b83549091506000906144c49063ffffffff80851691600160e01b900416613b07565b90506000811180156144d65750600083115b156145c2576000856001600160a01b03166318160ddd6040518163ffffffff1660e01b8152600401602060405180830381865afa15801561451b573d6000803e3d6000fd5b505050506040513d601f19601f8201168201806040525081019061453f9190615a1f565b9050600061454d838661497d565b9050600080831161456d5760405180602001604052806000815250614577565b6145778284615004565b604080516020810190915288546001600160e01b031681529091506145a090613c7f908361503f565b6001600160e01b0316600160e01b63ffffffff871602178755506145e4915050565b80156145e45783546001600160e01b0316600160e01b63ffffffff8416021784555b600073d86c8d4279ccafbec840c782bcc50d201f2774196040516001600160a01b038881166024830152919091169060440160408051601f198184030181529181526020820180516001600160e01b031663743597df60e11b1790525161464b9190615a94565b6000604051808303816000865af19150503d8060008114614688576040519150601f19603f3d011682016040523d82523d6000602084013e61468d565b606091505b505050505050505050565b6001600160a01b03828116600090815260106020908152604080832080546012845282852095871685529490925290912080546001600160e01b03909316908190559091801580156146f857506a0c097ce7bc90715b34b9f160241b8210155b1561470e57506a0c097ce7bc90715b34b9f160241b5b600060405180602001604052806147258585613b07565b90526040516370a0823160e01b81526001600160a01b0387811660048301529192506000918816906370a0823190602401602060405180830381865afa158015614773573d6000803e3d6000fd5b505050506040513d601f19601f820116820180604052508101906147979190615a1f565b905060006147a58284615092565b6001600160a01b038816600090815260146020526040812054919250906147cc9083613afb565b6001600160a01b0389811660008181526014602090815260409182902085905581518781529081018b90529394509092918c16917f2caecd17d02f56fa897705dcc740da2d237c373f70686f4e0d9bd3bf0400ea7a910160405180910390a3600073d86c8d4279ccafbec840c782bcc50d201f2774196001600160a01b03168a8a60405160240161485e929190615a4e565b60408051601f198184030181529181526020820180516001600160e01b0316631169274f60e21b179052516148939190615a94565b6000604051808303816000865af19150503d80600081146148d0576040519150601f19603f3d011682016040523d82523d6000602084013e6148d5565b606091505b50505050505050505050505050565b60007f45b96fe442630264581b197e84bbada861235052c5a1aadfff9ea4e40a969aa083601181111561491957614919615a38565b83601381111561492b5761492b615a38565b60408051928352602083019190915260009082015260600160405180910390a182601181111561162f5761162f615a38565b6000806000614970846000806000614146565b9250925092509193909250565b600061162f8284615b47565b60005b600d54811015614a1f57816001600160a01b0316600d82815481106149b3576149b36158e5565b6000918252602090912001546001600160a01b03161415614a0d5760405162461bcd60e51b81526020600482015260146024820152731b585c9ad95d08185b1c9958591e48185919195960621b6044820152606401610d87565b80614a1781615928565b91505061498c565b50600d80546001810182556000919091527fd7b6990105719101dabeb77144f2a3385c8033acd3af97e9423a695e81ad1eb50180546001600160a01b0319166001600160a01b0392909216919091179055565b6000614a7d42613b3d565b6001600160a01b03831660009081526010602090815260408083206011909252909120815492935090916001600160e01b0316614ad35781546001600160e01b0319166a0c097ce7bc90715b34b9f160241b1782555b80546001600160e01b0316614b015780546001600160e01b0319166a0c097ce7bc90715b34b9f160241b1781555b805463ffffffff909316600160e01b026001600160e01b0393841681179091558154909216909117905550565b6001600160a01b0383166000908152600960205260409020805460ff16614b975760405162461bcd60e51b815260206004820152601960248201527f636f6d70206d61726b6574206973206e6f74206c6973746564000000000000006044820152606401610d87565b6001600160a01b0384166000908152601a60205260409020548314614c1557614bbf84614474565b6001600160a01b0384166000818152601a602052604090819020859055517fdeafccd0c0b768b2529f7dcbbe58e155d6023059150b7490ed4535cc3744b92d90614c0c9086815260200190565b60405180910390a25b6001600160a01b0384166000908152601960205260409020548214611daf5760006040518060200160405280866001600160a01b031663aa5af0fd6040518163ffffffff1660e01b8152600401602060405180830381865afa158015614c7f573d6000803e3d6000fd5b505050506040513d601f19601f82011682018060405250810190614ca39190615a1f565b90529050614cb18582613b13565b6001600160a01b03851660008181526019602052604090819020859055517f20af8e791cc98f74b2d7a391c80980ca8e5aebf3d4060bf581997b6acae2e53790614cfe9086815260200190565b60405180910390a25050505050565b6001600160a01b03831660009081526009602052604081205460ff16614d34576009611b01565b6001600160a01b038085166000908152600960209081526040808320938716835260029093019052205460ff16614d6c576000611b01565b600080614d7c8587866000614146565b91935090915060009050826011811115614d9857614d98615a38565b14614db857816011811115614daf57614daf615a38565b9250505061162f565b8015613165576004614daf565b6001600160a01b0382166000908152600960205260408120805460ff16614df0576009915050611103565b6001600160a01b038316600090815260028201602052604090205460ff16151560011415614e22576000915050611103565b6001600160a01b03838116600090815260028301602090815260408083208054600160ff19909116811790915560088352818420805491820181558452919092200180546001600160a01b03191692871692909217909155517f3ab23ab0d51cccc0c3085aec51f99228625aa1a922b3a8ca89a26b0f2027a1a590614eaa9086908690615a4e565b60405180910390a15060009392505050565b6040805160208101909152600081526040518060200160405280670de0b6b3a7640000614ef18660000151866000015161497d565b614efb9190615b66565b90529392505050565b6040805160208101909152600081526040518060200160405280614efb614f378660000151670de0b6b3a764000061497d565b855161511c565b60007f45b96fe442630264581b197e84bbada861235052c5a1aadfff9ea4e40a969aa0846011811115614f7357614f73615a38565b846013811115614f8557614f85615a38565b604080519283526020830191909152810184905260600160405180910390a18360118111156113a0576113a0615a38565b6000816401000000008410614fde5760405162461bcd60e51b8152600401610d879190615b88565b509192915050565b600061162f614ffd84670de0b6b3a764000061497d565b835161511c565b6040805160208101909152600081526040518060200160405280614efb615039866a0c097ce7bc90715b34b9f160241b61497d565b8561511c565b6040805160208101909152600081526040518060200160405280614efb85600001518560000151613afb565b600081600160e01b8410614fde5760405162461bcd60e51b8152600401610d879190615b88565b60006a0c097ce7bc90715b34b9f160241b6150b184846000015161497d565b61162f9190615b66565b6040805160208101909152600081526040518060200160405280614efb85600001518561497d565b805160009061110390670de0b6b3a764000090615b66565b60008061510885856150bb565b90506121b7615116826150e3565b84613afb565b600061162f8284615b66565b6040518061014001604052806000815260200160008152602001600081526020016000815260200160008152602001600081526020016151746040518060200160405280600081525090565b815260200161518f6040518060200160405280600081525090565b81526020016151aa6040518060200160405280600081525090565b81526020016151c56040518060200160405280600081525090565b905290565b6001600160a01b03811681146112e757600080fd5b6000602082840312156151f157600080fd5b813561162f816151ca565b60008083601f84011261520e57600080fd5b50813567ffffffffffffffff81111561522657600080fd5b6020830191508360208260051b850101111561524157600080fd5b9250929050565b6000806000806040858703121561525e57600080fd5b843567ffffffffffffffff8082111561527657600080fd5b615282888389016151fc565b9096509450602087013591508082111561529b57600080fd5b506152a8878288016151fc565b95989497509550505050565b80151581146112e757600080fd5b600080604083850312156152d557600080fd5b82356152e0816151ca565b915060208301356152f0816152b4565b809150509250929050565b634e487b7160e01b600052604160045260246000fd5b604051601f8201601f1916810167ffffffffffffffff8111828210171561533a5761533a6152fb565b604052919050565b600067ffffffffffffffff82111561535c5761535c6152fb565b5060051b60200190565b600082601f83011261537757600080fd5b8135602061538c61538783615342565b615311565b82815260059290921b840181019181810190868411156153ab57600080fd5b8286015b848110156153cf5780356153c2816151ca565b83529183019183016153af565b509695505050505050565b600080604083850312156153ed57600080fd5b82356153f8816151ca565b9150602083013567ffffffffffffffff81111561541457600080fd5b61542085828601615366565b9150509250929050565b600080600080600060a0868803121561544257600080fd5b853561544d816151ca565b9450602086013561545d816151ca565b9350604086013561546d816151ca565b94979396509394606081013594506080013592915050565b6000806000806080858703121561549b57600080fd5b84356154a6816151ca565b935060208501356154b6816151ca565b925060408501356154c6816151ca565b9396929550929360600135925050565b600080604083850312156154e957600080fd5b82356154f4816151ca565b946020939093013593505050565b60006020828403121561551457600080fd5b813561162f816152b4565b60006020828403121561553157600080fd5b5035919050565b6000806000806080858703121561554e57600080fd5b8435615559816151ca565b93506020850135615569816151ca565b93969395505050506040820135916060013590565b60008060008060008060c0878903121561559757600080fd5b86356155a2816151ca565b955060208701356155b2816151ca565b945060408701356155c2816151ca565b935060608701356155d2816151ca565b9598949750929560808101359460a0909101359350915050565b60008060006060848603121561560157600080fd5b833561560c816151ca565b9250602084013561561c816151ca565b929592945050506040919091013590565b600080600080600060a0868803121561564557600080fd5b8535615650816151ca565b94506020860135615660816151ca565b93506040860135615670816151ca565b92506060860135615680816151ca565b949793965091946080013592915050565b600080600080608085870312156156a757600080fd5b843567ffffffffffffffff808211156156bf57600080fd5b6156cb88838901615366565b955060208701359150808211156156e157600080fd5b506156ee87828801615366565b93505060408501356156ff816152b4565b9150606085013561570f816152b4565b939692955090935050565b6000806040838503121561572d57600080fd5b8235615738816151ca565b915060208301356152f0816151ca565b600082601f83011261575957600080fd5b8135602061576961538783615342565b82815260059290921b8401810191818101908684111561578857600080fd5b8286015b848110156153cf578035835291830191830161578c565b6000806000606084860312156157b857600080fd5b833567ffffffffffffffff808211156157d057600080fd5b6157dc87838801615366565b945060208601359150808211156157f257600080fd5b6157fe87838801615748565b9350604086013591508082111561581457600080fd5b5061582186828701615748565b9150509250925092565b6020808252825182820181905260009190848201906040850190845b8181101561586c5783516001600160a01b031683529284019291840191600101615847565b50909695505050505050565b60006020828403121561588a57600080fd5b813567ffffffffffffffff8111156158a157600080fd5b6113a084828501615366565b6020808252825182820181905260009190848201906040850190845b8181101561586c578351835292840192918401916001016158c9565b634e487b7160e01b600052603260045260246000fd5b634e487b7160e01b600052601160045260246000fd5b600082821015615923576159236158fb565b500390565b600060001982141561593c5761593c6158fb565b5060010190565b60208082526028908201527f63616e6e6f742070617573652061206d61726b65742074686174206973206e6f6040820152671d081b1a5cdd195960c21b606082015260800190565b60208082526027908201527f6f6e6c7920706175736520677561726469616e20616e642061646d696e2063616040820152666e20706175736560c81b606082015260800190565b6020808252601690820152756f6e6c792061646d696e2063616e20756e706175736560501b604082015260600190565b600060208284031215615a1457600080fd5b815161162f816151ca565b600060208284031215615a3157600080fd5b5051919050565b634e487b7160e01b600052602160045260246000fd5b6001600160a01b0392831681529116602082015260400190565b60005b83811015615a83578181015183820152602001615a6b565b83811115611daf5750506000910152565b60008251615aa6818460208701615a68565b9190910192915050565b600060208284031215615ac257600080fd5b815161162f816152b4565b634e487b7160e01b600052600160045260246000fd5b60008060008060808587031215615af957600080fd5b505082516020840151604085015160609095015191969095509092509050565b634e487b7160e01b600052603160045260246000fd5b60008219821115615b4257615b426158fb565b500190565b6000816000190483118215151615615b6157615b616158fb565b500290565b600082615b8357634e487b7160e01b600052601260045260246000fd5b500490565b6020815260008251806020840152615ba7816040850160208701615a68565b601f01601f1916919091016040019291505056fea2646970667358221220dc266738e9dceb737f600ebf213b05007f92ddb4bf0a0f58a19368ed2827271264736f6c634300080a0033",
  "devdoc": {
    "author": "Compound",
    "kind": "dev",
    "methods": {
      "_grantComp(address,uint256)": {
        "details": "Note: If there is not enough COMP, we do not perform the transfer all.",
        "params": {
          "amount": "The amount of COMP to (possibly) transfer",
          "recipient": "The address of the recipient to transfer COMP to"
        }
      },
      "_setBorrowCapGuardian(address)": {
        "params": {
          "newBorrowCapGuardian": "The address of the new Borrow Cap Guardian"
        }
      },
      "_setCloseFactor(uint256)": {
        "details": "Admin function to set closeFactor",
        "params": {
          "newCloseFactorMantissa": "New close factor, scaled by 1e18"
        },
        "returns": {
          "_0": "uint 0=success, otherwise a failure"
        }
      },
      "_setCollateralFactor(address,uint256)": {
        "details": "Admin function to set per-market collateralFactor",
        "params": {
          "cToken": "The market to set the factor on",
          "newCollateralFactorMantissa": "The new collateral factor, scaled by 1e18"
        },
        "returns": {
          "_0": "uint 0=success, otherwise a failure. (See ErrorReporter for details)"
        }
      },
      "_setCompSpeeds(address[],uint256[],uint256[])": {
        "params": {
          "borrowSpeeds": "New borrow-side COMP speed for the corresponding market.",
          "cTokens": "The markets whose COMP speed to update.",
          "supplySpeeds": "New supply-side COMP speed for the corresponding market."
        }
      },
      "_setContributorCompSpeed(address,uint256)": {
        "params": {
          "compSpeed": "New COMP speed for contributor",
          "contributor": "The contributor whose COMP speed to update"
        }
      },
      "_setLiquidationIncentive(uint256)": {
        "details": "Admin function to set liquidationIncentive",
        "params": {
          "newLiquidationIncentiveMantissa": "New liquidationIncentive scaled by 1e18"
        },
        "returns": {
          "_0": "uint 0=success, otherwise a failure. (See ErrorReporter for details)"
        }
      },
      "_setMarketBorrowCaps(address[],uint256[])": {
        "details": "Admin or borrowCapGuardian function to set the borrow caps. A borrow cap of 0 corresponds to unlimited borrowing.",
        "params": {
          "cTokens": "The addresses of the markets (tokens) to change the borrow caps for",
          "newBorrowCaps": "The new borrow cap values in underlying to be set. A value of 0 corresponds to unlimited borrowing."
        }
      },
      "_setMarketSupplyCaps(address[],uint256[])": {
        "details": "Admin or supplyCapGuardian function to set the supply caps. A supply cap of 0 corresponds to unlimited supplying.",
        "params": {
          "cTokens": "The addresses of the markets (tokens) to change the supply caps for",
          "newSupplyCaps": "The new supply cap values in underlying to be set. A value of 0 corresponds to unlimited supplying."
        }
      },
      "_setPauseGuardian(address)": {
        "params": {
          "newPauseGuardian": "The address of the new Pause Guardian"
        },
        "returns": {
          "_0": "uint 0=success, otherwise a failure. (See enum Error for details)"
        }
      },
      "_setPriceOracle(address)": {
        "details": "Admin function to set a new price oracle",
        "returns": {
          "_0": "uint 0=success, otherwise a failure (see ErrorReporter.sol for details)"
        }
      },
      "_setSupplyCapGuardian(address)": {
        "params": {
          "newSupplyCapGuardian": "The address of the new Supply Cap Guardian"
        }
      },
      "_supportMarket(address)": {
        "details": "Admin function to set isListed and add support for the market",
        "params": {
          "cToken": "The address of the market (token) to list"
        },
        "returns": {
          "_0": "uint 0=success, otherwise a failure. (See enum Error for details)"
        }
      },
      "borrowAllowed(address,address,uint256)": {
        "params": {
          "borrowAmount": "The amount of underlying the account would borrow",
          "borrower": "The account which would borrow the asset",
          "cToken": "The market to verify the borrow against"
        },
        "returns": {
          "_0": "0 if the borrow is allowed, otherwise a semi-opaque error code (See ErrorReporter.sol)"
        }
      },
      "borrowVerify(address,address,uint256)": {
        "params": {
          "borrowAmount": "The amount of the underlying asset requested to borrow",
          "borrower": "The address borrowing the underlying",
          "cToken": "Asset whose underlying is being borrowed"
        }
      },
      "checkMembership(address,address)": {
        "params": {
          "account": "The address of the account to check",
          "cToken": "The cToken to check"
        },
        "returns": {
          "_0": "True if the account is in the asset, otherwise false."
        }
      },
      "claimComp(address)": {
        "params": {
          "holder": "The address to claim COMP for"
        }
      },
      "claimComp(address,address[])": {
        "params": {
          "cTokens": "The list of markets to claim COMP in",
          "holder": "The address to claim COMP for"
        }
      },
      "claimComp(address[],address[],bool,bool)": {
        "params": {
          "borrowers": "Whether or not to claim COMP earned by borrowing",
          "cTokens": "The list of markets to claim COMP in",
          "holders": "The addresses to claim COMP for",
          "suppliers": "Whether or not to claim COMP earned by supplying"
        }
      },
      "enterMarkets(address[])": {
        "params": {
          "cTokens": "The list of addresses of the cToken markets to be enabled"
        },
        "returns": {
          "_0": "Success indicator for whether each corresponding market was entered"
        }
      },
      "exitMarket(address)": {
        "details": "Sender must not have an outstanding borrow balance in the asset,  or be providing necessary collateral for an outstanding borrow.",
        "params": {
          "cTokenAddress": "The address of the asset to be removed"
        },
        "returns": {
          "_0": "Whether or not the account successfully exited the market"
        }
      },
      "getAccountLiquidity(address)": {
        "returns": {
          "_0": "(possible error code (semi-opaque), account liquidity in excess of collateral requirements,          account shortfall below collateral requirements)"
        }
      },
      "getAllMarkets()": {
        "details": "The automatic getter may be used to access an individual market.",
        "returns": {
          "_0": "The list of market addresses"
        }
      },
      "getAssetsIn(address)": {
        "params": {
          "account": "The address of the account to pull assets for"
        },
        "returns": {
          "_0": "A dynamic list with the assets the account has entered"
        }
      },
      "getCompAddress()": {
        "returns": {
          "_0": "The address of SONNE"
        }
      },
      "getExternalRewardDistributorAddress()": {
        "returns": {
          "_0": "The address of the external reward distributor"
        }
      },
      "getHypotheticalAccountLiquidity(address,address,uint256,uint256)": {
        "params": {
          "account": "The account to determine liquidity for",
          "borrowAmount": "The amount of underlying to hypothetically borrow",
          "cTokenModify": "The market to hypothetically redeem/borrow in",
          "redeemTokens": "The number of tokens to hypothetically redeem"
        },
        "returns": {
          "_0": "(possible error code (semi-opaque), hypothetical account liquidity in excess of collateral requirements,          hypothetical account shortfall below collateral requirements)"
        }
      },
      "isDeprecated(address)": {
        "details": "All borrows in a deprecated cToken market can be immediately liquidated",
        "params": {
          "cToken": "The market to check if deprecated"
        }
      },
      "liquidateBorrowAllowed(address,address,address,address,uint256)": {
        "params": {
          "borrower": "The address of the borrower",
          "cTokenBorrowed": "Asset which was borrowed by the borrower",
          "cTokenCollateral": "Asset which was used as collateral and will be seized",
          "liquidator": "The address repaying the borrow and seizing the collateral",
          "repayAmount": "The amount of underlying being repaid"
        }
      },
      "liquidateBorrowVerify(address,address,address,address,uint256,uint256)": {
        "params": {
          "actualRepayAmount": "The amount of underlying being repaid",
          "borrower": "The address of the borrower",
          "cTokenBorrowed": "Asset which was borrowed by the borrower",
          "cTokenCollateral": "Asset which was used as collateral and will be seized",
          "liquidator": "The address repaying the borrow and seizing the collateral"
        }
      },
      "liquidateCalculateSeizeTokens(address,address,uint256)": {
        "details": "Used in liquidation (called in cToken.liquidateBorrowFresh)",
        "params": {
          "actualRepayAmount": "The amount of cTokenBorrowed underlying to convert into cTokenCollateral tokens",
          "cTokenBorrowed": "The address of the borrowed cToken",
          "cTokenCollateral": "The address of the collateral cToken"
        },
        "returns": {
          "_0": "(errorCode, number of cTokenCollateral tokens to be seized in a liquidation)"
        }
      },
      "mintAllowed(address,address,uint256)": {
        "params": {
          "cToken": "The market to verify the mint against",
          "mintAmount": "The amount of underlying being supplied to the market in exchange for tokens",
          "minter": "The account which would get the minted tokens"
        },
        "returns": {
          "_0": "0 if the mint is allowed, otherwise a semi-opaque error code (See ErrorReporter.sol)"
        }
      },
      "mintVerify(address,address,uint256,uint256)": {
        "params": {
          "actualMintAmount": "The amount of the underlying asset being minted",
          "cToken": "Asset being minted",
          "mintTokens": "The number of tokens being minted",
          "minter": "The address minting the tokens"
        }
      },
      "redeemAllowed(address,address,uint256)": {
        "params": {
          "cToken": "The market to verify the redeem against",
          "redeemTokens": "The number of cTokens to exchange for the underlying asset in the market",
          "redeemer": "The account which would redeem the tokens"
        },
        "returns": {
          "_0": "0 if the redeem is allowed, otherwise a semi-opaque error code (See ErrorReporter.sol)"
        }
      },
      "redeemVerify(address,address,uint256,uint256)": {
        "params": {
          "cToken": "Asset being redeemed",
          "redeemAmount": "The amount of the underlying asset being redeemed",
          "redeemTokens": "The number of tokens being redeemed",
          "redeemer": "The address redeeming the tokens"
        }
      },
      "repayBorrowAllowed(address,address,address,uint256)": {
        "params": {
          "borrower": "The account which would borrowed the asset",
          "cToken": "The market to verify the repay against",
          "payer": "The account which would repay the asset",
          "repayAmount": "The amount of the underlying asset the account would repay"
        },
        "returns": {
          "_0": "0 if the repay is allowed, otherwise a semi-opaque error code (See ErrorReporter.sol)"
        }
      },
      "repayBorrowVerify(address,address,address,uint256,uint256)": {
        "params": {
          "actualRepayAmount": "The amount of underlying being repaid",
          "borrower": "The address of the borrower",
          "cToken": "Asset being repaid",
          "payer": "The address repaying the borrow"
        }
      },
      "seizeAllowed(address,address,address,address,uint256)": {
        "params": {
          "borrower": "The address of the borrower",
          "cTokenBorrowed": "Asset which was borrowed by the borrower",
          "cTokenCollateral": "Asset which was used as collateral and will be seized",
          "liquidator": "The address repaying the borrow and seizing the collateral",
          "seizeTokens": "The number of collateral tokens to seize"
        }
      },
      "seizeVerify(address,address,address,address,uint256)": {
        "params": {
          "borrower": "The address of the borrower",
          "cTokenBorrowed": "Asset which was borrowed by the borrower",
          "cTokenCollateral": "Asset which was used as collateral and will be seized",
          "liquidator": "The address repaying the borrow and seizing the collateral",
          "seizeTokens": "The number of collateral tokens to seize"
        }
      },
      "transferAllowed(address,address,address,uint256)": {
        "params": {
          "cToken": "The market to verify the transfer against",
          "dst": "The account which receives the tokens",
          "src": "The account which sources the tokens",
          "transferTokens": "The number of cTokens to transfer"
        },
        "returns": {
          "_0": "0 if the transfer is allowed, otherwise a semi-opaque error code (See ErrorReporter.sol)"
        }
      },
      "transferVerify(address,address,address,uint256)": {
        "params": {
          "cToken": "Asset being transferred",
          "dst": "The account which receives the tokens",
          "src": "The account which sources the tokens",
          "transferTokens": "The number of cTokens to transfer"
        }
      },
      "updateContributorRewards(address)": {
        "params": {
          "contributor": "The address to calculate contributor rewards for"
        }
      }
    },
    "title": "Compound's Comptroller Contract",
    "version": 1
  },
  "userdoc": {
    "events": {
      "ActionPaused(address,string,bool)": {
        "notice": "Emitted when an action is paused on a market"
      },
      "ActionPaused(string,bool)": {
        "notice": "Emitted when an action is paused globally"
      },
      "CompAccruedAdjusted(address,uint256,uint256)": {
        "notice": "Emitted when COMP accrued for a user has been manually adjusted."
      },
      "CompBorrowSpeedUpdated(address,uint256)": {
        "notice": "Emitted when a new borrow-side COMP speed is calculated for a market"
      },
      "CompGranted(address,uint256)": {
        "notice": "Emitted when COMP is granted by admin"
      },
      "CompReceivableUpdated(address,uint256,uint256)": {
        "notice": "Emitted when COMP receivable for a user has been updated."
      },
      "CompSupplySpeedUpdated(address,uint256)": {
        "notice": "Emitted when a new supply-side COMP speed is calculated for a market"
      },
      "ContributorCompSpeedUpdated(address,uint256)": {
        "notice": "Emitted when a new COMP speed is set for a contributor"
      },
      "DistributedBorrowerComp(address,address,uint256,uint256)": {
        "notice": "Emitted when COMP is distributed to a borrower"
      },
      "DistributedSupplierComp(address,address,uint256,uint256)": {
        "notice": "Emitted when COMP is distributed to a supplier"
      },
      "MarketEntered(address,address)": {
        "notice": "Emitted when an account enters a market"
      },
      "MarketExited(address,address)": {
        "notice": "Emitted when an account exits a market"
      },
      "MarketListed(address)": {
        "notice": "Emitted when an admin supports a market"
      },
      "NewBorrowCap(address,uint256)": {
        "notice": "Emitted when borrow cap for a cToken is changed"
      },
      "NewBorrowCapGuardian(address,address)": {
        "notice": "Emitted when borrow cap guardian is changed"
      },
      "NewCloseFactor(uint256,uint256)": {
        "notice": "Emitted when close factor is changed by admin"
      },
      "NewCollateralFactor(address,uint256,uint256)": {
        "notice": "Emitted when a collateral factor is changed by admin"
      },
      "NewLiquidationIncentive(uint256,uint256)": {
        "notice": "Emitted when liquidation incentive is changed by admin"
      },
      "NewPauseGuardian(address,address)": {
        "notice": "Emitted when pause guardian is changed"
      },
      "NewPriceOracle(address,address)": {
        "notice": "Emitted when price oracle is changed"
      },
      "NewSupplyCap(address,uint256)": {
        "notice": "Emitted when supply cap for a cToken is changed"
      },
      "NewSupplyCapGuardian(address,address)": {
        "notice": "Emitted when supply cap guardian is changed"
      }
    },
    "kind": "user",
    "methods": {
      "_grantComp(address,uint256)": {
        "notice": "Transfer COMP to the recipient"
      },
      "_setBorrowCapGuardian(address)": {
        "notice": "Admin function to change the Borrow Cap Guardian"
      },
      "_setCloseFactor(uint256)": {
        "notice": "Sets the closeFactor used when liquidating borrows"
      },
      "_setCollateralFactor(address,uint256)": {
        "notice": "Sets the collateralFactor for a market"
      },
      "_setCompSpeeds(address[],uint256[],uint256[])": {
        "notice": "Set COMP borrow and supply speeds for the specified markets."
      },
      "_setContributorCompSpeed(address,uint256)": {
        "notice": "Set COMP speed for a single contributor"
      },
      "_setLiquidationIncentive(uint256)": {
        "notice": "Sets liquidationIncentive"
      },
      "_setMarketBorrowCaps(address[],uint256[])": {
        "notice": "Set the given borrow caps for the given cToken markets. Borrowing that brings total borrows to or above borrow cap will revert."
      },
      "_setMarketSupplyCaps(address[],uint256[])": {
        "notice": "Set the given supply caps for the given cToken markets. Supplying that brings total supply to or above supply cap will revert."
      },
      "_setPauseGuardian(address)": {
        "notice": "Admin function to change the Pause Guardian"
      },
      "_setPriceOracle(address)": {
        "notice": "Sets a new price oracle for the comptroller"
      },
      "_setSupplyCapGuardian(address)": {
        "notice": "Admin function to change the Supply Cap Guardian"
      },
      "_supportMarket(address)": {
        "notice": "Add the market to the markets mapping and set it as listed"
      },
      "accountAssets(address,uint256)": {
        "notice": "Per-account mapping of \"assets you are in\", capped by maxAssets"
      },
      "admin()": {
        "notice": "Administrator for this contract"
      },
      "allMarkets(uint256)": {
        "notice": "A list of all markets"
      },
      "borrowAllowed(address,address,uint256)": {
        "notice": "Checks if the account should be allowed to borrow the underlying asset of the given market"
      },
      "borrowVerify(address,address,uint256)": {
        "notice": "Validates borrow and reverts on rejection. May emit logs."
      },
      "checkMembership(address,address)": {
        "notice": "Returns whether the given account is entered in the given asset"
      },
      "claimComp(address)": {
        "notice": "Claim all the comp accrued by holder in all markets"
      },
      "claimComp(address,address[])": {
        "notice": "Claim all the comp accrued by holder in the specified markets"
      },
      "claimComp(address[],address[],bool,bool)": {
        "notice": "Claim all comp accrued by the holders"
      },
      "closeFactorMantissa()": {
        "notice": "Multiplier used to calculate the maximum repayAmount when liquidating a borrow"
      },
      "compAccrued(address)": {
        "notice": "The COMP accrued but not yet transferred to each user"
      },
      "compBorrowSpeeds(address)": {
        "notice": "The rate at which comp is distributed to the corresponding borrow market (per block)"
      },
      "compBorrowState(address)": {
        "notice": "The COMP market borrow state for each market"
      },
      "compBorrowerIndex(address,address)": {
        "notice": "The COMP borrow index for each market for each borrower as of the last time they accrued COMP"
      },
      "compContributorSpeeds(address)": {
        "notice": "The portion of COMP that each contributor receives per block"
      },
      "compInitialIndex()": {
        "notice": "The initial COMP index for a market"
      },
      "compRate()": {
        "notice": "The rate at which the flywheel distributes COMP, per block"
      },
      "compReceivable(address)": {
        "notice": "Accounting storage mapping account addresses to how much COMP they owe the protocol."
      },
      "compSpeeds(address)": {
        "notice": "The portion of compRate that each market currently receives"
      },
      "compSupplierIndex(address,address)": {
        "notice": "The COMP borrow index for each market for each supplier as of the last time they accrued COMP"
      },
      "compSupplySpeeds(address)": {
        "notice": "The rate at which comp is distributed to the corresponding supply market (per block)"
      },
      "compSupplyState(address)": {
        "notice": "The COMP market supply state for each market"
      },
      "comptrollerImplementation()": {
        "notice": "Active brains of Unitroller"
      },
      "enterMarkets(address[])": {
        "notice": "Add assets to be included in account liquidity calculation"
      },
      "exitMarket(address)": {
        "notice": "Removes asset from sender's account liquidity calculation"
      },
      "fixBadAccruals(address[],uint256[])": {
        "notice": "Delete this function after proposal 65 is executed"
      },
      "getAccountLiquidity(address)": {
        "notice": "Determine the current account liquidity wrt collateral requirements"
      },
      "getAllMarkets()": {
        "notice": "Return all of the markets"
      },
      "getAssetsIn(address)": {
        "notice": "Returns the assets an account has entered"
      },
      "getCompAddress()": {
        "notice": "Return the address of the SONNE token"
      },
      "getExternalRewardDistributorAddress()": {
        "notice": "Return the address of the external reward distributor"
      },
      "getHypotheticalAccountLiquidity(address,address,uint256,uint256)": {
        "notice": "Determine what the account liquidity would be if the given amounts were redeemed/borrowed"
      },
      "isComptroller()": {
        "notice": "Indicator that this is a Comptroller contract (for inspection)"
      },
      "isDeprecated(address)": {
        "notice": "Returns true if the given cToken market has been deprecated"
      },
      "lastContributorBlock(address)": {
        "notice": "Last block at which a contributor's COMP rewards have been allocated"
      },
      "liquidateBorrowAllowed(address,address,address,address,uint256)": {
        "notice": "Checks if the liquidation should be allowed to occur"
      },
      "liquidateBorrowVerify(address,address,address,address,uint256,uint256)": {
        "notice": "Validates liquidateBorrow and reverts on rejection. May emit logs."
      },
      "liquidateCalculateSeizeTokens(address,address,uint256)": {
        "notice": "Calculate number of tokens of collateral asset to seize given an underlying amount"
      },
      "liquidationIncentiveMantissa()": {
        "notice": "Multiplier representing the discount on collateral that a liquidator receives"
      },
      "markets(address)": {
        "notice": "Official mapping of cTokens -> Market metadata"
      },
      "maxAssets()": {
        "notice": "Max number of assets a single account can participate in (borrow or use as collateral)"
      },
      "mintAllowed(address,address,uint256)": {
        "notice": "Checks if the account should be allowed to mint tokens in the given market"
      },
      "mintVerify(address,address,uint256,uint256)": {
        "notice": "Validates mint and reverts on rejection. May emit logs."
      },
      "oracle()": {
        "notice": "Oracle which gives the price of any given asset"
      },
      "pauseGuardian()": {
        "notice": "The Pause Guardian can pause certain actions as a safety mechanism.  Actions which allow users to remove their own assets cannot be paused.  Liquidation / seizing / transfer can only be paused globally, not by market."
      },
      "pendingAdmin()": {
        "notice": "Pending administrator for this contract"
      },
      "pendingComptrollerImplementation()": {
        "notice": "Pending brains of Unitroller"
      },
      "proposal65FixExecuted()": {
        "notice": "Flag indicating whether the function to fix COMP accruals has been executed (RE: proposal 62 bug)"
      },
      "redeemAllowed(address,address,uint256)": {
        "notice": "Checks if the account should be allowed to redeem tokens in the given market"
      },
      "redeemVerify(address,address,uint256,uint256)": {
        "notice": "Validates redeem and reverts on rejection. May emit logs."
      },
      "repayBorrowAllowed(address,address,address,uint256)": {
        "notice": "Checks if the account should be allowed to repay a borrow in the given market"
      },
      "repayBorrowVerify(address,address,address,uint256,uint256)": {
        "notice": "Validates repayBorrow and reverts on rejection. May emit logs."
      },
      "seizeAllowed(address,address,address,address,uint256)": {
        "notice": "Checks if the seizing of assets should be allowed to occur"
      },
      "seizeVerify(address,address,address,address,uint256)": {
        "notice": "Validates seize and reverts on rejection. May emit logs."
      },
      "transferAllowed(address,address,address,uint256)": {
        "notice": "Checks if the account should be allowed to transfer tokens in the given market"
      },
      "transferVerify(address,address,address,uint256)": {
        "notice": "Validates transfer and reverts on rejection. May emit logs."
      },
      "updateContributorRewards(address)": {
        "notice": "Calculate additional accrued COMP for a contributor since last accrual"
      }
    },
    "version": 1
  },
  "storageLayout": {
    "storage": [
      {
        "astId": 7178,
        "contract": "contracts/Comptroller.sol:Comptroller",
        "label": "admin",
        "offset": 0,
        "slot": "0",
        "type": "t_address"
      },
      {
        "astId": 7181,
        "contract": "contracts/Comptroller.sol:Comptroller",
        "label": "pendingAdmin",
        "offset": 0,
        "slot": "1",
        "type": "t_address"
      },
      {
        "astId": 7184,
        "contract": "contracts/Comptroller.sol:Comptroller",
        "label": "comptrollerImplementation",
        "offset": 0,
        "slot": "2",
        "type": "t_address"
      },
      {
        "astId": 7187,
        "contract": "contracts/Comptroller.sol:Comptroller",
        "label": "pendingComptrollerImplementation",
        "offset": 0,
        "slot": "3",
        "type": "t_address"
      },
      {
        "astId": 7194,
        "contract": "contracts/Comptroller.sol:Comptroller",
        "label": "oracle",
        "offset": 0,
        "slot": "4",
        "type": "t_contract(PriceOracle)9420"
      },
      {
        "astId": 7197,
        "contract": "contracts/Comptroller.sol:Comptroller",
        "label": "closeFactorMantissa",
        "offset": 0,
        "slot": "5",
        "type": "t_uint256"
      },
      {
        "astId": 7200,
        "contract": "contracts/Comptroller.sol:Comptroller",
        "label": "liquidationIncentiveMantissa",
        "offset": 0,
        "slot": "6",
        "type": "t_uint256"
      },
      {
        "astId": 7203,
        "contract": "contracts/Comptroller.sol:Comptroller",
        "label": "maxAssets",
        "offset": 0,
        "slot": "7",
        "type": "t_uint256"
      },
      {
        "astId": 7210,
        "contract": "contracts/Comptroller.sol:Comptroller",
        "label": "accountAssets",
        "offset": 0,
        "slot": "8",
        "type": "t_mapping(t_address,t_array(t_contract(CToken)2194)dyn_storage)"
      },
      {
        "astId": 7230,
        "contract": "contracts/Comptroller.sol:Comptroller",
        "label": "markets",
        "offset": 0,
        "slot": "9",
        "type": "t_mapping(t_address,t_struct(Market)7224_storage)"
      },
      {
        "astId": 7233,
        "contract": "contracts/Comptroller.sol:Comptroller",
        "label": "pauseGuardian",
        "offset": 0,
        "slot": "10",
        "type": "t_address"
      },
      {
        "astId": 7235,
        "contract": "contracts/Comptroller.sol:Comptroller",
        "label": "_mintGuardianPaused",
        "offset": 20,
        "slot": "10",
        "type": "t_bool"
      },
      {
        "astId": 7237,
        "contract": "contracts/Comptroller.sol:Comptroller",
        "label": "_borrowGuardianPaused",
        "offset": 21,
        "slot": "10",
        "type": "t_bool"
      },
      {
        "astId": 7239,
        "contract": "contracts/Comptroller.sol:Comptroller",
        "label": "transferGuardianPaused",
        "offset": 22,
        "slot": "10",
        "type": "t_bool"
      },
      {
        "astId": 7241,
        "contract": "contracts/Comptroller.sol:Comptroller",
        "label": "seizeGuardianPaused",
        "offset": 23,
        "slot": "10",
        "type": "t_bool"
      },
      {
        "astId": 7245,
        "contract": "contracts/Comptroller.sol:Comptroller",
        "label": "mintGuardianPaused",
        "offset": 0,
        "slot": "11",
        "type": "t_mapping(t_address,t_bool)"
      },
      {
        "astId": 7249,
        "contract": "contracts/Comptroller.sol:Comptroller",
        "label": "borrowGuardianPaused",
        "offset": 0,
        "slot": "12",
        "type": "t_mapping(t_address,t_bool)"
      },
      {
        "astId": 7262,
        "contract": "contracts/Comptroller.sol:Comptroller",
        "label": "allMarkets",
        "offset": 0,
        "slot": "13",
        "type": "t_array(t_contract(CToken)2194)dyn_storage"
      },
      {
        "astId": 7265,
        "contract": "contracts/Comptroller.sol:Comptroller",
        "label": "compRate",
        "offset": 0,
        "slot": "14",
        "type": "t_uint256"
      },
      {
        "astId": 7270,
        "contract": "contracts/Comptroller.sol:Comptroller",
        "label": "compSpeeds",
        "offset": 0,
        "slot": "15",
        "type": "t_mapping(t_address,t_uint256)"
      },
      {
        "astId": 7276,
        "contract": "contracts/Comptroller.sol:Comptroller",
        "label": "compSupplyState",
        "offset": 0,
        "slot": "16",
        "type": "t_mapping(t_address,t_struct(CompMarketState)7257_storage)"
      },
      {
        "astId": 7282,
        "contract": "contracts/Comptroller.sol:Comptroller",
        "label": "compBorrowState",
        "offset": 0,
        "slot": "17",
        "type": "t_mapping(t_address,t_struct(CompMarketState)7257_storage)"
      },
      {
        "astId": 7289,
        "contract": "contracts/Comptroller.sol:Comptroller",
        "label": "compSupplierIndex",
        "offset": 0,
        "slot": "18",
        "type": "t_mapping(t_address,t_mapping(t_address,t_uint256))"
      },
      {
        "astId": 7296,
        "contract": "contracts/Comptroller.sol:Comptroller",
        "label": "compBorrowerIndex",
        "offset": 0,
        "slot": "19",
        "type": "t_mapping(t_address,t_mapping(t_address,t_uint256))"
      },
      {
        "astId": 7301,
        "contract": "contracts/Comptroller.sol:Comptroller",
        "label": "compAccrued",
        "offset": 0,
        "slot": "20",
        "type": "t_mapping(t_address,t_uint256)"
      },
      {
        "astId": 7306,
        "contract": "contracts/Comptroller.sol:Comptroller",
        "label": "borrowCapGuardian",
        "offset": 0,
        "slot": "21",
        "type": "t_address"
      },
      {
        "astId": 7310,
        "contract": "contracts/Comptroller.sol:Comptroller",
        "label": "borrowCaps",
        "offset": 0,
        "slot": "22",
        "type": "t_mapping(t_address,t_uint256)"
      },
      {
        "astId": 7318,
        "contract": "contracts/Comptroller.sol:Comptroller",
        "label": "compContributorSpeeds",
        "offset": 0,
        "slot": "23",
        "type": "t_mapping(t_address,t_uint256)"
      },
      {
        "astId": 7323,
        "contract": "contracts/Comptroller.sol:Comptroller",
        "label": "lastContributorBlock",
        "offset": 0,
        "slot": "24",
        "type": "t_mapping(t_address,t_uint256)"
      },
      {
        "astId": 7331,
        "contract": "contracts/Comptroller.sol:Comptroller",
        "label": "compBorrowSpeeds",
        "offset": 0,
        "slot": "25",
        "type": "t_mapping(t_address,t_uint256)"
      },
      {
        "astId": 7336,
        "contract": "contracts/Comptroller.sol:Comptroller",
        "label": "compSupplySpeeds",
        "offset": 0,
        "slot": "26",
        "type": "t_mapping(t_address,t_uint256)"
      },
      {
        "astId": 7342,
        "contract": "contracts/Comptroller.sol:Comptroller",
        "label": "proposal65FixExecuted",
        "offset": 0,
        "slot": "27",
        "type": "t_bool"
      },
      {
        "astId": 7347,
        "contract": "contracts/Comptroller.sol:Comptroller",
        "label": "compReceivable",
        "offset": 0,
        "slot": "28",
        "type": "t_mapping(t_address,t_uint256)"
      },
      {
        "astId": 7352,
        "contract": "contracts/Comptroller.sol:Comptroller",
        "label": "supplyCapGuardian",
        "offset": 0,
        "slot": "29",
        "type": "t_address"
      },
      {
        "astId": 7356,
        "contract": "contracts/Comptroller.sol:Comptroller",
        "label": "supplyCaps",
        "offset": 0,
        "slot": "30",
        "type": "t_mapping(t_address,t_uint256)"
      }
    ],
    "types": {
      "t_address": {
        "encoding": "inplace",
        "label": "address",
        "numberOfBytes": "20"
      },
      "t_array(t_contract(CToken)2194)dyn_storage": {
        "base": "t_contract(CToken)2194",
        "encoding": "dynamic_array",
        "label": "contract CToken[]",
        "numberOfBytes": "32"
      },
      "t_bool": {
        "encoding": "inplace",
        "label": "bool",
        "numberOfBytes": "1"
      },
      "t_contract(CToken)2194": {
        "encoding": "inplace",
        "label": "contract CToken",
        "numberOfBytes": "20"
      },
      "t_contract(PriceOracle)9420": {
        "encoding": "inplace",
        "label": "contract PriceOracle",
        "numberOfBytes": "20"
      },
      "t_mapping(t_address,t_array(t_contract(CToken)2194)dyn_storage)": {
        "encoding": "mapping",
        "key": "t_address",
        "label": "mapping(address => contract CToken[])",
        "numberOfBytes": "32",
        "value": "t_array(t_contract(CToken)2194)dyn_storage"
      },
      "t_mapping(t_address,t_bool)": {
        "encoding": "mapping",
        "key": "t_address",
        "label": "mapping(address => bool)",
        "numberOfBytes": "32",
        "value": "t_bool"
      },
      "t_mapping(t_address,t_mapping(t_address,t_uint256))": {
        "encoding": "mapping",
        "key": "t_address",
        "label": "mapping(address => mapping(address => uint256))",
        "numberOfBytes": "32",
        "value": "t_mapping(t_address,t_uint256)"
      },
      "t_mapping(t_address,t_struct(CompMarketState)7257_storage)": {
        "encoding": "mapping",
        "key": "t_address",
        "label": "mapping(address => struct ComptrollerV3Storage.CompMarketState)",
        "numberOfBytes": "32",
        "value": "t_struct(CompMarketState)7257_storage"
      },
      "t_mapping(t_address,t_struct(Market)7224_storage)": {
        "encoding": "mapping",
        "key": "t_address",
        "label": "mapping(address => struct ComptrollerV2Storage.Market)",
        "numberOfBytes": "32",
        "value": "t_struct(Market)7224_storage"
      },
      "t_mapping(t_address,t_uint256)": {
        "encoding": "mapping",
        "key": "t_address",
        "label": "mapping(address => uint256)",
        "numberOfBytes": "32",
        "value": "t_uint256"
      },
      "t_struct(CompMarketState)7257_storage": {
        "encoding": "inplace",
        "label": "struct ComptrollerV3Storage.CompMarketState",
        "members": [
          {
            "astId": 7254,
            "contract": "contracts/Comptroller.sol:Comptroller",
            "label": "index",
            "offset": 0,
            "slot": "0",
            "type": "t_uint224"
          },
          {
            "astId": 7256,
            "contract": "contracts/Comptroller.sol:Comptroller",
            "label": "block",
            "offset": 28,
            "slot": "0",
            "type": "t_uint32"
          }
        ],
        "numberOfBytes": "32"
      },
      "t_struct(Market)7224_storage": {
        "encoding": "inplace",
        "label": "struct ComptrollerV2Storage.Market",
        "members": [
          {
            "astId": 7215,
            "contract": "contracts/Comptroller.sol:Comptroller",
            "label": "isListed",
            "offset": 0,
            "slot": "0",
            "type": "t_bool"
          },
          {
            "astId": 7217,
            "contract": "contracts/Comptroller.sol:Comptroller",
            "label": "collateralFactorMantissa",
            "offset": 0,
            "slot": "1",
            "type": "t_uint256"
          },
          {
            "astId": 7221,
            "contract": "contracts/Comptroller.sol:Comptroller",
            "label": "accountMembership",
            "offset": 0,
            "slot": "2",
            "type": "t_mapping(t_address,t_bool)"
          },
          {
            "astId": 7223,
            "contract": "contracts/Comptroller.sol:Comptroller",
            "label": "isComped",
            "offset": 0,
            "slot": "3",
            "type": "t_bool"
          }
        ],
        "numberOfBytes": "128"
      },
      "t_uint224": {
        "encoding": "inplace",
        "label": "uint224",
        "numberOfBytes": "28"
      },
      "t_uint256": {
        "encoding": "inplace",
        "label": "uint256",
        "numberOfBytes": "32"
      },
      "t_uint32": {
        "encoding": "inplace",
        "label": "uint32",
        "numberOfBytes": "4"
      }
    }
  }
}